Sheet: totals
B2: sheet | C2: title | D2: transistors | F2: gates
B3: of:=MID(FORMULA([.C3]);2;100) -> '0-F (upper c)'.$B$1 | C3: of:=['0-F (upper c)'.$B$1] -> 4 bit to 7-segment, digits 0-F (upper c) | D3: of:=OFFSET(INDIRECT([.B3]);47;63) -> 85 | F3: of:=OFFSET(INDIRECT([.B3]);48;63) -> 26
B4: of:=MID(FORMULA([.C4]);2;100) -> '0-F (lower c)'.$B$1 | C4: of:=['0-F (lower c)'.$B$1] -> 4 bit to 7-segment, digits 0-F (lower c) | D4: of:=OFFSET(INDIRECT([.B4]);47;62) -> 81 | F4: of:=OFFSET(INDIRECT([.B4]);48;62) -> 25
B5: of:=MID(FORMULA([.C5]);2;100) -> 'digits 0-9'.$B$1 | C5: of:=['digits 0-9'.$B$1] -> 4 bit to 7-segment, digits 0-9 | D5: of:=OFFSET(INDIRECT([.B5]);47;62) -> 42 | E5: 72 | F5: of:=OFFSET(INDIRECT([.B5]);48;62) -> 18
B6: of:=MID(FORMULA([.C6]);2;100) -> 'digits 0-7'.$B$1 | C6: of:=['digits 0-7'.$B$1] -> 3 bit to 7-segment, digits 0-7 | D6: of:=OFFSET(INDIRECT([.B6]);47;62) -> 40 | E6: 56 | F6: of:=OFFSET(INDIRECT([.B6]);48;62) -> 18
B7: of:=MID(FORMULA([.C7]);2;100) -> 'digits 0-5'.$B$1 | C7: of:=['digits 0-5'.$B$1] -> 3 bit to 7-segment, digits 0-5 | D7: of:=OFFSET(INDIRECT([.B7]);47;62) -> 23 | F7: of:=OFFSET(INDIRECT([.B7]);48;62) -> 14
B8: of:=MID(FORMULA([.C8]);2;100) -> 'digits 0-3'.$B$1 | C8: of:=['digits 0-3'.$B$1] -> 2 bit to 7-segment, digits 0-3 | D8: of:=OFFSET(INDIRECT([.B8]);47;62) -> 10 | E8: 18 | F8: of:=OFFSET(INDIRECT([.B8]);48;62) -> 7
B9: of:=MID(FORMULA([.C9]);2;100) -> 'digits 0-2'.$B$1 | C9: of:=['digits 0-2'.$B$1] -> 2 bit to 7-segment, digits 0-2 | D9: of:=OFFSET(INDIRECT([.B9]);47;62) -> 4 | F9: of:=OFFSET(INDIRECT([.B9]);48;62) -> 3
B10: of:=MID(FORMULA([.C10]);2;100) -> 'digits 1-2 (0 off)'.B1 | C10: of:=['digits 1-2 (0 off)'.B1] -> 2 bit to 7-segment, digits 1-2 (0 off) | D10: of:=OFFSET(INDIRECT([.B10]);47;62) -> 3 | F10: of:=OFFSET(INDIRECT([.B10]);48;62) -> 2

Sheet: 0-F (upper c)
B1: 4 bit to 7-segment, digits 0-F (upper c)
B2: Truth table | Q2: 7-segment display as defined by truth table
Q3: 0 | W3: of:=[.Q3]+1 -> 1 | AC3: of:=[.W3]+1 -> 2 | AI3: of:=[.AC3]+1 -> 3 | AO3: of:=[.AI3]+1 -> 4 | AU3: of:=[.AO3]+1 -> 5 | BA3: of:=[.AU3]+1 -> 6 | BG3: of:=[.BA3]+1 -> 7
B4: Inputs | G4: Outputs | Q4: of:=MATCH([.Q3];[.$B$7:.$B$22];0)+2 -> 3 | W4: of:=MATCH([.W3];[.$B$7:.$B$22];0)+2 -> 4 | AC4: of:=MATCH([.AC3];[.$B$7:.$B$22];0)+2 -> 5 | AI4: of:=MATCH([.AI3];[.$B$7:.$B$22];0)+2 -> 6 | AO4: of:=MATCH([.AO3];[.$B$7:.$B$22];0)+2 -> 7 | AU4: of:=MATCH([.AU3];[.$B$7:.$B$22];0)+2 -> 8 | BA4: of:=MATCH([.BA3];[.$B$7:.$B$22];0)+2 -> 9 | BG4: of:=MATCH([.BG3];[.$B$7:.$B$22];0)+2 -> 10
B5: # | C5: D | D5: C | E5: B | F5: A | G5: a | H5: b | I5: c | J5: d | K5: e | L5: f | M5: g | N5: P | R5: of:=HLOOKUP([.U5];[.$G$5:.$N$22];[.Q4];0) -> 1 | S5: of:=[.U5]&T(ORG.OPENOFFICE.STYLE(IF([.R5]=1;"seg1";IF([.R5]=0;"seg0";"segX")))) -> a | U5: a | X5: of:=HLOOKUP([.AA5];[.$G$5:.$N$22];[.W4];0) -> 0 | Y5: of:=[.AA5]&T(ORG.OPENOFFICE.STYLE(IF([.X5]=1;"seg1";IF([.X5]=0;"seg0";"segX")))) -> a | AA5: a | AD5: of:=HLOOKUP([.AG5];[.$G$5:.$N$22];[.AC4];0) -> 1 | AE5: of:=[.AG5]&T(ORG.OPENOFFICE.STYLE(IF([.AD5]=1;"seg1";IF([.AD5]=0;"seg0";"segX")))) -> a | AG5: a | AJ5: of:=HLOOKUP([.AM5];[.$G$5:.$N$22];[.AI4];0) -> 1 | AK5: of:=[.AM5]&T(ORG.OPENOFFICE.STYLE(IF([.AJ5]=1;"seg1";IF([.AJ5]=0;"seg0";"segX")))) -> a | AM5: a | AP5: of:=HLOOKUP([.AS5];[.$G$5:.$N$22];[.AO4];0) -> 0 | AQ5: of:=[.AS5]&T(ORG.OPENOFFICE.STYLE(IF([.AP5]=1;"seg1";IF([.AP5]=0;"seg0";"segX")))) -> a | AS5: a | AV5: of:=HLOOKUP([.AY5];[.$G$5:.$N$22];[.AU4];0) -> 1 | AW5: of:=[.AY5]&T(ORG.OPENOFFICE.STYLE(IF([.AV5]=1;"seg1";IF([.AV5]=0;"seg0";"segX")))) -> a | AY5: a | BB5: of:=HLOOKUP([.BE5];[.$G$5:.$N$22];[.BA4];0) -> 1 | BC5: of:=[.BE5]&T(ORG.OPENOFFICE.STYLE(IF([.BB5]=1;"seg1";IF([.BB5]=0;"seg0";"segX")))) -> a | BE5: a | BH5: of:=HLOOKUP([.BK5];[.$G$5:.$N$22];[.BG4];0) -> 1 | BI5: of:=[.BK5]&T(ORG.OPENOFFICE.STYLE(IF([.BH5]=1;"seg1";IF([.BH5]=0;"seg0";"segX")))) -> a | BK5: a
C6: 8 | D6: 4 | E6: 2 | F6: 1 | Q6: of:=HLOOKUP([.S6];[.$G$5:.$N$22];[.Q4];0) -> 1 | R6: of:=[.S6]&T(ORG.OPENOFFICE.STYLE(IF([.Q6]=1;"seg1";IF([.Q6]=0;"seg0";"segX")))) -> f | S6: f | T6: of:=HLOOKUP([.V6];[.$G$5:.$N$22];[.Q4];0) -> 1 | U6: of:=[.V6]&T(ORG.OPENOFFICE.STYLE(IF([.T6]=1;"seg1";IF([.T6]=0;"seg0";"segX")))) -> b | V6: b | W6: of:=HLOOKUP([.Y6];[.$G$5:.$N$22];[.W4];0) -> 0 | X6: of:=[.Y6]&T(ORG.OPENOFFICE.STYLE(IF([.W6]=1;"seg1";IF([.W6]=0;"seg0";"segX")))) -> f | Y6: f | Z6: of:=HLOOKUP([.AB6];[.$G$5:.$N$22];[.W4];0) -> 1 | AA6: of:=[.AB6]&T(ORG.OPENOFFICE.STYLE(IF([.Z6]=1;"seg1";IF([.Z6]=0;"seg0";"segX")))) -> b | AB6: b | AC6: of:=HLOOKUP([.AE6];[.$G$5:.$N$22];[.AC4];0) -> 0 | AD6: of:=[.AE6]&T(ORG.OPENOFFICE.STYLE(IF([.AC6]=1;"seg1";IF([.AC6]=0;"seg0";"segX")))) -> f | AE6: f | AF6: of:=HLOOKUP([.AH6];[.$G$5:.$N$22];[.AC4];0) -> 1 | AG6: of:=[.AH6]&T(ORG.OPENOFFICE.STYLE(IF([.AF6]=1;"seg1";IF([.AF6]=0;"seg0";"segX")))) -> b | AH6: b | AI6: of:=HLOOKUP([.AK6];[.$G$5:.$N$22];[.AI4];0) -> 0 | AJ6: of:=[.AK6]&T(ORG.OPENOFFICE.STYLE(IF([.AI6]=1;"seg1";IF([.AI6]=0;"seg0";"segX")))) -> f | AK6: f | AL6: of:=HLOOKUP([.AN6];[.$G$5:.$N$22];[.AI4];0) -> 1 | AM6: of:=[.AN6]&T(ORG.OPENOFFICE.STYLE(IF([.AL6]=1;"seg1";IF([.AL6]=0;"seg0";"segX")))) -> b | AN6: b | AO6: of:=HLOOKUP([.AQ6];[.$G$5:.$N$22];[.AO4];0) -> 1 | AP6: of:=[.AQ6]&T(ORG.OPENOFFICE.STYLE(IF([.AO6]=1;"seg1";IF([.AO6]=0;"seg0";"segX")))) -> f | AQ6: f | AR6: of:=HLOOKUP([.AT6];[.$G$5:.$N$22];[.AO4];0) -> 1 | AS6: of:=[.AT6]&T(ORG.OPENOFFICE.STYLE(IF([.AR6]=1;"seg1";IF([.AR6]=0;"seg0";"segX")))) -> b | AT6: b | AU6: of:=HLOOKUP([.AW6];[.$G$5:.$N$22];[.AU4];0) -> 1 | AV6: of:=[.AW6]&T(ORG.OPENOFFICE.STYLE(IF([.AU6]=1;"seg1";IF([.AU6]=0;"seg0";"segX")))) -> f | AW6: f | AX6: of:=HLOOKUP([.AZ6];[.$G$5:.$N$22];[.AU4];0) -> 0 | AY6: of:=[.AZ6]&T(ORG.OPENOFFICE.STYLE(IF([.AX6]=1;"seg1";IF([.AX6]=0;"seg0";"segX")))) -> b | AZ6: b | BA6: of:=HLOOKUP([.BC6];[.$G$5:.$N$22];[.BA4];0) -> 1 | BB6: of:=[.BC6]&T(ORG.OPENOFFICE.STYLE(IF([.BA6]=1;"seg1";IF([.BA6]=0;"seg0";"segX")))) -> f | BC6: f | BD6: of:=HLOOKUP([.BF6];[.$G$5:.$N$22];[.BA4];0) -> 0 | BE6: of:=[.BF6]&T(ORG.OPENOFFICE.STYLE(IF([.BD6]=1;"seg1";IF([.BD6]=0;"seg0";"segX")))) -> b | BF6: b | BG6: of:=HLOOKUP([.BI6];[.$G$5:.$N$22];[.BG4];0) -> 0 | BH6: of:=[.BI6]&T(ORG.OPENOFFICE.STYLE(IF([.BG6]=1;"seg1";IF([.BG6]=0;"seg0";"segX")))) -> f | BI6: f | BJ6: of:=HLOOKUP([.BL6];[.$G$5:.$N$22];[.BG4];0) -> 1 | BK6: of:=[.BL6]&T(ORG.OPENOFFICE.STYLE(IF([.BJ6]=1;"seg1";IF([.BJ6]=0;"seg0";"segX")))) -> b | BL6: b
B7: 0 | C7: of:=MOD(ROUNDDOWN([.$B7]/[.C$6]);2) -> 0 | D7: of:=MOD(ROUNDDOWN([.$B7]/[.D$6]);2) -> 0 | E7: of:=MOD(ROUNDDOWN([.$B7]/[.E$6]);2) -> 0 | F7: of:=MOD(ROUNDDOWN([.$B7]/[.F$6]);2) -> 0 | G7: 1 | H7: 1 | I7: 1 | J7: 1 | K7: 1 | L7: 1 | M7: 0 | N7: 0
B8: of:=[.B7]+1 -> 1 | C8: of:=MOD(ROUNDDOWN([.$B8]/[.C$6]);2) -> 0 | D8: of:=MOD(ROUNDDOWN([.$B8]/[.D$6]);2) -> 0 | E8: of:=MOD(ROUNDDOWN([.$B8]/[.E$6]);2) -> 0 | F8: of:=MOD(ROUNDDOWN([.$B8]/[.F$6]);2) -> 1 | G8: 0 | H8: 1 | I8: 1 | J8: 0 | K8: 0 | L8: 0 | M8: 0 | N8: 0 | R8: of:=HLOOKUP([.U8];[.$G$5:.$N$22];[.Q4];0) -> 0 | S8: of:=[.U8]&T(ORG.OPENOFFICE.STYLE(IF([.R8]=1;"seg1";IF([.R8]=0;"seg0";"segX")))) -> g | U8: g | X8: of:=HLOOKUP([.AA8];[.$G$5:.$N$22];[.W4];0) -> 0 | Y8: of:=[.AA8]&T(ORG.OPENOFFICE.STYLE(IF([.X8]=1;"seg1";IF([.X8]=0;"seg0";"segX")))) -> g | AA8: g | AD8: of:=HLOOKUP([.AG8];[.$G$5:.$N$22];[.AC4];0) -> 1 | AE8: of:=[.AG8]&T(ORG.OPENOFFICE.STYLE(IF([.AD8]=1;"seg1";IF([.AD8]=0;"seg0";"segX")))) -> g | AG8: g | AJ8: of:=HLOOKUP([.AM8];[.$G$5:.$N$22];[.AI4];0) -> 1 | AK8: of:=[.AM8]&T(ORG.OPENOFFICE.STYLE(IF([.AJ8]=1;"seg1";IF([.AJ8]=0;"seg0";"segX")))) -> g | AM8: g | AP8: of:=HLOOKUP([.AS8];[.$G$5:.$N$22];[.AO4];0) -> 1 | AQ8: of:=[.AS8]&T(ORG.OPENOFFICE.STYLE(IF([.AP8]=1;"seg1";IF([.AP8]=0;"seg0";"segX")))) -> g | AS8: g | AV8: of:=HLOOKUP([.AY8];[.$G$5:.$N$22];[.AU4];0) -> 1 | AW8: of:=[.AY8]&T(ORG.OPENOFFICE.STYLE(IF([.AV8]=1;"seg1";IF([.AV8]=0;"seg0";"segX")))) -> g | AY8: g | BB8: of:=HLOOKUP([.BE8];[.$G$5:.$N$22];[.BA4];0) -> 1 | BC8: of:=[.BE8]&T(ORG.OPENOFFICE.STYLE(IF([.BB8]=1;"seg1";IF([.BB8]=0;"seg0";"segX")))) -> g | BE8: g | BH8: of:=HLOOKUP([.BK8];[.$G$5:.$N$22];[.BG4];0) -> 0 | BI8: of:=[.BK8]&T(ORG.OPENOFFICE.STYLE(IF([.BH8]=1;"seg1";IF([.BH8]=0;"seg0";"segX")))) -> g | BK8: g
B9: of:=[.B8]+1 -> 2 | C9: of:=MOD(ROUNDDOWN([.$B9]/[.C$6]);2) -> 0 | D9: of:=MOD(ROUNDDOWN([.$B9]/[.D$6]);2) -> 0 | E9: of:=MOD(ROUNDDOWN([.$B9]/[.E$6]);2) -> 1 | F9: of:=MOD(ROUNDDOWN([.$B9]/[.F$6]);2) -> 0 | G9: 1 | H9: 1 | I9: 0 | J9: 1 | K9: 1 | L9: 0 | M9: 1 | N9: 0 | Q9: of:=HLOOKUP([.S9];[.$G$5:.$N$22];[.Q4];0) -> 1 | R9: of:=[.S9]&T(ORG.OPENOFFICE.STYLE(IF([.Q9]=1;"seg1";IF([.Q9]=0;"seg0";"segX")))) -> e | S9: e | T9: of:=HLOOKUP([.V9];[.$G$5:.$N$22];[.Q4];0) -> 1 | U9: of:=[.V9]&T(ORG.OPENOFFICE.STYLE(IF([.T9]=1;"seg1";IF([.T9]=0;"seg0";"segX")))) -> c | V9: c | W9: of:=HLOOKUP([.Y9];[.$G$5:.$N$22];[.W4];0) -> 0 | X9: of:=[.Y9]&T(ORG.OPENOFFICE.STYLE(IF([.W9]=1;"seg1";IF([.W9]=0;"seg0";"segX")))) -> e | Y9: e | Z9: of:=HLOOKUP([.AB9];[.$G$5:.$N$22];[.W4];0) -> 1 | AA9: of:=[.AB9]&T(ORG.OPENOFFICE.STYLE(IF([.Z9]=1;"seg1";IF([.Z9]=0;"seg0";"segX")))) -> c | AB9: c | AC9: of:=HLOOKUP([.AE9];[.$G$5:.$N$22];[.AC4];0) -> 1 | AD9: of:=[.AE9]&T(ORG.OPENOFFICE.STYLE(IF([.AC9]=1;"seg1";IF([.AC9]=0;"seg0";"segX")))) -> e | AE9: e | AF9: of:=HLOOKUP([.AH9];[.$G$5:.$N$22];[.AC4];0) -> 0 | AG9: of:=[.AH9]&T(ORG.OPENOFFICE.STYLE(IF([.AF9]=1;"seg1";IF([.AF9]=0;"seg0";"segX")))) -> c | AH9: c | AI9: of:=HLOOKUP([.AK9];[.$G$5:.$N$22];[.AI4];0) -> 0 | AJ9: of:=[.AK9]&T(ORG.OPENOFFICE.STYLE(IF([.AI9]=1;"seg1";IF([.AI9]=0;"seg0";"segX")))) -> e | AK9: e | AL9: of:=HLOOKUP([.AN9];[.$G$5:.$N$22];[.AI4];0) -> 1 | AM9: of:=[.AN9]&T(ORG.OPENOFFICE.STYLE(IF([.AL9]=1;"seg1";IF([.AL9]=0;"seg0";"segX")))) -> c | AN9: c | AO9: of:=HLOOKUP([.AQ9];[.$G$5:.$N$22];[.AO4];0) -> 0 | AP9: of:=[.AQ9]&T(ORG.OPENOFFICE.STYLE(IF([.AO9]=1;"seg1";IF([.AO9]=0;"seg0";"segX")))) -> e | AQ9: e | AR9: of:=HLOOKUP([.AT9];[.$G$5:.$N$22];[.AO4];0) -> 1 | AS9: of:=[.AT9]&T(ORG.OPENOFFICE.STYLE(IF([.AR9]=1;"seg1";IF([.AR9]=0;"seg0";"segX")))) -> c | AT9: c | AU9: of:=HLOOKUP([.AW9];[.$G$5:.$N$22];[.AU4];0) -> 0 | AV9: of:=[.AW9]&T(ORG.OPENOFFICE.STYLE(IF([.AU9]=1;"seg1";IF([.AU9]=0;"seg0";"segX")))) -> e | AW9: e | AX9: of:=HLOOKUP([.AZ9];[.$G$5:.$N$22];[.AU4];0) -> 1 | AY9: of:=[.AZ9]&T(ORG.OPENOFFICE.STYLE(IF([.AX9]=1;"seg1";IF([.AX9]=0;"seg0";"segX")))) -> c | AZ9: c | BA9: of:=HLOOKUP([.BC9];[.$G$5:.$N$22];[.BA4];0) -> 1 | BB9: of:=[.BC9]&T(ORG.OPENOFFICE.STYLE(IF([.BA9]=1;"seg1";IF([.BA9]=0;"seg0";"segX")))) -> e | BC9: e | BD9: of:=HLOOKUP([.BF9];[.$G$5:.$N$22];[.BA4];0) -> 1 | BE9: of:=[.BF9]&T(ORG.OPENOFFICE.STYLE(IF([.BD9]=1;"seg1";IF([.BD9]=0;"seg0";"segX")))) -> c | BF9: c | BG9: of:=HLOOKUP([.BI9];[.$G$5:.$N$22];[.BG4];0) -> 0 | BH9: of:=[.BI9]&T(ORG.OPENOFFICE.STYLE(IF([.BG9]=1;"seg1";IF([.BG9]=0;"seg0";"segX")))) -> e | BI9: e | BJ9: of:=HLOOKUP([.BL9];[.$G$5:.$N$22];[.BG4];0) -> 1 | BK9: of:=[.BL9]&T(ORG.OPENOFFICE.STYLE(IF([.BJ9]=1;"seg1";IF([.BJ9]=0;"seg0";"segX")))) -> c | BL9: c
B10: of:=[.B9]+1 -> 3 | C10: of:=MOD(ROUNDDOWN([.$B10]/[.C$6]);2) -> 0 | D10: of:=MOD(ROUNDDOWN([.$B10]/[.D$6]);2) -> 0 | E10: of:=MOD(ROUNDDOWN([.$B10]/[.E$6]);2) -> 1 | F10: of:=MOD(ROUNDDOWN([.$B10]/[.F$6]);2) -> 1 | G10: 1 | H10: 1 | I10: 1 | J10: 1 | K10: 0 | L10: 0 | M10: 1 | N10: 0
B11: of:=[.B10]+1 -> 4 | C11: of:=MOD(ROUNDDOWN([.$B11]/[.C$6]);2) -> 0 | D11: of:=MOD(ROUNDDOWN([.$B11]/[.D$6]);2) -> 1 | E11: of:=MOD(ROUNDDOWN([.$B11]/[.E$6]);2) -> 0 | F11: of:=MOD(ROUNDDOWN([.$B11]/[.F$6]);2) -> 0 | G11: 0 | H11: 1 | I11: 1 | J11: 0 | K11: 0 | L11: 1 | M11: 1 | N11: 0 | R11: of:=HLOOKUP([.U11];[.$G$5:.$N$22];[.Q4];0) -> 1 | S11: of:=[.U11]&T(ORG.OPENOFFICE.STYLE(IF([.R11]=1;"seg1";IF([.R11]=0;"seg0";"segX")))) -> d | U11: d | X11: of:=HLOOKUP([.AA11];[.$G$5:.$N$22];[.W4];0) -> 0 | Y11: of:=[.AA11]&T(ORG.OPENOFFICE.STYLE(IF([.X11]=1;"seg1";IF([.X11]=0;"seg0";"segX")))) -> d | AA11: d | AD11: of:=HLOOKUP([.AG11];[.$G$5:.$N$22];[.AC4];0) -> 1 | AE11: of:=[.AG11]&T(ORG.OPENOFFICE.STYLE(IF([.AD11]=1;"seg1";IF([.AD11]=0;"seg0";"segX")))) -> d | AG11: d | AJ11: of:=HLOOKUP([.AM11];[.$G$5:.$N$22];[.AI4];0) -> 1 | AK11: of:=[.AM11]&T(ORG.OPENOFFICE.STYLE(IF([.AJ11]=1;"seg1";IF([.AJ11]=0;"seg0";"segX")))) -> d | AM11: d | AP11: of:=HLOOKUP([.AS11];[.$G$5:.$N$22];[.AO4];0) -> 0 | AQ11: of:=[.AS11]&T(ORG.OPENOFFICE.STYLE(IF([.AP11]=1;"seg1";IF([.AP11]=0;"seg0";"segX")))) -> d | AS11: d | AV11: of:=HLOOKUP([.AY11];[.$G$5:.$N$22];[.AU4];0) -> 1 | AW11: of:=[.AY11]&T(ORG.OPENOFFICE.STYLE(IF([.AV11]=1;"seg1";IF([.AV11]=0;"seg0";"segX")))) -> d | AY11: d | BB11: of:=HLOOKUP([.BE11];[.$G$5:.$N$22];[.BA4];0) -> 1 | BC11: of:=[.BE11]&T(ORG.OPENOFFICE.STYLE(IF([.BB11]=1;"seg1";IF([.BB11]=0;"seg0";"segX")))) -> d | BE11: d | BH11: of:=HLOOKUP([.BK11];[.$G$5:.$N$22];[.BG4];0) -> 0 | BI11: of:=[.BK11]&T(ORG.OPENOFFICE.STYLE(IF([.BH11]=1;"seg1";IF([.BH11]=0;"seg0";"segX")))) -> d | BK11: d
B12: of:=[.B11]+1 -> 5 | C12: of:=MOD(ROUNDDOWN([.$B12]/[.C$6]);2) -> 0 | D12: of:=MOD(ROUNDDOWN([.$B12]/[.D$6]);2) -> 1 | E12: of:=MOD(ROUNDDOWN([.$B12]/[.E$6]);2) -> 0 | F12: of:=MOD(ROUNDDOWN([.$B12]/[.F$6]);2) -> 1 | G12: 1 | H12: 0 | I12: 1 | J12: 1 | K12: 0 | L12: 1 | M12: 1 | N12: 0
B13: of:=[.B12]+1 -> 6 | C13: of:=MOD(ROUNDDOWN([.$B13]/[.C$6]);2) -> 0 | D13: of:=MOD(ROUNDDOWN([.$B13]/[.D$6]);2) -> 1 | E13: of:=MOD(ROUNDDOWN([.$B13]/[.E$6]);2) -> 1 | F13: of:=MOD(ROUNDDOWN([.$B13]/[.F$6]);2) -> 0 | G13: 1 | H13: 0 | I13: 1 | J13: 1 | K13: 1 | L13: 1 | M13: 1 | N13: 0 | Q13: of:=[.BG3]+1 -> 8 | W13: of:=[.Q13]+1 -> 9 | AC13: of:=[.W13]+1 -> 10 | AI13: of:=[.AC13]+1 -> 11 | AO13: of:=[.AI13]+1 -> 12 | AU13: of:=[.AO13]+1 -> 13 | BA13: of:=[.AU13]+1 -> 14 | BG13: of:=[.BA13]+1 -> 15
B14: of:=[.B13]+1 -> 7 | C14: of:=MOD(ROUNDDOWN([.$B14]/[.C$6]);2) -> 0 | D14: of:=MOD(ROUNDDOWN([.$B14]/[.D$6]);2) -> 1 | E14: of:=MOD(ROUNDDOWN([.$B14]/[.E$6]);2) -> 1 | F14: of:=MOD(ROUNDDOWN([.$B14]/[.F$6]);2) -> 1 | G14: 1 | H14: 1 | I14: 1 | J14: 0 | K14: 0 | L14: 0 | M14: 0 | N14: 1 | Q14: of:=MATCH([.Q13];[.$B$7:.$B$22];0)+2 -> 11 | W14: of:=MATCH([.W13];[.$B$7:.$B$22];0)+2 -> 12 | AC14: of:=MATCH([.AC13];[.$B$7:.$B$22];0)+2 -> 13 | AI14: of:=MATCH([.AI13];[.$B$7:.$B$22];0)+2 -> 14 | AO14: of:=MATCH([.AO13];[.$B$7:.$B$22];0)+2 -> 15 | AU14: of:=MATCH([.AU13];[.$B$7:.$B$22];0)+2 -> 16 | BA14: of:=MATCH([.BA13];[.$B$7:.$B$22];0)+2 -> 17 | BG14: of:=MATCH([.BG13];[.$B$7:.$B$22];0)+2 -> 18
B15: of:=[.B14]+1 -> 8 | C15: of:=MOD(ROUNDDOWN([.$B15]/[.C$6]);2) -> 1 | D15: of:=MOD(ROUNDDOWN([.$B15]/[.D$6]);2) -> 0 | E15: of:=MOD(ROUNDDOWN([.$B15]/[.E$6]);2) -> 0 | F15: of:=MOD(ROUNDDOWN([.$B15]/[.F$6]);2) -> 0 | G15: 1 | H15: 1 | I15: 1 | J15: 1 | K15: 1 | L15: 1 | M15: 1 | N15: 0 | R15: of:=HLOOKUP([.U15];[.$G$5:.$N$22];[.Q14];0) -> 1 | S15: of:=[.U15]&T(ORG.OPENOFFICE.STYLE(IF([.R15]=1;"seg1";IF([.R15]=0;"seg0";"segX")))) -> a | U15: a | X15: of:=HLOOKUP([.AA15];[.$G$5:.$N$22];[.W14];0) -> 1 | Y15: of:=[.AA15]&T(ORG.OPENOFFICE.STYLE(IF([.X15]=1;"seg1";IF([.X15]=0;"seg0";"segX")))) -> a | AA15: a | AD15: of:=HLOOKUP([.AG15];[.$G$5:.$N$22];[.AC14];0) -> 1 | AE15: of:=[.AG15]&T(ORG.OPENOFFICE.STYLE(IF([.AD15]=1;"seg1";IF([.AD15]=0;"seg0";"segX")))) -> a | AG15: a | AJ15: of:=HLOOKUP([.AM15];[.$G$5:.$N$22];[.AI14];0) -> 0 | AK15: of:=[.AM15]&T(ORG.OPENOFFICE.STYLE(IF([.AJ15]=1;"seg1";IF([.AJ15]=0;"seg0";"segX")))) -> a | AM15: a | AP15: of:=HLOOKUP([.AS15];[.$G$5:.$N$22];[.AO14];0) -> 1 | AQ15: of:=[.AS15]&T(ORG.OPENOFFICE.STYLE(IF([.AP15]=1;"seg1";IF([.AP15]=0;"seg0";"segX")))) -> a | AS15: a | AV15: of:=HLOOKUP([.AY15];[.$G$5:.$N$22];[.AU14];0) -> 0 | AW15: of:=[.AY15]&T(ORG.OPENOFFICE.STYLE(IF([.AV15]=1;"seg1";IF([.AV15]=0;"seg0";"segX")))) -> a | AY15: a | BB15: of:=HLOOKUP([.BE15];[.$G$5:.$N$22];[.BA14];0) -> 1 | BC15: of:=[.BE15]&T(ORG.OPENOFFICE.STYLE(IF([.BB15]=1;"seg1";IF([.BB15]=0;"seg0";"segX")))) -> a | BE15: a | BH15: of:=HLOOKUP([.BK15];[.$G$5:.$N$22];[.BG14];0) -> 1 | BI15: of:=[.BK15]&T(ORG.OPENOFFICE.STYLE(IF([.BH15]=1;"seg1";IF([.BH15]=0;"seg0";"segX")))) -> a | BK15: a
B16: of:=[.B15]+1 -> 9 | C16: of:=MOD(ROUNDDOWN([.$B16]/[.C$6]);2) -> 1 | D16: of:=MOD(ROUNDDOWN([.$B16]/[.D$6]);2) -> 0 | E16: of:=MOD(ROUNDDOWN([.$B16]/[.E$6]);2) -> 0 | F16: of:=MOD(ROUNDDOWN([.$B16]/[.F$6]);2) -> 1 | G16: 1 | H16: 1 | I16: 1 | J16: 1 | K16: 0 | L16: 1 | M16: 1 | N16: 0 | Q16: of:=HLOOKUP([.S16];[.$G$5:.$N$22];[.Q14];0) -> 1 | R16: of:=[.S16]&T(ORG.OPENOFFICE.STYLE(IF([.Q16]=1;"seg1";IF([.Q16]=0;"seg0";"segX")))) -> f | S16: f | T16: of:=HLOOKUP([.V16];[.$G$5:.$N$22];[.Q14];0) -> 1 | U16: of:=[.V16]&T(ORG.OPENOFFICE.STYLE(IF([.T16]=1;"seg1";IF([.T16]=0;"seg0";"segX")))) -> b | V16: b | W16: of:=HLOOKUP([.Y16];[.$G$5:.$N$22];[.W14];0) -> 1 | X16: of:=[.Y16]&T(ORG.OPENOFFICE.STYLE(IF([.W16]=1;"seg1";IF([.W16]=0;"seg0";"segX")))) -> f | Y16: f | Z16: of:=HLOOKUP([.AB16];[.$G$5:.$N$22];[.W14];0) -> 1 | AA16: of:=[.AB16]&T(ORG.OPENOFFICE.STYLE(IF([.Z16]=1;"seg1";IF([.Z16]=0;"seg0";"segX")))) -> b | AB16: b | AC16: of:=HLOOKUP([.AE16];[.$G$5:.$N$22];[.AC14];0) -> 1 | AD16: of:=[.AE16]&T(ORG.OPENOFFICE.STYLE(IF([.AC16]=1;"seg1";IF([.AC16]=0;"seg0";"segX")))) -> f | AE16: f | AF16: of:=HLOOKUP([.AH16];[.$G$5:.$N$22];[.AC14];0) -> 1 | AG16: of:=[.AH16]&T(ORG.OPENOFFICE.STYLE(IF([.AF16]=1;"seg1";IF([.AF16]=0;"seg0";"segX")))) -> b | AH16: b | AI16: of:=HLOOKUP([.AK16];[.$G$5:.$N$22];[.AI14];0) -> 1 | AJ16: of:=[.AK16]&T(ORG.OPENOFFICE.STYLE(IF([.AI16]=1;"seg1";IF([.AI16]=0;"seg0";"segX")))) -> f | AK16: f | AL16: of:=HLOOKUP([.AN16];[.$G$5:.$N$22];[.AI14];0) -> 0 | AM16: of:=[.AN16]&T(ORG.OPENOFFICE.STYLE(IF([.AL16]=1;"seg1";IF([.AL16]=0;"seg0";"segX")))) -> b | AN16: b | AO16: of:=HLOOKUP([.AQ16];[.$G$5:.$N$22];[.AO14];0) -> 1 | AP16: of:=[.AQ16]&T(ORG.OPENOFFICE.STYLE(IF([.AO16]=1;"seg1";IF([.AO16]=0;"seg0";"segX")))) -> f | AQ16: f | AR16: of:=HLOOKUP([.AT16];[.$G$5:.$N$22];[.AO14];0) -> 0 | AS16: of:=[.AT16]&T(ORG.OPENOFFICE.STYLE(IF([.AR16]=1;"seg1";IF([.AR16]=0;"seg0";"segX")))) -> b | AT16: b | AU16: of:=HLOOKUP([.AW16];[.$G$5:.$N$22];[.AU14];0) -> 0 | AV16: of:=[.AW16]&T(ORG.OPENOFFICE.STYLE(IF([.AU16]=1;"seg1";IF([.AU16]=0;"seg0";"segX")))) -> f | AW16: f | AX16: of:=HLOOKUP([.AZ16];[.$G$5:.$N$22];[.AU14];0) -> 1 | AY16: of:=[.AZ16]&T(ORG.OPENOFFICE.STYLE(IF([.AX16]=1;"seg1";IF([.AX16]=0;"seg0";"segX")))) -> b | AZ16: b | BA16: of:=HLOOKUP([.BC16];[.$G$5:.$N$22];[.BA14];0) -> 1 | BB16: of:=[.BC16]&T(ORG.OPENOFFICE.STYLE(IF([.BA16]=1;"seg1";IF([.BA16]=0;"seg0";"segX")))) -> f | BC16: f | BD16: of:=HLOOKUP([.BF16];[.$G$5:.$N$22];[.BA14];0) -> 0 | BE16: of:=[.BF16]&T(ORG.OPENOFFICE.STYLE(IF([.BD16]=1;"seg1";IF([.BD16]=0;"seg0";"segX")))) -> b | BF16: b | BG16: of:=HLOOKUP([.BI16];[.$G$5:.$N$22];[.BG14];0) -> 1 | BH16: of:=[.BI16]&T(ORG.OPENOFFICE.STYLE(IF([.BG16]=1;"seg1";IF([.BG16]=0;"seg0";"segX")))) -> f | BI16: f | BJ16: of:=HLOOKUP([.BL16];[.$G$5:.$N$22];[.BG14];0) -> 0 | BK16: of:=[.BL16]&T(ORG.OPENOFFICE.STYLE(IF([.BJ16]=1;"seg1";IF([.BJ16]=0;"seg0";"segX")))) -> b | BL16: b
B17: of:=[.B16]+1 -> 10 | C17: of:=MOD(ROUNDDOWN([.$B17]/[.C$6]);2) -> 1 | D17: of:=MOD(ROUNDDOWN([.$B17]/[.D$6]);2) -> 0 | E17: of:=MOD(ROUNDDOWN([.$B17]/[.E$6]);2) -> 1 | F17: of:=MOD(ROUNDDOWN([.$B17]/[.F$6]);2) -> 0 | G17: 1 | H17: 1 | I17: 1 | J17: 0 | K17: 1 | L17: 1 | M17: 1 | N17: 0
B18: of:=[.B17]+1 -> 11 | C18: of:=MOD(ROUNDDOWN([.$B18]/[.C$6]);2) -> 1 | D18: of:=MOD(ROUNDDOWN([.$B18]/[.D$6]);2) -> 0 | E18: of:=MOD(ROUNDDOWN([.$B18]/[.E$6]);2) -> 1 | F18: of:=MOD(ROUNDDOWN([.$B18]/[.F$6]);2) -> 1 | G18: 0 | H18: 0 | I18: 1 | J18: 1 | K18: 1 | L18: 1 | M18: 1 | N18: 0 | R18: of:=HLOOKUP([.U18];[.$G$5:.$N$22];[.Q14];0) -> 1 | S18: of:=[.U18]&T(ORG.OPENOFFICE.STYLE(IF([.R18]=1;"seg1";IF([.R18]=0;"seg0";"segX")))) -> g | U18: g | X18: of:=HLOOKUP([.AA18];[.$G$5:.$N$22];[.W14];0) -> 1 | Y18: of:=[.AA18]&T(ORG.OPENOFFICE.STYLE(IF([.X18]=1;"seg1";IF([.X18]=0;"seg0";"segX")))) -> g | AA18: g | AD18: of:=HLOOKUP([.AG18];[.$G$5:.$N$22];[.AC14];0) -> 1 | AE18: of:=[.AG18]&T(ORG.OPENOFFICE.STYLE(IF([.AD18]=1;"seg1";IF([.AD18]=0;"seg0";"segX")))) -> g | AG18: g | AJ18: of:=HLOOKUP([.AM18];[.$G$5:.$N$22];[.AI14];0) -> 1 | AK18: of:=[.AM18]&T(ORG.OPENOFFICE.STYLE(IF([.AJ18]=1;"seg1";IF([.AJ18]=0;"seg0";"segX")))) -> g | AM18: g | AP18: of:=HLOOKUP([.AS18];[.$G$5:.$N$22];[.AO14];0) -> 0 | AQ18: of:=[.AS18]&T(ORG.OPENOFFICE.STYLE(IF([.AP18]=1;"seg1";IF([.AP18]=0;"seg0";"segX")))) -> g | AS18: g | AV18: of:=HLOOKUP([.AY18];[.$G$5:.$N$22];[.AU14];0) -> 1 | AW18: of:=[.AY18]&T(ORG.OPENOFFICE.STYLE(IF([.AV18]=1;"seg1";IF([.AV18]=0;"seg0";"segX")))) -> g | AY18: g | BB18: of:=HLOOKUP([.BE18];[.$G$5:.$N$22];[.BA14];0) -> 1 | BC18: of:=[.BE18]&T(ORG.OPENOFFICE.STYLE(IF([.BB18]=1;"seg1";IF([.BB18]=0;"seg0";"segX")))) -> g | BE18: g | BH18: of:=HLOOKUP([.BK18];[.$G$5:.$N$22];[.BG14];0) -> 1 | BI18: of:=[.BK18]&T(ORG.OPENOFFICE.STYLE(IF([.BH18]=1;"seg1";IF([.BH18]=0;"seg0";"segX")))) -> g | BK18: g
B19: of:=[.B18]+1 -> 12 | C19: of:=MOD(ROUNDDOWN([.$B19]/[.C$6]);2) -> 1 | D19: of:=MOD(ROUNDDOWN([.$B19]/[.D$6]);2) -> 1 | E19: of:=MOD(ROUNDDOWN([.$B19]/[.E$6]);2) -> 0 | F19: of:=MOD(ROUNDDOWN([.$B19]/[.F$6]);2) -> 0 | G19: 1 | H19: 0 | I19: 0 | J19: 1 | K19: 1 | L19: 1 | M19: 0 | N19: 0 | Q19: of:=HLOOKUP([.S19];[.$G$5:.$N$22];[.Q14];0) -> 1 | R19: of:=[.S19]&T(ORG.OPENOFFICE.STYLE(IF([.Q19]=1;"seg1";IF([.Q19]=0;"seg0";"segX")))) -> e | S19: e | T19: of:=HLOOKUP([.V19];[.$G$5:.$N$22];[.Q14];0) -> 1 | U19: of:=[.V19]&T(ORG.OPENOFFICE.STYLE(IF([.T19]=1;"seg1";IF([.T19]=0;"seg0";"segX")))) -> c | V19: c | W19: of:=HLOOKUP([.Y19];[.$G$5:.$N$22];[.W14];0) -> 0 | X19: of:=[.Y19]&T(ORG.OPENOFFICE.STYLE(IF([.W19]=1;"seg1";IF([.W19]=0;"seg0";"segX")))) -> e | Y19: e | Z19: of:=HLOOKUP([.AB19];[.$G$5:.$N$22];[.W14];0) -> 1 | AA19: of:=[.AB19]&T(ORG.OPENOFFICE.STYLE(IF([.Z19]=1;"seg1";IF([.Z19]=0;"seg0";"segX")))) -> c | AB19: c | AC19: of:=HLOOKUP([.AE19];[.$G$5:.$N$22];[.AC14];0) -> 1 | AD19: of:=[.AE19]&T(ORG.OPENOFFICE.STYLE(IF([.AC19]=1;"seg1";IF([.AC19]=0;"seg0";"segX")))) -> e | AE19: e | AF19: of:=HLOOKUP([.AH19];[.$G$5:.$N$22];[.AC14];0) -> 1 | AG19: of:=[.AH19]&T(ORG.OPENOFFICE.STYLE(IF([.AF19]=1;"seg1";IF([.AF19]=0;"seg0";"segX")))) -> c | AH19: c | AI19: of:=HLOOKUP([.AK19];[.$G$5:.$N$22];[.AI14];0) -> 1 | AJ19: of:=[.AK19]&T(ORG.OPENOFFICE.STYLE(IF([.AI19]=1;"seg1";IF([.AI19]=0;"seg0";"segX")))) -> e | AK19: e | AL19: of:=HLOOKUP([.AN19];[.$G$5:.$N$22];[.AI14];0) -> 1 | AM19: of:=[.AN19]&T(ORG.OPENOFFICE.STYLE(IF([.AL19]=1;"seg1";IF([.AL19]=0;"seg0";"segX")))) -> c | AN19: c | AO19: of:=HLOOKUP([.AQ19];[.$G$5:.$N$22];[.AO14];0) -> 1 | AP19: of:=[.AQ19]&T(ORG.OPENOFFICE.STYLE(IF([.AO19]=1;"seg1";IF([.AO19]=0;"seg0";"segX")))) -> e | AQ19: e | AR19: of:=HLOOKUP([.AT19];[.$G$5:.$N$22];[.AO14];0) -> 0 | AS19: of:=[.AT19]&T(ORG.OPENOFFICE.STYLE(IF([.AR19]=1;"seg1";IF([.AR19]=0;"seg0";"segX")))) -> c | AT19: c | AU19: of:=HLOOKUP([.AW19];[.$G$5:.$N$22];[.AU14];0) -> 1 | AV19: of:=[.AW19]&T(ORG.OPENOFFICE.STYLE(IF([.AU19]=1;"seg1";IF([.AU19]=0;"seg0";"segX")))) -> e | AW19: e | AX19: of:=HLOOKUP([.AZ19];[.$G$5:.$N$22];[.AU14];0) -> 1 | AY19: of:=[.AZ19]&T(ORG.OPENOFFICE.STYLE(IF([.AX19]=1;"seg1";IF([.AX19]=0;"seg0";"segX")))) -> c | AZ19: c | BA19: of:=HLOOKUP([.BC19];[.$G$5:.$N$22];[.BA14];0) -> 1 | BB19: of:=[.BC19]&T(ORG.OPENOFFICE.STYLE(IF([.BA19]=1;"seg1";IF([.BA19]=0;"seg0";"segX")))) -> e | BC19: e | BD19: of:=HLOOKUP([.BF19];[.$G$5:.$N$22];[.BA14];0) -> 0 | BE19: of:=[.BF19]&T(ORG.OPENOFFICE.STYLE(IF([.BD19]=1;"seg1";IF([.BD19]=0;"seg0";"segX")))) -> c | BF19: c | BG19: of:=HLOOKUP([.BI19];[.$G$5:.$N$22];[.BG14];0) -> 1 | BH19: of:=[.BI19]&T(ORG.OPENOFFICE.STYLE(IF([.BG19]=1;"seg1";IF([.BG19]=0;"seg0";"segX")))) -> e | BI19: e | BJ19: of:=HLOOKUP([.BL19];[.$G$5:.$N$22];[.BG14];0) -> 0 | BK19: of:=[.BL19]&T(ORG.OPENOFFICE.STYLE(IF([.BJ19]=1;"seg1";IF([.BJ19]=0;"seg0";"segX")))) -> c | BL19: c
B20: of:=[.B19]+1 -> 13 | C20: of:=MOD(ROUNDDOWN([.$B20]/[.C$6]);2) -> 1 | D20: of:=MOD(ROUNDDOWN([.$B20]/[.D$6]);2) -> 1 | E20: of:=MOD(ROUNDDOWN([.$B20]/[.E$6]);2) -> 0 | F20: of:=MOD(ROUNDDOWN([.$B20]/[.F$6]);2) -> 1 | G20: 0 | H20: 1 | I20: 1 | J20: 1 | K20: 1 | L20: 0 | M20: 1 | N20: 0
B21: of:=[.B20]+1 -> 14 | C21: of:=MOD(ROUNDDOWN([.$B21]/[.C$6]);2) -> 1 | D21: of:=MOD(ROUNDDOWN([.$B21]/[.D$6]);2) -> 1 | E21: of:=MOD(ROUNDDOWN([.$B21]/[.E$6]);2) -> 1 | F21: of:=MOD(ROUNDDOWN([.$B21]/[.F$6]);2) -> 0 | G21: 1 | H21: 0 | I21: 0 | J21: 1 | K21: 1 | L21: 1 | M21: 1 | N21: 0 | R21: of:=HLOOKUP([.U21];[.$G$5:.$N$22];[.Q14];0) -> 1 | S21: of:=[.U21]&T(ORG.OPENOFFICE.STYLE(IF([.R21]=1;"seg1";IF([.R21]=0;"seg0";"segX")))) -> d | U21: d | X21: of:=HLOOKUP([.AA21];[.$G$5:.$N$22];[.W14];0) -> 1 | Y21: of:=[.AA21]&T(ORG.OPENOFFICE.STYLE(IF([.X21]=1;"seg1";IF([.X21]=0;"seg0";"segX")))) -> d | AA21: d | AD21: of:=HLOOKUP([.AG21];[.$G$5:.$N$22];[.AC14];0) -> 0 | AE21: of:=[.AG21]&T(ORG.OPENOFFICE.STYLE(IF([.AD21]=1;"seg1";IF([.AD21]=0;"seg0";"segX")))) -> d | AG21: d | AJ21: of:=HLOOKUP([.AM21];[.$G$5:.$N$22];[.AI14];0) -> 1 | AK21: of:=[.AM21]&T(ORG.OPENOFFICE.STYLE(IF([.AJ21]=1;"seg1";IF([.AJ21]=0;"seg0";"segX")))) -> d | AM21: d | AP21: of:=HLOOKUP([.AS21];[.$G$5:.$N$22];[.AO14];0) -> 1 | AQ21: of:=[.AS21]&T(ORG.OPENOFFICE.STYLE(IF([.AP21]=1;"seg1";IF([.AP21]=0;"seg0";"segX")))) -> d | AS21: d | AV21: of:=HLOOKUP([.AY21];[.$G$5:.$N$22];[.AU14];0) -> 1 | AW21: of:=[.AY21]&T(ORG.OPENOFFICE.STYLE(IF([.AV21]=1;"seg1";IF([.AV21]=0;"seg0";"segX")))) -> d | AY21: d | BB21: of:=HLOOKUP([.BE21];[.$G$5:.$N$22];[.BA14];0) -> 1 | BC21: of:=[.BE21]&T(ORG.OPENOFFICE.STYLE(IF([.BB21]=1;"seg1";IF([.BB21]=0;"seg0";"segX")))) -> d | BE21: d | BH21: of:=HLOOKUP([.BK21];[.$G$5:.$N$22];[.BG14];0) -> 0 | BI21: of:=[.BK21]&T(ORG.OPENOFFICE.STYLE(IF([.BH21]=1;"seg1";IF([.BH21]=0;"seg0";"segX")))) -> d | BK21: d
B22: of:=[.B21]+1 -> 15 | C22: of:=MOD(ROUNDDOWN([.$B22]/[.C$6]);2) -> 1 | D22: of:=MOD(ROUNDDOWN([.$B22]/[.D$6]);2) -> 1 | E22: of:=MOD(ROUNDDOWN([.$B22]/[.E$6]);2) -> 1 | F22: of:=MOD(ROUNDDOWN([.$B22]/[.F$6]);2) -> 1 | G22: 1 | H22: 0 | I22: 0 | J22: 0 | K22: 1 | L22: 1 | M22: 1 | N22: 1
Q24: Karnaugh-maps
B25: of:=MATCH([.A25];[.$G$5:.$N$5])+5 -> 0 | C25: BA | H25: P | I25: of:=MATCH([.H25];[.$G$5:.$N$5])+5 -> 13 | J25: BA | Q25: a | R25: of:=MATCH([.Q25];[.$G$5:.$N$5])+5 -> 6 | S25: BA | X25: b | Y25: of:=MATCH([.X25];[.$G$5:.$N$5])+5 -> 7 | Z25: BA | AE25: c | AF25: of:=MATCH([.AE25];[.$G$5:.$N$5])+5 -> 8 | AG25: BA | AL25: d | AM25: of:=MATCH([.AL25];[.$G$5:.$N$5])+5 -> 9 | AN25: BA | AS25: e | AT25: of:=MATCH([.AS25];[.$G$5:.$N$5])+5 -> 10 | AU25: BA | AZ25: f | BA25: of:=MATCH([.AZ25];[.$G$5:.$N$5])+5 -> 11 | BB25: BA | BG25: g | BH25: of:=MATCH([.BG25];[.$G$5:.$N$5])+5 -> 12 | BI25: BA
C26: 00 | D26: 01 | E26: 11 | F26: 10 | J26: 00 | K26: 01 | L26: 11 | M26: 10 | S26: 00 | T26: 01 | U26: 11 | V26: 10 | Z26: 00 | AA26: 01 | AB26: 11 | AC26: 10 | AG26: 00 | AH26: 01 | AI26: 11 | AJ26: 10 | AN26: 00 | AO26: 01 | AP26: 11 | AQ26: 10 | AU26: 00 | AV26: 01 | AW26: 11 | AX26: 10 | BB26: 00 | BC26: 01 | BD26: 11 | BE26: 10 | BI26: 00 | BJ26: 01 | BK26: 11 | BL26: 10
A27: DC | C27: of:=HLOOKUP(MID([.C25];1;1);[.$C$5:.$F$6];2;0)*MID([.C26];1;1) + HLOOKUP(MID([.C25];2;1);[.$C$5:.$F$6];2;0)*MID([.C26];2;1) -> 0 | D27: of:=HLOOKUP(MID([.C25];1;1);[.$C$5:.$F$6];2;0)*MID([.D26];1;1) + HLOOKUP(MID([.C25];2;1);[.$C$5:.$F$6];2;0)*MID([.D26];2;1) -> 1 | E27: of:=HLOOKUP(MID([.C25];1;1);[.$C$5:.$F$6];2;0)*MID([.E26];1;1) + HLOOKUP(MID([.C25];2;1);[.$C$5:.$F$6];2;0)*MID([.E26];2;1) -> 3 | F27: of:=HLOOKUP(MID([.C25];1;1);[.$C$5:.$F$6];2;0)*MID([.F26];1;1) + HLOOKUP(MID([.C25];2;1);[.$C$5:.$F$6];2;0)*MID([.F26];2;1) -> 2 | H27: DC | J27: of:=HLOOKUP(MID([.J25];1;1);[.$C$5:.$F$6];2;0)*MID([.J26];1;1) + HLOOKUP(MID([.J25];2;1);[.$C$5:.$F$6];2;0)*MID([.J26];2;1) -> 0 | K27: of:=HLOOKUP(MID([.J25];1;1);[.$C$5:.$F$6];2;0)*MID([.K26];1;1) + HLOOKUP(MID([.J25];2;1);[.$C$5:.$F$6];2;0)*MID([.K26];2;1) -> 1 | L27: of:=HLOOKUP(MID([.J25];1;1);[.$C$5:.$F$6];2;0)*MID([.L26];1;1) + HLOOKUP(MID([.J25];2;1);[.$C$5:.$F$6];2;0)*MID([.L26];2;1) -> 3 | M27: of:=HLOOKUP(MID([.J25];1;1);[.$C$5:.$F$6];2;0)*MID([.M26];1;1) + HLOOKUP(MID([.J25];2;1);[.$C$5:.$F$6];2;0)*MID([.M26];2;1) -> 2 | Q27: DC | S27: of:=HLOOKUP(MID([.S25];1;1);[.$C$5:.$F$6];2;0)*MID([.S26];1;1) + HLOOKUP(MID([.S25];2;1);[.$C$5:.$F$6];2;0)*MID([.S26];2;1) -> 0 | T27: of:=HLOOKUP(MID([.S25];1;1);[.$C$5:.$F$6];2;0)*MID([.T26];1;1) + HLOOKUP(MID([.S25];2;1);[.$C$5:.$F$6];2;0)*MID([.T26];2;1) -> 1 | U27: of:=HLOOKUP(MID([.S25];1;1);[.$C$5:.$F$6];2;0)*MID([.U26];1;1) + HLOOKUP(MID([.S25];2;1);[.$C$5:.$F$6];2;0)*MID([.U26];2;1) -> 3 | V27: of:=HLOOKUP(MID([.S25];1;1);[.$C$5:.$F$6];2;0)*MID([.V26];1;1) + HLOOKUP(MID([.S25];2;1);[.$C$5:.$F$6];2;0)*MID([.V26];2;1) -> 2 | X27: DC | Z27: of:=HLOOKUP(MID([.Z25];1;1);[.$C$5:.$F$6];2;0)*MID([.Z26];1;1) + HLOOKUP(MID([.Z25];2;1);[.$C$5:.$F$6];2;0)*MID([.Z26];2;1) -> 0 | AA27: of:=HLOOKUP(MID([.Z25];1;1);[.$C$5:.$F$6];2;0)*MID([.AA26];1;1) + HLOOKUP(MID([.Z25];2;1);[.$C$5:.$F$6];2;0)*MID([.AA26];2;1) -> 1 | AB27: of:=HLOOKUP(MID([.Z25];1;1);[.$C$5:.$F$6];2;0)*MID([.AB26];1;1) + HLOOKUP(MID([.Z25];2;1);[.$C$5:.$F$6];2;0)*MID([.AB26];2;1) -> 3 | AC27: of:=HLOOKUP(MID([.Z25];1;1);[.$C$5:.$F$6];2;0)*MID([.AC26];1;1) + HLOOKUP(MID([.Z25];2;1);[.$C$5:.$F$6];2;0)*MID([.AC26];2;1) -> 2 | AE27: DC | AG27: of:=HLOOKUP(MID([.AG25];1;1);[.$C$5:.$F$6];2;0)*MID([.AG26];1;1) + HLOOKUP(MID([.AG25];2;1);[.$C$5:.$F$6];2;0)*MID([.AG26];2;1) -> 0 | AH27: of:=HLOOKUP(MID([.AG25];1;1);[.$C$5:.$F$6];2;0)*MID([.AH26];1;1) + HLOOKUP(MID([.AG25];2;1);[.$C$5:.$F$6];2;0)*MID([.AH26];2;1) -> 1 | AI27: of:=HLOOKUP(MID([.AG25];1;1);[.$C$5:.$F$6];2;0)*MID([.AI26];1;1) + HLOOKUP(MID([.AG25];2;1);[.$C$5:.$F$6];2;0)*MID([.AI26];2;1) -> 3 | AJ27: of:=HLOOKUP(MID([.AG25];1;1);[.$C$5:.$F$6];2;0)*MID([.AJ26];1;1) + HLOOKUP(MID([.AG25];2;1);[.$C$5:.$F$6];2;0)*MID([.AJ26];2;1) -> 2 | AL27: DC | AN27: of:=HLOOKUP(MID([.AN25];1;1);[.$C$5:.$F$6];2;0)*MID([.AN26];1;1) + HLOOKUP(MID([.AN25];2;1);[.$C$5:.$F$6];2;0)*MID([.AN26];2;1) -> 0 | AO27: of:=HLOOKUP(MID([.AN25];1;1);[.$C$5:.$F$6];2;0)*MID([.AO26];1;1) + HLOOKUP(MID([.AN25];2;1);[.$C$5:.$F$6];2;0)*MID([.AO26];2;1) -> 1 | AP27: of:=HLOOKUP(MID([.AN25];1;1);[.$C$5:.$F$6];2;0)*MID([.AP26];1;1) + HLOOKUP(MID([.AN25];2;1);[.$C$5:.$F$6];2;0)*MID([.AP26];2;1) -> 3 | AQ27: of:=HLOOKUP(MID([.AN25];1;1);[.$C$5:.$F$6];2;0)*MID([.AQ26];1;1) + HLOOKUP(MID([.AN25];2;1);[.$C$5:.$F$6];2;0)*MID([.AQ26];2;1) -> 2 | AS27: DC | AU27: of:=HLOOKUP(MID([.AU25];1;1);[.$C$5:.$F$6];2;0)*MID([.AU26];1;1) + HLOOKUP(MID([.AU25];2;1);[.$C$5:.$F$6];2;0)*MID([.AU26];2;1) -> 0 | AV27: of:=HLOOKUP(MID([.AU25];1;1);[.$C$5:.$F$6];2;0)*MID([.AV26];1;1) + HLOOKUP(MID([.AU25];2;1);[.$C$5:.$F$6];2;0)*MID([.AV26];2;1) -> 1 | AW27: of:=HLOOKUP(MID([.AU25];1;1);[.$C$5:.$F$6];2;0)*MID([.AW26];1;1) + HLOOKUP(MID([.AU25];2;1);[.$C$5:.$F$6];2;0)*MID([.AW26];2;1) -> 3 | AX27: of:=HLOOKUP(MID([.AU25];1;1);[.$C$5:.$F$6];2;0)*MID([.AX26];1;1) + HLOOKUP(MID([.AU25];2;1);[.$C$5:.$F$6];2;0)*MID([.AX26];2;1) -> 2 | AZ27: DC | BB27: of:=HLOOKUP(MID([.BB25];1;1);[.$C$5:.$F$6];2;0)*MID([.BB26];1;1) + HLOOKUP(MID([.BB25];2;1);[.$C$5:.$F$6];2;0)*MID([.BB26];2;1) -> 0 | BC27: of:=HLOOKUP(MID([.BB25];1;1);[.$C$5:.$F$6];2;0)*MID([.BC26];1;1) + HLOOKUP(MID([.BB25];2;1);[.$C$5:.$F$6];2;0)*MID([.BC26];2;1) -> 1 | BD27: of:=HLOOKUP(MID([.BB25];1;1);[.$C$5:.$F$6];2;0)*MID([.BD26];1;1) + HLOOKUP(MID([.BB25];2;1);[.$C$5:.$F$6];2;0)*MID([.BD26];2;1) -> 3 | BE27: of:=HLOOKUP(MID([.BB25];1;1);[.$C$5:.$F$6];2;0)*MID([.BE26];1;1) + HLOOKUP(MID([.BB25];2;1);[.$C$5:.$F$6];2;0)*MID([.BE26];2;1) -> 2 | BG27: DC | BI27: of:=HLOOKUP(MID([.BI25];1;1);[.$C$5:.$F$6];2;0)*MID([.BI26];1;1) + HLOOKUP(MID([.BI25];2;1);[.$C$5:.$F$6];2;0)*MID([.BI26];2;1) -> 0 | BJ27: of:=HLOOKUP(MID([.BI25];1;1);[.$C$5:.$F$6];2;0)*MID([.BJ26];1;1) + HLOOKUP(MID([.BI25];2;1);[.$C$5:.$F$6];2;0)*MID([.BJ26];2;1) -> 1 | BK27: of:=HLOOKUP(MID([.BI25];1;1);[.$C$5:.$F$6];2;0)*MID([.BK26];1;1) + HLOOKUP(MID([.BI25];2;1);[.$C$5:.$F$6];2;0)*MID([.BK26];2;1) -> 3 | BL27: of:=HLOOKUP(MID([.BI25];1;1);[.$C$5:.$F$6];2;0)*MID([.BL26];1;1) + HLOOKUP(MID([.BI25];2;1);[.$C$5:.$F$6];2;0)*MID([.BL26];2;1) -> 2
A28: 00 | B28: of:=HLOOKUP(MID([.A27];1;1);[.$C$5:.$F$6];2;0)*MID([.A28];1;1) + HLOOKUP(MID([.A27];2;1);[.$C$5:.$F$6];2;0)*MID([.A28];2;1) -> 0 | C28: of:=VLOOKUP([.B28]+[.C27];[.$B$7:.$N$22];[.B25]) -> 0 | D28: of:=VLOOKUP([.B28]+[.D27];[.$B$7:.$N$22];[.B25]) -> 0 | E28: of:=VLOOKUP([.B28]+[.E27];[.$B$7:.$N$22];[.B25]) -> 0 | F28: of:=VLOOKUP([.B28]+[.F27];[.$B$7:.$N$22];[.B25]) -> 0 | H28: 00 | I28: of:=HLOOKUP(MID([.H27];1;1);[.$C$5:.$F$6];2;0)*MID([.H28];1;1) + HLOOKUP(MID([.H27];2;1);[.$C$5:.$F$6];2;0)*MID([.H28];2;1) -> 0 | J28: of:=VLOOKUP([.I28]+[.J27];[.$B$7:.$N$22];[.I25]) -> 0 | K28: of:=VLOOKUP([.I28]+[.K27];[.$B$7:.$N$22];[.I25]) -> 0 | L28: of:=VLOOKUP([.I28]+[.L27];[.$B$7:.$N$22];[.I25]) -> 0 | M28: of:=VLOOKUP([.I28]+[.M27];[.$B$7:.$N$22];[.I25]) -> 0 | Q28: 00 | R28: of:=HLOOKUP(MID([.Q27];1;1);[.$C$5:.$F$6];2;0)*MID([.Q28];1;1) + HLOOKUP(MID([.Q27];2;1);[.$C$5:.$F$6];2;0)*MID([.Q28];2;1) -> 0 | S28: of:=VLOOKUP([.R28]+[.S27];[.$B$7:.$N$22];[.R25]) -> 1 | T28: of:=VLOOKUP([.R28]+[.T27];[.$B$7:.$N$22];[.R25]) -> 0 | U28: of:=VLOOKUP([.R28]+[.U27];[.$B$7:.$N$22];[.R25]) -> 1 | V28: of:=VLOOKUP([.R28]+[.V27];[.$B$7:.$N$22];[.R25]) -> 1 | X28: 00 | Y28: of:=HLOOKUP(MID([.X27];1;1);[.$C$5:.$F$6];2;0)*MID([.X28];1;1) + HLOOKUP(MID([.X27];2;1);[.$C$5:.$F$6];2;0)*MID([.X28];2;1) -> 0 | Z28: of:=VLOOKUP([.Y28]+[.Z27];[.$B$7:.$N$22];[.Y25]) -> 1 | AA28: of:=VLOOKUP([.Y28]+[.AA27];[.$B$7:.$N$22];[.Y25]) -> 1 | AB28: of:=VLOOKUP([.Y28]+[.AB27];[.$B$7:.$N$22];[.Y25]) -> 1 | AC28: of:=VLOOKUP([.Y28]+[.AC27];[.$B$7:.$N$22];[.Y25]) -> 1 | AE28: 00 | AF28: of:=HLOOKUP(MID([.AE27];1;1);[.$C$5:.$F$6];2;0)*MID([.AE28];1;1) + HLOOKUP(MID([.AE27];2;1);[.$C$5:.$F$6];2;0)*MID([.AE28];2;1) -> 0 | AG28: of:=VLOOKUP([.AF28]+[.AG27];[.$B$7:.$N$22];[.AF25]) -> 1 | AH28: of:=VLOOKUP([.AF28]+[.AH27];[.$B$7:.$N$22];[.AF25]) -> 1 | AI28: of:=VLOOKUP([.AF28]+[.AI27];[.$B$7:.$N$22];[.AF25]) -> 1 | AJ28: of:=VLOOKUP([.AF28]+[.AJ27];[.$B$7:.$N$22];[.AF25]) -> 0 | AL28: 00 | AM28: of:=HLOOKUP(MID([.AL27];1;1);[.$C$5:.$F$6];2;0)*MID([.AL28];1;1) + HLOOKUP(MID([.AL27];2;1);[.$C$5:.$F$6];2;0)*MID([.AL28];2;1) -> 0 | AN28: of:=VLOOKUP([.AM28]+[.AN27];[.$B$7:.$N$22];[.AM25]) -> 1 | AO28: of:=VLOOKUP([.AM28]+[.AO27];[.$B$7:.$N$22];[.AM25]) -> 0 | AP28: of:=VLOOKUP([.AM28]+[.AP27];[.$B$7:.$N$22];[.AM25]) -> 1 | AQ28: of:=VLOOKUP([.AM28]+[.AQ27];[.$B$7:.$N$22];[.AM25]) -> 1 | AS28: 00 | AT28: of:=HLOOKUP(MID([.AS27];1;1);[.$C$5:.$F$6];2;0)*MID([.AS28];1;1) + HLOOKUP(MID([.AS27];2;1);[.$C$5:.$F$6];2;0)*MID([.AS28];2;1) -> 0 | AU28: of:=VLOOKUP([.AT28]+[.AU27];[.$B$7:.$N$22];[.AT25]) -> 1 | AV28: of:=VLOOKUP([.AT28]+[.AV27];[.$B$7:.$N$22];[.AT25]) -> 0 | AW28: of:=VLOOKUP([.AT28]+[.AW27];[.$B$7:.$N$22];[.AT25]) -> 0 | AX28: of:=VLOOKUP([.AT28]+[.AX27];[.$B$7:.$N$22];[.AT25]) -> 1 | AZ28: 00 | BA28: of:=HLOOKUP(MID([.AZ27];1;1);[.$C$5:.$F$6];2;0)*MID([.AZ28];1;1) + HLOOKUP(MID([.AZ27];2;1);[.$C$5:.$F$6];2;0)*MID([.AZ28];2;1) -> 0 | BB28: of:=VLOOKUP([.BA28]+[.BB27];[.$B$7:.$N$22];[.BA25]) -> 1 | BC28: of:=VLOOKUP([.BA28]+[.BC27];[.$B$7:.$N$22];[.BA25]) -> 0 | BD28: of:=VLOOKUP([.BA28]+[.BD27];[.$B$7:.$N$22];[.BA25]) -> 0 | BE28: of:=VLOOKUP([.BA28]+[.BE27];[.$B$7:.$N$22];[.BA25]) -> 0 | BG28: 00 | BH28: of:=HLOOKUP(MID([.BG27];1;1);[.$C$5:.$F$6];2;0)*MID([.BG28];1;1) + HLOOKUP(MID([.BG27];2;1);[.$C$5:.$F$6];2;0)*MID([.BG28];2;1) -> 0 | BI28: of:=VLOOKUP([.BH28]+[.BI27];[.$B$7:.$N$22];[.BH25]) -> 0 | BJ28: of:=VLOOKUP([.BH28]+[.BJ27];[.$B$7:.$N$22];[.BH25]) -> 0 | BK28: of:=VLOOKUP([.BH28]+[.BK27];[.$B$7:.$N$22];[.BH25]) -> 1 | BL28: of:=VLOOKUP([.BH28]+[.BL27];[.$B$7:.$N$22];[.BH25]) -> 1
A29: 01 | B29: of:=HLOOKUP(MID([.A27];1;1);[.$C$5:.$F$6];2;0)*MID([.A29];1;1) + HLOOKUP(MID([.A27];2;1);[.$C$5:.$F$6];2;0)*MID([.A29];2;1) -> 4 | C29: of:=VLOOKUP([.B29]+[.C27];[.$B$7:.$N$22];[.B25]) -> 0 | D29: of:=VLOOKUP([.B29]+[.D27];[.$B$7:.$N$22];[.B25]) -> 0 | E29: of:=VLOOKUP([.B29]+[.E27];[.$B$7:.$N$22];[.B25]) -> 0 | F29: of:=VLOOKUP([.B29]+[.F27];[.$B$7:.$N$22];[.B25]) -> 0 | H29: 01 | I29: of:=HLOOKUP(MID([.H27];1;1);[.$C$5:.$F$6];2;0)*MID([.H29];1;1) + HLOOKUP(MID([.H27];2;1);[.$C$5:.$F$6];2;0)*MID([.H29];2;1) -> 4 | J29: of:=VLOOKUP([.I29]+[.J27];[.$B$7:.$N$22];[.I25]) -> 0 | K29: of:=VLOOKUP([.I29]+[.K27];[.$B$7:.$N$22];[.I25]) -> 0 | L29: of:=VLOOKUP([.I29]+[.L27];[.$B$7:.$N$22];[.I25]) -> 1 | M29: of:=VLOOKUP([.I29]+[.M27];[.$B$7:.$N$22];[.I25]) -> 0 | Q29: 01 | R29: of:=HLOOKUP(MID([.Q27];1;1);[.$C$5:.$F$6];2;0)*MID([.Q29];1;1) + HLOOKUP(MID([.Q27];2;1);[.$C$5:.$F$6];2;0)*MID([.Q29];2;1) -> 4 | S29: of:=VLOOKUP([.R29]+[.S27];[.$B$7:.$N$22];[.R25]) -> 0 | T29: of:=VLOOKUP([.R29]+[.T27];[.$B$7:.$N$22];[.R25]) -> 1 | U29: of:=VLOOKUP([.R29]+[.U27];[.$B$7:.$N$22];[.R25]) -> 1 | V29: of:=VLOOKUP([.R29]+[.V27];[.$B$7:.$N$22];[.R25]) -> 1 | X29: 01 | Y29: of:=HLOOKUP(MID([.X27];1;1);[.$C$5:.$F$6];2;0)*MID([.X29];1;1) + HLOOKUP(MID([.X27];2;1);[.$C$5:.$F$6];2;0)*MID([.X29];2;1) -> 4 | Z29: of:=VLOOKUP([.Y29]+[.Z27];[.$B$7:.$N$22];[.Y25]) -> 1 | AA29: of:=VLOOKUP([.Y29]+[.AA27];[.$B$7:.$N$22];[.Y25]) -> 0 | AB29: of:=VLOOKUP([.Y29]+[.AB27];[.$B$7:.$N$22];[.Y25]) -> 1 | AC29: of:=VLOOKUP([.Y29]+[.AC27];[.$B$7:.$N$22];[.Y25]) -> 0 | AE29: 01 | AF29: of:=HLOOKUP(MID([.AE27];1;1);[.$C$5:.$F$6];2;0)*MID([.AE29];1;1) + HLOOKUP(MID([.AE27];2;1);[.$C$5:.$F$6];2;0)*MID([.AE29];2;1) -> 4 | AG29: of:=VLOOKUP([.AF29]+[.AG27];[.$B$7:.$N$22];[.AF25]) -> 1 | AH29: of:=VLOOKUP([.AF29]+[.AH27];[.$B$7:.$N$22];[.AF25]) -> 1 | AI29: of:=VLOOKUP([.AF29]+[.AI27];[.$B$7:.$N$22];[.AF25]) -> 1 | AJ29: of:=VLOOKUP([.AF29]+[.AJ27];[.$B$7:.$N$22];[.AF25]) -> 1 | AL29: 01 | AM29: of:=HLOOKUP(MID([.AL27];1;1);[.$C$5:.$F$6];2;0)*MID([.AL29];1;1) + HLOOKUP(MID([.AL27];2;1);[.$C$5:.$F$6];2;0)*MID([.AL29];2;1) -> 4 | AN29: of:=VLOOKUP([.AM29]+[.AN27];[.$B$7:.$N$22];[.AM25]) -> 0 | AO29: of:=VLOOKUP([.AM29]+[.AO27];[.$B$7:.$N$22];[.AM25]) -> 1 | AP29: of:=VLOOKUP([.AM29]+[.AP27];[.$B$7:.$N$22];[.AM25]) -> 0 | AQ29: of:=VLOOKUP([.AM29]+[.AQ27];[.$B$7:.$N$22];[.AM25]) -> 1 | AS29: 01 | AT29: of:=HLOOKUP(MID([.AS27];1;1);[.$C$5:.$F$6];2;0)*MID([.AS29];1;1) + HLOOKUP(MID([.AS27];2;1);[.$C$5:.$F$6];2;0)*MID([.AS29];2;1) -> 4 | AU29: of:=VLOOKUP([.AT29]+[.AU27];[.$B$7:.$N$22];[.AT25]) -> 0 | AV29: of:=VLOOKUP([.AT29]+[.AV27];[.$B$7:.$N$22];[.AT25]) -> 0 | AW29: of:=VLOOKUP([.AT29]+[.AW27];[.$B$7:.$N$22];[.AT25]) -> 0 | AX29: of:=VLOOKUP([.AT29]+[.AX27];[.$B$7:.$N$22];[.AT25]) -> 1 | AZ29: 01 | BA29: of:=HLOOKUP(MID([.AZ27];1;1);[.$C$5:.$F$6];2;0)*MID([.AZ29];1;1) + HLOOKUP(MID([.AZ27];2;1);[.$C$5:.$F$6];2;0)*MID([.AZ29];2;1) -> 4 | BB29: of:=VLOOKUP([.BA29]+[.BB27];[.$B$7:.$N$22];[.BA25]) -> 1 | BC29: of:=VLOOKUP([.BA29]+[.BC27];[.$B$7:.$N$22];[.BA25]) -> 1 | BD29: of:=VLOOKUP([.BA29]+[.BD27];[.$B$7:.$N$22];[.BA25]) -> 0 | BE29: of:=VLOOKUP([.BA29]+[.BE27];[.$B$7:.$N$22];[.BA25]) -> 1 | BG29: 01 | BH29: of:=HLOOKUP(MID([.BG27];1;1);[.$C$5:.$F$6];2;0)*MID([.BG29];1;1) + HLOOKUP(MID([.BG27];2;1);[.$C$5:.$F$6];2;0)*MID([.BG29];2;1) -> 4 | BI29: of:=VLOOKUP([.BH29]+[.BI27];[.$B$7:.$N$22];[.BH25]) -> 1 | BJ29: of:=VLOOKUP([.BH29]+[.BJ27];[.$B$7:.$N$22];[.BH25]) -> 1 | BK29: of:=VLOOKUP([.BH29]+[.BK27];[.$B$7:.$N$22];[.BH25]) -> 0 | BL29: of:=VLOOKUP([.BH29]+[.BL27];[.$B$7:.$N$22];[.BH25]) -> 1
A30: 11 | B30: of:=HLOOKUP(MID([.A27];1;1);[.$C$5:.$F$6];2;0)*MID([.A30];1;1) + HLOOKUP(MID([.A27];2;1);[.$C$5:.$F$6];2;0)*MID([.A30];2;1) -> 12 | C30: of:=VLOOKUP([.B30]+[.C27];[.$B$7:.$N$22];[.B25]) -> 0 | D30: of:=VLOOKUP([.B30]+[.D27];[.$B$7:.$N$22];[.B25]) -> 0 | E30: of:=VLOOKUP([.B30]+[.E27];[.$B$7:.$N$22];[.B25]) -> 0 | F30: of:=VLOOKUP([.B30]+[.F27];[.$B$7:.$N$22];[.B25]) -> 0 | H30: 11 | I30: of:=HLOOKUP(MID([.H27];1;1);[.$C$5:.$F$6];2;0)*MID([.H30];1;1) + HLOOKUP(MID([.H27];2;1);[.$C$5:.$F$6];2;0)*MID([.H30];2;1) -> 12 | J30: of:=VLOOKUP([.I30]+[.J27];[.$B$7:.$N$22];[.I25]) -> 0 | K30: of:=VLOOKUP([.I30]+[.K27];[.$B$7:.$N$22];[.I25]) -> 0 | L30: of:=VLOOKUP([.I30]+[.L27];[.$B$7:.$N$22];[.I25]) -> 1 | M30: of:=VLOOKUP([.I30]+[.M27];[.$B$7:.$N$22];[.I25]) -> 0 | Q30: 11 | R30: of:=HLOOKUP(MID([.Q27];1;1);[.$C$5:.$F$6];2;0)*MID([.Q30];1;1) + HLOOKUP(MID([.Q27];2;1);[.$C$5:.$F$6];2;0)*MID([.Q30];2;1) -> 12 | S30: of:=VLOOKUP([.R30]+[.S27];[.$B$7:.$N$22];[.R25]) -> 1 | T30: of:=VLOOKUP([.R30]+[.T27];[.$B$7:.$N$22];[.R25]) -> 0 | U30: of:=VLOOKUP([.R30]+[.U27];[.$B$7:.$N$22];[.R25]) -> 1 | V30: of:=VLOOKUP([.R30]+[.V27];[.$B$7:.$N$22];[.R25]) -> 1 | X30: 11 | Y30: of:=HLOOKUP(MID([.X27];1;1);[.$C$5:.$F$6];2;0)*MID([.X30];1;1) + HLOOKUP(MID([.X27];2;1);[.$C$5:.$F$6];2;0)*MID([.X30];2;1) -> 12 | Z30: of:=VLOOKUP([.Y30]+[.Z27];[.$B$7:.$N$22];[.Y25]) -> 0 | AA30: of:=VLOOKUP([.Y30]+[.AA27];[.$B$7:.$N$22];[.Y25]) -> 1 | AB30: of:=VLOOKUP([.Y30]+[.AB27];[.$B$7:.$N$22];[.Y25]) -> 0 | AC30: of:=VLOOKUP([.Y30]+[.AC27];[.$B$7:.$N$22];[.Y25]) -> 0 | AE30: 11 | AF30: of:=HLOOKUP(MID([.AE27];1;1);[.$C$5:.$F$6];2;0)*MID([.AE30];1;1) + HLOOKUP(MID([.AE27];2;1);[.$C$5:.$F$6];2;0)*MID([.AE30];2;1) -> 12 | AG30: of:=VLOOKUP([.AF30]+[.AG27];[.$B$7:.$N$22];[.AF25]) -> 0 | AH30: of:=VLOOKUP([.AF30]+[.AH27];[.$B$7:.$N$22];[.AF25]) -> 1 | AI30: of:=VLOOKUP([.AF30]+[.AI27];[.$B$7:.$N$22];[.AF25]) -> 0 | AJ30: of:=VLOOKUP([.AF30]+[.AJ27];[.$B$7:.$N$22];[.AF25]) -> 0 | AL30: 11 | AM30: of:=HLOOKUP(MID([.AL27];1;1);[.$C$5:.$F$6];2;0)*MID([.AL30];1;1) + HLOOKUP(MID([.AL27];2;1);[.$C$5:.$F$6];2;0)*MID([.AL30];2;1) -> 12 | AN30: of:=VLOOKUP([.AM30]+[.AN27];[.$B$7:.$N$22];[.AM25]) -> 1 | AO30: of:=VLOOKUP([.AM30]+[.AO27];[.$B$7:.$N$22];[.AM25]) -> 1 | AP30: of:=VLOOKUP([.AM30]+[.AP27];[.$B$7:.$N$22];[.AM25]) -> 0 | AQ30: of:=VLOOKUP([.AM30]+[.AQ27];[.$B$7:.$N$22];[.AM25]) -> 1 | AS30: 11 | AT30: of:=HLOOKUP(MID([.AS27];1;1);[.$C$5:.$F$6];2;0)*MID([.AS30];1;1) + HLOOKUP(MID([.AS27];2;1);[.$C$5:.$F$6];2;0)*MID([.AS30];2;1) -> 12 | AU30: of:=VLOOKUP([.AT30]+[.AU27];[.$B$7:.$N$22];[.AT25]) -> 1 | AV30: of:=VLOOKUP([.AT30]+[.AV27];[.$B$7:.$N$22];[.AT25]) -> 1 | AW30: of:=VLOOKUP([.AT30]+[.AW27];[.$B$7:.$N$22];[.AT25]) -> 1 | AX30: of:=VLOOKUP([.AT30]+[.AX27];[.$B$7:.$N$22];[.AT25]) -> 1 | AZ30: 11 | BA30: of:=HLOOKUP(MID([.AZ27];1;1);[.$C$5:.$F$6];2;0)*MID([.AZ30];1;1) + HLOOKUP(MID([.AZ27];2;1);[.$C$5:.$F$6];2;0)*MID([.AZ30];2;1) -> 12 | BB30: of:=VLOOKUP([.BA30]+[.BB27];[.$B$7:.$N$22];[.BA25]) -> 1 | BC30: of:=VLOOKUP([.BA30]+[.BC27];[.$B$7:.$N$22];[.BA25]) -> 0 | BD30: of:=VLOOKUP([.BA30]+[.BD27];[.$B$7:.$N$22];[.BA25]) -> 1 | BE30: of:=VLOOKUP([.BA30]+[.BE27];[.$B$7:.$N$22];[.BA25]) -> 1 | BG30: 11 | BH30: of:=HLOOKUP(MID([.BG27];1;1);[.$C$5:.$F$6];2;0)*MID([.BG30];1;1) + HLOOKUP(MID([.BG27];2;1);[.$C$5:.$F$6];2;0)*MID([.BG30];2;1) -> 12 | BI30: of:=VLOOKUP([.BH30]+[.BI27];[.$B$7:.$N$22];[.BH25]) -> 0 | BJ30: of:=VLOOKUP([.BH30]+[.BJ27];[.$B$7:.$N$22];[.BH25]) -> 1 | BK30: of:=VLOOKUP([.BH30]+[.BK27];[.$B$7:.$N$22];[.BH25]) -> 1 | BL30: of:=VLOOKUP([.BH30]+[.BL27];[.$B$7:.$N$22];[.BH25]) -> 1
A31: 10 | B31: of:=HLOOKUP(MID([.A27];1;1);[.$C$5:.$F$6];2;0)*MID([.A31];1;1) + HLOOKUP(MID([.A27];2;1);[.$C$5:.$F$6];2;0)*MID([.A31];2;1) -> 8 | C31: of:=VLOOKUP([.B31]+[.C27];[.$B$7:.$N$22];[.B25]) -> 0 | D31: of:=VLOOKUP([.B31]+[.D27];[.$B$7:.$N$22];[.B25]) -> 0 | E31: of:=VLOOKUP([.B31]+[.E27];[.$B$7:.$N$22];[.B25]) -> 0 | F31: of:=VLOOKUP([.B31]+[.F27];[.$B$7:.$N$22];[.B25]) -> 0 | H31: 10 | I31: of:=HLOOKUP(MID([.H27];1;1);[.$C$5:.$F$6];2;0)*MID([.H31];1;1) + HLOOKUP(MID([.H27];2;1);[.$C$5:.$F$6];2;0)*MID([.H31];2;1) -> 8 | J31: of:=VLOOKUP([.I31]+[.J27];[.$B$7:.$N$22];[.I25]) -> 0 | K31: of:=VLOOKUP([.I31]+[.K27];[.$B$7:.$N$22];[.I25]) -> 0 | L31: of:=VLOOKUP([.I31]+[.L27];[.$B$7:.$N$22];[.I25]) -> 0 | M31: of:=VLOOKUP([.I31]+[.M27];[.$B$7:.$N$22];[.I25]) -> 0 | Q31: 10 | R31: of:=HLOOKUP(MID([.Q27];1;1);[.$C$5:.$F$6];2;0)*MID([.Q31];1;1) + HLOOKUP(MID([.Q27];2;1);[.$C$5:.$F$6];2;0)*MID([.Q31];2;1) -> 8 | S31: of:=VLOOKUP([.R31]+[.S27];[.$B$7:.$N$22];[.R25]) -> 1 | T31: of:=VLOOKUP([.R31]+[.T27];[.$B$7:.$N$22];[.R25]) -> 1 | U31: of:=VLOOKUP([.R31]+[.U27];[.$B$7:.$N$22];[.R25]) -> 0 | V31: of:=VLOOKUP([.R31]+[.V27];[.$B$7:.$N$22];[.R25]) -> 1 | X31: 10 | Y31: of:=HLOOKUP(MID([.X27];1;1);[.$C$5:.$F$6];2;0)*MID([.X31];1;1) + HLOOKUP(MID([.X27];2;1);[.$C$5:.$F$6];2;0)*MID([.X31];2;1) -> 8 | Z31: of:=VLOOKUP([.Y31]+[.Z27];[.$B$7:.$N$22];[.Y25]) -> 1 | AA31: of:=VLOOKUP([.Y31]+[.AA27];[.$B$7:.$N$22];[.Y25]) -> 1 | AB31: of:=VLOOKUP([.Y31]+[.AB27];[.$B$7:.$N$22];[.Y25]) -> 0 | AC31: of:=VLOOKUP([.Y31]+[.AC27];[.$B$7:.$N$22];[.Y25]) -> 1 | AE31: 10 | AF31: of:=HLOOKUP(MID([.AE27];1;1);[.$C$5:.$F$6];2;0)*MID([.AE31];1;1) + HLOOKUP(MID([.AE27];2;1);[.$C$5:.$F$6];2;0)*MID([.AE31];2;1) -> 8 | AG31: of:=VLOOKUP([.AF31]+[.AG27];[.$B$7:.$N$22];[.AF25]) -> 1 | AH31: of:=VLOOKUP([.AF31]+[.AH27];[.$B$7:.$N$22];[.AF25]) -> 1 | AI31: of:=VLOOKUP([.AF31]+[.AI27];[.$B$7:.$N$22];[.AF25]) -> 1 | AJ31: of:=VLOOKUP([.AF31]+[.AJ27];[.$B$7:.$N$22];[.AF25]) -> 1 | AL31: 10 | AM31: of:=HLOOKUP(MID([.AL27];1;1);[.$C$5:.$F$6];2;0)*MID([.AL31];1;1) + HLOOKUP(MID([.AL27];2;1);[.$C$5:.$F$6];2;0)*MID([.AL31];2;1) -> 8 | AN31: of:=VLOOKUP([.AM31]+[.AN27];[.$B$7:.$N$22];[.AM25]) -> 1 | AO31: of:=VLOOKUP([.AM31]+[.AO27];[.$B$7:.$N$22];[.AM25]) -> 1 | AP31: of:=VLOOKUP([.AM31]+[.AP27];[.$B$7:.$N$22];[.AM25]) -> 1 | AQ31: of:=VLOOKUP([.AM31]+[.AQ27];[.$B$7:.$N$22];[.AM25]) -> 0 | AS31: 10 | AT31: of:=HLOOKUP(MID([.AS27];1;1);[.$C$5:.$F$6];2;0)*MID([.AS31];1;1) + HLOOKUP(MID([.AS27];2;1);[.$C$5:.$F$6];2;0)*MID([.AS31];2;1) -> 8 | AU31: of:=VLOOKUP([.AT31]+[.AU27];[.$B$7:.$N$22];[.AT25]) -> 1 | AV31: of:=VLOOKUP([.AT31]+[.AV27];[.$B$7:.$N$22];[.AT25]) -> 0 | AW31: of:=VLOOKUP([.AT31]+[.AW27];[.$B$7:.$N$22];[.AT25]) -> 1 | AX31: of:=VLOOKUP([.AT31]+[.AX27];[.$B$7:.$N$22];[.AT25]) -> 1 | AZ31: 10 | BA31: of:=HLOOKUP(MID([.AZ27];1;1);[.$C$5:.$F$6];2;0)*MID([.AZ31];1;1) + HLOOKUP(MID([.AZ27];2;1);[.$C$5:.$F$6];2;0)*MID([.AZ31];2;1) -> 8 | BB31: of:=VLOOKUP([.BA31]+[.BB27];[.$B$7:.$N$22];[.BA25]) -> 1 | BC31: of:=VLOOKUP([.BA31]+[.BC27];[.$B$7:.$N$22];[.BA25]) -> 1 | BD31: of:=VLOOKUP([.BA31]+[.BD27];[.$B$7:.$N$22];[.BA25]) -> 1 | BE31: of:=VLOOKUP([.BA31]+[.BE27];[.$B$7:.$N$22];[.BA25]) -> 1 | BG31: 10 | BH31: of:=HLOOKUP(MID([.BG27];1;1);[.$C$5:.$F$6];2;0)*MID([.BG31];1;1) + HLOOKUP(MID([.BG27];2;1);[.$C$5:.$F$6];2;0)*MID([.BG31];2;1) -> 8 | BI31: of:=VLOOKUP([.BH31]+[.BI27];[.$B$7:.$N$22];[.BH25]) -> 1 | BJ31: of:=VLOOKUP([.BH31]+[.BJ27];[.$B$7:.$N$22];[.BH25]) -> 1 | BK31: of:=VLOOKUP([.BH31]+[.BK27];[.$B$7:.$N$22];[.BH25]) -> 1 | BL31: of:=VLOOKUP([.BH31]+[.BL27];[.$B$7:.$N$22];[.BH25]) -> 1 | BN31: D | BO31: C | BP31: B | BQ31: A
O32: 1 | P32: F | Q32: F = µ -D C -B -A | X32: F = µ -D C -B -A | BN32: 1 | BO32: 0 | BP32: 1 | BQ32: 1
O33: 2 | P33: G | Q33: G = µ D C B -A | AL33: G = µ D C B -A | AZ33: G = µ D C B -A | BN33: 0 | BO33: 0 | BP33: 0 | BQ33: 1
O34: 3 | P34: H | Q34: H = µ D -C B A | AL34: H = µ D -C B A | AS34: H = µ D -C B A | BN34: 0 | BO34: 1 | BP34: 0 | BQ34: 0
O35: 4 | P35: I | Q35: I = µ -D -C B -A | AZ35: I = µ -D -C B -A | BN35: 1 | BO35: 1 | BP35: 0 | BQ35: 1
O36: 5 | P36: J | X36: J = µ -C -B A | BN36: X | BO36: 1 | BP36: 1 | BQ36: 0
O37: 6 | P37: K | X37: K = µ D -C B -A | AS37: K = µ D -C B -A | BN37: 0 | BO37: 1 | BP37: 0 | BQ37: 1
O38: 7 | P38: L | X38: L = µ -D -C B A | AE38: L = µ -D -C B A | BG38: L = µ -D -C B A | BN38: 1 | BO38: 1 | BP38: 0 | BQ38: 0
O39: 8 | P39: M | X39: M = µ -D -C -B | AE39: M = µ -D -C -B | BN39: 1 | BO39: 1 | BP39: 1 | BQ39: X
O40: 9 | P40: N | AE40: N = µ D C -B A | AZ40: N = µ D C -B A | BN40: 0 | BO40: 0 | BP40: 1 | BQ40: 0
O41: 10 | P41: O | AL41: O = µ -D C -B A | BN41: 1 | BO41: 0 | BP41: 1 | BQ41: 0
H42: P = µ -C -B -A | O42: 11 | P42: P | AL42: P = µ -C -B -A | BN42: X | BO42: 1 | BP42: 1 | BQ42: 1
H43: -D | O43: 12 | P43: Q | AS43: Q = µ D -B -A | AZ43: Q = µ D -B -A | BN43: 0 | BO43: X | BP43: 1 | BQ43: 1
O44: 13 | P44: R | AS44: R = µ C B -A | BN44: X | BO44: 0 | BP44: 0 | BQ44: 1
O45: 14 | P45: S | BG45: S = µ D C B | BN45: 0 | BO45: 0 | BP45: 0 | BQ45: X
O46: 15 | P46: T | BG46: T = µ D -C -B -A | BN46: 0 | BO46: 1 | BP46: 1 | BQ46: 1
H47: T = µ -P -D | Q47: a = µ F G H I | X47: b = µ F J K L M | AE47: c = µ L M N | AL47: d = µ G H O P | AS47: e = µ H K Q R | AZ47: f = µ G I N Q | BG47: g = µ L P S | BM47: total
E48: transistors: | I48: 4 | Q48: 20 | X48: 19 | AE48: 7 | AL48: 11 | AS48: 10 | AZ48: 4 | BG48: 10 | BM48: of:=SUM([.I48:.BL48]) -> 85 | BO48: transistors
E49: gates: | I49: 4 | Q49: 5 | X49: 5 | AE49: 2 | AL49: 3 | AS49: 3 | AZ49: 1 | BG49: 3 | BM49: of:=SUM([.I49:.BL49]) -> 26 | BO49: gates

Sheet: 0-F (lower c)
B1: 4 bit to 7-segment, digits 0-F (lower c)
B2: Truth table | P2: 7-segment display as defined by truth table
P3: 0 | V3: of:=[.P3]+1 -> 1 | AB3: of:=[.V3]+1 -> 2 | AH3: of:=[.AB3]+1 -> 3 | AN3: of:=[.AH3]+1 -> 4 | AT3: of:=[.AN3]+1 -> 5 | AZ3: of:=[.AT3]+1 -> 6 | BF3: of:=[.AZ3]+1 -> 7
B4: Inputs | G4: Outputs | P4: of:=MATCH([.P3];[.$B$7:.$B$22];0)+2 -> 3 | V4: of:=MATCH([.V3];[.$B$7:.$B$22];0)+2 -> 4 | AB4: of:=MATCH([.AB3];[.$B$7:.$B$22];0)+2 -> 5 | AH4: of:=MATCH([.AH3];[.$B$7:.$B$22];0)+2 -> 6 | AN4: of:=MATCH([.AN3];[.$B$7:.$B$22];0)+2 -> 7 | AT4: of:=MATCH([.AT3];[.$B$7:.$B$22];0)+2 -> 8 | AZ4: of:=MATCH([.AZ3];[.$B$7:.$B$22];0)+2 -> 9 | BF4: of:=MATCH([.BF3];[.$B$7:.$B$22];0)+2 -> 10
B5: # | C5: D | D5: C | E5: B | F5: A | G5: a | H5: b | I5: c | J5: d | K5: e | L5: f | M5: g | Q5: of:=HLOOKUP([.T5];[.$G$5:.$M$22];[.P4];0) -> 1 | R5: of:=[.T5]&T(ORG.OPENOFFICE.STYLE(IF([.Q5]=1;"seg1";IF([.Q5]=0;"seg0";"segX")))) -> a | T5: a | W5: of:=HLOOKUP([.Z5];[.$G$5:.$M$22];[.V4];0) -> 0 | X5: of:=[.Z5]&T(ORG.OPENOFFICE.STYLE(IF([.W5]=1;"seg1";IF([.W5]=0;"seg0";"segX")))) -> a | Z5: a | AC5: of:=HLOOKUP([.AF5];[.$G$5:.$M$22];[.AB4];0) -> 1 | AD5: of:=[.AF5]&T(ORG.OPENOFFICE.STYLE(IF([.AC5]=1;"seg1";IF([.AC5]=0;"seg0";"segX")))) -> a | AF5: a | AI5: of:=HLOOKUP([.AL5];[.$G$5:.$M$22];[.AH4];0) -> 1 | AJ5: of:=[.AL5]&T(ORG.OPENOFFICE.STYLE(IF([.AI5]=1;"seg1";IF([.AI5]=0;"seg0";"segX")))) -> a | AL5: a | AO5: of:=HLOOKUP([.AR5];[.$G$5:.$M$22];[.AN4];0) -> 0 | AP5: of:=[.AR5]&T(ORG.OPENOFFICE.STYLE(IF([.AO5]=1;"seg1";IF([.AO5]=0;"seg0";"segX")))) -> a | AR5: a | AU5: of:=HLOOKUP([.AX5];[.$G$5:.$M$22];[.AT4];0) -> 1 | AV5: of:=[.AX5]&T(ORG.OPENOFFICE.STYLE(IF([.AU5]=1;"seg1";IF([.AU5]=0;"seg0";"segX")))) -> a | AX5: a | BA5: of:=HLOOKUP([.BD5];[.$G$5:.$M$22];[.AZ4];0) -> 1 | BB5: of:=[.BD5]&T(ORG.OPENOFFICE.STYLE(IF([.BA5]=1;"seg1";IF([.BA5]=0;"seg0";"segX")))) -> a | BD5: a | BG5: of:=HLOOKUP([.BJ5];[.$G$5:.$M$22];[.BF4];0) -> 1 | BH5: of:=[.BJ5]&T(ORG.OPENOFFICE.STYLE(IF([.BG5]=1;"seg1";IF([.BG5]=0;"seg0";"segX")))) -> a | BJ5: a
C6: 8 | D6: 4 | E6: 2 | F6: 1 | P6: of:=HLOOKUP([.R6];[.$G$5:.$M$22];[.P4];0) -> 1 | Q6: of:=[.R6]&T(ORG.OPENOFFICE.STYLE(IF([.P6]=1;"seg1";IF([.P6]=0;"seg0";"segX")))) -> f | R6: f | S6: of:=HLOOKUP([.U6];[.$G$5:.$M$22];[.P4];0) -> 1 | T6: of:=[.U6]&T(ORG.OPENOFFICE.STYLE(IF([.S6]=1;"seg1";IF([.S6]=0;"seg0";"segX")))) -> b | U6: b | V6: of:=HLOOKUP([.X6];[.$G$5:.$M$22];[.V4];0) -> 0 | W6: of:=[.X6]&T(ORG.OPENOFFICE.STYLE(IF([.V6]=1;"seg1";IF([.V6]=0;"seg0";"segX")))) -> f | X6: f | Y6: of:=HLOOKUP([.AA6];[.$G$5:.$M$22];[.V4];0) -> 1 | Z6: of:=[.AA6]&T(ORG.OPENOFFICE.STYLE(IF([.Y6]=1;"seg1";IF([.Y6]=0;"seg0";"segX")))) -> b | AA6: b | AB6: of:=HLOOKUP([.AD6];[.$G$5:.$M$22];[.AB4];0) -> 0 | AC6: of:=[.AD6]&T(ORG.OPENOFFICE.STYLE(IF([.AB6]=1;"seg1";IF([.AB6]=0;"seg0";"segX")))) -> f | AD6: f | AE6: of:=HLOOKUP([.AG6];[.$G$5:.$M$22];[.AB4];0) -> 1 | AF6: of:=[.AG6]&T(ORG.OPENOFFICE.STYLE(IF([.AE6]=1;"seg1";IF([.AE6]=0;"seg0";"segX")))) -> b | AG6: b | AH6: of:=HLOOKUP([.AJ6];[.$G$5:.$M$22];[.AH4];0) -> 0 | AI6: of:=[.AJ6]&T(ORG.OPENOFFICE.STYLE(IF([.AH6]=1;"seg1";IF([.AH6]=0;"seg0";"segX")))) -> f | AJ6: f | AK6: of:=HLOOKUP([.AM6];[.$G$5:.$M$22];[.AH4];0) -> 1 | AL6: of:=[.AM6]&T(ORG.OPENOFFICE.STYLE(IF([.AK6]=1;"seg1";IF([.AK6]=0;"seg0";"segX")))) -> b | AM6: b | AN6: of:=HLOOKUP([.AP6];[.$G$5:.$M$22];[.AN4];0) -> 1 | AO6: of:=[.AP6]&T(ORG.OPENOFFICE.STYLE(IF([.AN6]=1;"seg1";IF([.AN6]=0;"seg0";"segX")))) -> f | AP6: f | AQ6: of:=HLOOKUP([.AS6];[.$G$5:.$M$22];[.AN4];0) -> 1 | AR6: of:=[.AS6]&T(ORG.OPENOFFICE.STYLE(IF([.AQ6]=1;"seg1";IF([.AQ6]=0;"seg0";"segX")))) -> b | AS6: b | AT6: of:=HLOOKUP([.AV6];[.$G$5:.$M$22];[.AT4];0) -> 1 | AU6: of:=[.AV6]&T(ORG.OPENOFFICE.STYLE(IF([.AT6]=1;"seg1";IF([.AT6]=0;"seg0";"segX")))) -> f | AV6: f | AW6: of:=HLOOKUP([.AY6];[.$G$5:.$M$22];[.AT4];0) -> 0 | AX6: of:=[.AY6]&T(ORG.OPENOFFICE.STYLE(IF([.AW6]=1;"seg1";IF([.AW6]=0;"seg0";"segX")))) -> b | AY6: b | AZ6: of:=HLOOKUP([.BB6];[.$G$5:.$M$22];[.AZ4];0) -> 1 | BA6: of:=[.BB6]&T(ORG.OPENOFFICE.STYLE(IF([.AZ6]=1;"seg1";IF([.AZ6]=0;"seg0";"segX")))) -> f | BB6: f | BC6: of:=HLOOKUP([.BE6];[.$G$5:.$M$22];[.AZ4];0) -> 0 | BD6: of:=[.BE6]&T(ORG.OPENOFFICE.STYLE(IF([.BC6]=1;"seg1";IF([.BC6]=0;"seg0";"segX")))) -> b | BE6: b | BF6: of:=HLOOKUP([.BH6];[.$G$5:.$M$22];[.BF4];0) -> 0 | BG6: of:=[.BH6]&T(ORG.OPENOFFICE.STYLE(IF([.BF6]=1;"seg1";IF([.BF6]=0;"seg0";"segX")))) -> f | BH6: f | BI6: of:=HLOOKUP([.BK6];[.$G$5:.$M$22];[.BF4];0) -> 1 | BJ6: of:=[.BK6]&T(ORG.OPENOFFICE.STYLE(IF([.BI6]=1;"seg1";IF([.BI6]=0;"seg0";"segX")))) -> b | BK6: b
B7: 0 | C7: of:=MOD(ROUNDDOWN([.$B7]/[.C$6]);2) -> 0 | D7: of:=MOD(ROUNDDOWN([.$B7]/[.D$6]);2) -> 0 | E7: of:=MOD(ROUNDDOWN([.$B7]/[.E$6]);2) -> 0 | F7: of:=MOD(ROUNDDOWN([.$B7]/[.F$6]);2) -> 0 | G7: 1 | H7: 1 | I7: 1 | J7: 1 | K7: 1 | L7: 1 | M7: 0
B8: of:=[.B7]+1 -> 1 | C8: of:=MOD(ROUNDDOWN([.$B8]/[.C$6]);2) -> 0 | D8: of:=MOD(ROUNDDOWN([.$B8]/[.D$6]);2) -> 0 | E8: of:=MOD(ROUNDDOWN([.$B8]/[.E$6]);2) -> 0 | F8: of:=MOD(ROUNDDOWN([.$B8]/[.F$6]);2) -> 1 | G8: 0 | H8: 1 | I8: 1 | J8: 0 | K8: 0 | L8: 0 | M8: 0 | Q8: of:=HLOOKUP([.T8];[.$G$5:.$M$22];[.P4];0) -> 0 | R8: of:=[.T8]&T(ORG.OPENOFFICE.STYLE(IF([.Q8]=1;"seg1";IF([.Q8]=0;"seg0";"segX")))) -> g | T8: g | W8: of:=HLOOKUP([.Z8];[.$G$5:.$M$22];[.V4];0) -> 0 | X8: of:=[.Z8]&T(ORG.OPENOFFICE.STYLE(IF([.W8]=1;"seg1";IF([.W8]=0;"seg0";"segX")))) -> g | Z8: g | AC8: of:=HLOOKUP([.AF8];[.$G$5:.$M$22];[.AB4];0) -> 1 | AD8: of:=[.AF8]&T(ORG.OPENOFFICE.STYLE(IF([.AC8]=1;"seg1";IF([.AC8]=0;"seg0";"segX")))) -> g | AF8: g | AI8: of:=HLOOKUP([.AL8];[.$G$5:.$M$22];[.AH4];0) -> 1 | AJ8: of:=[.AL8]&T(ORG.OPENOFFICE.STYLE(IF([.AI8]=1;"seg1";IF([.AI8]=0;"seg0";"segX")))) -> g | AL8: g | AO8: of:=HLOOKUP([.AR8];[.$G$5:.$M$22];[.AN4];0) -> 1 | AP8: of:=[.AR8]&T(ORG.OPENOFFICE.STYLE(IF([.AO8]=1;"seg1";IF([.AO8]=0;"seg0";"segX")))) -> g | AR8: g | AU8: of:=HLOOKUP([.AX8];[.$G$5:.$M$22];[.AT4];0) -> 1 | AV8: of:=[.AX8]&T(ORG.OPENOFFICE.STYLE(IF([.AU8]=1;"seg1";IF([.AU8]=0;"seg0";"segX")))) -> g | AX8: g | BA8: of:=HLOOKUP([.BD8];[.$G$5:.$M$22];[.AZ4];0) -> 1 | BB8: of:=[.BD8]&T(ORG.OPENOFFICE.STYLE(IF([.BA8]=1;"seg1";IF([.BA8]=0;"seg0";"segX")))) -> g | BD8: g | BG8: of:=HLOOKUP([.BJ8];[.$G$5:.$M$22];[.BF4];0) -> 0 | BH8: of:=[.BJ8]&T(ORG.OPENOFFICE.STYLE(IF([.BG8]=1;"seg1";IF([.BG8]=0;"seg0";"segX")))) -> g | BJ8: g
B9: of:=[.B8]+1 -> 2 | C9: of:=MOD(ROUNDDOWN([.$B9]/[.C$6]);2) -> 0 | D9: of:=MOD(ROUNDDOWN([.$B9]/[.D$6]);2) -> 0 | E9: of:=MOD(ROUNDDOWN([.$B9]/[.E$6]);2) -> 1 | F9: of:=MOD(ROUNDDOWN([.$B9]/[.F$6]);2) -> 0 | G9: 1 | H9: 1 | I9: 0 | J9: 1 | K9: 1 | L9: 0 | M9: 1 | P9: of:=HLOOKUP([.R9];[.$G$5:.$M$22];[.P4];0) -> 1 | Q9: of:=[.R9]&T(ORG.OPENOFFICE.STYLE(IF([.P9]=1;"seg1";IF([.P9]=0;"seg0";"segX")))) -> e | R9: e | S9: of:=HLOOKUP([.U9];[.$G$5:.$M$22];[.P4];0) -> 1 | T9: of:=[.U9]&T(ORG.OPENOFFICE.STYLE(IF([.S9]=1;"seg1";IF([.S9]=0;"seg0";"segX")))) -> c | U9: c | V9: of:=HLOOKUP([.X9];[.$G$5:.$M$22];[.V4];0) -> 0 | W9: of:=[.X9]&T(ORG.OPENOFFICE.STYLE(IF([.V9]=1;"seg1";IF([.V9]=0;"seg0";"segX")))) -> e | X9: e | Y9: of:=HLOOKUP([.AA9];[.$G$5:.$M$22];[.V4];0) -> 1 | Z9: of:=[.AA9]&T(ORG.OPENOFFICE.STYLE(IF([.Y9]=1;"seg1";IF([.Y9]=0;"seg0";"segX")))) -> c | AA9: c | AB9: of:=HLOOKUP([.AD9];[.$G$5:.$M$22];[.AB4];0) -> 1 | AC9: of:=[.AD9]&T(ORG.OPENOFFICE.STYLE(IF([.AB9]=1;"seg1";IF([.AB9]=0;"seg0";"segX")))) -> e | AD9: e | AE9: of:=HLOOKUP([.AG9];[.$G$5:.$M$22];[.AB4];0) -> 0 | AF9: of:=[.AG9]&T(ORG.OPENOFFICE.STYLE(IF([.AE9]=1;"seg1";IF([.AE9]=0;"seg0";"segX")))) -> c | AG9: c | AH9: of:=HLOOKUP([.AJ9];[.$G$5:.$M$22];[.AH4];0) -> 0 | AI9: of:=[.AJ9]&T(ORG.OPENOFFICE.STYLE(IF([.AH9]=1;"seg1";IF([.AH9]=0;"seg0";"segX")))) -> e | AJ9: e | AK9: of:=HLOOKUP([.AM9];[.$G$5:.$M$22];[.AH4];0) -> 1 | AL9: of:=[.AM9]&T(ORG.OPENOFFICE.STYLE(IF([.AK9]=1;"seg1";IF([.AK9]=0;"seg0";"segX")))) -> c | AM9: c | AN9: of:=HLOOKUP([.AP9];[.$G$5:.$M$22];[.AN4];0) -> 0 | AO9: of:=[.AP9]&T(ORG.OPENOFFICE.STYLE(IF([.AN9]=1;"seg1";IF([.AN9]=0;"seg0";"segX")))) -> e | AP9: e | AQ9: of:=HLOOKUP([.AS9];[.$G$5:.$M$22];[.AN4];0) -> 1 | AR9: of:=[.AS9]&T(ORG.OPENOFFICE.STYLE(IF([.AQ9]=1;"seg1";IF([.AQ9]=0;"seg0";"segX")))) -> c | AS9: c | AT9: of:=HLOOKUP([.AV9];[.$G$5:.$M$22];[.AT4];0) -> 0 | AU9: of:=[.AV9]&T(ORG.OPENOFFICE.STYLE(IF([.AT9]=1;"seg1";IF([.AT9]=0;"seg0";"segX")))) -> e | AV9: e | AW9: of:=HLOOKUP([.AY9];[.$G$5:.$M$22];[.AT4];0) -> 1 | AX9: of:=[.AY9]&T(ORG.OPENOFFICE.STYLE(IF([.AW9]=1;"seg1";IF([.AW9]=0;"seg0";"segX")))) -> c | AY9: c | AZ9: of:=HLOOKUP([.BB9];[.$G$5:.$M$22];[.AZ4];0) -> 1 | BA9: of:=[.BB9]&T(ORG.OPENOFFICE.STYLE(IF([.AZ9]=1;"seg1";IF([.AZ9]=0;"seg0";"segX")))) -> e | BB9: e | BC9: of:=HLOOKUP([.BE9];[.$G$5:.$M$22];[.AZ4];0) -> 1 | BD9: of:=[.BE9]&T(ORG.OPENOFFICE.STYLE(IF([.BC9]=1;"seg1";IF([.BC9]=0;"seg0";"segX")))) -> c | BE9: c | BF9: of:=HLOOKUP([.BH9];[.$G$5:.$M$22];[.BF4];0) -> 0 | BG9: of:=[.BH9]&T(ORG.OPENOFFICE.STYLE(IF([.BF9]=1;"seg1";IF([.BF9]=0;"seg0";"segX")))) -> e | BH9: e | BI9: of:=HLOOKUP([.BK9];[.$G$5:.$M$22];[.BF4];0) -> 1 | BJ9: of:=[.BK9]&T(ORG.OPENOFFICE.STYLE(IF([.BI9]=1;"seg1";IF([.BI9]=0;"seg0";"segX")))) -> c | BK9: c
B10: of:=[.B9]+1 -> 3 | C10: of:=MOD(ROUNDDOWN([.$B10]/[.C$6]);2) -> 0 | D10: of:=MOD(ROUNDDOWN([.$B10]/[.D$6]);2) -> 0 | E10: of:=MOD(ROUNDDOWN([.$B10]/[.E$6]);2) -> 1 | F10: of:=MOD(ROUNDDOWN([.$B10]/[.F$6]);2) -> 1 | G10: 1 | H10: 1 | I10: 1 | J10: 1 | K10: 0 | L10: 0 | M10: 1
B11: of:=[.B10]+1 -> 4 | C11: of:=MOD(ROUNDDOWN([.$B11]/[.C$6]);2) -> 0 | D11: of:=MOD(ROUNDDOWN([.$B11]/[.D$6]);2) -> 1 | E11: of:=MOD(ROUNDDOWN([.$B11]/[.E$6]);2) -> 0 | F11: of:=MOD(ROUNDDOWN([.$B11]/[.F$6]);2) -> 0 | G11: 0 | H11: 1 | I11: 1 | J11: 0 | K11: 0 | L11: 1 | M11: 1 | Q11: of:=HLOOKUP([.T11];[.$G$5:.$M$22];[.P4];0) -> 1 | R11: of:=[.T11]&T(ORG.OPENOFFICE.STYLE(IF([.Q11]=1;"seg1";IF([.Q11]=0;"seg0";"segX")))) -> d | T11: d | W11: of:=HLOOKUP([.Z11];[.$G$5:.$M$22];[.V4];0) -> 0 | X11: of:=[.Z11]&T(ORG.OPENOFFICE.STYLE(IF([.W11]=1;"seg1";IF([.W11]=0;"seg0";"segX")))) -> d | Z11: d | AC11: of:=HLOOKUP([.AF11];[.$G$5:.$M$22];[.AB4];0) -> 1 | AD11: of:=[.AF11]&T(ORG.OPENOFFICE.STYLE(IF([.AC11]=1;"seg1";IF([.AC11]=0;"seg0";"segX")))) -> d | AF11: d | AI11: of:=HLOOKUP([.AL11];[.$G$5:.$M$22];[.AH4];0) -> 1 | AJ11: of:=[.AL11]&T(ORG.OPENOFFICE.STYLE(IF([.AI11]=1;"seg1";IF([.AI11]=0;"seg0";"segX")))) -> d | AL11: d | AO11: of:=HLOOKUP([.AR11];[.$G$5:.$M$22];[.AN4];0) -> 0 | AP11: of:=[.AR11]&T(ORG.OPENOFFICE.STYLE(IF([.AO11]=1;"seg1";IF([.AO11]=0;"seg0";"segX")))) -> d | AR11: d | AU11: of:=HLOOKUP([.AX11];[.$G$5:.$M$22];[.AT4];0) -> 1 | AV11: of:=[.AX11]&T(ORG.OPENOFFICE.STYLE(IF([.AU11]=1;"seg1";IF([.AU11]=0;"seg0";"segX")))) -> d | AX11: d | BA11: of:=HLOOKUP([.BD11];[.$G$5:.$M$22];[.AZ4];0) -> 1 | BB11: of:=[.BD11]&T(ORG.OPENOFFICE.STYLE(IF([.BA11]=1;"seg1";IF([.BA11]=0;"seg0";"segX")))) -> d | BD11: d | BG11: of:=HLOOKUP([.BJ11];[.$G$5:.$M$22];[.BF4];0) -> 0 | BH11: of:=[.BJ11]&T(ORG.OPENOFFICE.STYLE(IF([.BG11]=1;"seg1";IF([.BG11]=0;"seg0";"segX")))) -> d | BJ11: d
B12: of:=[.B11]+1 -> 5 | C12: of:=MOD(ROUNDDOWN([.$B12]/[.C$6]);2) -> 0 | D12: of:=MOD(ROUNDDOWN([.$B12]/[.D$6]);2) -> 1 | E12: of:=MOD(ROUNDDOWN([.$B12]/[.E$6]);2) -> 0 | F12: of:=MOD(ROUNDDOWN([.$B12]/[.F$6]);2) -> 1 | G12: 1 | H12: 0 | I12: 1 | J12: 1 | K12: 0 | L12: 1 | M12: 1
B13: of:=[.B12]+1 -> 6 | C13: of:=MOD(ROUNDDOWN([.$B13]/[.C$6]);2) -> 0 | D13: of:=MOD(ROUNDDOWN([.$B13]/[.D$6]);2) -> 1 | E13: of:=MOD(ROUNDDOWN([.$B13]/[.E$6]);2) -> 1 | F13: of:=MOD(ROUNDDOWN([.$B13]/[.F$6]);2) -> 0 | G13: 1 | H13: 0 | I13: 1 | J13: 1 | K13: 1 | L13: 1 | M13: 1 | P13: of:=[.BF3]+1 -> 8 | V13: of:=[.P13]+1 -> 9 | AB13: of:=[.V13]+1 -> 10 | AH13: of:=[.AB13]+1 -> 11 | AN13: of:=[.AH13]+1 -> 12 | AT13: of:=[.AN13]+1 -> 13 | AZ13: of:=[.AT13]+1 -> 14 | BF13: of:=[.AZ13]+1 -> 15
B14: of:=[.B13]+1 -> 7 | C14: of:=MOD(ROUNDDOWN([.$B14]/[.C$6]);2) -> 0 | D14: of:=MOD(ROUNDDOWN([.$B14]/[.D$6]);2) -> 1 | E14: of:=MOD(ROUNDDOWN([.$B14]/[.E$6]);2) -> 1 | F14: of:=MOD(ROUNDDOWN([.$B14]/[.F$6]);2) -> 1 | G14: 1 | H14: 1 | I14: 1 | J14: 0 | K14: 0 | L14: 0 | M14: 0 | P14: of:=MATCH([.P13];[.$B$7:.$B$22];0)+2 -> 11 | V14: of:=MATCH([.V13];[.$B$7:.$B$22];0)+2 -> 12 | AB14: of:=MATCH([.AB13];[.$B$7:.$B$22];0)+2 -> 13 | AH14: of:=MATCH([.AH13];[.$B$7:.$B$22];0)+2 -> 14 | AN14: of:=MATCH([.AN13];[.$B$7:.$B$22];0)+2 -> 15 | AT14: of:=MATCH([.AT13];[.$B$7:.$B$22];0)+2 -> 16 | AZ14: of:=MATCH([.AZ13];[.$B$7:.$B$22];0)+2 -> 17 | BF14: of:=MATCH([.BF13];[.$B$7:.$B$22];0)+2 -> 18
B15: of:=[.B14]+1 -> 8 | C15: of:=MOD(ROUNDDOWN([.$B15]/[.C$6]);2) -> 1 | D15: of:=MOD(ROUNDDOWN([.$B15]/[.D$6]);2) -> 0 | E15: of:=MOD(ROUNDDOWN([.$B15]/[.E$6]);2) -> 0 | F15: of:=MOD(ROUNDDOWN([.$B15]/[.F$6]);2) -> 0 | G15: 1 | H15: 1 | I15: 1 | J15: 1 | K15: 1 | L15: 1 | M15: 1 | Q15: of:=HLOOKUP([.T15];[.$G$5:.$M$22];[.P14];0) -> 1 | R15: of:=[.T15]&T(ORG.OPENOFFICE.STYLE(IF([.Q15]=1;"seg1";IF([.Q15]=0;"seg0";"segX")))) -> a | T15: a | W15: of:=HLOOKUP([.Z15];[.$G$5:.$M$22];[.V14];0) -> 1 | X15: of:=[.Z15]&T(ORG.OPENOFFICE.STYLE(IF([.W15]=1;"seg1";IF([.W15]=0;"seg0";"segX")))) -> a | Z15: a | AC15: of:=HLOOKUP([.AF15];[.$G$5:.$M$22];[.AB14];0) -> 1 | AD15: of:=[.AF15]&T(ORG.OPENOFFICE.STYLE(IF([.AC15]=1;"seg1";IF([.AC15]=0;"seg0";"segX")))) -> a | AF15: a | AI15: of:=HLOOKUP([.AL15];[.$G$5:.$M$22];[.AH14];0) -> 0 | AJ15: of:=[.AL15]&T(ORG.OPENOFFICE.STYLE(IF([.AI15]=1;"seg1";IF([.AI15]=0;"seg0";"segX")))) -> a | AL15: a | AO15: of:=HLOOKUP([.AR15];[.$G$5:.$M$22];[.AN14];0) -> 0 | AP15: of:=[.AR15]&T(ORG.OPENOFFICE.STYLE(IF([.AO15]=1;"seg1";IF([.AO15]=0;"seg0";"segX")))) -> a | AR15: a | AU15: of:=HLOOKUP([.AX15];[.$G$5:.$M$22];[.AT14];0) -> 0 | AV15: of:=[.AX15]&T(ORG.OPENOFFICE.STYLE(IF([.AU15]=1;"seg1";IF([.AU15]=0;"seg0";"segX")))) -> a | AX15: a | BA15: of:=HLOOKUP([.BD15];[.$G$5:.$M$22];[.AZ14];0) -> 1 | BB15: of:=[.BD15]&T(ORG.OPENOFFICE.STYLE(IF([.BA15]=1;"seg1";IF([.BA15]=0;"seg0";"segX")))) -> a | BD15: a | BG15: of:=HLOOKUP([.BJ15];[.$G$5:.$M$22];[.BF14];0) -> 1 | BH15: of:=[.BJ15]&T(ORG.OPENOFFICE.STYLE(IF([.BG15]=1;"seg1";IF([.BG15]=0;"seg0";"segX")))) -> a | BJ15: a
B16: of:=[.B15]+1 -> 9 | C16: of:=MOD(ROUNDDOWN([.$B16]/[.C$6]);2) -> 1 | D16: of:=MOD(ROUNDDOWN([.$B16]/[.D$6]);2) -> 0 | E16: of:=MOD(ROUNDDOWN([.$B16]/[.E$6]);2) -> 0 | F16: of:=MOD(ROUNDDOWN([.$B16]/[.F$6]);2) -> 1 | G16: 1 | H16: 1 | I16: 1 | J16: 1 | K16: 0 | L16: 1 | M16: 1 | P16: of:=HLOOKUP([.R16];[.$G$5:.$M$22];[.P14];0) -> 1 | Q16: of:=[.R16]&T(ORG.OPENOFFICE.STYLE(IF([.P16]=1;"seg1";IF([.P16]=0;"seg0";"segX")))) -> f | R16: f | S16: of:=HLOOKUP([.U16];[.$G$5:.$M$22];[.P14];0) -> 1 | T16: of:=[.U16]&T(ORG.OPENOFFICE.STYLE(IF([.S16]=1;"seg1";IF([.S16]=0;"seg0";"segX")))) -> b | U16: b | V16: of:=HLOOKUP([.X16];[.$G$5:.$M$22];[.V14];0) -> 1 | W16: of:=[.X16]&T(ORG.OPENOFFICE.STYLE(IF([.V16]=1;"seg1";IF([.V16]=0;"seg0";"segX")))) -> f | X16: f | Y16: of:=HLOOKUP([.AA16];[.$G$5:.$M$22];[.V14];0) -> 1 | Z16: of:=[.AA16]&T(ORG.OPENOFFICE.STYLE(IF([.Y16]=1;"seg1";IF([.Y16]=0;"seg0";"segX")))) -> b | AA16: b | AB16: of:=HLOOKUP([.AD16];[.$G$5:.$M$22];[.AB14];0) -> 1 | AC16: of:=[.AD16]&T(ORG.OPENOFFICE.STYLE(IF([.AB16]=1;"seg1";IF([.AB16]=0;"seg0";"segX")))) -> f | AD16: f | AE16: of:=HLOOKUP([.AG16];[.$G$5:.$M$22];[.AB14];0) -> 1 | AF16: of:=[.AG16]&T(ORG.OPENOFFICE.STYLE(IF([.AE16]=1;"seg1";IF([.AE16]=0;"seg0";"segX")))) -> b | AG16: b | AH16: of:=HLOOKUP([.AJ16];[.$G$5:.$M$22];[.AH14];0) -> 1 | AI16: of:=[.AJ16]&T(ORG.OPENOFFICE.STYLE(IF([.AH16]=1;"seg1";IF([.AH16]=0;"seg0";"segX")))) -> f | AJ16: f | AK16: of:=HLOOKUP([.AM16];[.$G$5:.$M$22];[.AH14];0) -> 0 | AL16: of:=[.AM16]&T(ORG.OPENOFFICE.STYLE(IF([.AK16]=1;"seg1";IF([.AK16]=0;"seg0";"segX")))) -> b | AM16: b | AN16: of:=HLOOKUP([.AP16];[.$G$5:.$M$22];[.AN14];0) -> 0 | AO16: of:=[.AP16]&T(ORG.OPENOFFICE.STYLE(IF([.AN16]=1;"seg1";IF([.AN16]=0;"seg0";"segX")))) -> f | AP16: f | AQ16: of:=HLOOKUP([.AS16];[.$G$5:.$M$22];[.AN14];0) -> 0 | AR16: of:=[.AS16]&T(ORG.OPENOFFICE.STYLE(IF([.AQ16]=1;"seg1";IF([.AQ16]=0;"seg0";"segX")))) -> b | AS16: b | AT16: of:=HLOOKUP([.AV16];[.$G$5:.$M$22];[.AT14];0) -> 0 | AU16: of:=[.AV16]&T(ORG.OPENOFFICE.STYLE(IF([.AT16]=1;"seg1";IF([.AT16]=0;"seg0";"segX")))) -> f | AV16: f | AW16: of:=HLOOKUP([.AY16];[.$G$5:.$M$22];[.AT14];0) -> 1 | AX16: of:=[.AY16]&T(ORG.OPENOFFICE.STYLE(IF([.AW16]=1;"seg1";IF([.AW16]=0;"seg0";"segX")))) -> b | AY16: b | AZ16: of:=HLOOKUP([.BB16];[.$G$5:.$M$22];[.AZ14];0) -> 1 | BA16: of:=[.BB16]&T(ORG.OPENOFFICE.STYLE(IF([.AZ16]=1;"seg1";IF([.AZ16]=0;"seg0";"segX")))) -> f | BB16: f | BC16: of:=HLOOKUP([.BE16];[.$G$5:.$M$22];[.AZ14];0) -> 0 | BD16: of:=[.BE16]&T(ORG.OPENOFFICE.STYLE(IF([.BC16]=1;"seg1";IF([.BC16]=0;"seg0";"segX")))) -> b | BE16: b | BF16: of:=HLOOKUP([.BH16];[.$G$5:.$M$22];[.BF14];0) -> 1 | BG16: of:=[.BH16]&T(ORG.OPENOFFICE.STYLE(IF([.BF16]=1;"seg1";IF([.BF16]=0;"seg0";"segX")))) -> f | BH16: f | BI16: of:=HLOOKUP([.BK16];[.$G$5:.$M$22];[.BF14];0) -> 0 | BJ16: of:=[.BK16]&T(ORG.OPENOFFICE.STYLE(IF([.BI16]=1;"seg1";IF([.BI16]=0;"seg0";"segX")))) -> b | BK16: b
B17: of:=[.B16]+1 -> 10 | C17: of:=MOD(ROUNDDOWN([.$B17]/[.C$6]);2) -> 1 | D17: of:=MOD(ROUNDDOWN([.$B17]/[.D$6]);2) -> 0 | E17: of:=MOD(ROUNDDOWN([.$B17]/[.E$6]);2) -> 1 | F17: of:=MOD(ROUNDDOWN([.$B17]/[.F$6]);2) -> 0 | G17: 1 | H17: 1 | I17: 1 | J17: 0 | K17: 1 | L17: 1 | M17: 1
B18: of:=[.B17]+1 -> 11 | C18: of:=MOD(ROUNDDOWN([.$B18]/[.C$6]);2) -> 1 | D18: of:=MOD(ROUNDDOWN([.$B18]/[.D$6]);2) -> 0 | E18: of:=MOD(ROUNDDOWN([.$B18]/[.E$6]);2) -> 1 | F18: of:=MOD(ROUNDDOWN([.$B18]/[.F$6]);2) -> 1 | G18: 0 | H18: 0 | I18: 1 | J18: 1 | K18: 1 | L18: 1 | M18: 1 | Q18: of:=HLOOKUP([.T18];[.$G$5:.$M$22];[.P14];0) -> 1 | R18: of:=[.T18]&T(ORG.OPENOFFICE.STYLE(IF([.Q18]=1;"seg1";IF([.Q18]=0;"seg0";"segX")))) -> g | T18: g | W18: of:=HLOOKUP([.Z18];[.$G$5:.$M$22];[.V14];0) -> 1 | X18: of:=[.Z18]&T(ORG.OPENOFFICE.STYLE(IF([.W18]=1;"seg1";IF([.W18]=0;"seg0";"segX")))) -> g | Z18: g | AC18: of:=HLOOKUP([.AF18];[.$G$5:.$M$22];[.AB14];0) -> 1 | AD18: of:=[.AF18]&T(ORG.OPENOFFICE.STYLE(IF([.AC18]=1;"seg1";IF([.AC18]=0;"seg0";"segX")))) -> g | AF18: g | AI18: of:=HLOOKUP([.AL18];[.$G$5:.$M$22];[.AH14];0) -> 1 | AJ18: of:=[.AL18]&T(ORG.OPENOFFICE.STYLE(IF([.AI18]=1;"seg1";IF([.AI18]=0;"seg0";"segX")))) -> g | AL18: g | AO18: of:=HLOOKUP([.AR18];[.$G$5:.$M$22];[.AN14];0) -> 1 | AP18: of:=[.AR18]&T(ORG.OPENOFFICE.STYLE(IF([.AO18]=1;"seg1";IF([.AO18]=0;"seg0";"segX")))) -> g | AR18: g | AU18: of:=HLOOKUP([.AX18];[.$G$5:.$M$22];[.AT14];0) -> 1 | AV18: of:=[.AX18]&T(ORG.OPENOFFICE.STYLE(IF([.AU18]=1;"seg1";IF([.AU18]=0;"seg0";"segX")))) -> g | AX18: g | BA18: of:=HLOOKUP([.BD18];[.$G$5:.$M$22];[.AZ14];0) -> 1 | BB18: of:=[.BD18]&T(ORG.OPENOFFICE.STYLE(IF([.BA18]=1;"seg1";IF([.BA18]=0;"seg0";"segX")))) -> g | BD18: g | BG18: of:=HLOOKUP([.BJ18];[.$G$5:.$M$22];[.BF14];0) -> 1 | BH18: of:=[.BJ18]&T(ORG.OPENOFFICE.STYLE(IF([.BG18]=1;"seg1";IF([.BG18]=0;"seg0";"segX")))) -> g | BJ18: g
B19: of:=[.B18]+1 -> 12 | C19: of:=MOD(ROUNDDOWN([.$B19]/[.C$6]);2) -> 1 | D19: of:=MOD(ROUNDDOWN([.$B19]/[.D$6]);2) -> 1 | E19: of:=MOD(ROUNDDOWN([.$B19]/[.E$6]);2) -> 0 | F19: of:=MOD(ROUNDDOWN([.$B19]/[.F$6]);2) -> 0 | G19: 0 | H19: 0 | I19: 0 | J19: 1 | K19: 1 | L19: 0 | M19: 1 | P19: of:=HLOOKUP([.R19];[.$G$5:.$M$22];[.P14];0) -> 1 | Q19: of:=[.R19]&T(ORG.OPENOFFICE.STYLE(IF([.P19]=1;"seg1";IF([.P19]=0;"seg0";"segX")))) -> e | R19: e | S19: of:=HLOOKUP([.U19];[.$G$5:.$M$22];[.P14];0) -> 1 | T19: of:=[.U19]&T(ORG.OPENOFFICE.STYLE(IF([.S19]=1;"seg1";IF([.S19]=0;"seg0";"segX")))) -> c | U19: c | V19: of:=HLOOKUP([.X19];[.$G$5:.$M$22];[.V14];0) -> 0 | W19: of:=[.X19]&T(ORG.OPENOFFICE.STYLE(IF([.V19]=1;"seg1";IF([.V19]=0;"seg0";"segX")))) -> e | X19: e | Y19: of:=HLOOKUP([.AA19];[.$G$5:.$M$22];[.V14];0) -> 1 | Z19: of:=[.AA19]&T(ORG.OPENOFFICE.STYLE(IF([.Y19]=1;"seg1";IF([.Y19]=0;"seg0";"segX")))) -> c | AA19: c | AB19: of:=HLOOKUP([.AD19];[.$G$5:.$M$22];[.AB14];0) -> 1 | AC19: of:=[.AD19]&T(ORG.OPENOFFICE.STYLE(IF([.AB19]=1;"seg1";IF([.AB19]=0;"seg0";"segX")))) -> e | AD19: e | AE19: of:=HLOOKUP([.AG19];[.$G$5:.$M$22];[.AB14];0) -> 1 | AF19: of:=[.AG19]&T(ORG.OPENOFFICE.STYLE(IF([.AE19]=1;"seg1";IF([.AE19]=0;"seg0";"segX")))) -> c | AG19: c | AH19: of:=HLOOKUP([.AJ19];[.$G$5:.$M$22];[.AH14];0) -> 1 | AI19: of:=[.AJ19]&T(ORG.OPENOFFICE.STYLE(IF([.AH19]=1;"seg1";IF([.AH19]=0;"seg0";"segX")))) -> e | AJ19: e | AK19: of:=HLOOKUP([.AM19];[.$G$5:.$M$22];[.AH14];0) -> 1 | AL19: of:=[.AM19]&T(ORG.OPENOFFICE.STYLE(IF([.AK19]=1;"seg1";IF([.AK19]=0;"seg0";"segX")))) -> c | AM19: c | AN19: of:=HLOOKUP([.AP19];[.$G$5:.$M$22];[.AN14];0) -> 1 | AO19: of:=[.AP19]&T(ORG.OPENOFFICE.STYLE(IF([.AN19]=1;"seg1";IF([.AN19]=0;"seg0";"segX")))) -> e | AP19: e | AQ19: of:=HLOOKUP([.AS19];[.$G$5:.$M$22];[.AN14];0) -> 0 | AR19: of:=[.AS19]&T(ORG.OPENOFFICE.STYLE(IF([.AQ19]=1;"seg1";IF([.AQ19]=0;"seg0";"segX")))) -> c | AS19: c | AT19: of:=HLOOKUP([.AV19];[.$G$5:.$M$22];[.AT14];0) -> 1 | AU19: of:=[.AV19]&T(ORG.OPENOFFICE.STYLE(IF([.AT19]=1;"seg1";IF([.AT19]=0;"seg0";"segX")))) -> e | AV19: e | AW19: of:=HLOOKUP([.AY19];[.$G$5:.$M$22];[.AT14];0) -> 1 | AX19: of:=[.AY19]&T(ORG.OPENOFFICE.STYLE(IF([.AW19]=1;"seg1";IF([.AW19]=0;"seg0";"segX")))) -> c | AY19: c | AZ19: of:=HLOOKUP([.BB19];[.$G$5:.$M$22];[.AZ14];0) -> 1 | BA19: of:=[.BB19]&T(ORG.OPENOFFICE.STYLE(IF([.AZ19]=1;"seg1";IF([.AZ19]=0;"seg0";"segX")))) -> e | BB19: e | BC19: of:=HLOOKUP([.BE19];[.$G$5:.$M$22];[.AZ14];0) -> 0 | BD19: of:=[.BE19]&T(ORG.OPENOFFICE.STYLE(IF([.BC19]=1;"seg1";IF([.BC19]=0;"seg0";"segX")))) -> c | BE19: c | BF19: of:=HLOOKUP([.BH19];[.$G$5:.$M$22];[.BF14];0) -> 1 | BG19: of:=[.BH19]&T(ORG.OPENOFFICE.STYLE(IF([.BF19]=1;"seg1";IF([.BF19]=0;"seg0";"segX")))) -> e | BH19: e | BI19: of:=HLOOKUP([.BK19];[.$G$5:.$M$22];[.BF14];0) -> 0 | BJ19: of:=[.BK19]&T(ORG.OPENOFFICE.STYLE(IF([.BI19]=1;"seg1";IF([.BI19]=0;"seg0";"segX")))) -> c | BK19: c
B20: of:=[.B19]+1 -> 13 | C20: of:=MOD(ROUNDDOWN([.$B20]/[.C$6]);2) -> 1 | D20: of:=MOD(ROUNDDOWN([.$B20]/[.D$6]);2) -> 1 | E20: of:=MOD(ROUNDDOWN([.$B20]/[.E$6]);2) -> 0 | F20: of:=MOD(ROUNDDOWN([.$B20]/[.F$6]);2) -> 1 | G20: 0 | H20: 1 | I20: 1 | J20: 1 | K20: 1 | L20: 0 | M20: 1
B21: of:=[.B20]+1 -> 14 | C21: of:=MOD(ROUNDDOWN([.$B21]/[.C$6]);2) -> 1 | D21: of:=MOD(ROUNDDOWN([.$B21]/[.D$6]);2) -> 1 | E21: of:=MOD(ROUNDDOWN([.$B21]/[.E$6]);2) -> 1 | F21: of:=MOD(ROUNDDOWN([.$B21]/[.F$6]);2) -> 0 | G21: 1 | H21: 0 | I21: 0 | J21: 1 | K21: 1 | L21: 1 | M21: 1 | Q21: of:=HLOOKUP([.T21];[.$G$5:.$M$22];[.P14];0) -> 1 | R21: of:=[.T21]&T(ORG.OPENOFFICE.STYLE(IF([.Q21]=1;"seg1";IF([.Q21]=0;"seg0";"segX")))) -> d | T21: d | W21: of:=HLOOKUP([.Z21];[.$G$5:.$M$22];[.V14];0) -> 1 | X21: of:=[.Z21]&T(ORG.OPENOFFICE.STYLE(IF([.W21]=1;"seg1";IF([.W21]=0;"seg0";"segX")))) -> d | Z21: d | AC21: of:=HLOOKUP([.AF21];[.$G$5:.$M$22];[.AB14];0) -> 0 | AD21: of:=[.AF21]&T(ORG.OPENOFFICE.STYLE(IF([.AC21]=1;"seg1";IF([.AC21]=0;"seg0";"segX")))) -> d | AF21: d | AI21: of:=HLOOKUP([.AL21];[.$G$5:.$M$22];[.AH14];0) -> 1 | AJ21: of:=[.AL21]&T(ORG.OPENOFFICE.STYLE(IF([.AI21]=1;"seg1";IF([.AI21]=0;"seg0";"segX")))) -> d | AL21: d | AO21: of:=HLOOKUP([.AR21];[.$G$5:.$M$22];[.AN14];0) -> 1 | AP21: of:=[.AR21]&T(ORG.OPENOFFICE.STYLE(IF([.AO21]=1;"seg1";IF([.AO21]=0;"seg0";"segX")))) -> d | AR21: d | AU21: of:=HLOOKUP([.AX21];[.$G$5:.$M$22];[.AT14];0) -> 1 | AV21: of:=[.AX21]&T(ORG.OPENOFFICE.STYLE(IF([.AU21]=1;"seg1";IF([.AU21]=0;"seg0";"segX")))) -> d | AX21: d | BA21: of:=HLOOKUP([.BD21];[.$G$5:.$M$22];[.AZ14];0) -> 1 | BB21: of:=[.BD21]&T(ORG.OPENOFFICE.STYLE(IF([.BA21]=1;"seg1";IF([.BA21]=0;"seg0";"segX")))) -> d | BD21: d | BG21: of:=HLOOKUP([.BJ21];[.$G$5:.$M$22];[.BF14];0) -> 0 | BH21: of:=[.BJ21]&T(ORG.OPENOFFICE.STYLE(IF([.BG21]=1;"seg1";IF([.BG21]=0;"seg0";"segX")))) -> d | BJ21: d
B22: of:=[.B21]+1 -> 15 | C22: of:=MOD(ROUNDDOWN([.$B22]/[.C$6]);2) -> 1 | D22: of:=MOD(ROUNDDOWN([.$B22]/[.D$6]);2) -> 1 | E22: of:=MOD(ROUNDDOWN([.$B22]/[.E$6]);2) -> 1 | F22: of:=MOD(ROUNDDOWN([.$B22]/[.F$6]);2) -> 1 | G22: 1 | H22: 0 | I22: 0 | J22: 0 | K22: 1 | L22: 1 | M22: 1
P24: Karnaugh-maps
P25: a | Q25: of:=MATCH([.P25];[.$G$5:.$M$5])+5 -> 6 | R25: BA | W25: b | X25: of:=MATCH([.W25];[.$G$5:.$M$5])+5 -> 7 | Y25: BA | AD25: c | AE25: of:=MATCH([.AD25];[.$G$5:.$M$5])+5 -> 8 | AF25: BA | AK25: d | AL25: of:=MATCH([.AK25];[.$G$5:.$M$5])+5 -> 9 | AM25: BA | AR25: e | AS25: of:=MATCH([.AR25];[.$G$5:.$M$5])+5 -> 10 | AT25: BA | AY25: f | AZ25: of:=MATCH([.AY25];[.$G$5:.$M$5])+5 -> 11 | BA25: BA | BF25: g | BG25: of:=MATCH([.BF25];[.$G$5:.$M$5])+5 -> 12 | BH25: BA
R26: 00 | S26: 01 | T26: 11 | U26: 10 | Y26: 00 | Z26: 01 | AA26: 11 | AB26: 10 | AF26: 00 | AG26: 01 | AH26: 11 | AI26: 10 | AM26: 00 | AN26: 01 | AO26: 11 | AP26: 10 | AT26: 00 | AU26: 01 | AV26: 11 | AW26: 10 | BA26: 00 | BB26: 01 | BC26: 11 | BD26: 10 | BH26: 00 | BI26: 01 | BJ26: 11 | BK26: 10
P27: DC | R27: of:=HLOOKUP(MID([.R25];1;1);[.$C$5:.$F$6];2;0)*MID([.R26];1;1) + HLOOKUP(MID([.R25];2;1);[.$C$5:.$F$6];2;0)*MID([.R26];2;1) -> 0 | S27: of:=HLOOKUP(MID([.R25];1;1);[.$C$5:.$F$6];2;0)*MID([.S26];1;1) + HLOOKUP(MID([.R25];2;1);[.$C$5:.$F$6];2;0)*MID([.S26];2;1) -> 1 | T27: of:=HLOOKUP(MID([.R25];1;1);[.$C$5:.$F$6];2;0)*MID([.T26];1;1) + HLOOKUP(MID([.R25];2;1);[.$C$5:.$F$6];2;0)*MID([.T26];2;1) -> 3 | U27: of:=HLOOKUP(MID([.R25];1;1);[.$C$5:.$F$6];2;0)*MID([.U26];1;1) + HLOOKUP(MID([.R25];2;1);[.$C$5:.$F$6];2;0)*MID([.U26];2;1) -> 2 | W27: DC | Y27: of:=HLOOKUP(MID([.Y25];1;1);[.$C$5:.$F$6];2;0)*MID([.Y26];1;1) + HLOOKUP(MID([.Y25];2;1);[.$C$5:.$F$6];2;0)*MID([.Y26];2;1) -> 0 | Z27: of:=HLOOKUP(MID([.Y25];1;1);[.$C$5:.$F$6];2;0)*MID([.Z26];1;1) + HLOOKUP(MID([.Y25];2;1);[.$C$5:.$F$6];2;0)*MID([.Z26];2;1) -> 1 | AA27: of:=HLOOKUP(MID([.Y25];1;1);[.$C$5:.$F$6];2;0)*MID([.AA26];1;1) + HLOOKUP(MID([.Y25];2;1);[.$C$5:.$F$6];2;0)*MID([.AA26];2;1) -> 3 | AB27: of:=HLOOKUP(MID([.Y25];1;1);[.$C$5:.$F$6];2;0)*MID([.AB26];1;1) + HLOOKUP(MID([.Y25];2;1);[.$C$5:.$F$6];2;0)*MID([.AB26];2;1) -> 2 | AD27: DC | AF27: of:=HLOOKUP(MID([.AF25];1;1);[.$C$5:.$F$6];2;0)*MID([.AF26];1;1) + HLOOKUP(MID([.AF25];2;1);[.$C$5:.$F$6];2;0)*MID([.AF26];2;1) -> 0 | AG27: of:=HLOOKUP(MID([.AF25];1;1);[.$C$5:.$F$6];2;0)*MID([.AG26];1;1) + HLOOKUP(MID([.AF25];2;1);[.$C$5:.$F$6];2;0)*MID([.AG26];2;1) -> 1 | AH27: of:=HLOOKUP(MID([.AF25];1;1);[.$C$5:.$F$6];2;0)*MID([.AH26];1;1) + HLOOKUP(MID([.AF25];2;1);[.$C$5:.$F$6];2;0)*MID([.AH26];2;1) -> 3 | AI27: of:=HLOOKUP(MID([.AF25];1;1);[.$C$5:.$F$6];2;0)*MID([.AI26];1;1) + HLOOKUP(MID([.AF25];2;1);[.$C$5:.$F$6];2;0)*MID([.AI26];2;1) -> 2 | AK27: DC | AM27: of:=HLOOKUP(MID([.AM25];1;1);[.$C$5:.$F$6];2;0)*MID([.AM26];1;1) + HLOOKUP(MID([.AM25];2;1);[.$C$5:.$F$6];2;0)*MID([.AM26];2;1) -> 0 | AN27: of:=HLOOKUP(MID([.AM25];1;1);[.$C$5:.$F$6];2;0)*MID([.AN26];1;1) + HLOOKUP(MID([.AM25];2;1);[.$C$5:.$F$6];2;0)*MID([.AN26];2;1) -> 1 | AO27: of:=HLOOKUP(MID([.AM25];1;1);[.$C$5:.$F$6];2;0)*MID([.AO26];1;1) + HLOOKUP(MID([.AM25];2;1);[.$C$5:.$F$6];2;0)*MID([.AO26];2;1) -> 3 | AP27: of:=HLOOKUP(MID([.AM25];1;1);[.$C$5:.$F$6];2;0)*MID([.AP26];1;1) + HLOOKUP(MID([.AM25];2;1);[.$C$5:.$F$6];2;0)*MID([.AP26];2;1) -> 2 | AR27: DC | AT27: of:=HLOOKUP(MID([.AT25];1;1);[.$C$5:.$F$6];2;0)*MID([.AT26];1;1) + HLOOKUP(MID([.AT25];2;1);[.$C$5:.$F$6];2;0)*MID([.AT26];2;1) -> 0 | AU27: of:=HLOOKUP(MID([.AT25];1;1);[.$C$5:.$F$6];2;0)*MID([.AU26];1;1) + HLOOKUP(MID([.AT25];2;1);[.$C$5:.$F$6];2;0)*MID([.AU26];2;1) -> 1 | AV27: of:=HLOOKUP(MID([.AT25];1;1);[.$C$5:.$F$6];2;0)*MID([.AV26];1;1) + HLOOKUP(MID([.AT25];2;1);[.$C$5:.$F$6];2;0)*MID([.AV26];2;1) -> 3 | AW27: of:=HLOOKUP(MID([.AT25];1;1);[.$C$5:.$F$6];2;0)*MID([.AW26];1;1) + HLOOKUP(MID([.AT25];2;1);[.$C$5:.$F$6];2;0)*MID([.AW26];2;1) -> 2 | AY27: DC | BA27: of:=HLOOKUP(MID([.BA25];1;1);[.$C$5:.$F$6];2;0)*MID([.BA26];1;1) + HLOOKUP(MID([.BA25];2;1);[.$C$5:.$F$6];2;0)*MID([.BA26];2;1) -> 0 | BB27: of:=HLOOKUP(MID([.BA25];1;1);[.$C$5:.$F$6];2;0)*MID([.BB26];1;1) + HLOOKUP(MID([.BA25];2;1);[.$C$5:.$F$6];2;0)*MID([.BB26];2;1) -> 1 | BC27: of:=HLOOKUP(MID([.BA25];1;1);[.$C$5:.$F$6];2;0)*MID([.BC26];1;1) + HLOOKUP(MID([.BA25];2;1);[.$C$5:.$F$6];2;0)*MID([.BC26];2;1) -> 3 | BD27: of:=HLOOKUP(MID([.BA25];1;1);[.$C$5:.$F$6];2;0)*MID([.BD26];1;1) + HLOOKUP(MID([.BA25];2;1);[.$C$5:.$F$6];2;0)*MID([.BD26];2;1) -> 2 | BF27: DC | BH27: of:=HLOOKUP(MID([.BH25];1;1);[.$C$5:.$F$6];2;0)*MID([.BH26];1;1) + HLOOKUP(MID([.BH25];2;1);[.$C$5:.$F$6];2;0)*MID([.BH26];2;1) -> 0 | BI27: of:=HLOOKUP(MID([.BH25];1;1);[.$C$5:.$F$6];2;0)*MID([.BI26];1;1) + HLOOKUP(MID([.BH25];2;1);[.$C$5:.$F$6];2;0)*MID([.BI26];2;1) -> 1 | BJ27: of:=HLOOKUP(MID([.BH25];1;1);[.$C$5:.$F$6];2;0)*MID([.BJ26];1;1) + HLOOKUP(MID([.BH25];2;1);[.$C$5:.$F$6];2;0)*MID([.BJ26];2;1) -> 3 | BK27: of:=HLOOKUP(MID([.BH25];1;1);[.$C$5:.$F$6];2;0)*MID([.BK26];1;1) + HLOOKUP(MID([.BH25];2;1);[.$C$5:.$F$6];2;0)*MID([.BK26];2;1) -> 2
P28: 00 | Q28: of:=HLOOKUP(MID([.P27];1;1);[.$C$5:.$F$6];2;0)*MID([.P28];1;1) + HLOOKUP(MID([.P27];2;1);[.$C$5:.$F$6];2;0)*MID([.P28];2;1) -> 0 | R28: of:=VLOOKUP([.Q28]+[.R27];[.$B$7:.$M$22];[.Q25]) -> 1 | S28: of:=VLOOKUP([.Q28]+[.S27];[.$B$7:.$M$22];[.Q25]) -> 0 | T28: of:=VLOOKUP([.Q28]+[.T27];[.$B$7:.$M$22];[.Q25]) -> 1 | U28: of:=VLOOKUP([.Q28]+[.U27];[.$B$7:.$M$22];[.Q25]) -> 1 | W28: 00 | X28: of:=HLOOKUP(MID([.W27];1;1);[.$C$5:.$F$6];2;0)*MID([.W28];1;1) + HLOOKUP(MID([.W27];2;1);[.$C$5:.$F$6];2;0)*MID([.W28];2;1) -> 0 | Y28: of:=VLOOKUP([.X28]+[.Y27];[.$B$7:.$M$22];[.X25]) -> 1 | Z28: of:=VLOOKUP([.X28]+[.Z27];[.$B$7:.$M$22];[.X25]) -> 1 | AA28: of:=VLOOKUP([.X28]+[.AA27];[.$B$7:.$M$22];[.X25]) -> 1 | AB28: of:=VLOOKUP([.X28]+[.AB27];[.$B$7:.$M$22];[.X25]) -> 1 | AD28: 00 | AE28: of:=HLOOKUP(MID([.AD27];1;1);[.$C$5:.$F$6];2;0)*MID([.AD28];1;1) + HLOOKUP(MID([.AD27];2;1);[.$C$5:.$F$6];2;0)*MID([.AD28];2;1) -> 0 | AF28: of:=VLOOKUP([.AE28]+[.AF27];[.$B$7:.$M$22];[.AE25]) -> 1 | AG28: of:=VLOOKUP([.AE28]+[.AG27];[.$B$7:.$M$22];[.AE25]) -> 1 | AH28: of:=VLOOKUP([.AE28]+[.AH27];[.$B$7:.$M$22];[.AE25]) -> 1 | AI28: of:=VLOOKUP([.AE28]+[.AI27];[.$B$7:.$M$22];[.AE25]) -> 0 | AK28: 00 | AL28: of:=HLOOKUP(MID([.AK27];1;1);[.$C$5:.$F$6];2;0)*MID([.AK28];1;1) + HLOOKUP(MID([.AK27];2;1);[.$C$5:.$F$6];2;0)*MID([.AK28];2;1) -> 0 | AM28: of:=VLOOKUP([.AL28]+[.AM27];[.$B$7:.$M$22];[.AL25]) -> 1 | AN28: of:=VLOOKUP([.AL28]+[.AN27];[.$B$7:.$M$22];[.AL25]) -> 0 | AO28: of:=VLOOKUP([.AL28]+[.AO27];[.$B$7:.$M$22];[.AL25]) -> 1 | AP28: of:=VLOOKUP([.AL28]+[.AP27];[.$B$7:.$M$22];[.AL25]) -> 1 | AR28: 00 | AS28: of:=HLOOKUP(MID([.AR27];1;1);[.$C$5:.$F$6];2;0)*MID([.AR28];1;1) + HLOOKUP(MID([.AR27];2;1);[.$C$5:.$F$6];2;0)*MID([.AR28];2;1) -> 0 | AT28: of:=VLOOKUP([.AS28]+[.AT27];[.$B$7:.$M$22];[.AS25]) -> 1 | AU28: of:=VLOOKUP([.AS28]+[.AU27];[.$B$7:.$M$22];[.AS25]) -> 0 | AV28: of:=VLOOKUP([.AS28]+[.AV27];[.$B$7:.$M$22];[.AS25]) -> 0 | AW28: of:=VLOOKUP([.AS28]+[.AW27];[.$B$7:.$M$22];[.AS25]) -> 1 | AY28: 00 | AZ28: of:=HLOOKUP(MID([.AY27];1;1);[.$C$5:.$F$6];2;0)*MID([.AY28];1;1) + HLOOKUP(MID([.AY27];2;1);[.$C$5:.$F$6];2;0)*MID([.AY28];2;1) -> 0 | BA28: of:=VLOOKUP([.AZ28]+[.BA27];[.$B$7:.$M$22];[.AZ25]) -> 1 | BB28: of:=VLOOKUP([.AZ28]+[.BB27];[.$B$7:.$M$22];[.AZ25]) -> 0 | BC28: of:=VLOOKUP([.AZ28]+[.BC27];[.$B$7:.$M$22];[.AZ25]) -> 0 | BD28: of:=VLOOKUP([.AZ28]+[.BD27];[.$B$7:.$M$22];[.AZ25]) -> 0 | BF28: 00 | BG28: of:=HLOOKUP(MID([.BF27];1;1);[.$C$5:.$F$6];2;0)*MID([.BF28];1;1) + HLOOKUP(MID([.BF27];2;1);[.$C$5:.$F$6];2;0)*MID([.BF28];2;1) -> 0 | BH28: of:=VLOOKUP([.BG28]+[.BH27];[.$B$7:.$M$22];[.BG25]) -> 0 | BI28: of:=VLOOKUP([.BG28]+[.BI27];[.$B$7:.$M$22];[.BG25]) -> 0 | BJ28: of:=VLOOKUP([.BG28]+[.BJ27];[.$B$7:.$M$22];[.BG25]) -> 1 | BK28: of:=VLOOKUP([.BG28]+[.BK27];[.$B$7:.$M$22];[.BG25]) -> 1
P29: 01 | Q29: of:=HLOOKUP(MID([.P27];1;1);[.$C$5:.$F$6];2;0)*MID([.P29];1;1) + HLOOKUP(MID([.P27];2;1);[.$C$5:.$F$6];2;0)*MID([.P29];2;1) -> 4 | R29: of:=VLOOKUP([.Q29]+[.R27];[.$B$7:.$M$22];[.Q25]) -> 0 | S29: of:=VLOOKUP([.Q29]+[.S27];[.$B$7:.$M$22];[.Q25]) -> 1 | T29: of:=VLOOKUP([.Q29]+[.T27];[.$B$7:.$M$22];[.Q25]) -> 1 | U29: of:=VLOOKUP([.Q29]+[.U27];[.$B$7:.$M$22];[.Q25]) -> 1 | W29: 01 | X29: of:=HLOOKUP(MID([.W27];1;1);[.$C$5:.$F$6];2;0)*MID([.W29];1;1) + HLOOKUP(MID([.W27];2;1);[.$C$5:.$F$6];2;0)*MID([.W29];2;1) -> 4 | Y29: of:=VLOOKUP([.X29]+[.Y27];[.$B$7:.$M$22];[.X25]) -> 1 | Z29: of:=VLOOKUP([.X29]+[.Z27];[.$B$7:.$M$22];[.X25]) -> 0 | AA29: of:=VLOOKUP([.X29]+[.AA27];[.$B$7:.$M$22];[.X25]) -> 1 | AB29: of:=VLOOKUP([.X29]+[.AB27];[.$B$7:.$M$22];[.X25]) -> 0 | AD29: 01 | AE29: of:=HLOOKUP(MID([.AD27];1;1);[.$C$5:.$F$6];2;0)*MID([.AD29];1;1) + HLOOKUP(MID([.AD27];2;1);[.$C$5:.$F$6];2;0)*MID([.AD29];2;1) -> 4 | AF29: of:=VLOOKUP([.AE29]+[.AF27];[.$B$7:.$M$22];[.AE25]) -> 1 | AG29: of:=VLOOKUP([.AE29]+[.AG27];[.$B$7:.$M$22];[.AE25]) -> 1 | AH29: of:=VLOOKUP([.AE29]+[.AH27];[.$B$7:.$M$22];[.AE25]) -> 1 | AI29: of:=VLOOKUP([.AE29]+[.AI27];[.$B$7:.$M$22];[.AE25]) -> 1 | AK29: 01 | AL29: of:=HLOOKUP(MID([.AK27];1;1);[.$C$5:.$F$6];2;0)*MID([.AK29];1;1) + HLOOKUP(MID([.AK27];2;1);[.$C$5:.$F$6];2;0)*MID([.AK29];2;1) -> 4 | AM29: of:=VLOOKUP([.AL29]+[.AM27];[.$B$7:.$M$22];[.AL25]) -> 0 | AN29: of:=VLOOKUP([.AL29]+[.AN27];[.$B$7:.$M$22];[.AL25]) -> 1 | AO29: of:=VLOOKUP([.AL29]+[.AO27];[.$B$7:.$M$22];[.AL25]) -> 0 | AP29: of:=VLOOKUP([.AL29]+[.AP27];[.$B$7:.$M$22];[.AL25]) -> 1 | AR29: 01 | AS29: of:=HLOOKUP(MID([.AR27];1;1);[.$C$5:.$F$6];2;0)*MID([.AR29];1;1) + HLOOKUP(MID([.AR27];2;1);[.$C$5:.$F$6];2;0)*MID([.AR29];2;1) -> 4 | AT29: of:=VLOOKUP([.AS29]+[.AT27];[.$B$7:.$M$22];[.AS25]) -> 0 | AU29: of:=VLOOKUP([.AS29]+[.AU27];[.$B$7:.$M$22];[.AS25]) -> 0 | AV29: of:=VLOOKUP([.AS29]+[.AV27];[.$B$7:.$M$22];[.AS25]) -> 0 | AW29: of:=VLOOKUP([.AS29]+[.AW27];[.$B$7:.$M$22];[.AS25]) -> 1 | AY29: 01 | AZ29: of:=HLOOKUP(MID([.AY27];1;1);[.$C$5:.$F$6];2;0)*MID([.AY29];1;1) + HLOOKUP(MID([.AY27];2;1);[.$C$5:.$F$6];2;0)*MID([.AY29];2;1) -> 4 | BA29: of:=VLOOKUP([.AZ29]+[.BA27];[.$B$7:.$M$22];[.AZ25]) -> 1 | BB29: of:=VLOOKUP([.AZ29]+[.BB27];[.$B$7:.$M$22];[.AZ25]) -> 1 | BC29: of:=VLOOKUP([.AZ29]+[.BC27];[.$B$7:.$M$22];[.AZ25]) -> 0 | BD29: of:=VLOOKUP([.AZ29]+[.BD27];[.$B$7:.$M$22];[.AZ25]) -> 1 | BF29: 01 | BG29: of:=HLOOKUP(MID([.BF27];1;1);[.$C$5:.$F$6];2;0)*MID([.BF29];1;1) + HLOOKUP(MID([.BF27];2;1);[.$C$5:.$F$6];2;0)*MID([.BF29];2;1) -> 4 | BH29: of:=VLOOKUP([.BG29]+[.BH27];[.$B$7:.$M$22];[.BG25]) -> 1 | BI29: of:=VLOOKUP([.BG29]+[.BI27];[.$B$7:.$M$22];[.BG25]) -> 1 | BJ29: of:=VLOOKUP([.BG29]+[.BJ27];[.$B$7:.$M$22];[.BG25]) -> 0 | BK29: of:=VLOOKUP([.BG29]+[.BK27];[.$B$7:.$M$22];[.BG25]) -> 1
P30: 11 | Q30: of:=HLOOKUP(MID([.P27];1;1);[.$C$5:.$F$6];2;0)*MID([.P30];1;1) + HLOOKUP(MID([.P27];2;1);[.$C$5:.$F$6];2;0)*MID([.P30];2;1) -> 12 | R30: of:=VLOOKUP([.Q30]+[.R27];[.$B$7:.$M$22];[.Q25]) -> 0 | S30: of:=VLOOKUP([.Q30]+[.S27];[.$B$7:.$M$22];[.Q25]) -> 0 | T30: of:=VLOOKUP([.Q30]+[.T27];[.$B$7:.$M$22];[.Q25]) -> 1 | U30: of:=VLOOKUP([.Q30]+[.U27];[.$B$7:.$M$22];[.Q25]) -> 1 | W30: 11 | X30: of:=HLOOKUP(MID([.W27];1;1);[.$C$5:.$F$6];2;0)*MID([.W30];1;1) + HLOOKUP(MID([.W27];2;1);[.$C$5:.$F$6];2;0)*MID([.W30];2;1) -> 12 | Y30: of:=VLOOKUP([.X30]+[.Y27];[.$B$7:.$M$22];[.X25]) -> 0 | Z30: of:=VLOOKUP([.X30]+[.Z27];[.$B$7:.$M$22];[.X25]) -> 1 | AA30: of:=VLOOKUP([.X30]+[.AA27];[.$B$7:.$M$22];[.X25]) -> 0 | AB30: of:=VLOOKUP([.X30]+[.AB27];[.$B$7:.$M$22];[.X25]) -> 0 | AD30: 11 | AE30: of:=HLOOKUP(MID([.AD27];1;1);[.$C$5:.$F$6];2;0)*MID([.AD30];1;1) + HLOOKUP(MID([.AD27];2;1);[.$C$5:.$F$6];2;0)*MID([.AD30];2;1) -> 12 | AF30: of:=VLOOKUP([.AE30]+[.AF27];[.$B$7:.$M$22];[.AE25]) -> 0 | AG30: of:=VLOOKUP([.AE30]+[.AG27];[.$B$7:.$M$22];[.AE25]) -> 1 | AH30: of:=VLOOKUP([.AE30]+[.AH27];[.$B$7:.$M$22];[.AE25]) -> 0 | AI30: of:=VLOOKUP([.AE30]+[.AI27];[.$B$7:.$M$22];[.AE25]) -> 0 | AK30: 11 | AL30: of:=HLOOKUP(MID([.AK27];1;1);[.$C$5:.$F$6];2;0)*MID([.AK30];1;1) + HLOOKUP(MID([.AK27];2;1);[.$C$5:.$F$6];2;0)*MID([.AK30];2;1) -> 12 | AM30: of:=VLOOKUP([.AL30]+[.AM27];[.$B$7:.$M$22];[.AL25]) -> 1 | AN30: of:=VLOOKUP([.AL30]+[.AN27];[.$B$7:.$M$22];[.AL25]) -> 1 | AO30: of:=VLOOKUP([.AL30]+[.AO27];[.$B$7:.$M$22];[.AL25]) -> 0 | AP30: of:=VLOOKUP([.AL30]+[.AP27];[.$B$7:.$M$22];[.AL25]) -> 1 | AR30: 11 | AS30: of:=HLOOKUP(MID([.AR27];1;1);[.$C$5:.$F$6];2;0)*MID([.AR30];1;1) + HLOOKUP(MID([.AR27];2;1);[.$C$5:.$F$6];2;0)*MID([.AR30];2;1) -> 12 | AT30: of:=VLOOKUP([.AS30]+[.AT27];[.$B$7:.$M$22];[.AS25]) -> 1 | AU30: of:=VLOOKUP([.AS30]+[.AU27];[.$B$7:.$M$22];[.AS25]) -> 1 | AV30: of:=VLOOKUP([.AS30]+[.AV27];[.$B$7:.$M$22];[.AS25]) -> 1 | AW30: of:=VLOOKUP([.AS30]+[.AW27];[.$B$7:.$M$22];[.AS25]) -> 1 | AY30: 11 | AZ30: of:=HLOOKUP(MID([.AY27];1;1);[.$C$5:.$F$6];2;0)*MID([.AY30];1;1) + HLOOKUP(MID([.AY27];2;1);[.$C$5:.$F$6];2;0)*MID([.AY30];2;1) -> 12 | BA30: of:=VLOOKUP([.AZ30]+[.BA27];[.$B$7:.$M$22];[.AZ25]) -> 0 | BB30: of:=VLOOKUP([.AZ30]+[.BB27];[.$B$7:.$M$22];[.AZ25]) -> 0 | BC30: of:=VLOOKUP([.AZ30]+[.BC27];[.$B$7:.$M$22];[.AZ25]) -> 1 | BD30: of:=VLOOKUP([.AZ30]+[.BD27];[.$B$7:.$M$22];[.AZ25]) -> 1 | BF30: 11 | BG30: of:=HLOOKUP(MID([.BF27];1;1);[.$C$5:.$F$6];2;0)*MID([.BF30];1;1) + HLOOKUP(MID([.BF27];2;1);[.$C$5:.$F$6];2;0)*MID([.BF30];2;1) -> 12 | BH30: of:=VLOOKUP([.BG30]+[.BH27];[.$B$7:.$M$22];[.BG25]) -> 1 | BI30: of:=VLOOKUP([.BG30]+[.BI27];[.$B$7:.$M$22];[.BG25]) -> 1 | BJ30: of:=VLOOKUP([.BG30]+[.BJ27];[.$B$7:.$M$22];[.BG25]) -> 1 | BK30: of:=VLOOKUP([.BG30]+[.BK27];[.$B$7:.$M$22];[.BG25]) -> 1
P31: 10 | Q31: of:=HLOOKUP(MID([.P27];1;1);[.$C$5:.$F$6];2;0)*MID([.P31];1;1) + HLOOKUP(MID([.P27];2;1);[.$C$5:.$F$6];2;0)*MID([.P31];2;1) -> 8 | R31: of:=VLOOKUP([.Q31]+[.R27];[.$B$7:.$M$22];[.Q25]) -> 1 | S31: of:=VLOOKUP([.Q31]+[.S27];[.$B$7:.$M$22];[.Q25]) -> 1 | T31: of:=VLOOKUP([.Q31]+[.T27];[.$B$7:.$M$22];[.Q25]) -> 0 | U31: of:=VLOOKUP([.Q31]+[.U27];[.$B$7:.$M$22];[.Q25]) -> 1 | W31: 10 | X31: of:=HLOOKUP(MID([.W27];1;1);[.$C$5:.$F$6];2;0)*MID([.W31];1;1) + HLOOKUP(MID([.W27];2;1);[.$C$5:.$F$6];2;0)*MID([.W31];2;1) -> 8 | Y31: of:=VLOOKUP([.X31]+[.Y27];[.$B$7:.$M$22];[.X25]) -> 1 | Z31: of:=VLOOKUP([.X31]+[.Z27];[.$B$7:.$M$22];[.X25]) -> 1 | AA31: of:=VLOOKUP([.X31]+[.AA27];[.$B$7:.$M$22];[.X25]) -> 0 | AB31: of:=VLOOKUP([.X31]+[.AB27];[.$B$7:.$M$22];[.X25]) -> 1 | AD31: 10 | AE31: of:=HLOOKUP(MID([.AD27];1;1);[.$C$5:.$F$6];2;0)*MID([.AD31];1;1) + HLOOKUP(MID([.AD27];2;1);[.$C$5:.$F$6];2;0)*MID([.AD31];2;1) -> 8 | AF31: of:=VLOOKUP([.AE31]+[.AF27];[.$B$7:.$M$22];[.AE25]) -> 1 | AG31: of:=VLOOKUP([.AE31]+[.AG27];[.$B$7:.$M$22];[.AE25]) -> 1 | AH31: of:=VLOOKUP([.AE31]+[.AH27];[.$B$7:.$M$22];[.AE25]) -> 1 | AI31: of:=VLOOKUP([.AE31]+[.AI27];[.$B$7:.$M$22];[.AE25]) -> 1 | AK31: 10 | AL31: of:=HLOOKUP(MID([.AK27];1;1);[.$C$5:.$F$6];2;0)*MID([.AK31];1;1) + HLOOKUP(MID([.AK27];2;1);[.$C$5:.$F$6];2;0)*MID([.AK31];2;1) -> 8 | AM31: of:=VLOOKUP([.AL31]+[.AM27];[.$B$7:.$M$22];[.AL25]) -> 1 | AN31: of:=VLOOKUP([.AL31]+[.AN27];[.$B$7:.$M$22];[.AL25]) -> 1 | AO31: of:=VLOOKUP([.AL31]+[.AO27];[.$B$7:.$M$22];[.AL25]) -> 1 | AP31: of:=VLOOKUP([.AL31]+[.AP27];[.$B$7:.$M$22];[.AL25]) -> 0 | AR31: 10 | AS31: of:=HLOOKUP(MID([.AR27];1;1);[.$C$5:.$F$6];2;0)*MID([.AR31];1;1) + HLOOKUP(MID([.AR27];2;1);[.$C$5:.$F$6];2;0)*MID([.AR31];2;1) -> 8 | AT31: of:=VLOOKUP([.AS31]+[.AT27];[.$B$7:.$M$22];[.AS25]) -> 1 | AU31: of:=VLOOKUP([.AS31]+[.AU27];[.$B$7:.$M$22];[.AS25]) -> 0 | AV31: of:=VLOOKUP([.AS31]+[.AV27];[.$B$7:.$M$22];[.AS25]) -> 1 | AW31: of:=VLOOKUP([.AS31]+[.AW27];[.$B$7:.$M$22];[.AS25]) -> 1 | AY31: 10 | AZ31: of:=HLOOKUP(MID([.AY27];1;1);[.$C$5:.$F$6];2;0)*MID([.AY31];1;1) + HLOOKUP(MID([.AY27];2;1);[.$C$5:.$F$6];2;0)*MID([.AY31];2;1) -> 8 | BA31: of:=VLOOKUP([.AZ31]+[.BA27];[.$B$7:.$M$22];[.AZ25]) -> 1 | BB31: of:=VLOOKUP([.AZ31]+[.BB27];[.$B$7:.$M$22];[.AZ25]) -> 1 | BC31: of:=VLOOKUP([.AZ31]+[.BC27];[.$B$7:.$M$22];[.AZ25]) -> 1 | BD31: of:=VLOOKUP([.AZ31]+[.BD27];[.$B$7:.$M$22];[.AZ25]) -> 1 | BF31: 10 | BG31: of:=HLOOKUP(MID([.BF27];1;1);[.$C$5:.$F$6];2;0)*MID([.BF31];1;1) + HLOOKUP(MID([.BF27];2;1);[.$C$5:.$F$6];2;0)*MID([.BF31];2;1) -> 8 | BH31: of:=VLOOKUP([.BG31]+[.BH27];[.$B$7:.$M$22];[.BG25]) -> 1 | BI31: of:=VLOOKUP([.BG31]+[.BI27];[.$B$7:.$M$22];[.BG25]) -> 1 | BJ31: of:=VLOOKUP([.BG31]+[.BJ27];[.$B$7:.$M$22];[.BG25]) -> 1 | BK31: of:=VLOOKUP([.BG31]+[.BK27];[.$B$7:.$M$22];[.BG25]) -> 1
N32: 1 | O32: F | P32: F = µ -D C -B -A | W32: F = µ -D C -B -A
N33: 2 | O33: G | P33: G = µ D C B -A | AK33: G = µ D C B -A | AY33: G = µ D C B -A
N34: 3 | O34: H | P34: H = µ D -C B A | AK34: H = µ D -C B A | AR34: H = µ D -C B A
N35: 4 | O35: I | P35: I = µ -D -C B | AY35: I = µ -D -C B
N36: 5 | O36: J | W36: J = µ -C -B A
N37: 6 | O37: K | W37: K = µ D -C B -A | AR37: K = µ D -C B -A
N38: 7 | O38: L | W38: L = µ -D -C A | AD38: L = µ -D -C A
N39: 8 | O39: M | W39: M = µ -D -C -B -A | AD39: M = µ -D -C -B -A | AK39: M = µ -D -C -B -A
N40: 9 | O40: N | AD40: N = µ D C -B A | AY40: N = µ D C -B A
N41: 10 | O41: O | AK41: O = µ -D C -B A
N42: 11 | O42: P | AK42: P = µ D -C -B -A | BF42: P = µ D -C -B -A
N43: 12 | O43: Q | AR43: Q = µ D -B -A | AY43: Q = µ D -B -A
N44: 13 | O44: R | AR44: R = µ C B -A
N45: 14 | O45: S | BF45: S = µ D C B
N46: 15 | O46: T
I47: Inv. Inputs | P47: a = µ F G H I | W47: b = µ F J K L M | AD47: c = µ L M N | AK47: d = µ G H M O P | AR47: e = µ H K Q R | AY47: f = µ G I N Q | BF47: g = µ P S | BL47: total
E48: transistors: | I48: 4 | P48: 19 | W48: 19 | AD48: 7 | AK48: 13 | AR48: 10 | AY48: 4 | BF48: 5 | BL48: of:=SUM([.I48:.BK48]) -> 81 | BN48: transistors
E49: gates: | I49: 4 | P49: 5 | W49: 5 | AD49: 2 | AK49: 3 | AR49: 3 | AY49: 1 | BF49: 2 | BL49: of:=SUM([.I49:.BK49]) -> 25 | BN49: gates

Sheet: digits 0-9
B1: 4 bit to 7-segment, digits 0-9
B2: Truth table | P2: 7-segment display as defined by truth table
P3: 0 | V3: of:=[.P3]+1 -> 1 | AB3: of:=[.V3]+1 -> 2 | AH3: of:=[.AB3]+1 -> 3 | AN3: of:=[.AH3]+1 -> 4 | AT3: of:=[.AN3]+1 -> 5 | AZ3: of:=[.AT3]+1 -> 6 | BF3: of:=[.AZ3]+1 -> 7
B4: Inputs | G4: Outputs | P4: of:=MATCH([.P3];[.$B$7:.$B$22];0)+2 -> 3 | V4: of:=MATCH([.V3];[.$B$7:.$B$22];0)+2 -> 4 | AB4: of:=MATCH([.AB3];[.$B$7:.$B$22];0)+2 -> 5 | AH4: of:=MATCH([.AH3];[.$B$7:.$B$22];0)+2 -> 6 | AN4: of:=MATCH([.AN3];[.$B$7:.$B$22];0)+2 -> 7 | AT4: of:=MATCH([.AT3];[.$B$7:.$B$22];0)+2 -> 8 | AZ4: of:=MATCH([.AZ3];[.$B$7:.$B$22];0)+2 -> 9 | BF4: of:=MATCH([.BF3];[.$B$7:.$B$22];0)+2 -> 10
B5: # | C5: D | D5: C | E5: B | F5: A | G5: a | H5: b | I5: c | J5: d | K5: e | L5: f | M5: g | Q5: of:=HLOOKUP([.T5];[.$G$5:.$M$22];[.P4];0) -> 1 | R5: of:=[.T5]&T(ORG.OPENOFFICE.STYLE(IF([.Q5]=1;"seg1";IF([.Q5]=0;"seg0";"segX")))) -> a | T5: a | W5: of:=HLOOKUP([.Z5];[.$G$5:.$M$22];[.V4];0) -> 0 | X5: of:=[.Z5]&T(ORG.OPENOFFICE.STYLE(IF([.W5]=1;"seg1";IF([.W5]=0;"seg0";"segX")))) -> a | Z5: a | AC5: of:=HLOOKUP([.AF5];[.$G$5:.$M$22];[.AB4];0) -> 1 | AD5: of:=[.AF5]&T(ORG.OPENOFFICE.STYLE(IF([.AC5]=1;"seg1";IF([.AC5]=0;"seg0";"segX")))) -> a | AF5: a | AI5: of:=HLOOKUP([.AL5];[.$G$5:.$M$22];[.AH4];0) -> 1 | AJ5: of:=[.AL5]&T(ORG.OPENOFFICE.STYLE(IF([.AI5]=1;"seg1";IF([.AI5]=0;"seg0";"segX")))) -> a | AL5: a | AO5: of:=HLOOKUP([.AR5];[.$G$5:.$M$22];[.AN4];0) -> 0 | AP5: of:=[.AR5]&T(ORG.OPENOFFICE.STYLE(IF([.AO5]=1;"seg1";IF([.AO5]=0;"seg0";"segX")))) -> a | AR5: a | AU5: of:=HLOOKUP([.AX5];[.$G$5:.$M$22];[.AT4];0) -> 1 | AV5: of:=[.AX5]&T(ORG.OPENOFFICE.STYLE(IF([.AU5]=1;"seg1";IF([.AU5]=0;"seg0";"segX")))) -> a | AX5: a | BA5: of:=HLOOKUP([.BD5];[.$G$5:.$M$22];[.AZ4];0) -> 1 | BB5: of:=[.BD5]&T(ORG.OPENOFFICE.STYLE(IF([.BA5]=1;"seg1";IF([.BA5]=0;"seg0";"segX")))) -> a | BD5: a | BG5: of:=HLOOKUP([.BJ5];[.$G$5:.$M$22];[.BF4];0) -> 1 | BH5: of:=[.BJ5]&T(ORG.OPENOFFICE.STYLE(IF([.BG5]=1;"seg1";IF([.BG5]=0;"seg0";"segX")))) -> a | BJ5: a
C6: 8 | D6: 4 | E6: 2 | F6: 1 | P6: of:=HLOOKUP([.R6];[.$G$5:.$M$22];[.P4];0) -> 1 | Q6: of:=[.R6]&T(ORG.OPENOFFICE.STYLE(IF([.P6]=1;"seg1";IF([.P6]=0;"seg0";"segX")))) -> f | R6: f | S6: of:=HLOOKUP([.U6];[.$G$5:.$M$22];[.P4];0) -> 1 | T6: of:=[.U6]&T(ORG.OPENOFFICE.STYLE(IF([.S6]=1;"seg1";IF([.S6]=0;"seg0";"segX")))) -> b | U6: b | V6: of:=HLOOKUP([.X6];[.$G$5:.$M$22];[.V4];0) -> 0 | W6: of:=[.X6]&T(ORG.OPENOFFICE.STYLE(IF([.V6]=1;"seg1";IF([.V6]=0;"seg0";"segX")))) -> f | X6: f | Y6: of:=HLOOKUP([.AA6];[.$G$5:.$M$22];[.V4];0) -> 1 | Z6: of:=[.AA6]&T(ORG.OPENOFFICE.STYLE(IF([.Y6]=1;"seg1";IF([.Y6]=0;"seg0";"segX")))) -> b | AA6: b | AB6: of:=HLOOKUP([.AD6];[.$G$5:.$M$22];[.AB4];0) -> 0 | AC6: of:=[.AD6]&T(ORG.OPENOFFICE.STYLE(IF([.AB6]=1;"seg1";IF([.AB6]=0;"seg0";"segX")))) -> f | AD6: f | AE6: of:=HLOOKUP([.AG6];[.$G$5:.$M$22];[.AB4];0) -> 1 | AF6: of:=[.AG6]&T(ORG.OPENOFFICE.STYLE(IF([.AE6]=1;"seg1";IF([.AE6]=0;"seg0";"segX")))) -> b | AG6: b | AH6: of:=HLOOKUP([.AJ6];[.$G$5:.$M$22];[.AH4];0) -> 0 | AI6: of:=[.AJ6]&T(ORG.OPENOFFICE.STYLE(IF([.AH6]=1;"seg1";IF([.AH6]=0;"seg0";"segX")))) -> f | AJ6: f | AK6: of:=HLOOKUP([.AM6];[.$G$5:.$M$22];[.AH4];0) -> 1 | AL6: of:=[.AM6]&T(ORG.OPENOFFICE.STYLE(IF([.AK6]=1;"seg1";IF([.AK6]=0;"seg0";"segX")))) -> b | AM6: b | AN6: of:=HLOOKUP([.AP6];[.$G$5:.$M$22];[.AN4];0) -> 1 | AO6: of:=[.AP6]&T(ORG.OPENOFFICE.STYLE(IF([.AN6]=1;"seg1";IF([.AN6]=0;"seg0";"segX")))) -> f | AP6: f | AQ6: of:=HLOOKUP([.AS6];[.$G$5:.$M$22];[.AN4];0) -> 1 | AR6: of:=[.AS6]&T(ORG.OPENOFFICE.STYLE(IF([.AQ6]=1;"seg1";IF([.AQ6]=0;"seg0";"segX")))) -> b | AS6: b | AT6: of:=HLOOKUP([.AV6];[.$G$5:.$M$22];[.AT4];0) -> 1 | AU6: of:=[.AV6]&T(ORG.OPENOFFICE.STYLE(IF([.AT6]=1;"seg1";IF([.AT6]=0;"seg0";"segX")))) -> f | AV6: f | AW6: of:=HLOOKUP([.AY6];[.$G$5:.$M$22];[.AT4];0) -> 0 | AX6: of:=[.AY6]&T(ORG.OPENOFFICE.STYLE(IF([.AW6]=1;"seg1";IF([.AW6]=0;"seg0";"segX")))) -> b | AY6: b | AZ6: of:=HLOOKUP([.BB6];[.$G$5:.$M$22];[.AZ4];0) -> 1 | BA6: of:=[.BB6]&T(ORG.OPENOFFICE.STYLE(IF([.AZ6]=1;"seg1";IF([.AZ6]=0;"seg0";"segX")))) -> f | BB6: f | BC6: of:=HLOOKUP([.BE6];[.$G$5:.$M$22];[.AZ4];0) -> 0 | BD6: of:=[.BE6]&T(ORG.OPENOFFICE.STYLE(IF([.BC6]=1;"seg1";IF([.BC6]=0;"seg0";"segX")))) -> b | BE6: b | BF6: of:=HLOOKUP([.BH6];[.$G$5:.$M$22];[.BF4];0) -> 0 | BG6: of:=[.BH6]&T(ORG.OPENOFFICE.STYLE(IF([.BF6]=1;"seg1";IF([.BF6]=0;"seg0";"segX")))) -> f | BH6: f | BI6: of:=HLOOKUP([.BK6];[.$G$5:.$M$22];[.BF4];0) -> 1 | BJ6: of:=[.BK6]&T(ORG.OPENOFFICE.STYLE(IF([.BI6]=1;"seg1";IF([.BI6]=0;"seg0";"segX")))) -> b | BK6: b
B7: 0 | C7: of:=MOD(ROUNDDOWN([.$B7]/[.C$6]);2) -> 0 | D7: of:=MOD(ROUNDDOWN([.$B7]/[.D$6]);2) -> 0 | E7: of:=MOD(ROUNDDOWN([.$B7]/[.E$6]);2) -> 0 | F7: of:=MOD(ROUNDDOWN([.$B7]/[.F$6]);2) -> 0 | G7: 1 | H7: 1 | I7: 1 | J7: 1 | K7: 1 | L7: 1 | M7: 0
B8: of:=[.B7]+1 -> 1 | C8: of:=MOD(ROUNDDOWN([.$B8]/[.C$6]);2) -> 0 | D8: of:=MOD(ROUNDDOWN([.$B8]/[.D$6]);2) -> 0 | E8: of:=MOD(ROUNDDOWN([.$B8]/[.E$6]);2) -> 0 | F8: of:=MOD(ROUNDDOWN([.$B8]/[.F$6]);2) -> 1 | G8: 0 | H8: 1 | I8: 1 | J8: 0 | K8: 0 | L8: 0 | M8: 0 | Q8: of:=HLOOKUP([.T8];[.$G$5:.$M$22];[.P4];0) -> 0 | R8: of:=[.T8]&T(ORG.OPENOFFICE.STYLE(IF([.Q8]=1;"seg1";IF([.Q8]=0;"seg0";"segX")))) -> g | T8: g | W8: of:=HLOOKUP([.Z8];[.$G$5:.$M$22];[.V4];0) -> 0 | X8: of:=[.Z8]&T(ORG.OPENOFFICE.STYLE(IF([.W8]=1;"seg1";IF([.W8]=0;"seg0";"segX")))) -> g | Z8: g | AC8: of:=HLOOKUP([.AF8];[.$G$5:.$M$22];[.AB4];0) -> 1 | AD8: of:=[.AF8]&T(ORG.OPENOFFICE.STYLE(IF([.AC8]=1;"seg1";IF([.AC8]=0;"seg0";"segX")))) -> g | AF8: g | AI8: of:=HLOOKUP([.AL8];[.$G$5:.$M$22];[.AH4];0) -> 1 | AJ8: of:=[.AL8]&T(ORG.OPENOFFICE.STYLE(IF([.AI8]=1;"seg1";IF([.AI8]=0;"seg0";"segX")))) -> g | AL8: g | AO8: of:=HLOOKUP([.AR8];[.$G$5:.$M$22];[.AN4];0) -> 1 | AP8: of:=[.AR8]&T(ORG.OPENOFFICE.STYLE(IF([.AO8]=1;"seg1";IF([.AO8]=0;"seg0";"segX")))) -> g | AR8: g | AU8: of:=HLOOKUP([.AX8];[.$G$5:.$M$22];[.AT4];0) -> 1 | AV8: of:=[.AX8]&T(ORG.OPENOFFICE.STYLE(IF([.AU8]=1;"seg1";IF([.AU8]=0;"seg0";"segX")))) -> g | AX8: g | BA8: of:=HLOOKUP([.BD8];[.$G$5:.$M$22];[.AZ4];0) -> 1 | BB8: of:=[.BD8]&T(ORG.OPENOFFICE.STYLE(IF([.BA8]=1;"seg1";IF([.BA8]=0;"seg0";"segX")))) -> g | BD8: g | BG8: of:=HLOOKUP([.BJ8];[.$G$5:.$M$22];[.BF4];0) -> 0 | BH8: of:=[.BJ8]&T(ORG.OPENOFFICE.STYLE(IF([.BG8]=1;"seg1";IF([.BG8]=0;"seg0";"segX")))) -> g | BJ8: g
B9: of:=[.B8]+1 -> 2 | C9: of:=MOD(ROUNDDOWN([.$B9]/[.C$6]);2) -> 0 | D9: of:=MOD(ROUNDDOWN([.$B9]/[.D$6]);2) -> 0 | E9: of:=MOD(ROUNDDOWN([.$B9]/[.E$6]);2) -> 1 | F9: of:=MOD(ROUNDDOWN([.$B9]/[.F$6]);2) -> 0 | G9: 1 | H9: 1 | I9: 0 | J9: 1 | K9: 1 | L9: 0 | M9: 1 | P9: of:=HLOOKUP([.R9];[.$G$5:.$M$22];[.P4];0) -> 1 | Q9: of:=[.R9]&T(ORG.OPENOFFICE.STYLE(IF([.P9]=1;"seg1";IF([.P9]=0;"seg0";"segX")))) -> e | R9: e | S9: of:=HLOOKUP([.U9];[.$G$5:.$M$22];[.P4];0) -> 1 | T9: of:=[.U9]&T(ORG.OPENOFFICE.STYLE(IF([.S9]=1;"seg1";IF([.S9]=0;"seg0";"segX")))) -> c | U9: c | V9: of:=HLOOKUP([.X9];[.$G$5:.$M$22];[.V4];0) -> 0 | W9: of:=[.X9]&T(ORG.OPENOFFICE.STYLE(IF([.V9]=1;"seg1";IF([.V9]=0;"seg0";"segX")))) -> e | X9: e | Y9: of:=HLOOKUP([.AA9];[.$G$5:.$M$22];[.V4];0) -> 1 | Z9: of:=[.AA9]&T(ORG.OPENOFFICE.STYLE(IF([.Y9]=1;"seg1";IF([.Y9]=0;"seg0";"segX")))) -> c | AA9: c | AB9: of:=HLOOKUP([.AD9];[.$G$5:.$M$22];[.AB4];0) -> 1 | AC9: of:=[.AD9]&T(ORG.OPENOFFICE.STYLE(IF([.AB9]=1;"seg1";IF([.AB9]=0;"seg0";"segX")))) -> e | AD9: e | AE9: of:=HLOOKUP([.AG9];[.$G$5:.$M$22];[.AB4];0) -> 0 | AF9: of:=[.AG9]&T(ORG.OPENOFFICE.STYLE(IF([.AE9]=1;"seg1";IF([.AE9]=0;"seg0";"segX")))) -> c | AG9: c | AH9: of:=HLOOKUP([.AJ9];[.$G$5:.$M$22];[.AH4];0) -> 0 | AI9: of:=[.AJ9]&T(ORG.OPENOFFICE.STYLE(IF([.AH9]=1;"seg1";IF([.AH9]=0;"seg0";"segX")))) -> e | AJ9: e | AK9: of:=HLOOKUP([.AM9];[.$G$5:.$M$22];[.AH4];0) -> 1 | AL9: of:=[.AM9]&T(ORG.OPENOFFICE.STYLE(IF([.AK9]=1;"seg1";IF([.AK9]=0;"seg0";"segX")))) -> c | AM9: c | AN9: of:=HLOOKUP([.AP9];[.$G$5:.$M$22];[.AN4];0) -> 0 | AO9: of:=[.AP9]&T(ORG.OPENOFFICE.STYLE(IF([.AN9]=1;"seg1";IF([.AN9]=0;"seg0";"segX")))) -> e | AP9: e | AQ9: of:=HLOOKUP([.AS9];[.$G$5:.$M$22];[.AN4];0) -> 1 | AR9: of:=[.AS9]&T(ORG.OPENOFFICE.STYLE(IF([.AQ9]=1;"seg1";IF([.AQ9]=0;"seg0";"segX")))) -> c | AS9: c | AT9: of:=HLOOKUP([.AV9];[.$G$5:.$M$22];[.AT4];0) -> 0 | AU9: of:=[.AV9]&T(ORG.OPENOFFICE.STYLE(IF([.AT9]=1;"seg1";IF([.AT9]=0;"seg0";"segX")))) -> e | AV9: e | AW9: of:=HLOOKUP([.AY9];[.$G$5:.$M$22];[.AT4];0) -> 1 | AX9: of:=[.AY9]&T(ORG.OPENOFFICE.STYLE(IF([.AW9]=1;"seg1";IF([.AW9]=0;"seg0";"segX")))) -> c | AY9: c | AZ9: of:=HLOOKUP([.BB9];[.$G$5:.$M$22];[.AZ4];0) -> 1 | BA9: of:=[.BB9]&T(ORG.OPENOFFICE.STYLE(IF([.AZ9]=1;"seg1";IF([.AZ9]=0;"seg0";"segX")))) -> e | BB9: e | BC9: of:=HLOOKUP([.BE9];[.$G$5:.$M$22];[.AZ4];0) -> 1 | BD9: of:=[.BE9]&T(ORG.OPENOFFICE.STYLE(IF([.BC9]=1;"seg1";IF([.BC9]=0;"seg0";"segX")))) -> c | BE9: c | BF9: of:=HLOOKUP([.BH9];[.$G$5:.$M$22];[.BF4];0) -> 0 | BG9: of:=[.BH9]&T(ORG.OPENOFFICE.STYLE(IF([.BF9]=1;"seg1";IF([.BF9]=0;"seg0";"segX")))) -> e | BH9: e | BI9: of:=HLOOKUP([.BK9];[.$G$5:.$M$22];[.BF4];0) -> 1 | BJ9: of:=[.BK9]&T(ORG.OPENOFFICE.STYLE(IF([.BI9]=1;"seg1";IF([.BI9]=0;"seg0";"segX")))) -> c | BK9: c
B10: of:=[.B9]+1 -> 3 | C10: of:=MOD(ROUNDDOWN([.$B10]/[.C$6]);2) -> 0 | D10: of:=MOD(ROUNDDOWN([.$B10]/[.D$6]);2) -> 0 | E10: of:=MOD(ROUNDDOWN([.$B10]/[.E$6]);2) -> 1 | F10: of:=MOD(ROUNDDOWN([.$B10]/[.F$6]);2) -> 1 | G10: 1 | H10: 1 | I10: 1 | J10: 1 | K10: 0 | L10: 0 | M10: 1
B11: of:=[.B10]+1 -> 4 | C11: of:=MOD(ROUNDDOWN([.$B11]/[.C$6]);2) -> 0 | D11: of:=MOD(ROUNDDOWN([.$B11]/[.D$6]);2) -> 1 | E11: of:=MOD(ROUNDDOWN([.$B11]/[.E$6]);2) -> 0 | F11: of:=MOD(ROUNDDOWN([.$B11]/[.F$6]);2) -> 0 | G11: 0 | H11: 1 | I11: 1 | J11: 0 | K11: 0 | L11: 1 | M11: 1 | Q11: of:=HLOOKUP([.T11];[.$G$5:.$M$22];[.P4];0) -> 1 | R11: of:=[.T11]&T(ORG.OPENOFFICE.STYLE(IF([.Q11]=1;"seg1";IF([.Q11]=0;"seg0";"segX")))) -> d | T11: d | W11: of:=HLOOKUP([.Z11];[.$G$5:.$M$22];[.V4];0) -> 0 | X11: of:=[.Z11]&T(ORG.OPENOFFICE.STYLE(IF([.W11]=1;"seg1";IF([.W11]=0;"seg0";"segX")))) -> d | Z11: d | AC11: of:=HLOOKUP([.AF11];[.$G$5:.$M$22];[.AB4];0) -> 1 | AD11: of:=[.AF11]&T(ORG.OPENOFFICE.STYLE(IF([.AC11]=1;"seg1";IF([.AC11]=0;"seg0";"segX")))) -> d | AF11: d | AI11: of:=HLOOKUP([.AL11];[.$G$5:.$M$22];[.AH4];0) -> 1 | AJ11: of:=[.AL11]&T(ORG.OPENOFFICE.STYLE(IF([.AI11]=1;"seg1";IF([.AI11]=0;"seg0";"segX")))) -> d | AL11: d | AO11: of:=HLOOKUP([.AR11];[.$G$5:.$M$22];[.AN4];0) -> 0 | AP11: of:=[.AR11]&T(ORG.OPENOFFICE.STYLE(IF([.AO11]=1;"seg1";IF([.AO11]=0;"seg0";"segX")))) -> d | AR11: d | AU11: of:=HLOOKUP([.AX11];[.$G$5:.$M$22];[.AT4];0) -> 1 | AV11: of:=[.AX11]&T(ORG.OPENOFFICE.STYLE(IF([.AU11]=1;"seg1";IF([.AU11]=0;"seg0";"segX")))) -> d | AX11: d | BA11: of:=HLOOKUP([.BD11];[.$G$5:.$M$22];[.AZ4];0) -> 1 | BB11: of:=[.BD11]&T(ORG.OPENOFFICE.STYLE(IF([.BA11]=1;"seg1";IF([.BA11]=0;"seg0";"segX")))) -> d | BD11: d | BG11: of:=HLOOKUP([.BJ11];[.$G$5:.$M$22];[.BF4];0) -> 0 | BH11: of:=[.BJ11]&T(ORG.OPENOFFICE.STYLE(IF([.BG11]=1;"seg1";IF([.BG11]=0;"seg0";"segX")))) -> d | BJ11: d
B12: of:=[.B11]+1 -> 5 | C12: of:=MOD(ROUNDDOWN([.$B12]/[.C$6]);2) -> 0 | D12: of:=MOD(ROUNDDOWN([.$B12]/[.D$6]);2) -> 1 | E12: of:=MOD(ROUNDDOWN([.$B12]/[.E$6]);2) -> 0 | F12: of:=MOD(ROUNDDOWN([.$B12]/[.F$6]);2) -> 1 | G12: 1 | H12: 0 | I12: 1 | J12: 1 | K12: 0 | L12: 1 | M12: 1
B13: of:=[.B12]+1 -> 6 | C13: of:=MOD(ROUNDDOWN([.$B13]/[.C$6]);2) -> 0 | D13: of:=MOD(ROUNDDOWN([.$B13]/[.D$6]);2) -> 1 | E13: of:=MOD(ROUNDDOWN([.$B13]/[.E$6]);2) -> 1 | F13: of:=MOD(ROUNDDOWN([.$B13]/[.F$6]);2) -> 0 | G13: 1 | H13: 0 | I13: 1 | J13: 1 | K13: 1 | L13: 1 | M13: 1 | P13: of:=[.BF3]+1 -> 8 | V13: of:=[.P13]+1 -> 9 | AB13: of:=[.V13]+1 -> 10 | AH13: of:=[.AB13]+1 -> 11 | AN13: of:=[.AH13]+1 -> 12 | AT13: of:=[.AN13]+1 -> 13 | AZ13: of:=[.AT13]+1 -> 14 | BF13: of:=[.AZ13]+1 -> 15
B14: of:=[.B13]+1 -> 7 | C14: of:=MOD(ROUNDDOWN([.$B14]/[.C$6]);2) -> 0 | D14: of:=MOD(ROUNDDOWN([.$B14]/[.D$6]);2) -> 1 | E14: of:=MOD(ROUNDDOWN([.$B14]/[.E$6]);2) -> 1 | F14: of:=MOD(ROUNDDOWN([.$B14]/[.F$6]);2) -> 1 | G14: 1 | H14: 1 | I14: 1 | J14: 0 | K14: 0 | L14: 0 | M14: 0 | P14: of:=MATCH([.P13];[.$B$7:.$B$22];0)+2 -> 11 | V14: of:=MATCH([.V13];[.$B$7:.$B$22];0)+2 -> 12 | AB14: of:=MATCH([.AB13];[.$B$7:.$B$22];0)+2 -> 13 | AH14: of:=MATCH([.AH13];[.$B$7:.$B$22];0)+2 -> 14 | AN14: of:=MATCH([.AN13];[.$B$7:.$B$22];0)+2 -> 15 | AT14: of:=MATCH([.AT13];[.$B$7:.$B$22];0)+2 -> 16 | AZ14: of:=MATCH([.AZ13];[.$B$7:.$B$22];0)+2 -> 17 | BF14: of:=MATCH([.BF13];[.$B$7:.$B$22];0)+2 -> 18
B15: of:=[.B14]+1 -> 8 | C15: of:=MOD(ROUNDDOWN([.$B15]/[.C$6]);2) -> 1 | D15: of:=MOD(ROUNDDOWN([.$B15]/[.D$6]);2) -> 0 | E15: of:=MOD(ROUNDDOWN([.$B15]/[.E$6]);2) -> 0 | F15: of:=MOD(ROUNDDOWN([.$B15]/[.F$6]);2) -> 0 | G15: 1 | H15: 1 | I15: 1 | J15: 1 | K15: 1 | L15: 1 | M15: 1 | Q15: of:=HLOOKUP([.T15];[.$G$5:.$M$22];[.P14];0) -> 1 | R15: of:=[.T15]&T(ORG.OPENOFFICE.STYLE(IF([.Q15]=1;"seg1";IF([.Q15]=0;"seg0";"segX")))) -> a | T15: a | W15: of:=HLOOKUP([.Z15];[.$G$5:.$M$22];[.V14];0) -> 1 | X15: of:=[.Z15]&T(ORG.OPENOFFICE.STYLE(IF([.W15]=1;"seg1";IF([.W15]=0;"seg0";"segX")))) -> a | Z15: a | AC15: of:=HLOOKUP([.AF15];[.$G$5:.$M$22];[.AB14];0) -> X | AD15: of:=[.AF15]&T(ORG.OPENOFFICE.STYLE(IF([.AC15]=1;"seg1";IF([.AC15]=0;"seg0";"segX")))) -> a | AF15: a | AI15: of:=HLOOKUP([.AL15];[.$G$5:.$M$22];[.AH14];0) -> X | AJ15: of:=[.AL15]&T(ORG.OPENOFFICE.STYLE(IF([.AI15]=1;"seg1";IF([.AI15]=0;"seg0";"segX")))) -> a | AL15: a | AO15: of:=HLOOKUP([.AR15];[.$G$5:.$M$22];[.AN14];0) -> X | AP15: of:=[.AR15]&T(ORG.OPENOFFICE.STYLE(IF([.AO15]=1;"seg1";IF([.AO15]=0;"seg0";"segX")))) -> a | AR15: a | AU15: of:=HLOOKUP([.AX15];[.$G$5:.$M$22];[.AT14];0) -> X | AV15: of:=[.AX15]&T(ORG.OPENOFFICE.STYLE(IF([.AU15]=1;"seg1";IF([.AU15]=0;"seg0";"segX")))) -> a | AX15: a | BA15: of:=HLOOKUP([.BD15];[.$G$5:.$M$22];[.AZ14];0) -> X | BB15: of:=[.BD15]&T(ORG.OPENOFFICE.STYLE(IF([.BA15]=1;"seg1";IF([.BA15]=0;"seg0";"segX")))) -> a | BD15: a | BG15: of:=HLOOKUP([.BJ15];[.$G$5:.$M$22];[.BF14];0) -> X | BH15: of:=[.BJ15]&T(ORG.OPENOFFICE.STYLE(IF([.BG15]=1;"seg1";IF([.BG15]=0;"seg0";"segX")))) -> a | BJ15: a
B16: of:=[.B15]+1 -> 9 | C16: of:=MOD(ROUNDDOWN([.$B16]/[.C$6]);2) -> 1 | D16: of:=MOD(ROUNDDOWN([.$B16]/[.D$6]);2) -> 0 | E16: of:=MOD(ROUNDDOWN([.$B16]/[.E$6]);2) -> 0 | F16: of:=MOD(ROUNDDOWN([.$B16]/[.F$6]);2) -> 1 | G16: 1 | H16: 1 | I16: 1 | J16: 1 | K16: 0 | L16: 1 | M16: 1 | P16: of:=HLOOKUP([.R16];[.$G$5:.$M$22];[.P14];0) -> 1 | Q16: of:=[.R16]&T(ORG.OPENOFFICE.STYLE(IF([.P16]=1;"seg1";IF([.P16]=0;"seg0";"segX")))) -> f | R16: f | S16: of:=HLOOKUP([.U16];[.$G$5:.$M$22];[.P14];0) -> 1 | T16: of:=[.U16]&T(ORG.OPENOFFICE.STYLE(IF([.S16]=1;"seg1";IF([.S16]=0;"seg0";"segX")))) -> b | U16: b | V16: of:=HLOOKUP([.X16];[.$G$5:.$M$22];[.V14];0) -> 1 | W16: of:=[.X16]&T(ORG.OPENOFFICE.STYLE(IF([.V16]=1;"seg1";IF([.V16]=0;"seg0";"segX")))) -> f | X16: f | Y16: of:=HLOOKUP([.AA16];[.$G$5:.$M$22];[.V14];0) -> 1 | Z16: of:=[.AA16]&T(ORG.OPENOFFICE.STYLE(IF([.Y16]=1;"seg1";IF([.Y16]=0;"seg0";"segX")))) -> b | AA16: b | AB16: of:=HLOOKUP([.AD16];[.$G$5:.$M$22];[.AB14];0) -> X | AC16: of:=[.AD16]&T(ORG.OPENOFFICE.STYLE(IF([.AB16]=1;"seg1";IF([.AB16]=0;"seg0";"segX")))) -> f | AD16: f | AE16: of:=HLOOKUP([.AG16];[.$G$5:.$M$22];[.AB14];0) -> X | AF16: of:=[.AG16]&T(ORG.OPENOFFICE.STYLE(IF([.AE16]=1;"seg1";IF([.AE16]=0;"seg0";"segX")))) -> b | AG16: b | AH16: of:=HLOOKUP([.AJ16];[.$G$5:.$M$22];[.AH14];0) -> X | AI16: of:=[.AJ16]&T(ORG.OPENOFFICE.STYLE(IF([.AH16]=1;"seg1";IF([.AH16]=0;"seg0";"segX")))) -> f | AJ16: f | AK16: of:=HLOOKUP([.AM16];[.$G$5:.$M$22];[.AH14];0) -> X | AL16: of:=[.AM16]&T(ORG.OPENOFFICE.STYLE(IF([.AK16]=1;"seg1";IF([.AK16]=0;"seg0";"segX")))) -> b | AM16: b | AN16: of:=HLOOKUP([.AP16];[.$G$5:.$M$22];[.AN14];0) -> X | AO16: of:=[.AP16]&T(ORG.OPENOFFICE.STYLE(IF([.AN16]=1;"seg1";IF([.AN16]=0;"seg0";"segX")))) -> f | AP16: f | AQ16: of:=HLOOKUP([.AS16];[.$G$5:.$M$22];[.AN14];0) -> X | AR16: of:=[.AS16]&T(ORG.OPENOFFICE.STYLE(IF([.AQ16]=1;"seg1";IF([.AQ16]=0;"seg0";"segX")))) -> b | AS16: b | AT16: of:=HLOOKUP([.AV16];[.$G$5:.$M$22];[.AT14];0) -> X | AU16: of:=[.AV16]&T(ORG.OPENOFFICE.STYLE(IF([.AT16]=1;"seg1";IF([.AT16]=0;"seg0";"segX")))) -> f | AV16: f | AW16: of:=HLOOKUP([.AY16];[.$G$5:.$M$22];[.AT14];0) -> X | AX16: of:=[.AY16]&T(ORG.OPENOFFICE.STYLE(IF([.AW16]=1;"seg1";IF([.AW16]=0;"seg0";"segX")))) -> b | AY16: b | AZ16: of:=HLOOKUP([.BB16];[.$G$5:.$M$22];[.AZ14];0) -> X | BA16: of:=[.BB16]&T(ORG.OPENOFFICE.STYLE(IF([.AZ16]=1;"seg1";IF([.AZ16]=0;"seg0";"segX")))) -> f | BB16: f | BC16: of:=HLOOKUP([.BE16];[.$G$5:.$M$22];[.AZ14];0) -> X | BD16: of:=[.BE16]&T(ORG.OPENOFFICE.STYLE(IF([.BC16]=1;"seg1";IF([.BC16]=0;"seg0";"segX")))) -> b | BE16: b | BF16: of:=HLOOKUP([.BH16];[.$G$5:.$M$22];[.BF14];0) -> X | BG16: of:=[.BH16]&T(ORG.OPENOFFICE.STYLE(IF([.BF16]=1;"seg1";IF([.BF16]=0;"seg0";"segX")))) -> f | BH16: f | BI16: of:=HLOOKUP([.BK16];[.$G$5:.$M$22];[.BF14];0) -> X | BJ16: of:=[.BK16]&T(ORG.OPENOFFICE.STYLE(IF([.BI16]=1;"seg1";IF([.BI16]=0;"seg0";"segX")))) -> b | BK16: b
B17: of:=[.B16]+1 -> 10 | C17: of:=MOD(ROUNDDOWN([.$B17]/[.C$6]);2) -> 1 | D17: of:=MOD(ROUNDDOWN([.$B17]/[.D$6]);2) -> 0 | E17: of:=MOD(ROUNDDOWN([.$B17]/[.E$6]);2) -> 1 | F17: of:=MOD(ROUNDDOWN([.$B17]/[.F$6]);2) -> 0 | G17: X | H17: X | I17: X | J17: X | K17: X | L17: X | M17: X
B18: of:=[.B17]+1 -> 11 | C18: of:=MOD(ROUNDDOWN([.$B18]/[.C$6]);2) -> 1 | D18: of:=MOD(ROUNDDOWN([.$B18]/[.D$6]);2) -> 0 | E18: of:=MOD(ROUNDDOWN([.$B18]/[.E$6]);2) -> 1 | F18: of:=MOD(ROUNDDOWN([.$B18]/[.F$6]);2) -> 1 | G18: X | H18: X | I18: X | J18: X | K18: X | L18: X | M18: X | Q18: of:=HLOOKUP([.T18];[.$G$5:.$M$22];[.P14];0) -> 1 | R18: of:=[.T18]&T(ORG.OPENOFFICE.STYLE(IF([.Q18]=1;"seg1";IF([.Q18]=0;"seg0";"segX")))) -> g | T18: g | W18: of:=HLOOKUP([.Z18];[.$G$5:.$M$22];[.V14];0) -> 1 | X18: of:=[.Z18]&T(ORG.OPENOFFICE.STYLE(IF([.W18]=1;"seg1";IF([.W18]=0;"seg0";"segX")))) -> g | Z18: g | AC18: of:=HLOOKUP([.AF18];[.$G$5:.$M$22];[.AB14];0) -> X | AD18: of:=[.AF18]&T(ORG.OPENOFFICE.STYLE(IF([.AC18]=1;"seg1";IF([.AC18]=0;"seg0";"segX")))) -> g | AF18: g | AI18: of:=HLOOKUP([.AL18];[.$G$5:.$M$22];[.AH14];0) -> X | AJ18: of:=[.AL18]&T(ORG.OPENOFFICE.STYLE(IF([.AI18]=1;"seg1";IF([.AI18]=0;"seg0";"segX")))) -> g | AL18: g | AO18: of:=HLOOKUP([.AR18];[.$G$5:.$M$22];[.AN14];0) -> X | AP18: of:=[.AR18]&T(ORG.OPENOFFICE.STYLE(IF([.AO18]=1;"seg1";IF([.AO18]=0;"seg0";"segX")))) -> g | AR18: g | AU18: of:=HLOOKUP([.AX18];[.$G$5:.$M$22];[.AT14];0) -> X | AV18: of:=[.AX18]&T(ORG.OPENOFFICE.STYLE(IF([.AU18]=1;"seg1";IF([.AU18]=0;"seg0";"segX")))) -> g | AX18: g | BA18: of:=HLOOKUP([.BD18];[.$G$5:.$M$22];[.AZ14];0) -> X | BB18: of:=[.BD18]&T(ORG.OPENOFFICE.STYLE(IF([.BA18]=1;"seg1";IF([.BA18]=0;"seg0";"segX")))) -> g | BD18: g | BG18: of:=HLOOKUP([.BJ18];[.$G$5:.$M$22];[.BF14];0) -> X | BH18: of:=[.BJ18]&T(ORG.OPENOFFICE.STYLE(IF([.BG18]=1;"seg1";IF([.BG18]=0;"seg0";"segX")))) -> g | BJ18: g
B19: of:=[.B18]+1 -> 12 | C19: of:=MOD(ROUNDDOWN([.$B19]/[.C$6]);2) -> 1 | D19: of:=MOD(ROUNDDOWN([.$B19]/[.D$6]);2) -> 1 | E19: of:=MOD(ROUNDDOWN([.$B19]/[.E$6]);2) -> 0 | F19: of:=MOD(ROUNDDOWN([.$B19]/[.F$6]);2) -> 0 | G19: X | H19: X | I19: X | J19: X | K19: X | L19: X | M19: X | P19: of:=HLOOKUP([.R19];[.$G$5:.$M$22];[.P14];0) -> 1 | Q19: of:=[.R19]&T(ORG.OPENOFFICE.STYLE(IF([.P19]=1;"seg1";IF([.P19]=0;"seg0";"segX")))) -> e | R19: e | S19: of:=HLOOKUP([.U19];[.$G$5:.$M$22];[.P14];0) -> 1 | T19: of:=[.U19]&T(ORG.OPENOFFICE.STYLE(IF([.S19]=1;"seg1";IF([.S19]=0;"seg0";"segX")))) -> c | U19: c | V19: of:=HLOOKUP([.X19];[.$G$5:.$M$22];[.V14];0) -> 0 | W19: of:=[.X19]&T(ORG.OPENOFFICE.STYLE(IF([.V19]=1;"seg1";IF([.V19]=0;"seg0";"segX")))) -> e | X19: e | Y19: of:=HLOOKUP([.AA19];[.$G$5:.$M$22];[.V14];0) -> 1 | Z19: of:=[.AA19]&T(ORG.OPENOFFICE.STYLE(IF([.Y19]=1;"seg1";IF([.Y19]=0;"seg0";"segX")))) -> c | AA19: c | AB19: of:=HLOOKUP([.AD19];[.$G$5:.$M$22];[.AB14];0) -> X | AC19: of:=[.AD19]&T(ORG.OPENOFFICE.STYLE(IF([.AB19]=1;"seg1";IF([.AB19]=0;"seg0";"segX")))) -> e | AD19: e | AE19: of:=HLOOKUP([.AG19];[.$G$5:.$M$22];[.AB14];0) -> X | AF19: of:=[.AG19]&T(ORG.OPENOFFICE.STYLE(IF([.AE19]=1;"seg1";IF([.AE19]=0;"seg0";"segX")))) -> c | AG19: c | AH19: of:=HLOOKUP([.AJ19];[.$G$5:.$M$22];[.AH14];0) -> X | AI19: of:=[.AJ19]&T(ORG.OPENOFFICE.STYLE(IF([.AH19]=1;"seg1";IF([.AH19]=0;"seg0";"segX")))) -> e | AJ19: e | AK19: of:=HLOOKUP([.AM19];[.$G$5:.$M$22];[.AH14];0) -> X | AL19: of:=[.AM19]&T(ORG.OPENOFFICE.STYLE(IF([.AK19]=1;"seg1";IF([.AK19]=0;"seg0";"segX")))) -> c | AM19: c | AN19: of:=HLOOKUP([.AP19];[.$G$5:.$M$22];[.AN14];0) -> X | AO19: of:=[.AP19]&T(ORG.OPENOFFICE.STYLE(IF([.AN19]=1;"seg1";IF([.AN19]=0;"seg0";"segX")))) -> e | AP19: e | AQ19: of:=HLOOKUP([.AS19];[.$G$5:.$M$22];[.AN14];0) -> X | AR19: of:=[.AS19]&T(ORG.OPENOFFICE.STYLE(IF([.AQ19]=1;"seg1";IF([.AQ19]=0;"seg0";"segX")))) -> c | AS19: c | AT19: of:=HLOOKUP([.AV19];[.$G$5:.$M$22];[.AT14];0) -> X | AU19: of:=[.AV19]&T(ORG.OPENOFFICE.STYLE(IF([.AT19]=1;"seg1";IF([.AT19]=0;"seg0";"segX")))) -> e | AV19: e | AW19: of:=HLOOKUP([.AY19];[.$G$5:.$M$22];[.AT14];0) -> X | AX19: of:=[.AY19]&T(ORG.OPENOFFICE.STYLE(IF([.AW19]=1;"seg1";IF([.AW19]=0;"seg0";"segX")))) -> c | AY19: c | AZ19: of:=HLOOKUP([.BB19];[.$G$5:.$M$22];[.AZ14];0) -> X | BA19: of:=[.BB19]&T(ORG.OPENOFFICE.STYLE(IF([.AZ19]=1;"seg1";IF([.AZ19]=0;"seg0";"segX")))) -> e | BB19: e | BC19: of:=HLOOKUP([.BE19];[.$G$5:.$M$22];[.AZ14];0) -> X | BD19: of:=[.BE19]&T(ORG.OPENOFFICE.STYLE(IF([.BC19]=1;"seg1";IF([.BC19]=0;"seg0";"segX")))) -> c | BE19: c | BF19: of:=HLOOKUP([.BH19];[.$G$5:.$M$22];[.BF14];0) -> X | BG19: of:=[.BH19]&T(ORG.OPENOFFICE.STYLE(IF([.BF19]=1;"seg1";IF([.BF19]=0;"seg0";"segX")))) -> e | BH19: e | BI19: of:=HLOOKUP([.BK19];[.$G$5:.$M$22];[.BF14];0) -> X | BJ19: of:=[.BK19]&T(ORG.OPENOFFICE.STYLE(IF([.BI19]=1;"seg1";IF([.BI19]=0;"seg0";"segX")))) -> c | BK19: c
B20: of:=[.B19]+1 -> 13 | C20: of:=MOD(ROUNDDOWN([.$B20]/[.C$6]);2) -> 1 | D20: of:=MOD(ROUNDDOWN([.$B20]/[.D$6]);2) -> 1 | E20: of:=MOD(ROUNDDOWN([.$B20]/[.E$6]);2) -> 0 | F20: of:=MOD(ROUNDDOWN([.$B20]/[.F$6]);2) -> 1 | G20: X | H20: X | I20: X | J20: X | K20: X | L20: X | M20: X
B21: of:=[.B20]+1 -> 14 | C21: of:=MOD(ROUNDDOWN([.$B21]/[.C$6]);2) -> 1 | D21: of:=MOD(ROUNDDOWN([.$B21]/[.D$6]);2) -> 1 | E21: of:=MOD(ROUNDDOWN([.$B21]/[.E$6]);2) -> 1 | F21: of:=MOD(ROUNDDOWN([.$B21]/[.F$6]);2) -> 0 | G21: X | H21: X | I21: X | J21: X | K21: X | L21: X | M21: X | Q21: of:=HLOOKUP([.T21];[.$G$5:.$M$22];[.P14];0) -> 1 | R21: of:=[.T21]&T(ORG.OPENOFFICE.STYLE(IF([.Q21]=1;"seg1";IF([.Q21]=0;"seg0";"segX")))) -> d | T21: d | W21: of:=HLOOKUP([.Z21];[.$G$5:.$M$22];[.V14];0) -> 1 | X21: of:=[.Z21]&T(ORG.OPENOFFICE.STYLE(IF([.W21]=1;"seg1";IF([.W21]=0;"seg0";"segX")))) -> d | Z21: d | AC21: of:=HLOOKUP([.AF21];[.$G$5:.$M$22];[.AB14];0) -> X | AD21: of:=[.AF21]&T(ORG.OPENOFFICE.STYLE(IF([.AC21]=1;"seg1";IF([.AC21]=0;"seg0";"segX")))) -> d | AF21: d | AI21: of:=HLOOKUP([.AL21];[.$G$5:.$M$22];[.AH14];0) -> X | AJ21: of:=[.AL21]&T(ORG.OPENOFFICE.STYLE(IF([.AI21]=1;"seg1";IF([.AI21]=0;"seg0";"segX")))) -> d | AL21: d | AO21: of:=HLOOKUP([.AR21];[.$G$5:.$M$22];[.AN14];0) -> X | AP21: of:=[.AR21]&T(ORG.OPENOFFICE.STYLE(IF([.AO21]=1;"seg1";IF([.AO21]=0;"seg0";"segX")))) -> d | AR21: d | AU21: of:=HLOOKUP([.AX21];[.$G$5:.$M$22];[.AT14];0) -> X | AV21: of:=[.AX21]&T(ORG.OPENOFFICE.STYLE(IF([.AU21]=1;"seg1";IF([.AU21]=0;"seg0";"segX")))) -> d | AX21: d | BA21: of:=HLOOKUP([.BD21];[.$G$5:.$M$22];[.AZ14];0) -> X | BB21: of:=[.BD21]&T(ORG.OPENOFFICE.STYLE(IF([.BA21]=1;"seg1";IF([.BA21]=0;"seg0";"segX")))) -> d | BD21: d | BG21: of:=HLOOKUP([.BJ21];[.$G$5:.$M$22];[.BF14];0) -> X | BH21: of:=[.BJ21]&T(ORG.OPENOFFICE.STYLE(IF([.BG21]=1;"seg1";IF([.BG21]=0;"seg0";"segX")))) -> d | BJ21: d
B22: of:=[.B21]+1 -> 15 | C22: of:=MOD(ROUNDDOWN([.$B22]/[.C$6]);2) -> 1 | D22: of:=MOD(ROUNDDOWN([.$B22]/[.D$6]);2) -> 1 | E22: of:=MOD(ROUNDDOWN([.$B22]/[.E$6]);2) -> 1 | F22: of:=MOD(ROUNDDOWN([.$B22]/[.F$6]);2) -> 1 | G22: X | H22: X | I22: X | J22: X | K22: X | L22: X | M22: X
P24: Karnaugh-maps
P25: a | Q25: of:=MATCH([.P25];[.$G$5:.$M$5])+5 -> 6 | R25: BA | W25: b | X25: of:=MATCH([.W25];[.$G$5:.$M$5])+5 -> 7 | Y25: BA | AD25: c | AE25: of:=MATCH([.AD25];[.$G$5:.$M$5])+5 -> 8 | AF25: BA | AK25: d | AL25: of:=MATCH([.AK25];[.$G$5:.$M$5])+5 -> 9 | AM25: BA | AR25: e | AS25: of:=MATCH([.AR25];[.$G$5:.$M$5])+5 -> 10 | AT25: BA | AY25: f | AZ25: of:=MATCH([.AY25];[.$G$5:.$M$5])+5 -> 11 | BA25: BA | BF25: g | BG25: of:=MATCH([.BF25];[.$G$5:.$M$5])+5 -> 12 | BH25: BA
R26: 00 | S26: 01 | T26: 11 | U26: 10 | Y26: 00 | Z26: 01 | AA26: 11 | AB26: 10 | AF26: 00 | AG26: 01 | AH26: 11 | AI26: 10 | AM26: 00 | AN26: 01 | AO26: 11 | AP26: 10 | AT26: 00 | AU26: 01 | AV26: 11 | AW26: 10 | BA26: 00 | BB26: 01 | BC26: 11 | BD26: 10 | BH26: 00 | BI26: 01 | BJ26: 11 | BK26: 10
P27: DC | R27: of:=HLOOKUP(MID([.R25];1;1);[.$C$5:.$F$6];2;0)*MID([.R26];1;1) + HLOOKUP(MID([.R25];2;1);[.$C$5:.$F$6];2;0)*MID([.R26];2;1) -> 0 | S27: of:=HLOOKUP(MID([.R25];1;1);[.$C$5:.$F$6];2;0)*MID([.S26];1;1) + HLOOKUP(MID([.R25];2;1);[.$C$5:.$F$6];2;0)*MID([.S26];2;1) -> 1 | T27: of:=HLOOKUP(MID([.R25];1;1);[.$C$5:.$F$6];2;0)*MID([.T26];1;1) + HLOOKUP(MID([.R25];2;1);[.$C$5:.$F$6];2;0)*MID([.T26];2;1) -> 3 | U27: of:=HLOOKUP(MID([.R25];1;1);[.$C$5:.$F$6];2;0)*MID([.U26];1;1) + HLOOKUP(MID([.R25];2;1);[.$C$5:.$F$6];2;0)*MID([.U26];2;1) -> 2 | W27: DC | Y27: of:=HLOOKUP(MID([.Y25];1;1);[.$C$5:.$F$6];2;0)*MID([.Y26];1;1) + HLOOKUP(MID([.Y25];2;1);[.$C$5:.$F$6];2;0)*MID([.Y26];2;1) -> 0 | Z27: of:=HLOOKUP(MID([.Y25];1;1);[.$C$5:.$F$6];2;0)*MID([.Z26];1;1) + HLOOKUP(MID([.Y25];2;1);[.$C$5:.$F$6];2;0)*MID([.Z26];2;1) -> 1 | AA27: of:=HLOOKUP(MID([.Y25];1;1);[.$C$5:.$F$6];2;0)*MID([.AA26];1;1) + HLOOKUP(MID([.Y25];2;1);[.$C$5:.$F$6];2;0)*MID([.AA26];2;1) -> 3 | AB27: of:=HLOOKUP(MID([.Y25];1;1);[.$C$5:.$F$6];2;0)*MID([.AB26];1;1) + HLOOKUP(MID([.Y25];2;1);[.$C$5:.$F$6];2;0)*MID([.AB26];2;1) -> 2 | AD27: DC | AF27: of:=HLOOKUP(MID([.AF25];1;1);[.$C$5:.$F$6];2;0)*MID([.AF26];1;1) + HLOOKUP(MID([.AF25];2;1);[.$C$5:.$F$6];2;0)*MID([.AF26];2;1) -> 0 | AG27: of:=HLOOKUP(MID([.AF25];1;1);[.$C$5:.$F$6];2;0)*MID([.AG26];1;1) + HLOOKUP(MID([.AF25];2;1);[.$C$5:.$F$6];2;0)*MID([.AG26];2;1) -> 1 | AH27: of:=HLOOKUP(MID([.AF25];1;1);[.$C$5:.$F$6];2;0)*MID([.AH26];1;1) + HLOOKUP(MID([.AF25];2;1);[.$C$5:.$F$6];2;0)*MID([.AH26];2;1) -> 3 | AI27: of:=HLOOKUP(MID([.AF25];1;1);[.$C$5:.$F$6];2;0)*MID([.AI26];1;1) + HLOOKUP(MID([.AF25];2;1);[.$C$5:.$F$6];2;0)*MID([.AI26];2;1) -> 2 | AK27: DC | AM27: of:=HLOOKUP(MID([.AM25];1;1);[.$C$5:.$F$6];2;0)*MID([.AM26];1;1) + HLOOKUP(MID([.AM25];2;1);[.$C$5:.$F$6];2;0)*MID([.AM26];2;1) -> 0 | AN27: of:=HLOOKUP(MID([.AM25];1;1);[.$C$5:.$F$6];2;0)*MID([.AN26];1;1) + HLOOKUP(MID([.AM25];2;1);[.$C$5:.$F$6];2;0)*MID([.AN26];2;1) -> 1 | AO27: of:=HLOOKUP(MID([.AM25];1;1);[.$C$5:.$F$6];2;0)*MID([.AO26];1;1) + HLOOKUP(MID([.AM25];2;1);[.$C$5:.$F$6];2;0)*MID([.AO26];2;1) -> 3 | AP27: of:=HLOOKUP(MID([.AM25];1;1);[.$C$5:.$F$6];2;0)*MID([.AP26];1;1) + HLOOKUP(MID([.AM25];2;1);[.$C$5:.$F$6];2;0)*MID([.AP26];2;1) -> 2 | AR27: DC | AT27: of:=HLOOKUP(MID([.AT25];1;1);[.$C$5:.$F$6];2;0)*MID([.AT26];1;1) + HLOOKUP(MID([.AT25];2;1);[.$C$5:.$F$6];2;0)*MID([.AT26];2;1) -> 0 | AU27: of:=HLOOKUP(MID([.AT25];1;1);[.$C$5:.$F$6];2;0)*MID([.AU26];1;1) + HLOOKUP(MID([.AT25];2;1);[.$C$5:.$F$6];2;0)*MID([.AU26];2;1) -> 1 | AV27: of:=HLOOKUP(MID([.AT25];1;1);[.$C$5:.$F$6];2;0)*MID([.AV26];1;1) + HLOOKUP(MID([.AT25];2;1);[.$C$5:.$F$6];2;0)*MID([.AV26];2;1) -> 3 | AW27: of:=HLOOKUP(MID([.AT25];1;1);[.$C$5:.$F$6];2;0)*MID([.AW26];1;1) + HLOOKUP(MID([.AT25];2;1);[.$C$5:.$F$6];2;0)*MID([.AW26];2;1) -> 2 | AY27: DC | BA27: of:=HLOOKUP(MID([.BA25];1;1);[.$C$5:.$F$6];2;0)*MID([.BA26];1;1) + HLOOKUP(MID([.BA25];2;1);[.$C$5:.$F$6];2;0)*MID([.BA26];2;1) -> 0 | BB27: of:=HLOOKUP(MID([.BA25];1;1);[.$C$5:.$F$6];2;0)*MID([.BB26];1;1) + HLOOKUP(MID([.BA25];2;1);[.$C$5:.$F$6];2;0)*MID([.BB26];2;1) -> 1 | BC27: of:=HLOOKUP(MID([.BA25];1;1);[.$C$5:.$F$6];2;0)*MID([.BC26];1;1) + HLOOKUP(MID([.BA25];2;1);[.$C$5:.$F$6];2;0)*MID([.BC26];2;1) -> 3 | BD27: of:=HLOOKUP(MID([.BA25];1;1);[.$C$5:.$F$6];2;0)*MID([.BD26];1;1) + HLOOKUP(MID([.BA25];2;1);[.$C$5:.$F$6];2;0)*MID([.BD26];2;1) -> 2 | BF27: DC | BH27: of:=HLOOKUP(MID([.BH25];1;1);[.$C$5:.$F$6];2;0)*MID([.BH26];1;1) + HLOOKUP(MID([.BH25];2;1);[.$C$5:.$F$6];2;0)*MID([.BH26];2;1) -> 0 | BI27: of:=HLOOKUP(MID([.BH25];1;1);[.$C$5:.$F$6];2;0)*MID([.BI26];1;1) + HLOOKUP(MID([.BH25];2;1);[.$C$5:.$F$6];2;0)*MID([.BI26];2;1) -> 1 | BJ27: of:=HLOOKUP(MID([.BH25];1;1);[.$C$5:.$F$6];2;0)*MID([.BJ26];1;1) + HLOOKUP(MID([.BH25];2;1);[.$C$5:.$F$6];2;0)*MID([.BJ26];2;1) -> 3 | BK27: of:=HLOOKUP(MID([.BH25];1;1);[.$C$5:.$F$6];2;0)*MID([.BK26];1;1) + HLOOKUP(MID([.BH25];2;1);[.$C$5:.$F$6];2;0)*MID([.BK26];2;1) -> 2
P28: 00 | Q28: of:=HLOOKUP(MID([.P27];1;1);[.$C$5:.$F$6];2;0)*MID([.P28];1;1) + HLOOKUP(MID([.P27];2;1);[.$C$5:.$F$6];2;0)*MID([.P28];2;1) -> 0 | R28: of:=VLOOKUP([.Q28]+[.R27];[.$B$7:.$M$22];[.Q25]) -> 1 | S28: of:=VLOOKUP([.Q28]+[.S27];[.$B$7:.$M$22];[.Q25]) -> 0 | T28: of:=VLOOKUP([.Q28]+[.T27];[.$B$7:.$M$22];[.Q25]) -> 1 | U28: of:=VLOOKUP([.Q28]+[.U27];[.$B$7:.$M$22];[.Q25]) -> 1 | W28: 00 | X28: of:=HLOOKUP(MID([.W27];1;1);[.$C$5:.$F$6];2;0)*MID([.W28];1;1) + HLOOKUP(MID([.W27];2;1);[.$C$5:.$F$6];2;0)*MID([.W28];2;1) -> 0 | Y28: of:=VLOOKUP([.X28]+[.Y27];[.$B$7:.$M$22];[.X25]) -> 1 | Z28: of:=VLOOKUP([.X28]+[.Z27];[.$B$7:.$M$22];[.X25]) -> 1 | AA28: of:=VLOOKUP([.X28]+[.AA27];[.$B$7:.$M$22];[.X25]) -> 1 | AB28: of:=VLOOKUP([.X28]+[.AB27];[.$B$7:.$M$22];[.X25]) -> 1 | AD28: 00 | AE28: of:=HLOOKUP(MID([.AD27];1;1);[.$C$5:.$F$6];2;0)*MID([.AD28];1;1) + HLOOKUP(MID([.AD27];2;1);[.$C$5:.$F$6];2;0)*MID([.AD28];2;1) -> 0 | AF28: of:=VLOOKUP([.AE28]+[.AF27];[.$B$7:.$M$22];[.AE25]) -> 1 | AG28: of:=VLOOKUP([.AE28]+[.AG27];[.$B$7:.$M$22];[.AE25]) -> 1 | AH28: of:=VLOOKUP([.AE28]+[.AH27];[.$B$7:.$M$22];[.AE25]) -> 1 | AI28: of:=VLOOKUP([.AE28]+[.AI27];[.$B$7:.$M$22];[.AE25]) -> 0 | AK28: 00 | AL28: of:=HLOOKUP(MID([.AK27];1;1);[.$C$5:.$F$6];2;0)*MID([.AK28];1;1) + HLOOKUP(MID([.AK27];2;1);[.$C$5:.$F$6];2;0)*MID([.AK28];2;1) -> 0 | AM28: of:=VLOOKUP([.AL28]+[.AM27];[.$B$7:.$M$22];[.AL25]) -> 1 | AN28: of:=VLOOKUP([.AL28]+[.AN27];[.$B$7:.$M$22];[.AL25]) -> 0 | AO28: of:=VLOOKUP([.AL28]+[.AO27];[.$B$7:.$M$22];[.AL25]) -> 1 | AP28: of:=VLOOKUP([.AL28]+[.AP27];[.$B$7:.$M$22];[.AL25]) -> 1 | AR28: 00 | AS28: of:=HLOOKUP(MID([.AR27];1;1);[.$C$5:.$F$6];2;0)*MID([.AR28];1;1) + HLOOKUP(MID([.AR27];2;1);[.$C$5:.$F$6];2;0)*MID([.AR28];2;1) -> 0 | AT28: of:=VLOOKUP([.AS28]+[.AT27];[.$B$7:.$M$22];[.AS25]) -> 1 | AU28: of:=VLOOKUP([.AS28]+[.AU27];[.$B$7:.$M$22];[.AS25]) -> 0 | AV28: of:=VLOOKUP([.AS28]+[.AV27];[.$B$7:.$M$22];[.AS25]) -> 0 | AW28: of:=VLOOKUP([.AS28]+[.AW27];[.$B$7:.$M$22];[.AS25]) -> 1 | AY28: 00 | AZ28: of:=HLOOKUP(MID([.AY27];1;1);[.$C$5:.$F$6];2;0)*MID([.AY28];1;1) + HLOOKUP(MID([.AY27];2;1);[.$C$5:.$F$6];2;0)*MID([.AY28];2;1) -> 0 | BA28: of:=VLOOKUP([.AZ28]+[.BA27];[.$B$7:.$M$22];[.AZ25]) -> 1 | BB28: of:=VLOOKUP([.AZ28]+[.BB27];[.$B$7:.$M$22];[.AZ25]) -> 0 | BC28: of:=VLOOKUP([.AZ28]+[.BC27];[.$B$7:.$M$22];[.AZ25]) -> 0 | BD28: of:=VLOOKUP([.AZ28]+[.BD27];[.$B$7:.$M$22];[.AZ25]) -> 0 | BF28: 00 | BG28: of:=HLOOKUP(MID([.BF27];1;1);[.$C$5:.$F$6];2;0)*MID([.BF28];1;1) + HLOOKUP(MID([.BF27];2;1);[.$C$5:.$F$6];2;0)*MID([.BF28];2;1) -> 0 | BH28: of:=VLOOKUP([.BG28]+[.BH27];[.$B$7:.$M$22];[.BG25]) -> 0 | BI28: of:=VLOOKUP([.BG28]+[.BI27];[.$B$7:.$M$22];[.BG25]) -> 0 | BJ28: of:=VLOOKUP([.BG28]+[.BJ27];[.$B$7:.$M$22];[.BG25]) -> 1 | BK28: of:=VLOOKUP([.BG28]+[.BK27];[.$B$7:.$M$22];[.BG25]) -> 1
P29: 01 | Q29: of:=HLOOKUP(MID([.P27];1;1);[.$C$5:.$F$6];2;0)*MID([.P29];1;1) + HLOOKUP(MID([.P27];2;1);[.$C$5:.$F$6];2;0)*MID([.P29];2;1) -> 4 | R29: of:=VLOOKUP([.Q29]+[.R27];[.$B$7:.$M$22];[.Q25]) -> 0 | S29: of:=VLOOKUP([.Q29]+[.S27];[.$B$7:.$M$22];[.Q25]) -> 1 | T29: of:=VLOOKUP([.Q29]+[.T27];[.$B$7:.$M$22];[.Q25]) -> 1 | U29: of:=VLOOKUP([.Q29]+[.U27];[.$B$7:.$M$22];[.Q25]) -> 1 | W29: 01 | X29: of:=HLOOKUP(MID([.W27];1;1);[.$C$5:.$F$6];2;0)*MID([.W29];1;1) + HLOOKUP(MID([.W27];2;1);[.$C$5:.$F$6];2;0)*MID([.W29];2;1) -> 4 | Y29: of:=VLOOKUP([.X29]+[.Y27];[.$B$7:.$M$22];[.X25]) -> 1 | Z29: of:=VLOOKUP([.X29]+[.Z27];[.$B$7:.$M$22];[.X25]) -> 0 | AA29: of:=VLOOKUP([.X29]+[.AA27];[.$B$7:.$M$22];[.X25]) -> 1 | AB29: of:=VLOOKUP([.X29]+[.AB27];[.$B$7:.$M$22];[.X25]) -> 0 | AD29: 01 | AE29: of:=HLOOKUP(MID([.AD27];1;1);[.$C$5:.$F$6];2;0)*MID([.AD29];1;1) + HLOOKUP(MID([.AD27];2;1);[.$C$5:.$F$6];2;0)*MID([.AD29];2;1) -> 4 | AF29: of:=VLOOKUP([.AE29]+[.AF27];[.$B$7:.$M$22];[.AE25]) -> 1 | AG29: of:=VLOOKUP([.AE29]+[.AG27];[.$B$7:.$M$22];[.AE25]) -> 1 | AH29: of:=VLOOKUP([.AE29]+[.AH27];[.$B$7:.$M$22];[.AE25]) -> 1 | AI29: of:=VLOOKUP([.AE29]+[.AI27];[.$B$7:.$M$22];[.AE25]) -> 1 | AK29: 01 | AL29: of:=HLOOKUP(MID([.AK27];1;1);[.$C$5:.$F$6];2;0)*MID([.AK29];1;1) + HLOOKUP(MID([.AK27];2;1);[.$C$5:.$F$6];2;0)*MID([.AK29];2;1) -> 4 | AM29: of:=VLOOKUP([.AL29]+[.AM27];[.$B$7:.$M$22];[.AL25]) -> 0 | AN29: of:=VLOOKUP([.AL29]+[.AN27];[.$B$7:.$M$22];[.AL25]) -> 1 | AO29: of:=VLOOKUP([.AL29]+[.AO27];[.$B$7:.$M$22];[.AL25]) -> 0 | AP29: of:=VLOOKUP([.AL29]+[.AP27];[.$B$7:.$M$22];[.AL25]) -> 1 | AR29: 01 | AS29: of:=HLOOKUP(MID([.AR27];1;1);[.$C$5:.$F$6];2;0)*MID([.AR29];1;1) + HLOOKUP(MID([.AR27];2;1);[.$C$5:.$F$6];2;0)*MID([.AR29];2;1) -> 4 | AT29: of:=VLOOKUP([.AS29]+[.AT27];[.$B$7:.$M$22];[.AS25]) -> 0 | AU29: of:=VLOOKUP([.AS29]+[.AU27];[.$B$7:.$M$22];[.AS25]) -> 0 | AV29: of:=VLOOKUP([.AS29]+[.AV27];[.$B$7:.$M$22];[.AS25]) -> 0 | AW29: of:=VLOOKUP([.AS29]+[.AW27];[.$B$7:.$M$22];[.AS25]) -> 1 | AY29: 01 | AZ29: of:=HLOOKUP(MID([.AY27];1;1);[.$C$5:.$F$6];2;0)*MID([.AY29];1;1) + HLOOKUP(MID([.AY27];2;1);[.$C$5:.$F$6];2;0)*MID([.AY29];2;1) -> 4 | BA29: of:=VLOOKUP([.AZ29]+[.BA27];[.$B$7:.$M$22];[.AZ25]) -> 1 | BB29: of:=VLOOKUP([.AZ29]+[.BB27];[.$B$7:.$M$22];[.AZ25]) -> 1 | BC29: of:=VLOOKUP([.AZ29]+[.BC27];[.$B$7:.$M$22];[.AZ25]) -> 0 | BD29: of:=VLOOKUP([.AZ29]+[.BD27];[.$B$7:.$M$22];[.AZ25]) -> 1 | BF29: 01 | BG29: of:=HLOOKUP(MID([.BF27];1;1);[.$C$5:.$F$6];2;0)*MID([.BF29];1;1) + HLOOKUP(MID([.BF27];2;1);[.$C$5:.$F$6];2;0)*MID([.BF29];2;1) -> 4 | BH29: of:=VLOOKUP([.BG29]+[.BH27];[.$B$7:.$M$22];[.BG25]) -> 1 | BI29: of:=VLOOKUP([.BG29]+[.BI27];[.$B$7:.$M$22];[.BG25]) -> 1 | BJ29: of:=VLOOKUP([.BG29]+[.BJ27];[.$B$7:.$M$22];[.BG25]) -> 0 | BK29: of:=VLOOKUP([.BG29]+[.BK27];[.$B$7:.$M$22];[.BG25]) -> 1
P30: 11 | Q30: of:=HLOOKUP(MID([.P27];1;1);[.$C$5:.$F$6];2;0)*MID([.P30];1;1) + HLOOKUP(MID([.P27];2;1);[.$C$5:.$F$6];2;0)*MID([.P30];2;1) -> 12 | R30: of:=VLOOKUP([.Q30]+[.R27];[.$B$7:.$M$22];[.Q25]) -> X | S30: of:=VLOOKUP([.Q30]+[.S27];[.$B$7:.$M$22];[.Q25]) -> X | T30: of:=VLOOKUP([.Q30]+[.T27];[.$B$7:.$M$22];[.Q25]) -> X | U30: of:=VLOOKUP([.Q30]+[.U27];[.$B$7:.$M$22];[.Q25]) -> X | W30: 11 | X30: of:=HLOOKUP(MID([.W27];1;1);[.$C$5:.$F$6];2;0)*MID([.W30];1;1) + HLOOKUP(MID([.W27];2;1);[.$C$5:.$F$6];2;0)*MID([.W30];2;1) -> 12 | Y30: of:=VLOOKUP([.X30]+[.Y27];[.$B$7:.$M$22];[.X25]) -> X | Z30: of:=VLOOKUP([.X30]+[.Z27];[.$B$7:.$M$22];[.X25]) -> X | AA30: of:=VLOOKUP([.X30]+[.AA27];[.$B$7:.$M$22];[.X25]) -> X | AB30: of:=VLOOKUP([.X30]+[.AB27];[.$B$7:.$M$22];[.X25]) -> X | AD30: 11 | AE30: of:=HLOOKUP(MID([.AD27];1;1);[.$C$5:.$F$6];2;0)*MID([.AD30];1;1) + HLOOKUP(MID([.AD27];2;1);[.$C$5:.$F$6];2;0)*MID([.AD30];2;1) -> 12 | AF30: of:=VLOOKUP([.AE30]+[.AF27];[.$B$7:.$M$22];[.AE25]) -> X | AG30: of:=VLOOKUP([.AE30]+[.AG27];[.$B$7:.$M$22];[.AE25]) -> X | AH30: of:=VLOOKUP([.AE30]+[.AH27];[.$B$7:.$M$22];[.AE25]) -> X | AI30: of:=VLOOKUP([.AE30]+[.AI27];[.$B$7:.$M$22];[.AE25]) -> X | AK30: 11 | AL30: of:=HLOOKUP(MID([.AK27];1;1);[.$C$5:.$F$6];2;0)*MID([.AK30];1;1) + HLOOKUP(MID([.AK27];2;1);[.$C$5:.$F$6];2;0)*MID([.AK30];2;1) -> 12 | AM30: of:=VLOOKUP([.AL30]+[.AM27];[.$B$7:.$M$22];[.AL25]) -> X | AN30: of:=VLOOKUP([.AL30]+[.AN27];[.$B$7:.$M$22];[.AL25]) -> X | AO30: of:=VLOOKUP([.AL30]+[.AO27];[.$B$7:.$M$22];[.AL25]) -> X | AP30: of:=VLOOKUP([.AL30]+[.AP27];[.$B$7:.$M$22];[.AL25]) -> X | AR30: 11 | AS30: of:=HLOOKUP(MID([.AR27];1;1);[.$C$5:.$F$6];2;0)*MID([.AR30];1;1) + HLOOKUP(MID([.AR27];2;1);[.$C$5:.$F$6];2;0)*MID([.AR30];2;1) -> 12 | AT30: of:=VLOOKUP([.AS30]+[.AT27];[.$B$7:.$M$22];[.AS25]) -> X | AU30: of:=VLOOKUP([.AS30]+[.AU27];[.$B$7:.$M$22];[.AS25]) -> X | AV30: of:=VLOOKUP([.AS30]+[.AV27];[.$B$7:.$M$22];[.AS25]) -> X | AW30: of:=VLOOKUP([.AS30]+[.AW27];[.$B$7:.$M$22];[.AS25]) -> X | AY30: 11 | AZ30: of:=HLOOKUP(MID([.AY27];1;1);[.$C$5:.$F$6];2;0)*MID([.AY30];1;1) + HLOOKUP(MID([.AY27];2;1);[.$C$5:.$F$6];2;0)*MID([.AY30];2;1) -> 12 | BA30: of:=VLOOKUP([.AZ30]+[.BA27];[.$B$7:.$M$22];[.AZ25]) -> X | BB30: of:=VLOOKUP([.AZ30]+[.BB27];[.$B$7:.$M$22];[.AZ25]) -> X | BC30: of:=VLOOKUP([.AZ30]+[.BC27];[.$B$7:.$M$22];[.AZ25]) -> X | BD30: of:=VLOOKUP([.AZ30]+[.BD27];[.$B$7:.$M$22];[.AZ25]) -> X | BF30: 11 | BG30: of:=HLOOKUP(MID([.BF27];1;1);[.$C$5:.$F$6];2;0)*MID([.BF30];1;1) + HLOOKUP(MID([.BF27];2;1);[.$C$5:.$F$6];2;0)*MID([.BF30];2;1) -> 12 | BH30: of:=VLOOKUP([.BG30]+[.BH27];[.$B$7:.$M$22];[.BG25]) -> X | BI30: of:=VLOOKUP([.BG30]+[.BI27];[.$B$7:.$M$22];[.BG25]) -> X | BJ30: of:=VLOOKUP([.BG30]+[.BJ27];[.$B$7:.$M$22];[.BG25]) -> X | BK30: of:=VLOOKUP([.BG30]+[.BK27];[.$B$7:.$M$22];[.BG25]) -> X
P31: 10 | Q31: of:=HLOOKUP(MID([.P27];1;1);[.$C$5:.$F$6];2;0)*MID([.P31];1;1) + HLOOKUP(MID([.P27];2;1);[.$C$5:.$F$6];2;0)*MID([.P31];2;1) -> 8 | R31: of:=VLOOKUP([.Q31]+[.R27];[.$B$7:.$M$22];[.Q25]) -> 1 | S31: of:=VLOOKUP([.Q31]+[.S27];[.$B$7:.$M$22];[.Q25]) -> 1 | T31: of:=VLOOKUP([.Q31]+[.T27];[.$B$7:.$M$22];[.Q25]) -> X | U31: of:=VLOOKUP([.Q31]+[.U27];[.$B$7:.$M$22];[.Q25]) -> X | W31: 10 | X31: of:=HLOOKUP(MID([.W27];1;1);[.$C$5:.$F$6];2;0)*MID([.W31];1;1) + HLOOKUP(MID([.W27];2;1);[.$C$5:.$F$6];2;0)*MID([.W31];2;1) -> 8 | Y31: of:=VLOOKUP([.X31]+[.Y27];[.$B$7:.$M$22];[.X25]) -> 1 | Z31: of:=VLOOKUP([.X31]+[.Z27];[.$B$7:.$M$22];[.X25]) -> 1 | AA31: of:=VLOOKUP([.X31]+[.AA27];[.$B$7:.$M$22];[.X25]) -> X | AB31: of:=VLOOKUP([.X31]+[.AB27];[.$B$7:.$M$22];[.X25]) -> X | AD31: 10 | AE31: of:=HLOOKUP(MID([.AD27];1;1);[.$C$5:.$F$6];2;0)*MID([.AD31];1;1) + HLOOKUP(MID([.AD27];2;1);[.$C$5:.$F$6];2;0)*MID([.AD31];2;1) -> 8 | AF31: of:=VLOOKUP([.AE31]+[.AF27];[.$B$7:.$M$22];[.AE25]) -> 1 | AG31: of:=VLOOKUP([.AE31]+[.AG27];[.$B$7:.$M$22];[.AE25]) -> 1 | AH31: of:=VLOOKUP([.AE31]+[.AH27];[.$B$7:.$M$22];[.AE25]) -> X | AI31: of:=VLOOKUP([.AE31]+[.AI27];[.$B$7:.$M$22];[.AE25]) -> X | AK31: 10 | AL31: of:=HLOOKUP(MID([.AK27];1;1);[.$C$5:.$F$6];2;0)*MID([.AK31];1;1) + HLOOKUP(MID([.AK27];2;1);[.$C$5:.$F$6];2;0)*MID([.AK31];2;1) -> 8 | AM31: of:=VLOOKUP([.AL31]+[.AM27];[.$B$7:.$M$22];[.AL25]) -> 1 | AN31: of:=VLOOKUP([.AL31]+[.AN27];[.$B$7:.$M$22];[.AL25]) -> 1 | AO31: of:=VLOOKUP([.AL31]+[.AO27];[.$B$7:.$M$22];[.AL25]) -> X | AP31: of:=VLOOKUP([.AL31]+[.AP27];[.$B$7:.$M$22];[.AL25]) -> X | AR31: 10 | AS31: of:=HLOOKUP(MID([.AR27];1;1);[.$C$5:.$F$6];2;0)*MID([.AR31];1;1) + HLOOKUP(MID([.AR27];2;1);[.$C$5:.$F$6];2;0)*MID([.AR31];2;1) -> 8 | AT31: of:=VLOOKUP([.AS31]+[.AT27];[.$B$7:.$M$22];[.AS25]) -> 1 | AU31: of:=VLOOKUP([.AS31]+[.AU27];[.$B$7:.$M$22];[.AS25]) -> 0 | AV31: of:=VLOOKUP([.AS31]+[.AV27];[.$B$7:.$M$22];[.AS25]) -> X | AW31: of:=VLOOKUP([.AS31]+[.AW27];[.$B$7:.$M$22];[.AS25]) -> X | AY31: 10 | AZ31: of:=HLOOKUP(MID([.AY27];1;1);[.$C$5:.$F$6];2;0)*MID([.AY31];1;1) + HLOOKUP(MID([.AY27];2;1);[.$C$5:.$F$6];2;0)*MID([.AY31];2;1) -> 8 | BA31: of:=VLOOKUP([.AZ31]+[.BA27];[.$B$7:.$M$22];[.AZ25]) -> 1 | BB31: of:=VLOOKUP([.AZ31]+[.BB27];[.$B$7:.$M$22];[.AZ25]) -> 1 | BC31: of:=VLOOKUP([.AZ31]+[.BC27];[.$B$7:.$M$22];[.AZ25]) -> X | BD31: of:=VLOOKUP([.AZ31]+[.BD27];[.$B$7:.$M$22];[.AZ25]) -> X | BF31: 10 | BG31: of:=HLOOKUP(MID([.BF27];1;1);[.$C$5:.$F$6];2;0)*MID([.BF31];1;1) + HLOOKUP(MID([.BF27];2;1);[.$C$5:.$F$6];2;0)*MID([.BF31];2;1) -> 8 | BH31: of:=VLOOKUP([.BG31]+[.BH27];[.$B$7:.$M$22];[.BG25]) -> 1 | BI31: of:=VLOOKUP([.BG31]+[.BI27];[.$B$7:.$M$22];[.BG25]) -> 1 | BJ31: of:=VLOOKUP([.BG31]+[.BJ27];[.$B$7:.$M$22];[.BG25]) -> X | BK31: of:=VLOOKUP([.BG31]+[.BK27];[.$B$7:.$M$22];[.BG25]) -> X
N32: 1 | O32: F
N33: 2 | O33: G | P33: G = µ D C B -A | AK33: G = µ D C B -A | AY33: G = µ D C B -A
N34: 3 | O34: H | P34: H = µ -C B A | AK34: H = µ -C B A | AR34: H = µ -C B A
N35: 4 | O35: I
N36: 5 | O36: J | W36: J = µ -C -B A
N37: 6 | O37: K | W37: K = µ -C B -A
N38: 7 | O38: L
N39: 8 | O39: M
N40: 9 | O40: N | AD40: N = µ C -B A | AY40: N = µ C -B A
N41: 10 | O41: O
N42: 11 | O42: P | AK42: P = µ -C -B -A | BF42: P = µ -C -B -A
N43: 12 | O43: Q | AR43: Q = A
N44: 13 | O44: R | AY44: R = µ -B -A
N45: 14 | O45: S | BF45: S = µ D C B
N46: 15 | O46: T
I47: Inv. Inputs (no -D) | P47: a = µ G H | W47: b = µ J K | AD47: c = -N | AK47: d = µ G H P | AR47: e = µ H A | AY47: f = µ G N R | BF47: g = µ P S | BL47: total
E48: transistors: | I48: 3 | P48: 9 | W48: 8 | AD48: 4 | AK48: 6 | AR48: 2 | AY48: 5 | BF48: 5 | BL48: of:=SUM([.I48:.BK48]) -> 42 | BN48: transistors
E49: gates: | I49: 3 | P49: 3 | W49: 3 | AD49: 2 | AK49: 2 | AR49: 1 | AY49: 2 | BF49: 2 | BL49: of:=SUM([.I49:.BK49]) -> 18 | BN49: gates

Sheet: digits 0-7
B1: 3 bit to 7-segment, digits 0-7
B2: Truth table | P2: 7-segment display as defined by truth table
P3: 0 | V3: of:=[.P3]+1 -> 1 | AB3: of:=[.V3]+1 -> 2 | AH3: of:=[.AB3]+1 -> 3 | AN3: of:=[.AH3]+1 -> 4 | AT3: of:=[.AN3]+1 -> 5 | AZ3: of:=[.AT3]+1 -> 6 | BF3: of:=[.AZ3]+1 -> 7
B4: Inputs | G4: Outputs | P4: of:=MATCH([.P3];[.$B$7:.$B$22];0)+2 -> 3 | V4: of:=MATCH([.V3];[.$B$7:.$B$22];0)+2 -> 4 | AB4: of:=MATCH([.AB3];[.$B$7:.$B$22];0)+2 -> 5 | AH4: of:=MATCH([.AH3];[.$B$7:.$B$22];0)+2 -> 6 | AN4: of:=MATCH([.AN3];[.$B$7:.$B$22];0)+2 -> 7 | AT4: of:=MATCH([.AT3];[.$B$7:.$B$22];0)+2 -> 8 | AZ4: of:=MATCH([.AZ3];[.$B$7:.$B$22];0)+2 -> 9 | BF4: of:=MATCH([.BF3];[.$B$7:.$B$22];0)+2 -> 10
B5: # | C5: D | D5: C | E5: B | F5: A | G5: a | H5: b | I5: c | J5: d | K5: e | L5: f | M5: g | Q5: of:=HLOOKUP([.T5];[.$G$5:.$M$22];[.P4];0) -> 1 | R5: of:=[.T5]&T(ORG.OPENOFFICE.STYLE(IF([.Q5]=1;"seg1";IF([.Q5]=0;"seg0";"segX")))) -> a | T5: a | W5: of:=HLOOKUP([.Z5];[.$G$5:.$M$22];[.V4];0) -> 0 | X5: of:=[.Z5]&T(ORG.OPENOFFICE.STYLE(IF([.W5]=1;"seg1";IF([.W5]=0;"seg0";"segX")))) -> a | Z5: a | AC5: of:=HLOOKUP([.AF5];[.$G$5:.$M$22];[.AB4];0) -> 1 | AD5: of:=[.AF5]&T(ORG.OPENOFFICE.STYLE(IF([.AC5]=1;"seg1";IF([.AC5]=0;"seg0";"segX")))) -> a | AF5: a | AI5: of:=HLOOKUP([.AL5];[.$G$5:.$M$22];[.AH4];0) -> 1 | AJ5: of:=[.AL5]&T(ORG.OPENOFFICE.STYLE(IF([.AI5]=1;"seg1";IF([.AI5]=0;"seg0";"segX")))) -> a | AL5: a | AO5: of:=HLOOKUP([.AR5];[.$G$5:.$M$22];[.AN4];0) -> 0 | AP5: of:=[.AR5]&T(ORG.OPENOFFICE.STYLE(IF([.AO5]=1;"seg1";IF([.AO5]=0;"seg0";"segX")))) -> a | AR5: a | AU5: of:=HLOOKUP([.AX5];[.$G$5:.$M$22];[.AT4];0) -> 1 | AV5: of:=[.AX5]&T(ORG.OPENOFFICE.STYLE(IF([.AU5]=1;"seg1";IF([.AU5]=0;"seg0";"segX")))) -> a | AX5: a | BA5: of:=HLOOKUP([.BD5];[.$G$5:.$M$22];[.AZ4];0) -> 1 | BB5: of:=[.BD5]&T(ORG.OPENOFFICE.STYLE(IF([.BA5]=1;"seg1";IF([.BA5]=0;"seg0";"segX")))) -> a | BD5: a | BG5: of:=HLOOKUP([.BJ5];[.$G$5:.$M$22];[.BF4];0) -> 1 | BH5: of:=[.BJ5]&T(ORG.OPENOFFICE.STYLE(IF([.BG5]=1;"seg1";IF([.BG5]=0;"seg0";"segX")))) -> a | BJ5: a
C6: 8 | D6: 4 | E6: 2 | F6: 1 | P6: of:=HLOOKUP([.R6];[.$G$5:.$M$22];[.P4];0) -> 1 | Q6: of:=[.R6]&T(ORG.OPENOFFICE.STYLE(IF([.P6]=1;"seg1";IF([.P6]=0;"seg0";"segX")))) -> f | R6: f | S6: of:=HLOOKUP([.U6];[.$G$5:.$M$22];[.P4];0) -> 1 | T6: of:=[.U6]&T(ORG.OPENOFFICE.STYLE(IF([.S6]=1;"seg1";IF([.S6]=0;"seg0";"segX")))) -> b | U6: b | V6: of:=HLOOKUP([.X6];[.$G$5:.$M$22];[.V4];0) -> 0 | W6: of:=[.X6]&T(ORG.OPENOFFICE.STYLE(IF([.V6]=1;"seg1";IF([.V6]=0;"seg0";"segX")))) -> f | X6: f | Y6: of:=HLOOKUP([.AA6];[.$G$5:.$M$22];[.V4];0) -> 1 | Z6: of:=[.AA6]&T(ORG.OPENOFFICE.STYLE(IF([.Y6]=1;"seg1";IF([.Y6]=0;"seg0";"segX")))) -> b | AA6: b | AB6: of:=HLOOKUP([.AD6];[.$G$5:.$M$22];[.AB4];0) -> 0 | AC6: of:=[.AD6]&T(ORG.OPENOFFICE.STYLE(IF([.AB6]=1;"seg1";IF([.AB6]=0;"seg0";"segX")))) -> f | AD6: f | AE6: of:=HLOOKUP([.AG6];[.$G$5:.$M$22];[.AB4];0) -> 1 | AF6: of:=[.AG6]&T(ORG.OPENOFFICE.STYLE(IF([.AE6]=1;"seg1";IF([.AE6]=0;"seg0";"segX")))) -> b | AG6: b | AH6: of:=HLOOKUP([.AJ6];[.$G$5:.$M$22];[.AH4];0) -> 0 | AI6: of:=[.AJ6]&T(ORG.OPENOFFICE.STYLE(IF([.AH6]=1;"seg1";IF([.AH6]=0;"seg0";"segX")))) -> f | AJ6: f | AK6: of:=HLOOKUP([.AM6];[.$G$5:.$M$22];[.AH4];0) -> 1 | AL6: of:=[.AM6]&T(ORG.OPENOFFICE.STYLE(IF([.AK6]=1;"seg1";IF([.AK6]=0;"seg0";"segX")))) -> b | AM6: b | AN6: of:=HLOOKUP([.AP6];[.$G$5:.$M$22];[.AN4];0) -> 1 | AO6: of:=[.AP6]&T(ORG.OPENOFFICE.STYLE(IF([.AN6]=1;"seg1";IF([.AN6]=0;"seg0";"segX")))) -> f | AP6: f | AQ6: of:=HLOOKUP([.AS6];[.$G$5:.$M$22];[.AN4];0) -> 1 | AR6: of:=[.AS6]&T(ORG.OPENOFFICE.STYLE(IF([.AQ6]=1;"seg1";IF([.AQ6]=0;"seg0";"segX")))) -> b | AS6: b | AT6: of:=HLOOKUP([.AV6];[.$G$5:.$M$22];[.AT4];0) -> 1 | AU6: of:=[.AV6]&T(ORG.OPENOFFICE.STYLE(IF([.AT6]=1;"seg1";IF([.AT6]=0;"seg0";"segX")))) -> f | AV6: f | AW6: of:=HLOOKUP([.AY6];[.$G$5:.$M$22];[.AT4];0) -> 0 | AX6: of:=[.AY6]&T(ORG.OPENOFFICE.STYLE(IF([.AW6]=1;"seg1";IF([.AW6]=0;"seg0";"segX")))) -> b | AY6: b | AZ6: of:=HLOOKUP([.BB6];[.$G$5:.$M$22];[.AZ4];0) -> 1 | BA6: of:=[.BB6]&T(ORG.OPENOFFICE.STYLE(IF([.AZ6]=1;"seg1";IF([.AZ6]=0;"seg0";"segX")))) -> f | BB6: f | BC6: of:=HLOOKUP([.BE6];[.$G$5:.$M$22];[.AZ4];0) -> 0 | BD6: of:=[.BE6]&T(ORG.OPENOFFICE.STYLE(IF([.BC6]=1;"seg1";IF([.BC6]=0;"seg0";"segX")))) -> b | BE6: b | BF6: of:=HLOOKUP([.BH6];[.$G$5:.$M$22];[.BF4];0) -> 0 | BG6: of:=[.BH6]&T(ORG.OPENOFFICE.STYLE(IF([.BF6]=1;"seg1";IF([.BF6]=0;"seg0";"segX")))) -> f | BH6: f | BI6: of:=HLOOKUP([.BK6];[.$G$5:.$M$22];[.BF4];0) -> 1 | BJ6: of:=[.BK6]&T(ORG.OPENOFFICE.STYLE(IF([.BI6]=1;"seg1";IF([.BI6]=0;"seg0";"segX")))) -> b | BK6: b
B7: 0 | C7: of:=MOD(ROUNDDOWN([.$B7]/[.C$6]);2) -> 0 | D7: of:=MOD(ROUNDDOWN([.$B7]/[.D$6]);2) -> 0 | E7: of:=MOD(ROUNDDOWN([.$B7]/[.E$6]);2) -> 0 | F7: of:=MOD(ROUNDDOWN([.$B7]/[.F$6]);2) -> 0 | G7: 1 | H7: 1 | I7: 1 | J7: 1 | K7: 1 | L7: 1 | M7: 0
B8: of:=[.B7]+1 -> 1 | C8: of:=MOD(ROUNDDOWN([.$B8]/[.C$6]);2) -> 0 | D8: of:=MOD(ROUNDDOWN([.$B8]/[.D$6]);2) -> 0 | E8: of:=MOD(ROUNDDOWN([.$B8]/[.E$6]);2) -> 0 | F8: of:=MOD(ROUNDDOWN([.$B8]/[.F$6]);2) -> 1 | G8: 0 | H8: 1 | I8: 1 | J8: 0 | K8: 0 | L8: 0 | M8: 0 | Q8: of:=HLOOKUP([.T8];[.$G$5:.$M$22];[.P4];0) -> 0 | R8: of:=[.T8]&T(ORG.OPENOFFICE.STYLE(IF([.Q8]=1;"seg1";IF([.Q8]=0;"seg0";"segX")))) -> g | T8: g | W8: of:=HLOOKUP([.Z8];[.$G$5:.$M$22];[.V4];0) -> 0 | X8: of:=[.Z8]&T(ORG.OPENOFFICE.STYLE(IF([.W8]=1;"seg1";IF([.W8]=0;"seg0";"segX")))) -> g | Z8: g | AC8: of:=HLOOKUP([.AF8];[.$G$5:.$M$22];[.AB4];0) -> 1 | AD8: of:=[.AF8]&T(ORG.OPENOFFICE.STYLE(IF([.AC8]=1;"seg1";IF([.AC8]=0;"seg0";"segX")))) -> g | AF8: g | AI8: of:=HLOOKUP([.AL8];[.$G$5:.$M$22];[.AH4];0) -> 1 | AJ8: of:=[.AL8]&T(ORG.OPENOFFICE.STYLE(IF([.AI8]=1;"seg1";IF([.AI8]=0;"seg0";"segX")))) -> g | AL8: g | AO8: of:=HLOOKUP([.AR8];[.$G$5:.$M$22];[.AN4];0) -> 1 | AP8: of:=[.AR8]&T(ORG.OPENOFFICE.STYLE(IF([.AO8]=1;"seg1";IF([.AO8]=0;"seg0";"segX")))) -> g | AR8: g | AU8: of:=HLOOKUP([.AX8];[.$G$5:.$M$22];[.AT4];0) -> 1 | AV8: of:=[.AX8]&T(ORG.OPENOFFICE.STYLE(IF([.AU8]=1;"seg1";IF([.AU8]=0;"seg0";"segX")))) -> g | AX8: g | BA8: of:=HLOOKUP([.BD8];[.$G$5:.$M$22];[.AZ4];0) -> 1 | BB8: of:=[.BD8]&T(ORG.OPENOFFICE.STYLE(IF([.BA8]=1;"seg1";IF([.BA8]=0;"seg0";"segX")))) -> g | BD8: g | BG8: of:=HLOOKUP([.BJ8];[.$G$5:.$M$22];[.BF4];0) -> 0 | BH8: of:=[.BJ8]&T(ORG.OPENOFFICE.STYLE(IF([.BG8]=1;"seg1";IF([.BG8]=0;"seg0";"segX")))) -> g | BJ8: g
B9: of:=[.B8]+1 -> 2 | C9: of:=MOD(ROUNDDOWN([.$B9]/[.C$6]);2) -> 0 | D9: of:=MOD(ROUNDDOWN([.$B9]/[.D$6]);2) -> 0 | E9: of:=MOD(ROUNDDOWN([.$B9]/[.E$6]);2) -> 1 | F9: of:=MOD(ROUNDDOWN([.$B9]/[.F$6]);2) -> 0 | G9: 1 | H9: 1 | I9: 0 | J9: 1 | K9: 1 | L9: 0 | M9: 1 | P9: of:=HLOOKUP([.R9];[.$G$5:.$M$22];[.P4];0) -> 1 | Q9: of:=[.R9]&T(ORG.OPENOFFICE.STYLE(IF([.P9]=1;"seg1";IF([.P9]=0;"seg0";"segX")))) -> e | R9: e | S9: of:=HLOOKUP([.U9];[.$G$5:.$M$22];[.P4];0) -> 1 | T9: of:=[.U9]&T(ORG.OPENOFFICE.STYLE(IF([.S9]=1;"seg1";IF([.S9]=0;"seg0";"segX")))) -> c | U9: c | V9: of:=HLOOKUP([.X9];[.$G$5:.$M$22];[.V4];0) -> 0 | W9: of:=[.X9]&T(ORG.OPENOFFICE.STYLE(IF([.V9]=1;"seg1";IF([.V9]=0;"seg0";"segX")))) -> e | X9: e | Y9: of:=HLOOKUP([.AA9];[.$G$5:.$M$22];[.V4];0) -> 1 | Z9: of:=[.AA9]&T(ORG.OPENOFFICE.STYLE(IF([.Y9]=1;"seg1";IF([.Y9]=0;"seg0";"segX")))) -> c | AA9: c | AB9: of:=HLOOKUP([.AD9];[.$G$5:.$M$22];[.AB4];0) -> 1 | AC9: of:=[.AD9]&T(ORG.OPENOFFICE.STYLE(IF([.AB9]=1;"seg1";IF([.AB9]=0;"seg0";"segX")))) -> e | AD9: e | AE9: of:=HLOOKUP([.AG9];[.$G$5:.$M$22];[.AB4];0) -> 0 | AF9: of:=[.AG9]&T(ORG.OPENOFFICE.STYLE(IF([.AE9]=1;"seg1";IF([.AE9]=0;"seg0";"segX")))) -> c | AG9: c | AH9: of:=HLOOKUP([.AJ9];[.$G$5:.$M$22];[.AH4];0) -> 0 | AI9: of:=[.AJ9]&T(ORG.OPENOFFICE.STYLE(IF([.AH9]=1;"seg1";IF([.AH9]=0;"seg0";"segX")))) -> e | AJ9: e | AK9: of:=HLOOKUP([.AM9];[.$G$5:.$M$22];[.AH4];0) -> 1 | AL9: of:=[.AM9]&T(ORG.OPENOFFICE.STYLE(IF([.AK9]=1;"seg1";IF([.AK9]=0;"seg0";"segX")))) -> c | AM9: c | AN9: of:=HLOOKUP([.AP9];[.$G$5:.$M$22];[.AN4];0) -> 0 | AO9: of:=[.AP9]&T(ORG.OPENOFFICE.STYLE(IF([.AN9]=1;"seg1";IF([.AN9]=0;"seg0";"segX")))) -> e | AP9: e | AQ9: of:=HLOOKUP([.AS9];[.$G$5:.$M$22];[.AN4];0) -> 1 | AR9: of:=[.AS9]&T(ORG.OPENOFFICE.STYLE(IF([.AQ9]=1;"seg1";IF([.AQ9]=0;"seg0";"segX")))) -> c | AS9: c | AT9: of:=HLOOKUP([.AV9];[.$G$5:.$M$22];[.AT4];0) -> 0 | AU9: of:=[.AV9]&T(ORG.OPENOFFICE.STYLE(IF([.AT9]=1;"seg1";IF([.AT9]=0;"seg0";"segX")))) -> e | AV9: e | AW9: of:=HLOOKUP([.AY9];[.$G$5:.$M$22];[.AT4];0) -> 1 | AX9: of:=[.AY9]&T(ORG.OPENOFFICE.STYLE(IF([.AW9]=1;"seg1";IF([.AW9]=0;"seg0";"segX")))) -> c | AY9: c | AZ9: of:=HLOOKUP([.BB9];[.$G$5:.$M$22];[.AZ4];0) -> 1 | BA9: of:=[.BB9]&T(ORG.OPENOFFICE.STYLE(IF([.AZ9]=1;"seg1";IF([.AZ9]=0;"seg0";"segX")))) -> e | BB9: e | BC9: of:=HLOOKUP([.BE9];[.$G$5:.$M$22];[.AZ4];0) -> 1 | BD9: of:=[.BE9]&T(ORG.OPENOFFICE.STYLE(IF([.BC9]=1;"seg1";IF([.BC9]=0;"seg0";"segX")))) -> c | BE9: c | BF9: of:=HLOOKUP([.BH9];[.$G$5:.$M$22];[.BF4];0) -> 0 | BG9: of:=[.BH9]&T(ORG.OPENOFFICE.STYLE(IF([.BF9]=1;"seg1";IF([.BF9]=0;"seg0";"segX")))) -> e | BH9: e | BI9: of:=HLOOKUP([.BK9];[.$G$5:.$M$22];[.BF4];0) -> 1 | BJ9: of:=[.BK9]&T(ORG.OPENOFFICE.STYLE(IF([.BI9]=1;"seg1";IF([.BI9]=0;"seg0";"segX")))) -> c | BK9: c
B10: of:=[.B9]+1 -> 3 | C10: of:=MOD(ROUNDDOWN([.$B10]/[.C$6]);2) -> 0 | D10: of:=MOD(ROUNDDOWN([.$B10]/[.D$6]);2) -> 0 | E10: of:=MOD(ROUNDDOWN([.$B10]/[.E$6]);2) -> 1 | F10: of:=MOD(ROUNDDOWN([.$B10]/[.F$6]);2) -> 1 | G10: 1 | H10: 1 | I10: 1 | J10: 1 | K10: 0 | L10: 0 | M10: 1
B11: of:=[.B10]+1 -> 4 | C11: of:=MOD(ROUNDDOWN([.$B11]/[.C$6]);2) -> 0 | D11: of:=MOD(ROUNDDOWN([.$B11]/[.D$6]);2) -> 1 | E11: of:=MOD(ROUNDDOWN([.$B11]/[.E$6]);2) -> 0 | F11: of:=MOD(ROUNDDOWN([.$B11]/[.F$6]);2) -> 0 | G11: 0 | H11: 1 | I11: 1 | J11: 0 | K11: 0 | L11: 1 | M11: 1 | Q11: of:=HLOOKUP([.T11];[.$G$5:.$M$22];[.P4];0) -> 1 | R11: of:=[.T11]&T(ORG.OPENOFFICE.STYLE(IF([.Q11]=1;"seg1";IF([.Q11]=0;"seg0";"segX")))) -> d | T11: d | W11: of:=HLOOKUP([.Z11];[.$G$5:.$M$22];[.V4];0) -> 0 | X11: of:=[.Z11]&T(ORG.OPENOFFICE.STYLE(IF([.W11]=1;"seg1";IF([.W11]=0;"seg0";"segX")))) -> d | Z11: d | AC11: of:=HLOOKUP([.AF11];[.$G$5:.$M$22];[.AB4];0) -> 1 | AD11: of:=[.AF11]&T(ORG.OPENOFFICE.STYLE(IF([.AC11]=1;"seg1";IF([.AC11]=0;"seg0";"segX")))) -> d | AF11: d | AI11: of:=HLOOKUP([.AL11];[.$G$5:.$M$22];[.AH4];0) -> 1 | AJ11: of:=[.AL11]&T(ORG.OPENOFFICE.STYLE(IF([.AI11]=1;"seg1";IF([.AI11]=0;"seg0";"segX")))) -> d | AL11: d | AO11: of:=HLOOKUP([.AR11];[.$G$5:.$M$22];[.AN4];0) -> 0 | AP11: of:=[.AR11]&T(ORG.OPENOFFICE.STYLE(IF([.AO11]=1;"seg1";IF([.AO11]=0;"seg0";"segX")))) -> d | AR11: d | AU11: of:=HLOOKUP([.AX11];[.$G$5:.$M$22];[.AT4];0) -> 1 | AV11: of:=[.AX11]&T(ORG.OPENOFFICE.STYLE(IF([.AU11]=1;"seg1";IF([.AU11]=0;"seg0";"segX")))) -> d | AX11: d | BA11: of:=HLOOKUP([.BD11];[.$G$5:.$M$22];[.AZ4];0) -> 1 | BB11: of:=[.BD11]&T(ORG.OPENOFFICE.STYLE(IF([.BA11]=1;"seg1";IF([.BA11]=0;"seg0";"segX")))) -> d | BD11: d | BG11: of:=HLOOKUP([.BJ11];[.$G$5:.$M$22];[.BF4];0) -> 0 | BH11: of:=[.BJ11]&T(ORG.OPENOFFICE.STYLE(IF([.BG11]=1;"seg1";IF([.BG11]=0;"seg0";"segX")))) -> d | BJ11: d
B12: of:=[.B11]+1 -> 5 | C12: of:=MOD(ROUNDDOWN([.$B12]/[.C$6]);2) -> 0 | D12: of:=MOD(ROUNDDOWN([.$B12]/[.D$6]);2) -> 1 | E12: of:=MOD(ROUNDDOWN([.$B12]/[.E$6]);2) -> 0 | F12: of:=MOD(ROUNDDOWN([.$B12]/[.F$6]);2) -> 1 | G12: 1 | H12: 0 | I12: 1 | J12: 1 | K12: 0 | L12: 1 | M12: 1
B13: of:=[.B12]+1 -> 6 | C13: of:=MOD(ROUNDDOWN([.$B13]/[.C$6]);2) -> 0 | D13: of:=MOD(ROUNDDOWN([.$B13]/[.D$6]);2) -> 1 | E13: of:=MOD(ROUNDDOWN([.$B13]/[.E$6]);2) -> 1 | F13: of:=MOD(ROUNDDOWN([.$B13]/[.F$6]);2) -> 0 | G13: 1 | H13: 0 | I13: 1 | J13: 1 | K13: 1 | L13: 1 | M13: 1 | P13: of:=[.BF3]+1 -> 8 | V13: of:=[.P13]+1 -> 9 | AB13: of:=[.V13]+1 -> 10 | AH13: of:=[.AB13]+1 -> 11 | AN13: of:=[.AH13]+1 -> 12 | AT13: of:=[.AN13]+1 -> 13 | AZ13: of:=[.AT13]+1 -> 14 | BF13: of:=[.AZ13]+1 -> 15
B14: of:=[.B13]+1 -> 7 | C14: of:=MOD(ROUNDDOWN([.$B14]/[.C$6]);2) -> 0 | D14: of:=MOD(ROUNDDOWN([.$B14]/[.D$6]);2) -> 1 | E14: of:=MOD(ROUNDDOWN([.$B14]/[.E$6]);2) -> 1 | F14: of:=MOD(ROUNDDOWN([.$B14]/[.F$6]);2) -> 1 | G14: 1 | H14: 1 | I14: 1 | J14: 0 | K14: 0 | L14: 0 | M14: 0 | P14: of:=MATCH([.P13];[.$B$7:.$B$22];0)+2 -> 11 | V14: of:=MATCH([.V13];[.$B$7:.$B$22];0)+2 -> 12 | AB14: of:=MATCH([.AB13];[.$B$7:.$B$22];0)+2 -> 13 | AH14: of:=MATCH([.AH13];[.$B$7:.$B$22];0)+2 -> 14 | AN14: of:=MATCH([.AN13];[.$B$7:.$B$22];0)+2 -> 15 | AT14: of:=MATCH([.AT13];[.$B$7:.$B$22];0)+2 -> 16 | AZ14: of:=MATCH([.AZ13];[.$B$7:.$B$22];0)+2 -> 17 | BF14: of:=MATCH([.BF13];[.$B$7:.$B$22];0)+2 -> 18
B15: of:=[.B14]+1 -> 8 | C15: of:=MOD(ROUNDDOWN([.$B15]/[.C$6]);2) -> 1 | D15: of:=MOD(ROUNDDOWN([.$B15]/[.D$6]);2) -> 0 | E15: of:=MOD(ROUNDDOWN([.$B15]/[.E$6]);2) -> 0 | F15: of:=MOD(ROUNDDOWN([.$B15]/[.F$6]);2) -> 0 | G15: X | H15: X | I15: X | J15: X | K15: X | L15: X | M15: X | Q15: of:=HLOOKUP([.T15];[.$G$5:.$M$22];[.P14];0) -> X | R15: of:=[.T15]&T(ORG.OPENOFFICE.STYLE(IF([.Q15]=1;"seg1";IF([.Q15]=0;"seg0";"segX")))) -> a | T15: a | W15: of:=HLOOKUP([.Z15];[.$G$5:.$M$22];[.V14];0) -> X | X15: of:=[.Z15]&T(ORG.OPENOFFICE.STYLE(IF([.W15]=1;"seg1";IF([.W15]=0;"seg0";"segX")))) -> a | Z15: a | AC15: of:=HLOOKUP([.AF15];[.$G$5:.$M$22];[.AB14];0) -> X | AD15: of:=[.AF15]&T(ORG.OPENOFFICE.STYLE(IF([.AC15]=1;"seg1";IF([.AC15]=0;"seg0";"segX")))) -> a | AF15: a | AI15: of:=HLOOKUP([.AL15];[.$G$5:.$M$22];[.AH14];0) -> X | AJ15: of:=[.AL15]&T(ORG.OPENOFFICE.STYLE(IF([.AI15]=1;"seg1";IF([.AI15]=0;"seg0";"segX")))) -> a | AL15: a | AO15: of:=HLOOKUP([.AR15];[.$G$5:.$M$22];[.AN14];0) -> X | AP15: of:=[.AR15]&T(ORG.OPENOFFICE.STYLE(IF([.AO15]=1;"seg1";IF([.AO15]=0;"seg0";"segX")))) -> a | AR15: a | AU15: of:=HLOOKUP([.AX15];[.$G$5:.$M$22];[.AT14];0) -> X | AV15: of:=[.AX15]&T(ORG.OPENOFFICE.STYLE(IF([.AU15]=1;"seg1";IF([.AU15]=0;"seg0";"segX")))) -> a | AX15: a | BA15: of:=HLOOKUP([.BD15];[.$G$5:.$M$22];[.AZ14];0) -> X | BB15: of:=[.BD15]&T(ORG.OPENOFFICE.STYLE(IF([.BA15]=1;"seg1";IF([.BA15]=0;"seg0";"segX")))) -> a | BD15: a | BG15: of:=HLOOKUP([.BJ15];[.$G$5:.$M$22];[.BF14];0) -> X | BH15: of:=[.BJ15]&T(ORG.OPENOFFICE.STYLE(IF([.BG15]=1;"seg1";IF([.BG15]=0;"seg0";"segX")))) -> a | BJ15: a
B16: of:=[.B15]+1 -> 9 | C16: of:=MOD(ROUNDDOWN([.$B16]/[.C$6]);2) -> 1 | D16: of:=MOD(ROUNDDOWN([.$B16]/[.D$6]);2) -> 0 | E16: of:=MOD(ROUNDDOWN([.$B16]/[.E$6]);2) -> 0 | F16: of:=MOD(ROUNDDOWN([.$B16]/[.F$6]);2) -> 1 | G16: X | H16: X | I16: X | J16: X | K16: X | L16: X | M16: X | P16: of:=HLOOKUP([.R16];[.$G$5:.$M$22];[.P14];0) -> X | Q16: of:=[.R16]&T(ORG.OPENOFFICE.STYLE(IF([.P16]=1;"seg1";IF([.P16]=0;"seg0";"segX")))) -> f | R16: f | S16: of:=HLOOKUP([.U16];[.$G$5:.$M$22];[.P14];0) -> X | T16: of:=[.U16]&T(ORG.OPENOFFICE.STYLE(IF([.S16]=1;"seg1";IF([.S16]=0;"seg0";"segX")))) -> b | U16: b | V16: of:=HLOOKUP([.X16];[.$G$5:.$M$22];[.V14];0) -> X | W16: of:=[.X16]&T(ORG.OPENOFFICE.STYLE(IF([.V16]=1;"seg1";IF([.V16]=0;"seg0";"segX")))) -> f | X16: f | Y16: of:=HLOOKUP([.AA16];[.$G$5:.$M$22];[.V14];0) -> X | Z16: of:=[.AA16]&T(ORG.OPENOFFICE.STYLE(IF([.Y16]=1;"seg1";IF([.Y16]=0;"seg0";"segX")))) -> b | AA16: b | AB16: of:=HLOOKUP([.AD16];[.$G$5:.$M$22];[.AB14];0) -> X | AC16: of:=[.AD16]&T(ORG.OPENOFFICE.STYLE(IF([.AB16]=1;"seg1";IF([.AB16]=0;"seg0";"segX")))) -> f | AD16: f | AE16: of:=HLOOKUP([.AG16];[.$G$5:.$M$22];[.AB14];0) -> X | AF16: of:=[.AG16]&T(ORG.OPENOFFICE.STYLE(IF([.AE16]=1;"seg1";IF([.AE16]=0;"seg0";"segX")))) -> b | AG16: b | AH16: of:=HLOOKUP([.AJ16];[.$G$5:.$M$22];[.AH14];0) -> X | AI16: of:=[.AJ16]&T(ORG.OPENOFFICE.STYLE(IF([.AH16]=1;"seg1";IF([.AH16]=0;"seg0";"segX")))) -> f | AJ16: f | AK16: of:=HLOOKUP([.AM16];[.$G$5:.$M$22];[.AH14];0) -> X | AL16: of:=[.AM16]&T(ORG.OPENOFFICE.STYLE(IF([.AK16]=1;"seg1";IF([.AK16]=0;"seg0";"segX")))) -> b | AM16: b | AN16: of:=HLOOKUP([.AP16];[.$G$5:.$M$22];[.AN14];0) -> X | AO16: of:=[.AP16]&T(ORG.OPENOFFICE.STYLE(IF([.AN16]=1;"seg1";IF([.AN16]=0;"seg0";"segX")))) -> f | AP16: f | AQ16: of:=HLOOKUP([.AS16];[.$G$5:.$M$22];[.AN14];0) -> X | AR16: of:=[.AS16]&T(ORG.OPENOFFICE.STYLE(IF([.AQ16]=1;"seg1";IF([.AQ16]=0;"seg0";"segX")))) -> b | AS16: b | AT16: of:=HLOOKUP([.AV16];[.$G$5:.$M$22];[.AT14];0) -> X | AU16: of:=[.AV16]&T(ORG.OPENOFFICE.STYLE(IF([.AT16]=1;"seg1";IF([.AT16]=0;"seg0";"segX")))) -> f | AV16: f | AW16: of:=HLOOKUP([.AY16];[.$G$5:.$M$22];[.AT14];0) -> X | AX16: of:=[.AY16]&T(ORG.OPENOFFICE.STYLE(IF([.AW16]=1;"seg1";IF([.AW16]=0;"seg0";"segX")))) -> b | AY16: b | AZ16: of:=HLOOKUP([.BB16];[.$G$5:.$M$22];[.AZ14];0) -> X | BA16: of:=[.BB16]&T(ORG.OPENOFFICE.STYLE(IF([.AZ16]=1;"seg1";IF([.AZ16]=0;"seg0";"segX")))) -> f | BB16: f | BC16: of:=HLOOKUP([.BE16];[.$G$5:.$M$22];[.AZ14];0) -> X | BD16: of:=[.BE16]&T(ORG.OPENOFFICE.STYLE(IF([.BC16]=1;"seg1";IF([.BC16]=0;"seg0";"segX")))) -> b | BE16: b | BF16: of:=HLOOKUP([.BH16];[.$G$5:.$M$22];[.BF14];0) -> X | BG16: of:=[.BH16]&T(ORG.OPENOFFICE.STYLE(IF([.BF16]=1;"seg1";IF([.BF16]=0;"seg0";"segX")))) -> f | BH16: f | BI16: of:=HLOOKUP([.BK16];[.$G$5:.$M$22];[.BF14];0) -> X | BJ16: of:=[.BK16]&T(ORG.OPENOFFICE.STYLE(IF([.BI16]=1;"seg1";IF([.BI16]=0;"seg0";"segX")))) -> b | BK16: b
B17: of:=[.B16]+1 -> 10 | C17: of:=MOD(ROUNDDOWN([.$B17]/[.C$6]);2) -> 1 | D17: of:=MOD(ROUNDDOWN([.$B17]/[.D$6]);2) -> 0 | E17: of:=MOD(ROUNDDOWN([.$B17]/[.E$6]);2) -> 1 | F17: of:=MOD(ROUNDDOWN([.$B17]/[.F$6]);2) -> 0 | G17: X | H17: X | I17: X | J17: X | K17: X | L17: X | M17: X
B18: of:=[.B17]+1 -> 11 | C18: of:=MOD(ROUNDDOWN([.$B18]/[.C$6]);2) -> 1 | D18: of:=MOD(ROUNDDOWN([.$B18]/[.D$6]);2) -> 0 | E18: of:=MOD(ROUNDDOWN([.$B18]/[.E$6]);2) -> 1 | F18: of:=MOD(ROUNDDOWN([.$B18]/[.F$6]);2) -> 1 | G18: X | H18: X | I18: X | J18: X | K18: X | L18: X | M18: X | Q18: of:=HLOOKUP([.T18];[.$G$5:.$M$22];[.P14];0) -> X | R18: of:=[.T18]&T(ORG.OPENOFFICE.STYLE(IF([.Q18]=1;"seg1";IF([.Q18]=0;"seg0";"segX")))) -> g | T18: g | W18: of:=HLOOKUP([.Z18];[.$G$5:.$M$22];[.V14];0) -> X | X18: of:=[.Z18]&T(ORG.OPENOFFICE.STYLE(IF([.W18]=1;"seg1";IF([.W18]=0;"seg0";"segX")))) -> g | Z18: g | AC18: of:=HLOOKUP([.AF18];[.$G$5:.$M$22];[.AB14];0) -> X | AD18: of:=[.AF18]&T(ORG.OPENOFFICE.STYLE(IF([.AC18]=1;"seg1";IF([.AC18]=0;"seg0";"segX")))) -> g | AF18: g | AI18: of:=HLOOKUP([.AL18];[.$G$5:.$M$22];[.AH14];0) -> X | AJ18: of:=[.AL18]&T(ORG.OPENOFFICE.STYLE(IF([.AI18]=1;"seg1";IF([.AI18]=0;"seg0";"segX")))) -> g | AL18: g | AO18: of:=HLOOKUP([.AR18];[.$G$5:.$M$22];[.AN14];0) -> X | AP18: of:=[.AR18]&T(ORG.OPENOFFICE.STYLE(IF([.AO18]=1;"seg1";IF([.AO18]=0;"seg0";"segX")))) -> g | AR18: g | AU18: of:=HLOOKUP([.AX18];[.$G$5:.$M$22];[.AT14];0) -> X | AV18: of:=[.AX18]&T(ORG.OPENOFFICE.STYLE(IF([.AU18]=1;"seg1";IF([.AU18]=0;"seg0";"segX")))) -> g | AX18: g | BA18: of:=HLOOKUP([.BD18];[.$G$5:.$M$22];[.AZ14];0) -> X | BB18: of:=[.BD18]&T(ORG.OPENOFFICE.STYLE(IF([.BA18]=1;"seg1";IF([.BA18]=0;"seg0";"segX")))) -> g | BD18: g | BG18: of:=HLOOKUP([.BJ18];[.$G$5:.$M$22];[.BF14];0) -> X | BH18: of:=[.BJ18]&T(ORG.OPENOFFICE.STYLE(IF([.BG18]=1;"seg1";IF([.BG18]=0;"seg0";"segX")))) -> g | BJ18: g
B19: of:=[.B18]+1 -> 12 | C19: of:=MOD(ROUNDDOWN([.$B19]/[.C$6]);2) -> 1 | D19: of:=MOD(ROUNDDOWN([.$B19]/[.D$6]);2) -> 1 | E19: of:=MOD(ROUNDDOWN([.$B19]/[.E$6]);2) -> 0 | F19: of:=MOD(ROUNDDOWN([.$B19]/[.F$6]);2) -> 0 | G19: X | H19: X | I19: X | J19: X | K19: X | L19: X | M19: X | P19: of:=HLOOKUP([.R19];[.$G$5:.$M$22];[.P14];0) -> X | Q19: of:=[.R19]&T(ORG.OPENOFFICE.STYLE(IF([.P19]=1;"seg1";IF([.P19]=0;"seg0";"segX")))) -> e | R19: e | S19: of:=HLOOKUP([.U19];[.$G$5:.$M$22];[.P14];0) -> X | T19: of:=[.U19]&T(ORG.OPENOFFICE.STYLE(IF([.S19]=1;"seg1";IF([.S19]=0;"seg0";"segX")))) -> c | U19: c | V19: of:=HLOOKUP([.X19];[.$G$5:.$M$22];[.V14];0) -> X | W19: of:=[.X19]&T(ORG.OPENOFFICE.STYLE(IF([.V19]=1;"seg1";IF([.V19]=0;"seg0";"segX")))) -> e | X19: e | Y19: of:=HLOOKUP([.AA19];[.$G$5:.$M$22];[.V14];0) -> X | Z19: of:=[.AA19]&T(ORG.OPENOFFICE.STYLE(IF([.Y19]=1;"seg1";IF([.Y19]=0;"seg0";"segX")))) -> c | AA19: c | AB19: of:=HLOOKUP([.AD19];[.$G$5:.$M$22];[.AB14];0) -> X | AC19: of:=[.AD19]&T(ORG.OPENOFFICE.STYLE(IF([.AB19]=1;"seg1";IF([.AB19]=0;"seg0";"segX")))) -> e | AD19: e | AE19: of:=HLOOKUP([.AG19];[.$G$5:.$M$22];[.AB14];0) -> X | AF19: of:=[.AG19]&T(ORG.OPENOFFICE.STYLE(IF([.AE19]=1;"seg1";IF([.AE19]=0;"seg0";"segX")))) -> c | AG19: c | AH19: of:=HLOOKUP([.AJ19];[.$G$5:.$M$22];[.AH14];0) -> X | AI19: of:=[.AJ19]&T(ORG.OPENOFFICE.STYLE(IF([.AH19]=1;"seg1";IF([.AH19]=0;"seg0";"segX")))) -> e | AJ19: e | AK19: of:=HLOOKUP([.AM19];[.$G$5:.$M$22];[.AH14];0) -> X | AL19: of:=[.AM19]&T(ORG.OPENOFFICE.STYLE(IF([.AK19]=1;"seg1";IF([.AK19]=0;"seg0";"segX")))) -> c | AM19: c | AN19: of:=HLOOKUP([.AP19];[.$G$5:.$M$22];[.AN14];0) -> X | AO19: of:=[.AP19]&T(ORG.OPENOFFICE.STYLE(IF([.AN19]=1;"seg1";IF([.AN19]=0;"seg0";"segX")))) -> e | AP19: e | AQ19: of:=HLOOKUP([.AS19];[.$G$5:.$M$22];[.AN14];0) -> X | AR19: of:=[.AS19]&T(ORG.OPENOFFICE.STYLE(IF([.AQ19]=1;"seg1";IF([.AQ19]=0;"seg0";"segX")))) -> c | AS19: c | AT19: of:=HLOOKUP([.AV19];[.$G$5:.$M$22];[.AT14];0) -> X | AU19: of:=[.AV19]&T(ORG.OPENOFFICE.STYLE(IF([.AT19]=1;"seg1";IF([.AT19]=0;"seg0";"segX")))) -> e | AV19: e | AW19: of:=HLOOKUP([.AY19];[.$G$5:.$M$22];[.AT14];0) -> X | AX19: of:=[.AY19]&T(ORG.OPENOFFICE.STYLE(IF([.AW19]=1;"seg1";IF([.AW19]=0;"seg0";"segX")))) -> c | AY19: c | AZ19: of:=HLOOKUP([.BB19];[.$G$5:.$M$22];[.AZ14];0) -> X | BA19: of:=[.BB19]&T(ORG.OPENOFFICE.STYLE(IF([.AZ19]=1;"seg1";IF([.AZ19]=0;"seg0";"segX")))) -> e | BB19: e | BC19: of:=HLOOKUP([.BE19];[.$G$5:.$M$22];[.AZ14];0) -> X | BD19: of:=[.BE19]&T(ORG.OPENOFFICE.STYLE(IF([.BC19]=1;"seg1";IF([.BC19]=0;"seg0";"segX")))) -> c | BE19: c | BF19: of:=HLOOKUP([.BH19];[.$G$5:.$M$22];[.BF14];0) -> X | BG19: of:=[.BH19]&T(ORG.OPENOFFICE.STYLE(IF([.BF19]=1;"seg1";IF([.BF19]=0;"seg0";"segX")))) -> e | BH19: e | BI19: of:=HLOOKUP([.BK19];[.$G$5:.$M$22];[.BF14];0) -> X | BJ19: of:=[.BK19]&T(ORG.OPENOFFICE.STYLE(IF([.BI19]=1;"seg1";IF([.BI19]=0;"seg0";"segX")))) -> c | BK19: c
B20: of:=[.B19]+1 -> 13 | C20: of:=MOD(ROUNDDOWN([.$B20]/[.C$6]);2) -> 1 | D20: of:=MOD(ROUNDDOWN([.$B20]/[.D$6]);2) -> 1 | E20: of:=MOD(ROUNDDOWN([.$B20]/[.E$6]);2) -> 0 | F20: of:=MOD(ROUNDDOWN([.$B20]/[.F$6]);2) -> 1 | G20: X | H20: X | I20: X | J20: X | K20: X | L20: X | M20: X
B21: of:=[.B20]+1 -> 14 | C21: of:=MOD(ROUNDDOWN([.$B21]/[.C$6]);2) -> 1 | D21: of:=MOD(ROUNDDOWN([.$B21]/[.D$6]);2) -> 1 | E21: of:=MOD(ROUNDDOWN([.$B21]/[.E$6]);2) -> 1 | F21: of:=MOD(ROUNDDOWN([.$B21]/[.F$6]);2) -> 0 | G21: X | H21: X | I21: X | J21: X | K21: X | L21: X | M21: X | Q21: of:=HLOOKUP([.T21];[.$G$5:.$M$22];[.P14];0) -> X | R21: of:=[.T21]&T(ORG.OPENOFFICE.STYLE(IF([.Q21]=1;"seg1";IF([.Q21]=0;"seg0";"segX")))) -> d | T21: d | W21: of:=HLOOKUP([.Z21];[.$G$5:.$M$22];[.V14];0) -> X | X21: of:=[.Z21]&T(ORG.OPENOFFICE.STYLE(IF([.W21]=1;"seg1";IF([.W21]=0;"seg0";"segX")))) -> d | Z21: d | AC21: of:=HLOOKUP([.AF21];[.$G$5:.$M$22];[.AB14];0) -> X | AD21: of:=[.AF21]&T(ORG.OPENOFFICE.STYLE(IF([.AC21]=1;"seg1";IF([.AC21]=0;"seg0";"segX")))) -> d | AF21: d | AI21: of:=HLOOKUP([.AL21];[.$G$5:.$M$22];[.AH14];0) -> X | AJ21: of:=[.AL21]&T(ORG.OPENOFFICE.STYLE(IF([.AI21]=1;"seg1";IF([.AI21]=0;"seg0";"segX")))) -> d | AL21: d | AO21: of:=HLOOKUP([.AR21];[.$G$5:.$M$22];[.AN14];0) -> X | AP21: of:=[.AR21]&T(ORG.OPENOFFICE.STYLE(IF([.AO21]=1;"seg1";IF([.AO21]=0;"seg0";"segX")))) -> d | AR21: d | AU21: of:=HLOOKUP([.AX21];[.$G$5:.$M$22];[.AT14];0) -> X | AV21: of:=[.AX21]&T(ORG.OPENOFFICE.STYLE(IF([.AU21]=1;"seg1";IF([.AU21]=0;"seg0";"segX")))) -> d | AX21: d | BA21: of:=HLOOKUP([.BD21];[.$G$5:.$M$22];[.AZ14];0) -> X | BB21: of:=[.BD21]&T(ORG.OPENOFFICE.STYLE(IF([.BA21]=1;"seg1";IF([.BA21]=0;"seg0";"segX")))) -> d | BD21: d | BG21: of:=HLOOKUP([.BJ21];[.$G$5:.$M$22];[.BF14];0) -> X | BH21: of:=[.BJ21]&T(ORG.OPENOFFICE.STYLE(IF([.BG21]=1;"seg1";IF([.BG21]=0;"seg0";"segX")))) -> d | BJ21: d
B22: of:=[.B21]+1 -> 15 | C22: of:=MOD(ROUNDDOWN([.$B22]/[.C$6]);2) -> 1 | D22: of:=MOD(ROUNDDOWN([.$B22]/[.D$6]);2) -> 1 | E22: of:=MOD(ROUNDDOWN([.$B22]/[.E$6]);2) -> 1 | F22: of:=MOD(ROUNDDOWN([.$B22]/[.F$6]);2) -> 1 | G22: X | H22: X | I22: X | J22: X | K22: X | L22: X | M22: X
P24: Karnaugh-maps
P25: a | Q25: of:=MATCH([.P25];[.$G$5:.$M$5])+5 -> 6 | R25: BA | W25: b | X25: of:=MATCH([.W25];[.$G$5:.$M$5])+5 -> 7 | Y25: BA | AD25: c | AE25: of:=MATCH([.AD25];[.$G$5:.$M$5])+5 -> 8 | AF25: BA | AK25: d | AL25: of:=MATCH([.AK25];[.$G$5:.$M$5])+5 -> 9 | AM25: BA | AR25: e | AS25: of:=MATCH([.AR25];[.$G$5:.$M$5])+5 -> 10 | AT25: BA | AY25: f | AZ25: of:=MATCH([.AY25];[.$G$5:.$M$5])+5 -> 11 | BA25: BA | BF25: g | BG25: of:=MATCH([.BF25];[.$G$5:.$M$5])+5 -> 12 | BH25: BA
R26: 00 | S26: 01 | T26: 11 | U26: 10 | Y26: 00 | Z26: 01 | AA26: 11 | AB26: 10 | AF26: 00 | AG26: 01 | AH26: 11 | AI26: 10 | AM26: 00 | AN26: 01 | AO26: 11 | AP26: 10 | AT26: 00 | AU26: 01 | AV26: 11 | AW26: 10 | BA26: 00 | BB26: 01 | BC26: 11 | BD26: 10 | BH26: 00 | BI26: 01 | BJ26: 11 | BK26: 10
P27: DC | R27: of:=HLOOKUP(MID([.R25];1;1);[.$C$5:.$F$6];2;0)*MID([.R26];1;1) + HLOOKUP(MID([.R25];2;1);[.$C$5:.$F$6];2;0)*MID([.R26];2;1) -> 0 | S27: of:=HLOOKUP(MID([.R25];1;1);[.$C$5:.$F$6];2;0)*MID([.S26];1;1) + HLOOKUP(MID([.R25];2;1);[.$C$5:.$F$6];2;0)*MID([.S26];2;1) -> 1 | T27: of:=HLOOKUP(MID([.R25];1;1);[.$C$5:.$F$6];2;0)*MID([.T26];1;1) + HLOOKUP(MID([.R25];2;1);[.$C$5:.$F$6];2;0)*MID([.T26];2;1) -> 3 | U27: of:=HLOOKUP(MID([.R25];1;1);[.$C$5:.$F$6];2;0)*MID([.U26];1;1) + HLOOKUP(MID([.R25];2;1);[.$C$5:.$F$6];2;0)*MID([.U26];2;1) -> 2 | W27: DC | Y27: of:=HLOOKUP(MID([.Y25];1;1);[.$C$5:.$F$6];2;0)*MID([.Y26];1;1) + HLOOKUP(MID([.Y25];2;1);[.$C$5:.$F$6];2;0)*MID([.Y26];2;1) -> 0 | Z27: of:=HLOOKUP(MID([.Y25];1;1);[.$C$5:.$F$6];2;0)*MID([.Z26];1;1) + HLOOKUP(MID([.Y25];2;1);[.$C$5:.$F$6];2;0)*MID([.Z26];2;1) -> 1 | AA27: of:=HLOOKUP(MID([.Y25];1;1);[.$C$5:.$F$6];2;0)*MID([.AA26];1;1) + HLOOKUP(MID([.Y25];2;1);[.$C$5:.$F$6];2;0)*MID([.AA26];2;1) -> 3 | AB27: of:=HLOOKUP(MID([.Y25];1;1);[.$C$5:.$F$6];2;0)*MID([.AB26];1;1) + HLOOKUP(MID([.Y25];2;1);[.$C$5:.$F$6];2;0)*MID([.AB26];2;1) -> 2 | AD27: DC | AF27: of:=HLOOKUP(MID([.AF25];1;1);[.$C$5:.$F$6];2;0)*MID([.AF26];1;1) + HLOOKUP(MID([.AF25];2;1);[.$C$5:.$F$6];2;0)*MID([.AF26];2;1) -> 0 | AG27: of:=HLOOKUP(MID([.AF25];1;1);[.$C$5:.$F$6];2;0)*MID([.AG26];1;1) + HLOOKUP(MID([.AF25];2;1);[.$C$5:.$F$6];2;0)*MID([.AG26];2;1) -> 1 | AH27: of:=HLOOKUP(MID([.AF25];1;1);[.$C$5:.$F$6];2;0)*MID([.AH26];1;1) + HLOOKUP(MID([.AF25];2;1);[.$C$5:.$F$6];2;0)*MID([.AH26];2;1) -> 3 | AI27: of:=HLOOKUP(MID([.AF25];1;1);[.$C$5:.$F$6];2;0)*MID([.AI26];1;1) + HLOOKUP(MID([.AF25];2;1);[.$C$5:.$F$6];2;0)*MID([.AI26];2;1) -> 2 | AK27: DC | AM27: of:=HLOOKUP(MID([.AM25];1;1);[.$C$5:.$F$6];2;0)*MID([.AM26];1;1) + HLOOKUP(MID([.AM25];2;1);[.$C$5:.$F$6];2;0)*MID([.AM26];2;1) -> 0 | AN27: of:=HLOOKUP(MID([.AM25];1;1);[.$C$5:.$F$6];2;0)*MID([.AN26];1;1) + HLOOKUP(MID([.AM25];2;1);[.$C$5:.$F$6];2;0)*MID([.AN26];2;1) -> 1 | AO27: of:=HLOOKUP(MID([.AM25];1;1);[.$C$5:.$F$6];2;0)*MID([.AO26];1;1) + HLOOKUP(MID([.AM25];2;1);[.$C$5:.$F$6];2;0)*MID([.AO26];2;1) -> 3 | AP27: of:=HLOOKUP(MID([.AM25];1;1);[.$C$5:.$F$6];2;0)*MID([.AP26];1;1) + HLOOKUP(MID([.AM25];2;1);[.$C$5:.$F$6];2;0)*MID([.AP26];2;1) -> 2 | AR27: DC | AT27: of:=HLOOKUP(MID([.AT25];1;1);[.$C$5:.$F$6];2;0)*MID([.AT26];1;1) + HLOOKUP(MID([.AT25];2;1);[.$C$5:.$F$6];2;0)*MID([.AT26];2;1) -> 0 | AU27: of:=HLOOKUP(MID([.AT25];1;1);[.$C$5:.$F$6];2;0)*MID([.AU26];1;1) + HLOOKUP(MID([.AT25];2;1);[.$C$5:.$F$6];2;0)*MID([.AU26];2;1) -> 1 | AV27: of:=HLOOKUP(MID([.AT25];1;1);[.$C$5:.$F$6];2;0)*MID([.AV26];1;1) + HLOOKUP(MID([.AT25];2;1);[.$C$5:.$F$6];2;0)*MID([.AV26];2;1) -> 3 | AW27: of:=HLOOKUP(MID([.AT25];1;1);[.$C$5:.$F$6];2;0)*MID([.AW26];1;1) + HLOOKUP(MID([.AT25];2;1);[.$C$5:.$F$6];2;0)*MID([.AW26];2;1) -> 2 | AY27: DC | BA27: of:=HLOOKUP(MID([.BA25];1;1);[.$C$5:.$F$6];2;0)*MID([.BA26];1;1) + HLOOKUP(MID([.BA25];2;1);[.$C$5:.$F$6];2;0)*MID([.BA26];2;1) -> 0 | BB27: of:=HLOOKUP(MID([.BA25];1;1);[.$C$5:.$F$6];2;0)*MID([.BB26];1;1) + HLOOKUP(MID([.BA25];2;1);[.$C$5:.$F$6];2;0)*MID([.BB26];2;1) -> 1 | BC27: of:=HLOOKUP(MID([.BA25];1;1);[.$C$5:.$F$6];2;0)*MID([.BC26];1;1) + HLOOKUP(MID([.BA25];2;1);[.$C$5:.$F$6];2;0)*MID([.BC26];2;1) -> 3 | BD27: of:=HLOOKUP(MID([.BA25];1;1);[.$C$5:.$F$6];2;0)*MID([.BD26];1;1) + HLOOKUP(MID([.BA25];2;1);[.$C$5:.$F$6];2;0)*MID([.BD26];2;1) -> 2 | BF27: DC | BH27: of:=HLOOKUP(MID([.BH25];1;1);[.$C$5:.$F$6];2;0)*MID([.BH26];1;1) + HLOOKUP(MID([.BH25];2;1);[.$C$5:.$F$6];2;0)*MID([.BH26];2;1) -> 0 | BI27: of:=HLOOKUP(MID([.BH25];1;1);[.$C$5:.$F$6];2;0)*MID([.BI26];1;1) + HLOOKUP(MID([.BH25];2;1);[.$C$5:.$F$6];2;0)*MID([.BI26];2;1) -> 1 | BJ27: of:=HLOOKUP(MID([.BH25];1;1);[.$C$5:.$F$6];2;0)*MID([.BJ26];1;1) + HLOOKUP(MID([.BH25];2;1);[.$C$5:.$F$6];2;0)*MID([.BJ26];2;1) -> 3 | BK27: of:=HLOOKUP(MID([.BH25];1;1);[.$C$5:.$F$6];2;0)*MID([.BK26];1;1) + HLOOKUP(MID([.BH25];2;1);[.$C$5:.$F$6];2;0)*MID([.BK26];2;1) -> 2
P28: 00 | Q28: of:=HLOOKUP(MID([.P27];1;1);[.$C$5:.$F$6];2;0)*MID([.P28];1;1) + HLOOKUP(MID([.P27];2;1);[.$C$5:.$F$6];2;0)*MID([.P28];2;1) -> 0 | R28: of:=VLOOKUP([.Q28]+[.R27];[.$B$7:.$M$22];[.Q25]) -> 1 | S28: of:=VLOOKUP([.Q28]+[.S27];[.$B$7:.$M$22];[.Q25]) -> 0 | T28: of:=VLOOKUP([.Q28]+[.T27];[.$B$7:.$M$22];[.Q25]) -> 1 | U28: of:=VLOOKUP([.Q28]+[.U27];[.$B$7:.$M$22];[.Q25]) -> 1 | W28: 00 | X28: of:=HLOOKUP(MID([.W27];1;1);[.$C$5:.$F$6];2;0)*MID([.W28];1;1) + HLOOKUP(MID([.W27];2;1);[.$C$5:.$F$6];2;0)*MID([.W28];2;1) -> 0 | Y28: of:=VLOOKUP([.X28]+[.Y27];[.$B$7:.$M$22];[.X25]) -> 1 | Z28: of:=VLOOKUP([.X28]+[.Z27];[.$B$7:.$M$22];[.X25]) -> 1 | AA28: of:=VLOOKUP([.X28]+[.AA27];[.$B$7:.$M$22];[.X25]) -> 1 | AB28: of:=VLOOKUP([.X28]+[.AB27];[.$B$7:.$M$22];[.X25]) -> 1 | AD28: 00 | AE28: of:=HLOOKUP(MID([.AD27];1;1);[.$C$5:.$F$6];2;0)*MID([.AD28];1;1) + HLOOKUP(MID([.AD27];2;1);[.$C$5:.$F$6];2;0)*MID([.AD28];2;1) -> 0 | AF28: of:=VLOOKUP([.AE28]+[.AF27];[.$B$7:.$M$22];[.AE25]) -> 1 | AG28: of:=VLOOKUP([.AE28]+[.AG27];[.$B$7:.$M$22];[.AE25]) -> 1 | AH28: of:=VLOOKUP([.AE28]+[.AH27];[.$B$7:.$M$22];[.AE25]) -> 1 | AI28: of:=VLOOKUP([.AE28]+[.AI27];[.$B$7:.$M$22];[.AE25]) -> 0 | AK28: 00 | AL28: of:=HLOOKUP(MID([.AK27];1;1);[.$C$5:.$F$6];2;0)*MID([.AK28];1;1) + HLOOKUP(MID([.AK27];2;1);[.$C$5:.$F$6];2;0)*MID([.AK28];2;1) -> 0 | AM28: of:=VLOOKUP([.AL28]+[.AM27];[.$B$7:.$M$22];[.AL25]) -> 1 | AN28: of:=VLOOKUP([.AL28]+[.AN27];[.$B$7:.$M$22];[.AL25]) -> 0 | AO28: of:=VLOOKUP([.AL28]+[.AO27];[.$B$7:.$M$22];[.AL25]) -> 1 | AP28: of:=VLOOKUP([.AL28]+[.AP27];[.$B$7:.$M$22];[.AL25]) -> 1 | AR28: 00 | AS28: of:=HLOOKUP(MID([.AR27];1;1);[.$C$5:.$F$6];2;0)*MID([.AR28];1;1) + HLOOKUP(MID([.AR27];2;1);[.$C$5:.$F$6];2;0)*MID([.AR28];2;1) -> 0 | AT28: of:=VLOOKUP([.AS28]+[.AT27];[.$B$7:.$M$22];[.AS25]) -> 1 | AU28: of:=VLOOKUP([.AS28]+[.AU27];[.$B$7:.$M$22];[.AS25]) -> 0 | AV28: of:=VLOOKUP([.AS28]+[.AV27];[.$B$7:.$M$22];[.AS25]) -> 0 | AW28: of:=VLOOKUP([.AS28]+[.AW27];[.$B$7:.$M$22];[.AS25]) -> 1 | AY28: 00 | AZ28: of:=HLOOKUP(MID([.AY27];1;1);[.$C$5:.$F$6];2;0)*MID([.AY28];1;1) + HLOOKUP(MID([.AY27];2;1);[.$C$5:.$F$6];2;0)*MID([.AY28];2;1) -> 0 | BA28: of:=VLOOKUP([.AZ28]+[.BA27];[.$B$7:.$M$22];[.AZ25]) -> 1 | BB28: of:=VLOOKUP([.AZ28]+[.BB27];[.$B$7:.$M$22];[.AZ25]) -> 0 | BC28: of:=VLOOKUP([.AZ28]+[.BC27];[.$B$7:.$M$22];[.AZ25]) -> 0 | BD28: of:=VLOOKUP([.AZ28]+[.BD27];[.$B$7:.$M$22];[.AZ25]) -> 0 | BF28: 00 | BG28: of:=HLOOKUP(MID([.BF27];1;1);[.$C$5:.$F$6];2;0)*MID([.BF28];1;1) + HLOOKUP(MID([.BF27];2;1);[.$C$5:.$F$6];2;0)*MID([.BF28];2;1) -> 0 | BH28: of:=VLOOKUP([.BG28]+[.BH27];[.$B$7:.$M$22];[.BG25]) -> 0 | BI28: of:=VLOOKUP([.BG28]+[.BI27];[.$B$7:.$M$22];[.BG25]) -> 0 | BJ28: of:=VLOOKUP([.BG28]+[.BJ27];[.$B$7:.$M$22];[.BG25]) -> 1 | BK28: of:=VLOOKUP([.BG28]+[.BK27];[.$B$7:.$M$22];[.BG25]) -> 1
P29: 01 | Q29: of:=HLOOKUP(MID([.P27];1;1);[.$C$5:.$F$6];2;0)*MID([.P29];1;1) + HLOOKUP(MID([.P27];2;1);[.$C$5:.$F$6];2;0)*MID([.P29];2;1) -> 4 | R29: of:=VLOOKUP([.Q29]+[.R27];[.$B$7:.$M$22];[.Q25]) -> 0 | S29: of:=VLOOKUP([.Q29]+[.S27];[.$B$7:.$M$22];[.Q25]) -> 1 | T29: of:=VLOOKUP([.Q29]+[.T27];[.$B$7:.$M$22];[.Q25]) -> 1 | U29: of:=VLOOKUP([.Q29]+[.U27];[.$B$7:.$M$22];[.Q25]) -> 1 | W29: 01 | X29: of:=HLOOKUP(MID([.W27];1;1);[.$C$5:.$F$6];2;0)*MID([.W29];1;1) + HLOOKUP(MID([.W27];2;1);[.$C$5:.$F$6];2;0)*MID([.W29];2;1) -> 4 | Y29: of:=VLOOKUP([.X29]+[.Y27];[.$B$7:.$M$22];[.X25]) -> 1 | Z29: of:=VLOOKUP([.X29]+[.Z27];[.$B$7:.$M$22];[.X25]) -> 0 | AA29: of:=VLOOKUP([.X29]+[.AA27];[.$B$7:.$M$22];[.X25]) -> 1 | AB29: of:=VLOOKUP([.X29]+[.AB27];[.$B$7:.$M$22];[.X25]) -> 0 | AD29: 01 | AE29: of:=HLOOKUP(MID([.AD27];1;1);[.$C$5:.$F$6];2;0)*MID([.AD29];1;1) + HLOOKUP(MID([.AD27];2;1);[.$C$5:.$F$6];2;0)*MID([.AD29];2;1) -> 4 | AF29: of:=VLOOKUP([.AE29]+[.AF27];[.$B$7:.$M$22];[.AE25]) -> 1 | AG29: of:=VLOOKUP([.AE29]+[.AG27];[.$B$7:.$M$22];[.AE25]) -> 1 | AH29: of:=VLOOKUP([.AE29]+[.AH27];[.$B$7:.$M$22];[.AE25]) -> 1 | AI29: of:=VLOOKUP([.AE29]+[.AI27];[.$B$7:.$M$22];[.AE25]) -> 1 | AK29: 01 | AL29: of:=HLOOKUP(MID([.AK27];1;1);[.$C$5:.$F$6];2;0)*MID([.AK29];1;1) + HLOOKUP(MID([.AK27];2;1);[.$C$5:.$F$6];2;0)*MID([.AK29];2;1) -> 4 | AM29: of:=VLOOKUP([.AL29]+[.AM27];[.$B$7:.$M$22];[.AL25]) -> 0 | AN29: of:=VLOOKUP([.AL29]+[.AN27];[.$B$7:.$M$22];[.AL25]) -> 1 | AO29: of:=VLOOKUP([.AL29]+[.AO27];[.$B$7:.$M$22];[.AL25]) -> 0 | AP29: of:=VLOOKUP([.AL29]+[.AP27];[.$B$7:.$M$22];[.AL25]) -> 1 | AR29: 01 | AS29: of:=HLOOKUP(MID([.AR27];1;1);[.$C$5:.$F$6];2;0)*MID([.AR29];1;1) + HLOOKUP(MID([.AR27];2;1);[.$C$5:.$F$6];2;0)*MID([.AR29];2;1) -> 4 | AT29: of:=VLOOKUP([.AS29]+[.AT27];[.$B$7:.$M$22];[.AS25]) -> 0 | AU29: of:=VLOOKUP([.AS29]+[.AU27];[.$B$7:.$M$22];[.AS25]) -> 0 | AV29: of:=VLOOKUP([.AS29]+[.AV27];[.$B$7:.$M$22];[.AS25]) -> 0 | AW29: of:=VLOOKUP([.AS29]+[.AW27];[.$B$7:.$M$22];[.AS25]) -> 1 | AY29: 01 | AZ29: of:=HLOOKUP(MID([.AY27];1;1);[.$C$5:.$F$6];2;0)*MID([.AY29];1;1) + HLOOKUP(MID([.AY27];2;1);[.$C$5:.$F$6];2;0)*MID([.AY29];2;1) -> 4 | BA29: of:=VLOOKUP([.AZ29]+[.BA27];[.$B$7:.$M$22];[.AZ25]) -> 1 | BB29: of:=VLOOKUP([.AZ29]+[.BB27];[.$B$7:.$M$22];[.AZ25]) -> 1 | BC29: of:=VLOOKUP([.AZ29]+[.BC27];[.$B$7:.$M$22];[.AZ25]) -> 0 | BD29: of:=VLOOKUP([.AZ29]+[.BD27];[.$B$7:.$M$22];[.AZ25]) -> 1 | BF29: 01 | BG29: of:=HLOOKUP(MID([.BF27];1;1);[.$C$5:.$F$6];2;0)*MID([.BF29];1;1) + HLOOKUP(MID([.BF27];2;1);[.$C$5:.$F$6];2;0)*MID([.BF29];2;1) -> 4 | BH29: of:=VLOOKUP([.BG29]+[.BH27];[.$B$7:.$M$22];[.BG25]) -> 1 | BI29: of:=VLOOKUP([.BG29]+[.BI27];[.$B$7:.$M$22];[.BG25]) -> 1 | BJ29: of:=VLOOKUP([.BG29]+[.BJ27];[.$B$7:.$M$22];[.BG25]) -> 0 | BK29: of:=VLOOKUP([.BG29]+[.BK27];[.$B$7:.$M$22];[.BG25]) -> 1
P30: 11 | Q30: of:=HLOOKUP(MID([.P27];1;1);[.$C$5:.$F$6];2;0)*MID([.P30];1;1) + HLOOKUP(MID([.P27];2;1);[.$C$5:.$F$6];2;0)*MID([.P30];2;1) -> 12 | R30: of:=VLOOKUP([.Q30]+[.R27];[.$B$7:.$M$22];[.Q25]) -> X | S30: of:=VLOOKUP([.Q30]+[.S27];[.$B$7:.$M$22];[.Q25]) -> X | T30: of:=VLOOKUP([.Q30]+[.T27];[.$B$7:.$M$22];[.Q25]) -> X | U30: of:=VLOOKUP([.Q30]+[.U27];[.$B$7:.$M$22];[.Q25]) -> X | W30: 11 | X30: of:=HLOOKUP(MID([.W27];1;1);[.$C$5:.$F$6];2;0)*MID([.W30];1;1) + HLOOKUP(MID([.W27];2;1);[.$C$5:.$F$6];2;0)*MID([.W30];2;1) -> 12 | Y30: of:=VLOOKUP([.X30]+[.Y27];[.$B$7:.$M$22];[.X25]) -> X | Z30: of:=VLOOKUP([.X30]+[.Z27];[.$B$7:.$M$22];[.X25]) -> X | AA30: of:=VLOOKUP([.X30]+[.AA27];[.$B$7:.$M$22];[.X25]) -> X | AB30: of:=VLOOKUP([.X30]+[.AB27];[.$B$7:.$M$22];[.X25]) -> X | AD30: 11 | AE30: of:=HLOOKUP(MID([.AD27];1;1);[.$C$5:.$F$6];2;0)*MID([.AD30];1;1) + HLOOKUP(MID([.AD27];2;1);[.$C$5:.$F$6];2;0)*MID([.AD30];2;1) -> 12 | AF30: of:=VLOOKUP([.AE30]+[.AF27];[.$B$7:.$M$22];[.AE25]) -> X | AG30: of:=VLOOKUP([.AE30]+[.AG27];[.$B$7:.$M$22];[.AE25]) -> X | AH30: of:=VLOOKUP([.AE30]+[.AH27];[.$B$7:.$M$22];[.AE25]) -> X | AI30: of:=VLOOKUP([.AE30]+[.AI27];[.$B$7:.$M$22];[.AE25]) -> X | AK30: 11 | AL30: of:=HLOOKUP(MID([.AK27];1;1);[.$C$5:.$F$6];2;0)*MID([.AK30];1;1) + HLOOKUP(MID([.AK27];2;1);[.$C$5:.$F$6];2;0)*MID([.AK30];2;1) -> 12 | AM30: of:=VLOOKUP([.AL30]+[.AM27];[.$B$7:.$M$22];[.AL25]) -> X | AN30: of:=VLOOKUP([.AL30]+[.AN27];[.$B$7:.$M$22];[.AL25]) -> X | AO30: of:=VLOOKUP([.AL30]+[.AO27];[.$B$7:.$M$22];[.AL25]) -> X | AP30: of:=VLOOKUP([.AL30]+[.AP27];[.$B$7:.$M$22];[.AL25]) -> X | AR30: 11 | AS30: of:=HLOOKUP(MID([.AR27];1;1);[.$C$5:.$F$6];2;0)*MID([.AR30];1;1) + HLOOKUP(MID([.AR27];2;1);[.$C$5:.$F$6];2;0)*MID([.AR30];2;1) -> 12 | AT30: of:=VLOOKUP([.AS30]+[.AT27];[.$B$7:.$M$22];[.AS25]) -> X | AU30: of:=VLOOKUP([.AS30]+[.AU27];[.$B$7:.$M$22];[.AS25]) -> X | AV30: of:=VLOOKUP([.AS30]+[.AV27];[.$B$7:.$M$22];[.AS25]) -> X | AW30: of:=VLOOKUP([.AS30]+[.AW27];[.$B$7:.$M$22];[.AS25]) -> X | AY30: 11 | AZ30: of:=HLOOKUP(MID([.AY27];1;1);[.$C$5:.$F$6];2;0)*MID([.AY30];1;1) + HLOOKUP(MID([.AY27];2;1);[.$C$5:.$F$6];2;0)*MID([.AY30];2;1) -> 12 | BA30: of:=VLOOKUP([.AZ30]+[.BA27];[.$B$7:.$M$22];[.AZ25]) -> X | BB30: of:=VLOOKUP([.AZ30]+[.BB27];[.$B$7:.$M$22];[.AZ25]) -> X | BC30: of:=VLOOKUP([.AZ30]+[.BC27];[.$B$7:.$M$22];[.AZ25]) -> X | BD30: of:=VLOOKUP([.AZ30]+[.BD27];[.$B$7:.$M$22];[.AZ25]) -> X | BF30: 11 | BG30: of:=HLOOKUP(MID([.BF27];1;1);[.$C$5:.$F$6];2;0)*MID([.BF30];1;1) + HLOOKUP(MID([.BF27];2;1);[.$C$5:.$F$6];2;0)*MID([.BF30];2;1) -> 12 | BH30: of:=VLOOKUP([.BG30]+[.BH27];[.$B$7:.$M$22];[.BG25]) -> X | BI30: of:=VLOOKUP([.BG30]+[.BI27];[.$B$7:.$M$22];[.BG25]) -> X | BJ30: of:=VLOOKUP([.BG30]+[.BJ27];[.$B$7:.$M$22];[.BG25]) -> X | BK30: of:=VLOOKUP([.BG30]+[.BK27];[.$B$7:.$M$22];[.BG25]) -> X
P31: 10 | Q31: of:=HLOOKUP(MID([.P27];1;1);[.$C$5:.$F$6];2;0)*MID([.P31];1;1) + HLOOKUP(MID([.P27];2;1);[.$C$5:.$F$6];2;0)*MID([.P31];2;1) -> 8 | R31: of:=VLOOKUP([.Q31]+[.R27];[.$B$7:.$M$22];[.Q25]) -> X | S31: of:=VLOOKUP([.Q31]+[.S27];[.$B$7:.$M$22];[.Q25]) -> X | T31: of:=VLOOKUP([.Q31]+[.T27];[.$B$7:.$M$22];[.Q25]) -> X | U31: of:=VLOOKUP([.Q31]+[.U27];[.$B$7:.$M$22];[.Q25]) -> X | W31: 10 | X31: of:=HLOOKUP(MID([.W27];1;1);[.$C$5:.$F$6];2;0)*MID([.W31];1;1) + HLOOKUP(MID([.W27];2;1);[.$C$5:.$F$6];2;0)*MID([.W31];2;1) -> 8 | Y31: of:=VLOOKUP([.X31]+[.Y27];[.$B$7:.$M$22];[.X25]) -> X | Z31: of:=VLOOKUP([.X31]+[.Z27];[.$B$7:.$M$22];[.X25]) -> X | AA31: of:=VLOOKUP([.X31]+[.AA27];[.$B$7:.$M$22];[.X25]) -> X | AB31: of:=VLOOKUP([.X31]+[.AB27];[.$B$7:.$M$22];[.X25]) -> X | AD31: 10 | AE31: of:=HLOOKUP(MID([.AD27];1;1);[.$C$5:.$F$6];2;0)*MID([.AD31];1;1) + HLOOKUP(MID([.AD27];2;1);[.$C$5:.$F$6];2;0)*MID([.AD31];2;1) -> 8 | AF31: of:=VLOOKUP([.AE31]+[.AF27];[.$B$7:.$M$22];[.AE25]) -> X | AG31: of:=VLOOKUP([.AE31]+[.AG27];[.$B$7:.$M$22];[.AE25]) -> X | AH31: of:=VLOOKUP([.AE31]+[.AH27];[.$B$7:.$M$22];[.AE25]) -> X | AI31: of:=VLOOKUP([.AE31]+[.AI27];[.$B$7:.$M$22];[.AE25]) -> X | AK31: 10 | AL31: of:=HLOOKUP(MID([.AK27];1;1);[.$C$5:.$F$6];2;0)*MID([.AK31];1;1) + HLOOKUP(MID([.AK27];2;1);[.$C$5:.$F$6];2;0)*MID([.AK31];2;1) -> 8 | AM31: of:=VLOOKUP([.AL31]+[.AM27];[.$B$7:.$M$22];[.AL25]) -> X | AN31: of:=VLOOKUP([.AL31]+[.AN27];[.$B$7:.$M$22];[.AL25]) -> X | AO31: of:=VLOOKUP([.AL31]+[.AO27];[.$B$7:.$M$22];[.AL25]) -> X | AP31: of:=VLOOKUP([.AL31]+[.AP27];[.$B$7:.$M$22];[.AL25]) -> X | AR31: 10 | AS31: of:=HLOOKUP(MID([.AR27];1;1);[.$C$5:.$F$6];2;0)*MID([.AR31];1;1) + HLOOKUP(MID([.AR27];2;1);[.$C$5:.$F$6];2;0)*MID([.AR31];2;1) -> 8 | AT31: of:=VLOOKUP([.AS31]+[.AT27];[.$B$7:.$M$22];[.AS25]) -> X | AU31: of:=VLOOKUP([.AS31]+[.AU27];[.$B$7:.$M$22];[.AS25]) -> X | AV31: of:=VLOOKUP([.AS31]+[.AV27];[.$B$7:.$M$22];[.AS25]) -> X | AW31: of:=VLOOKUP([.AS31]+[.AW27];[.$B$7:.$M$22];[.AS25]) -> X | AY31: 10 | AZ31: of:=HLOOKUP(MID([.AY27];1;1);[.$C$5:.$F$6];2;0)*MID([.AY31];1;1) + HLOOKUP(MID([.AY27];2;1);[.$C$5:.$F$6];2;0)*MID([.AY31];2;1) -> 8 | BA31: of:=VLOOKUP([.AZ31]+[.BA27];[.$B$7:.$M$22];[.AZ25]) -> X | BB31: of:=VLOOKUP([.AZ31]+[.BB27];[.$B$7:.$M$22];[.AZ25]) -> X | BC31: of:=VLOOKUP([.AZ31]+[.BC27];[.$B$7:.$M$22];[.AZ25]) -> X | BD31: of:=VLOOKUP([.AZ31]+[.BD27];[.$B$7:.$M$22];[.AZ25]) -> X | BF31: 10 | BG31: of:=HLOOKUP(MID([.BF27];1;1);[.$C$5:.$F$6];2;0)*MID([.BF31];1;1) + HLOOKUP(MID([.BF27];2;1);[.$C$5:.$F$6];2;0)*MID([.BF31];2;1) -> 8 | BH31: of:=VLOOKUP([.BG31]+[.BH27];[.$B$7:.$M$22];[.BG25]) -> X | BI31: of:=VLOOKUP([.BG31]+[.BI27];[.$B$7:.$M$22];[.BG25]) -> X | BJ31: of:=VLOOKUP([.BG31]+[.BJ27];[.$B$7:.$M$22];[.BG25]) -> X | BK31: of:=VLOOKUP([.BG31]+[.BK27];[.$B$7:.$M$22];[.BG25]) -> X
N32: 1 | O32: F
N33: 2 | O33: G | P33: G = µ C B -A | AK33: G = µ C B -A | AY33: G = µ C B -A
N34: 3 | O34: H | P34: H = µ -C B A | AK34: H = µ -C B A | AR34: H = µ -C B A
N35: 4 | O35: I
N36: 5 | O36: J | W36: J = µ -C -B A
N37: 6 | O37: K | W37: K = µ -C B -A
N38: 7 | O38: L
N39: 8 | O39: M
N40: 9 | O40: N | AD40: N = µ C -B A | AY40: N = µ C -B A
N41: 10 | O41: O
N42: 11 | O42: P | AK42: P = µ -C -B -A | BF42: P = µ -C -B -A
N43: 12 | O43: Q | AR43: Q = A
N44: 13 | O44: R | AY44: R = µ -B -A
N45: 14 | O45: S | BF45: S = µ C B
N46: 15 | O46: T
I47: Inv. Inputs | P47: a = µ G H | W47: b = µ J K | AD47: c = -N | AK47: d = µ G H P | AR47: e = µ H A | AY47: f = µ G N R | BF47: g = µ P S | BL47: total
E48: transistors: | I48: 3 | P48: 8 | W48: 8 | AD48: 4 | AK48: 6 | AR48: 2 | AY48: 5 | BF48: 4 | BL48: of:=SUM([.I48:.BK48]) -> 40 | BN48: transistors
E49: gates: | I49: 3 | P49: 3 | W49: 3 | AD49: 2 | AK49: 2 | AR49: 1 | AY49: 2 | BF49: 2 | BL49: of:=SUM([.I49:.BK49]) -> 18 | BN49: gates

Sheet: digits 0-5
B1: 3 bit to 7-segment, digits 0-5
B2: Truth table | P2: 7-segment display as defined by truth table
P3: 0 | V3: of:=[.P3]+1 -> 1 | AB3: of:=[.V3]+1 -> 2 | AH3: of:=[.AB3]+1 -> 3 | AN3: of:=[.AH3]+1 -> 4 | AT3: of:=[.AN3]+1 -> 5 | AZ3: of:=[.AT3]+1 -> 6 | BF3: of:=[.AZ3]+1 -> 7
B4: Inputs | G4: Outputs | P4: of:=MATCH([.P3];[.$B$7:.$B$22];0)+2 -> 3 | V4: of:=MATCH([.V3];[.$B$7:.$B$22];0)+2 -> 4 | AB4: of:=MATCH([.AB3];[.$B$7:.$B$22];0)+2 -> 5 | AH4: of:=MATCH([.AH3];[.$B$7:.$B$22];0)+2 -> 6 | AN4: of:=MATCH([.AN3];[.$B$7:.$B$22];0)+2 -> 7 | AT4: of:=MATCH([.AT3];[.$B$7:.$B$22];0)+2 -> 8 | AZ4: of:=MATCH([.AZ3];[.$B$7:.$B$22];0)+2 -> 9 | BF4: of:=MATCH([.BF3];[.$B$7:.$B$22];0)+2 -> 10
B5: # | C5: D | D5: C | E5: B | F5: A | G5: a | H5: b | I5: c | J5: d | K5: e | L5: f | M5: g | Q5: of:=HLOOKUP([.T5];[.$G$5:.$M$22];[.P4];0) -> 1 | R5: of:=[.T5]&T(ORG.OPENOFFICE.STYLE(IF([.Q5]=1;"seg1";IF([.Q5]=0;"seg0";"segX")))) -> a | T5: a | W5: of:=HLOOKUP([.Z5];[.$G$5:.$M$22];[.V4];0) -> 0 | X5: of:=[.Z5]&T(ORG.OPENOFFICE.STYLE(IF([.W5]=1;"seg1";IF([.W5]=0;"seg0";"segX")))) -> a | Z5: a | AC5: of:=HLOOKUP([.AF5];[.$G$5:.$M$22];[.AB4];0) -> 1 | AD5: of:=[.AF5]&T(ORG.OPENOFFICE.STYLE(IF([.AC5]=1;"seg1";IF([.AC5]=0;"seg0";"segX")))) -> a | AF5: a | AI5: of:=HLOOKUP([.AL5];[.$G$5:.$M$22];[.AH4];0) -> 1 | AJ5: of:=[.AL5]&T(ORG.OPENOFFICE.STYLE(IF([.AI5]=1;"seg1";IF([.AI5]=0;"seg0";"segX")))) -> a | AL5: a | AO5: of:=HLOOKUP([.AR5];[.$G$5:.$M$22];[.AN4];0) -> 0 | AP5: of:=[.AR5]&T(ORG.OPENOFFICE.STYLE(IF([.AO5]=1;"seg1";IF([.AO5]=0;"seg0";"segX")))) -> a | AR5: a | AU5: of:=HLOOKUP([.AX5];[.$G$5:.$M$22];[.AT4];0) -> 1 | AV5: of:=[.AX5]&T(ORG.OPENOFFICE.STYLE(IF([.AU5]=1;"seg1";IF([.AU5]=0;"seg0";"segX")))) -> a | AX5: a | BA5: of:=HLOOKUP([.BD5];[.$G$5:.$M$22];[.AZ4];0) -> X | BB5: of:=[.BD5]&T(ORG.OPENOFFICE.STYLE(IF([.BA5]=1;"seg1";IF([.BA5]=0;"seg0";"segX")))) -> a | BD5: a | BG5: of:=HLOOKUP([.BJ5];[.$G$5:.$M$22];[.BF4];0) -> X | BH5: of:=[.BJ5]&T(ORG.OPENOFFICE.STYLE(IF([.BG5]=1;"seg1";IF([.BG5]=0;"seg0";"segX")))) -> a | BJ5: a
C6: 8 | D6: 4 | E6: 2 | F6: 1 | P6: of:=HLOOKUP([.R6];[.$G$5:.$M$22];[.P4];0) -> 1 | Q6: of:=[.R6]&T(ORG.OPENOFFICE.STYLE(IF([.P6]=1;"seg1";IF([.P6]=0;"seg0";"segX")))) -> f | R6: f | S6: of:=HLOOKUP([.U6];[.$G$5:.$M$22];[.P4];0) -> 1 | T6: of:=[.U6]&T(ORG.OPENOFFICE.STYLE(IF([.S6]=1;"seg1";IF([.S6]=0;"seg0";"segX")))) -> b | U6: b | V6: of:=HLOOKUP([.X6];[.$G$5:.$M$22];[.V4];0) -> 0 | W6: of:=[.X6]&T(ORG.OPENOFFICE.STYLE(IF([.V6]=1;"seg1";IF([.V6]=0;"seg0";"segX")))) -> f | X6: f | Y6: of:=HLOOKUP([.AA6];[.$G$5:.$M$22];[.V4];0) -> 1 | Z6: of:=[.AA6]&T(ORG.OPENOFFICE.STYLE(IF([.Y6]=1;"seg1";IF([.Y6]=0;"seg0";"segX")))) -> b | AA6: b | AB6: of:=HLOOKUP([.AD6];[.$G$5:.$M$22];[.AB4];0) -> 0 | AC6: of:=[.AD6]&T(ORG.OPENOFFICE.STYLE(IF([.AB6]=1;"seg1";IF([.AB6]=0;"seg0";"segX")))) -> f | AD6: f | AE6: of:=HLOOKUP([.AG6];[.$G$5:.$M$22];[.AB4];0) -> 1 | AF6: of:=[.AG6]&T(ORG.OPENOFFICE.STYLE(IF([.AE6]=1;"seg1";IF([.AE6]=0;"seg0";"segX")))) -> b | AG6: b | AH6: of:=HLOOKUP([.AJ6];[.$G$5:.$M$22];[.AH4];0) -> 0 | AI6: of:=[.AJ6]&T(ORG.OPENOFFICE.STYLE(IF([.AH6]=1;"seg1";IF([.AH6]=0;"seg0";"segX")))) -> f | AJ6: f | AK6: of:=HLOOKUP([.AM6];[.$G$5:.$M$22];[.AH4];0) -> 1 | AL6: of:=[.AM6]&T(ORG.OPENOFFICE.STYLE(IF([.AK6]=1;"seg1";IF([.AK6]=0;"seg0";"segX")))) -> b | AM6: b | AN6: of:=HLOOKUP([.AP6];[.$G$5:.$M$22];[.AN4];0) -> 1 | AO6: of:=[.AP6]&T(ORG.OPENOFFICE.STYLE(IF([.AN6]=1;"seg1";IF([.AN6]=0;"seg0";"segX")))) -> f | AP6: f | AQ6: of:=HLOOKUP([.AS6];[.$G$5:.$M$22];[.AN4];0) -> 1 | AR6: of:=[.AS6]&T(ORG.OPENOFFICE.STYLE(IF([.AQ6]=1;"seg1";IF([.AQ6]=0;"seg0";"segX")))) -> b | AS6: b | AT6: of:=HLOOKUP([.AV6];[.$G$5:.$M$22];[.AT4];0) -> 1 | AU6: of:=[.AV6]&T(ORG.OPENOFFICE.STYLE(IF([.AT6]=1;"seg1";IF([.AT6]=0;"seg0";"segX")))) -> f | AV6: f | AW6: of:=HLOOKUP([.AY6];[.$G$5:.$M$22];[.AT4];0) -> 0 | AX6: of:=[.AY6]&T(ORG.OPENOFFICE.STYLE(IF([.AW6]=1;"seg1";IF([.AW6]=0;"seg0";"segX")))) -> b | AY6: b | AZ6: of:=HLOOKUP([.BB6];[.$G$5:.$M$22];[.AZ4];0) -> X | BA6: of:=[.BB6]&T(ORG.OPENOFFICE.STYLE(IF([.AZ6]=1;"seg1";IF([.AZ6]=0;"seg0";"segX")))) -> f | BB6: f | BC6: of:=HLOOKUP([.BE6];[.$G$5:.$M$22];[.AZ4];0) -> X | BD6: of:=[.BE6]&T(ORG.OPENOFFICE.STYLE(IF([.BC6]=1;"seg1";IF([.BC6]=0;"seg0";"segX")))) -> b | BE6: b | BF6: of:=HLOOKUP([.BH6];[.$G$5:.$M$22];[.BF4];0) -> X | BG6: of:=[.BH6]&T(ORG.OPENOFFICE.STYLE(IF([.BF6]=1;"seg1";IF([.BF6]=0;"seg0";"segX")))) -> f | BH6: f | BI6: of:=HLOOKUP([.BK6];[.$G$5:.$M$22];[.BF4];0) -> X | BJ6: of:=[.BK6]&T(ORG.OPENOFFICE.STYLE(IF([.BI6]=1;"seg1";IF([.BI6]=0;"seg0";"segX")))) -> b | BK6: b
B7: 0 | C7: of:=MOD(ROUNDDOWN([.$B7]/[.C$6]);2) -> 0 | D7: of:=MOD(ROUNDDOWN([.$B7]/[.D$6]);2) -> 0 | E7: of:=MOD(ROUNDDOWN([.$B7]/[.E$6]);2) -> 0 | F7: of:=MOD(ROUNDDOWN([.$B7]/[.F$6]);2) -> 0 | G7: 1 | H7: 1 | I7: 1 | J7: 1 | K7: 1 | L7: 1 | M7: 0
B8: of:=[.B7]+1 -> 1 | C8: of:=MOD(ROUNDDOWN([.$B8]/[.C$6]);2) -> 0 | D8: of:=MOD(ROUNDDOWN([.$B8]/[.D$6]);2) -> 0 | E8: of:=MOD(ROUNDDOWN([.$B8]/[.E$6]);2) -> 0 | F8: of:=MOD(ROUNDDOWN([.$B8]/[.F$6]);2) -> 1 | G8: 0 | H8: 1 | I8: 1 | J8: 0 | K8: 0 | L8: 0 | M8: 0 | Q8: of:=HLOOKUP([.T8];[.$G$5:.$M$22];[.P4];0) -> 0 | R8: of:=[.T8]&T(ORG.OPENOFFICE.STYLE(IF([.Q8]=1;"seg1";IF([.Q8]=0;"seg0";"segX")))) -> g | T8: g | W8: of:=HLOOKUP([.Z8];[.$G$5:.$M$22];[.V4];0) -> 0 | X8: of:=[.Z8]&T(ORG.OPENOFFICE.STYLE(IF([.W8]=1;"seg1";IF([.W8]=0;"seg0";"segX")))) -> g | Z8: g | AC8: of:=HLOOKUP([.AF8];[.$G$5:.$M$22];[.AB4];0) -> 1 | AD8: of:=[.AF8]&T(ORG.OPENOFFICE.STYLE(IF([.AC8]=1;"seg1";IF([.AC8]=0;"seg0";"segX")))) -> g | AF8: g | AI8: of:=HLOOKUP([.AL8];[.$G$5:.$M$22];[.AH4];0) -> 1 | AJ8: of:=[.AL8]&T(ORG.OPENOFFICE.STYLE(IF([.AI8]=1;"seg1";IF([.AI8]=0;"seg0";"segX")))) -> g | AL8: g | AO8: of:=HLOOKUP([.AR8];[.$G$5:.$M$22];[.AN4];0) -> 1 | AP8: of:=[.AR8]&T(ORG.OPENOFFICE.STYLE(IF([.AO8]=1;"seg1";IF([.AO8]=0;"seg0";"segX")))) -> g | AR8: g | AU8: of:=HLOOKUP([.AX8];[.$G$5:.$M$22];[.AT4];0) -> 1 | AV8: of:=[.AX8]&T(ORG.OPENOFFICE.STYLE(IF([.AU8]=1;"seg1";IF([.AU8]=0;"seg0";"segX")))) -> g | AX8: g | BA8: of:=HLOOKUP([.BD8];[.$G$5:.$M$22];[.AZ4];0) -> X | BB8: of:=[.BD8]&T(ORG.OPENOFFICE.STYLE(IF([.BA8]=1;"seg1";IF([.BA8]=0;"seg0";"segX")))) -> g | BD8: g | BG8: of:=HLOOKUP([.BJ8];[.$G$5:.$M$22];[.BF4];0) -> X | BH8: of:=[.BJ8]&T(ORG.OPENOFFICE.STYLE(IF([.BG8]=1;"seg1";IF([.BG8]=0;"seg0";"segX")))) -> g | BJ8: g
B9: of:=[.B8]+1 -> 2 | C9: of:=MOD(ROUNDDOWN([.$B9]/[.C$6]);2) -> 0 | D9: of:=MOD(ROUNDDOWN([.$B9]/[.D$6]);2) -> 0 | E9: of:=MOD(ROUNDDOWN([.$B9]/[.E$6]);2) -> 1 | F9: of:=MOD(ROUNDDOWN([.$B9]/[.F$6]);2) -> 0 | G9: 1 | H9: 1 | I9: 0 | J9: 1 | K9: 1 | L9: 0 | M9: 1 | P9: of:=HLOOKUP([.R9];[.$G$5:.$M$22];[.P4];0) -> 1 | Q9: of:=[.R9]&T(ORG.OPENOFFICE.STYLE(IF([.P9]=1;"seg1";IF([.P9]=0;"seg0";"segX")))) -> e | R9: e | S9: of:=HLOOKUP([.U9];[.$G$5:.$M$22];[.P4];0) -> 1 | T9: of:=[.U9]&T(ORG.OPENOFFICE.STYLE(IF([.S9]=1;"seg1";IF([.S9]=0;"seg0";"segX")))) -> c | U9: c | V9: of:=HLOOKUP([.X9];[.$G$5:.$M$22];[.V4];0) -> 0 | W9: of:=[.X9]&T(ORG.OPENOFFICE.STYLE(IF([.V9]=1;"seg1";IF([.V9]=0;"seg0";"segX")))) -> e | X9: e | Y9: of:=HLOOKUP([.AA9];[.$G$5:.$M$22];[.V4];0) -> 1 | Z9: of:=[.AA9]&T(ORG.OPENOFFICE.STYLE(IF([.Y9]=1;"seg1";IF([.Y9]=0;"seg0";"segX")))) -> c | AA9: c | AB9: of:=HLOOKUP([.AD9];[.$G$5:.$M$22];[.AB4];0) -> 1 | AC9: of:=[.AD9]&T(ORG.OPENOFFICE.STYLE(IF([.AB9]=1;"seg1";IF([.AB9]=0;"seg0";"segX")))) -> e | AD9: e | AE9: of:=HLOOKUP([.AG9];[.$G$5:.$M$22];[.AB4];0) -> 0 | AF9: of:=[.AG9]&T(ORG.OPENOFFICE.STYLE(IF([.AE9]=1;"seg1";IF([.AE9]=0;"seg0";"segX")))) -> c | AG9: c | AH9: of:=HLOOKUP([.AJ9];[.$G$5:.$M$22];[.AH4];0) -> 0 | AI9: of:=[.AJ9]&T(ORG.OPENOFFICE.STYLE(IF([.AH9]=1;"seg1";IF([.AH9]=0;"seg0";"segX")))) -> e | AJ9: e | AK9: of:=HLOOKUP([.AM9];[.$G$5:.$M$22];[.AH4];0) -> 1 | AL9: of:=[.AM9]&T(ORG.OPENOFFICE.STYLE(IF([.AK9]=1;"seg1";IF([.AK9]=0;"seg0";"segX")))) -> c | AM9: c | AN9: of:=HLOOKUP([.AP9];[.$G$5:.$M$22];[.AN4];0) -> 0 | AO9: of:=[.AP9]&T(ORG.OPENOFFICE.STYLE(IF([.AN9]=1;"seg1";IF([.AN9]=0;"seg0";"segX")))) -> e | AP9: e | AQ9: of:=HLOOKUP([.AS9];[.$G$5:.$M$22];[.AN4];0) -> 1 | AR9: of:=[.AS9]&T(ORG.OPENOFFICE.STYLE(IF([.AQ9]=1;"seg1";IF([.AQ9]=0;"seg0";"segX")))) -> c | AS9: c | AT9: of:=HLOOKUP([.AV9];[.$G$5:.$M$22];[.AT4];0) -> 0 | AU9: of:=[.AV9]&T(ORG.OPENOFFICE.STYLE(IF([.AT9]=1;"seg1";IF([.AT9]=0;"seg0";"segX")))) -> e | AV9: e | AW9: of:=HLOOKUP([.AY9];[.$G$5:.$M$22];[.AT4];0) -> 1 | AX9: of:=[.AY9]&T(ORG.OPENOFFICE.STYLE(IF([.AW9]=1;"seg1";IF([.AW9]=0;"seg0";"segX")))) -> c | AY9: c | AZ9: of:=HLOOKUP([.BB9];[.$G$5:.$M$22];[.AZ4];0) -> X | BA9: of:=[.BB9]&T(ORG.OPENOFFICE.STYLE(IF([.AZ9]=1;"seg1";IF([.AZ9]=0;"seg0";"segX")))) -> e | BB9: e | BC9: of:=HLOOKUP([.BE9];[.$G$5:.$M$22];[.AZ4];0) -> X | BD9: of:=[.BE9]&T(ORG.OPENOFFICE.STYLE(IF([.BC9]=1;"seg1";IF([.BC9]=0;"seg0";"segX")))) -> c | BE9: c | BF9: of:=HLOOKUP([.BH9];[.$G$5:.$M$22];[.BF4];0) -> X | BG9: of:=[.BH9]&T(ORG.OPENOFFICE.STYLE(IF([.BF9]=1;"seg1";IF([.BF9]=0;"seg0";"segX")))) -> e | BH9: e | BI9: of:=HLOOKUP([.BK9];[.$G$5:.$M$22];[.BF4];0) -> X | BJ9: of:=[.BK9]&T(ORG.OPENOFFICE.STYLE(IF([.BI9]=1;"seg1";IF([.BI9]=0;"seg0";"segX")))) -> c | BK9: c
B10: of:=[.B9]+1 -> 3 | C10: of:=MOD(ROUNDDOWN([.$B10]/[.C$6]);2) -> 0 | D10: of:=MOD(ROUNDDOWN([.$B10]/[.D$6]);2) -> 0 | E10: of:=MOD(ROUNDDOWN([.$B10]/[.E$6]);2) -> 1 | F10: of:=MOD(ROUNDDOWN([.$B10]/[.F$6]);2) -> 1 | G10: 1 | H10: 1 | I10: 1 | J10: 1 | K10: 0 | L10: 0 | M10: 1
B11: of:=[.B10]+1 -> 4 | C11: of:=MOD(ROUNDDOWN([.$B11]/[.C$6]);2) -> 0 | D11: of:=MOD(ROUNDDOWN([.$B11]/[.D$6]);2) -> 1 | E11: of:=MOD(ROUNDDOWN([.$B11]/[.E$6]);2) -> 0 | F11: of:=MOD(ROUNDDOWN([.$B11]/[.F$6]);2) -> 0 | G11: 0 | H11: 1 | I11: 1 | J11: 0 | K11: 0 | L11: 1 | M11: 1 | Q11: of:=HLOOKUP([.T11];[.$G$5:.$M$22];[.P4];0) -> 1 | R11: of:=[.T11]&T(ORG.OPENOFFICE.STYLE(IF([.Q11]=1;"seg1";IF([.Q11]=0;"seg0";"segX")))) -> d | T11: d | W11: of:=HLOOKUP([.Z11];[.$G$5:.$M$22];[.V4];0) -> 0 | X11: of:=[.Z11]&T(ORG.OPENOFFICE.STYLE(IF([.W11]=1;"seg1";IF([.W11]=0;"seg0";"segX")))) -> d | Z11: d | AC11: of:=HLOOKUP([.AF11];[.$G$5:.$M$22];[.AB4];0) -> 1 | AD11: of:=[.AF11]&T(ORG.OPENOFFICE.STYLE(IF([.AC11]=1;"seg1";IF([.AC11]=0;"seg0";"segX")))) -> d | AF11: d | AI11: of:=HLOOKUP([.AL11];[.$G$5:.$M$22];[.AH4];0) -> 1 | AJ11: of:=[.AL11]&T(ORG.OPENOFFICE.STYLE(IF([.AI11]=1;"seg1";IF([.AI11]=0;"seg0";"segX")))) -> d | AL11: d | AO11: of:=HLOOKUP([.AR11];[.$G$5:.$M$22];[.AN4];0) -> 0 | AP11: of:=[.AR11]&T(ORG.OPENOFFICE.STYLE(IF([.AO11]=1;"seg1";IF([.AO11]=0;"seg0";"segX")))) -> d | AR11: d | AU11: of:=HLOOKUP([.AX11];[.$G$5:.$M$22];[.AT4];0) -> 1 | AV11: of:=[.AX11]&T(ORG.OPENOFFICE.STYLE(IF([.AU11]=1;"seg1";IF([.AU11]=0;"seg0";"segX")))) -> d | AX11: d | BA11: of:=HLOOKUP([.BD11];[.$G$5:.$M$22];[.AZ4];0) -> X | BB11: of:=[.BD11]&T(ORG.OPENOFFICE.STYLE(IF([.BA11]=1;"seg1";IF([.BA11]=0;"seg0";"segX")))) -> d | BD11: d | BG11: of:=HLOOKUP([.BJ11];[.$G$5:.$M$22];[.BF4];0) -> X | BH11: of:=[.BJ11]&T(ORG.OPENOFFICE.STYLE(IF([.BG11]=1;"seg1";IF([.BG11]=0;"seg0";"segX")))) -> d | BJ11: d
B12: of:=[.B11]+1 -> 5 | C12: of:=MOD(ROUNDDOWN([.$B12]/[.C$6]);2) -> 0 | D12: of:=MOD(ROUNDDOWN([.$B12]/[.D$6]);2) -> 1 | E12: of:=MOD(ROUNDDOWN([.$B12]/[.E$6]);2) -> 0 | F12: of:=MOD(ROUNDDOWN([.$B12]/[.F$6]);2) -> 1 | G12: 1 | H12: 0 | I12: 1 | J12: 1 | K12: 0 | L12: 1 | M12: 1
B13: of:=[.B12]+1 -> 6 | C13: of:=MOD(ROUNDDOWN([.$B13]/[.C$6]);2) -> 0 | D13: of:=MOD(ROUNDDOWN([.$B13]/[.D$6]);2) -> 1 | E13: of:=MOD(ROUNDDOWN([.$B13]/[.E$6]);2) -> 1 | F13: of:=MOD(ROUNDDOWN([.$B13]/[.F$6]);2) -> 0 | G13: X | H13: X | I13: X | J13: X | K13: X | L13: X | M13: X | P13: of:=[.BF3]+1 -> 8 | V13: of:=[.P13]+1 -> 9 | AB13: of:=[.V13]+1 -> 10 | AH13: of:=[.AB13]+1 -> 11 | AN13: of:=[.AH13]+1 -> 12 | AT13: of:=[.AN13]+1 -> 13 | AZ13: of:=[.AT13]+1 -> 14 | BF13: of:=[.AZ13]+1 -> 15
B14: of:=[.B13]+1 -> 7 | C14: of:=MOD(ROUNDDOWN([.$B14]/[.C$6]);2) -> 0 | D14: of:=MOD(ROUNDDOWN([.$B14]/[.D$6]);2) -> 1 | E14: of:=MOD(ROUNDDOWN([.$B14]/[.E$6]);2) -> 1 | F14: of:=MOD(ROUNDDOWN([.$B14]/[.F$6]);2) -> 1 | G14: X | H14: X | I14: X | J14: X | K14: X | L14: X | M14: X | P14: of:=MATCH([.P13];[.$B$7:.$B$22];0)+2 -> 11 | V14: of:=MATCH([.V13];[.$B$7:.$B$22];0)+2 -> 12 | AB14: of:=MATCH([.AB13];[.$B$7:.$B$22];0)+2 -> 13 | AH14: of:=MATCH([.AH13];[.$B$7:.$B$22];0)+2 -> 14 | AN14: of:=MATCH([.AN13];[.$B$7:.$B$22];0)+2 -> 15 | AT14: of:=MATCH([.AT13];[.$B$7:.$B$22];0)+2 -> 16 | AZ14: of:=MATCH([.AZ13];[.$B$7:.$B$22];0)+2 -> 17 | BF14: of:=MATCH([.BF13];[.$B$7:.$B$22];0)+2 -> 18
B15: of:=[.B14]+1 -> 8 | C15: of:=MOD(ROUNDDOWN([.$B15]/[.C$6]);2) -> 1 | D15: of:=MOD(ROUNDDOWN([.$B15]/[.D$6]);2) -> 0 | E15: of:=MOD(ROUNDDOWN([.$B15]/[.E$6]);2) -> 0 | F15: of:=MOD(ROUNDDOWN([.$B15]/[.F$6]);2) -> 0 | G15: X | H15: X | I15: X | J15: X | K15: X | L15: X | M15: X | Q15: of:=HLOOKUP([.T15];[.$G$5:.$M$22];[.P14];0) -> X | R15: of:=[.T15]&T(ORG.OPENOFFICE.STYLE(IF([.Q15]=1;"seg1";IF([.Q15]=0;"seg0";"segX")))) -> a | T15: a | W15: of:=HLOOKUP([.Z15];[.$G$5:.$M$22];[.V14];0) -> X | X15: of:=[.Z15]&T(ORG.OPENOFFICE.STYLE(IF([.W15]=1;"seg1";IF([.W15]=0;"seg0";"segX")))) -> a | Z15: a | AC15: of:=HLOOKUP([.AF15];[.$G$5:.$M$22];[.AB14];0) -> X | AD15: of:=[.AF15]&T(ORG.OPENOFFICE.STYLE(IF([.AC15]=1;"seg1";IF([.AC15]=0;"seg0";"segX")))) -> a | AF15: a | AI15: of:=HLOOKUP([.AL15];[.$G$5:.$M$22];[.AH14];0) -> X | AJ15: of:=[.AL15]&T(ORG.OPENOFFICE.STYLE(IF([.AI15]=1;"seg1";IF([.AI15]=0;"seg0";"segX")))) -> a | AL15: a | AO15: of:=HLOOKUP([.AR15];[.$G$5:.$M$22];[.AN14];0) -> X | AP15: of:=[.AR15]&T(ORG.OPENOFFICE.STYLE(IF([.AO15]=1;"seg1";IF([.AO15]=0;"seg0";"segX")))) -> a | AR15: a | AU15: of:=HLOOKUP([.AX15];[.$G$5:.$M$22];[.AT14];0) -> X | AV15: of:=[.AX15]&T(ORG.OPENOFFICE.STYLE(IF([.AU15]=1;"seg1";IF([.AU15]=0;"seg0";"segX")))) -> a | AX15: a | BA15: of:=HLOOKUP([.BD15];[.$G$5:.$M$22];[.AZ14];0) -> X | BB15: of:=[.BD15]&T(ORG.OPENOFFICE.STYLE(IF([.BA15]=1;"seg1";IF([.BA15]=0;"seg0";"segX")))) -> a | BD15: a | BG15: of:=HLOOKUP([.BJ15];[.$G$5:.$M$22];[.BF14];0) -> X | BH15: of:=[.BJ15]&T(ORG.OPENOFFICE.STYLE(IF([.BG15]=1;"seg1";IF([.BG15]=0;"seg0";"segX")))) -> a | BJ15: a
B16: of:=[.B15]+1 -> 9 | C16: of:=MOD(ROUNDDOWN([.$B16]/[.C$6]);2) -> 1 | D16: of:=MOD(ROUNDDOWN([.$B16]/[.D$6]);2) -> 0 | E16: of:=MOD(ROUNDDOWN([.$B16]/[.E$6]);2) -> 0 | F16: of:=MOD(ROUNDDOWN([.$B16]/[.F$6]);2) -> 1 | G16: X | H16: X | I16: X | J16: X | K16: X | L16: X | M16: X | P16: of:=HLOOKUP([.R16];[.$G$5:.$M$22];[.P14];0) -> X | Q16: of:=[.R16]&T(ORG.OPENOFFICE.STYLE(IF([.P16]=1;"seg1";IF([.P16]=0;"seg0";"segX")))) -> f | R16: f | S16: of:=HLOOKUP([.U16];[.$G$5:.$M$22];[.P14];0) -> X | T16: of:=[.U16]&T(ORG.OPENOFFICE.STYLE(IF([.S16]=1;"seg1";IF([.S16]=0;"seg0";"segX")))) -> b | U16: b | V16: of:=HLOOKUP([.X16];[.$G$5:.$M$22];[.V14];0) -> X | W16: of:=[.X16]&T(ORG.OPENOFFICE.STYLE(IF([.V16]=1;"seg1";IF([.V16]=0;"seg0";"segX")))) -> f | X16: f | Y16: of:=HLOOKUP([.AA16];[.$G$5:.$M$22];[.V14];0) -> X | Z16: of:=[.AA16]&T(ORG.OPENOFFICE.STYLE(IF([.Y16]=1;"seg1";IF([.Y16]=0;"seg0";"segX")))) -> b | AA16: b | AB16: of:=HLOOKUP([.AD16];[.$G$5:.$M$22];[.AB14];0) -> X | AC16: of:=[.AD16]&T(ORG.OPENOFFICE.STYLE(IF([.AB16]=1;"seg1";IF([.AB16]=0;"seg0";"segX")))) -> f | AD16: f | AE16: of:=HLOOKUP([.AG16];[.$G$5:.$M$22];[.AB14];0) -> X | AF16: of:=[.AG16]&T(ORG.OPENOFFICE.STYLE(IF([.AE16]=1;"seg1";IF([.AE16]=0;"seg0";"segX")))) -> b | AG16: b | AH16: of:=HLOOKUP([.AJ16];[.$G$5:.$M$22];[.AH14];0) -> X | AI16: of:=[.AJ16]&T(ORG.OPENOFFICE.STYLE(IF([.AH16]=1;"seg1";IF([.AH16]=0;"seg0";"segX")))) -> f | AJ16: f | AK16: of:=HLOOKUP([.AM16];[.$G$5:.$M$22];[.AH14];0) -> X | AL16: of:=[.AM16]&T(ORG.OPENOFFICE.STYLE(IF([.AK16]=1;"seg1";IF([.AK16]=0;"seg0";"segX")))) -> b | AM16: b | AN16: of:=HLOOKUP([.AP16];[.$G$5:.$M$22];[.AN14];0) -> X | AO16: of:=[.AP16]&T(ORG.OPENOFFICE.STYLE(IF([.AN16]=1;"seg1";IF([.AN16]=0;"seg0";"segX")))) -> f | AP16: f | AQ16: of:=HLOOKUP([.AS16];[.$G$5:.$M$22];[.AN14];0) -> X | AR16: of:=[.AS16]&T(ORG.OPENOFFICE.STYLE(IF([.AQ16]=1;"seg1";IF([.AQ16]=0;"seg0";"segX")))) -> b | AS16: b | AT16: of:=HLOOKUP([.AV16];[.$G$5:.$M$22];[.AT14];0) -> X | AU16: of:=[.AV16]&T(ORG.OPENOFFICE.STYLE(IF([.AT16]=1;"seg1";IF([.AT16]=0;"seg0";"segX")))) -> f | AV16: f | AW16: of:=HLOOKUP([.AY16];[.$G$5:.$M$22];[.AT14];0) -> X | AX16: of:=[.AY16]&T(ORG.OPENOFFICE.STYLE(IF([.AW16]=1;"seg1";IF([.AW16]=0;"seg0";"segX")))) -> b | AY16: b | AZ16: of:=HLOOKUP([.BB16];[.$G$5:.$M$22];[.AZ14];0) -> X | BA16: of:=[.BB16]&T(ORG.OPENOFFICE.STYLE(IF([.AZ16]=1;"seg1";IF([.AZ16]=0;"seg0";"segX")))) -> f | BB16: f | BC16: of:=HLOOKUP([.BE16];[.$G$5:.$M$22];[.AZ14];0) -> X | BD16: of:=[.BE16]&T(ORG.OPENOFFICE.STYLE(IF([.BC16]=1;"seg1";IF([.BC16]=0;"seg0";"segX")))) -> b | BE16: b | BF16: of:=HLOOKUP([.BH16];[.$G$5:.$M$22];[.BF14];0) -> X | BG16: of:=[.BH16]&T(ORG.OPENOFFICE.STYLE(IF([.BF16]=1;"seg1";IF([.BF16]=0;"seg0";"segX")))) -> f | BH16: f | BI16: of:=HLOOKUP([.BK16];[.$G$5:.$M$22];[.BF14];0) -> X | BJ16: of:=[.BK16]&T(ORG.OPENOFFICE.STYLE(IF([.BI16]=1;"seg1";IF([.BI16]=0;"seg0";"segX")))) -> b | BK16: b
B17: of:=[.B16]+1 -> 10 | C17: of:=MOD(ROUNDDOWN([.$B17]/[.C$6]);2) -> 1 | D17: of:=MOD(ROUNDDOWN([.$B17]/[.D$6]);2) -> 0 | E17: of:=MOD(ROUNDDOWN([.$B17]/[.E$6]);2) -> 1 | F17: of:=MOD(ROUNDDOWN([.$B17]/[.F$6]);2) -> 0 | G17: X | H17: X | I17: X | J17: X | K17: X | L17: X | M17: X
B18: of:=[.B17]+1 -> 11 | C18: of:=MOD(ROUNDDOWN([.$B18]/[.C$6]);2) -> 1 | D18: of:=MOD(ROUNDDOWN([.$B18]/[.D$6]);2) -> 0 | E18: of:=MOD(ROUNDDOWN([.$B18]/[.E$6]);2) -> 1 | F18: of:=MOD(ROUNDDOWN([.$B18]/[.F$6]);2) -> 1 | G18: X | H18: X | I18: X | J18: X | K18: X | L18: X | M18: X | Q18: of:=HLOOKUP([.T18];[.$G$5:.$M$22];[.P14];0) -> X | R18: of:=[.T18]&T(ORG.OPENOFFICE.STYLE(IF([.Q18]=1;"seg1";IF([.Q18]=0;"seg0";"segX")))) -> g | T18: g | W18: of:=HLOOKUP([.Z18];[.$G$5:.$M$22];[.V14];0) -> X | X18: of:=[.Z18]&T(ORG.OPENOFFICE.STYLE(IF([.W18]=1;"seg1";IF([.W18]=0;"seg0";"segX")))) -> g | Z18: g | AC18: of:=HLOOKUP([.AF18];[.$G$5:.$M$22];[.AB14];0) -> X | AD18: of:=[.AF18]&T(ORG.OPENOFFICE.STYLE(IF([.AC18]=1;"seg1";IF([.AC18]=0;"seg0";"segX")))) -> g | AF18: g | AI18: of:=HLOOKUP([.AL18];[.$G$5:.$M$22];[.AH14];0) -> X | AJ18: of:=[.AL18]&T(ORG.OPENOFFICE.STYLE(IF([.AI18]=1;"seg1";IF([.AI18]=0;"seg0";"segX")))) -> g | AL18: g | AO18: of:=HLOOKUP([.AR18];[.$G$5:.$M$22];[.AN14];0) -> X | AP18: of:=[.AR18]&T(ORG.OPENOFFICE.STYLE(IF([.AO18]=1;"seg1";IF([.AO18]=0;"seg0";"segX")))) -> g | AR18: g | AU18: of:=HLOOKUP([.AX18];[.$G$5:.$M$22];[.AT14];0) -> X | AV18: of:=[.AX18]&T(ORG.OPENOFFICE.STYLE(IF([.AU18]=1;"seg1";IF([.AU18]=0;"seg0";"segX")))) -> g | AX18: g | BA18: of:=HLOOKUP([.BD18];[.$G$5:.$M$22];[.AZ14];0) -> X | BB18: of:=[.BD18]&T(ORG.OPENOFFICE.STYLE(IF([.BA18]=1;"seg1";IF([.BA18]=0;"seg0";"segX")))) -> g | BD18: g | BG18: of:=HLOOKUP([.BJ18];[.$G$5:.$M$22];[.BF14];0) -> X | BH18: of:=[.BJ18]&T(ORG.OPENOFFICE.STYLE(IF([.BG18]=1;"seg1";IF([.BG18]=0;"seg0";"segX")))) -> g | BJ18: g
B19: of:=[.B18]+1 -> 12 | C19: of:=MOD(ROUNDDOWN([.$B19]/[.C$6]);2) -> 1 | D19: of:=MOD(ROUNDDOWN([.$B19]/[.D$6]);2) -> 1 | E19: of:=MOD(ROUNDDOWN([.$B19]/[.E$6]);2) -> 0 | F19: of:=MOD(ROUNDDOWN([.$B19]/[.F$6]);2) -> 0 | G19: X | H19: X | I19: X | J19: X | K19: X | L19: X | M19: X | P19: of:=HLOOKUP([.R19];[.$G$5:.$M$22];[.P14];0) -> X | Q19: of:=[.R19]&T(ORG.OPENOFFICE.STYLE(IF([.P19]=1;"seg1";IF([.P19]=0;"seg0";"segX")))) -> e | R19: e | S19: of:=HLOOKUP([.U19];[.$G$5:.$M$22];[.P14];0) -> X | T19: of:=[.U19]&T(ORG.OPENOFFICE.STYLE(IF([.S19]=1;"seg1";IF([.S19]=0;"seg0";"segX")))) -> c | U19: c | V19: of:=HLOOKUP([.X19];[.$G$5:.$M$22];[.V14];0) -> X | W19: of:=[.X19]&T(ORG.OPENOFFICE.STYLE(IF([.V19]=1;"seg1";IF([.V19]=0;"seg0";"segX")))) -> e | X19: e | Y19: of:=HLOOKUP([.AA19];[.$G$5:.$M$22];[.V14];0) -> X | Z19: of:=[.AA19]&T(ORG.OPENOFFICE.STYLE(IF([.Y19]=1;"seg1";IF([.Y19]=0;"seg0";"segX")))) -> c | AA19: c | AB19: of:=HLOOKUP([.AD19];[.$G$5:.$M$22];[.AB14];0) -> X | AC19: of:=[.AD19]&T(ORG.OPENOFFICE.STYLE(IF([.AB19]=1;"seg1";IF([.AB19]=0;"seg0";"segX")))) -> e | AD19: e | AE19: of:=HLOOKUP([.AG19];[.$G$5:.$M$22];[.AB14];0) -> X | AF19: of:=[.AG19]&T(ORG.OPENOFFICE.STYLE(IF([.AE19]=1;"seg1";IF([.AE19]=0;"seg0";"segX")))) -> c | AG19: c | AH19: of:=HLOOKUP([.AJ19];[.$G$5:.$M$22];[.AH14];0) -> X | AI19: of:=[.AJ19]&T(ORG.OPENOFFICE.STYLE(IF([.AH19]=1;"seg1";IF([.AH19]=0;"seg0";"segX")))) -> e | AJ19: e | AK19: of:=HLOOKUP([.AM19];[.$G$5:.$M$22];[.AH14];0) -> X | AL19: of:=[.AM19]&T(ORG.OPENOFFICE.STYLE(IF([.AK19]=1;"seg1";IF([.AK19]=0;"seg0";"segX")))) -> c | AM19: c | AN19: of:=HLOOKUP([.AP19];[.$G$5:.$M$22];[.AN14];0) -> X | AO19: of:=[.AP19]&T(ORG.OPENOFFICE.STYLE(IF([.AN19]=1;"seg1";IF([.AN19]=0;"seg0";"segX")))) -> e | AP19: e | AQ19: of:=HLOOKUP([.AS19];[.$G$5:.$M$22];[.AN14];0) -> X | AR19: of:=[.AS19]&T(ORG.OPENOFFICE.STYLE(IF([.AQ19]=1;"seg1";IF([.AQ19]=0;"seg0";"segX")))) -> c | AS19: c | AT19: of:=HLOOKUP([.AV19];[.$G$5:.$M$22];[.AT14];0) -> X | AU19: of:=[.AV19]&T(ORG.OPENOFFICE.STYLE(IF([.AT19]=1;"seg1";IF([.AT19]=0;"seg0";"segX")))) -> e | AV19: e | AW19: of:=HLOOKUP([.AY19];[.$G$5:.$M$22];[.AT14];0) -> X | AX19: of:=[.AY19]&T(ORG.OPENOFFICE.STYLE(IF([.AW19]=1;"seg1";IF([.AW19]=0;"seg0";"segX")))) -> c | AY19: c | AZ19: of:=HLOOKUP([.BB19];[.$G$5:.$M$22];[.AZ14];0) -> X | BA19: of:=[.BB19]&T(ORG.OPENOFFICE.STYLE(IF([.AZ19]=1;"seg1";IF([.AZ19]=0;"seg0";"segX")))) -> e | BB19: e | BC19: of:=HLOOKUP([.BE19];[.$G$5:.$M$22];[.AZ14];0) -> X | BD19: of:=[.BE19]&T(ORG.OPENOFFICE.STYLE(IF([.BC19]=1;"seg1";IF([.BC19]=0;"seg0";"segX")))) -> c | BE19: c | BF19: of:=HLOOKUP([.BH19];[.$G$5:.$M$22];[.BF14];0) -> X | BG19: of:=[.BH19]&T(ORG.OPENOFFICE.STYLE(IF([.BF19]=1;"seg1";IF([.BF19]=0;"seg0";"segX")))) -> e | BH19: e | BI19: of:=HLOOKUP([.BK19];[.$G$5:.$M$22];[.BF14];0) -> X | BJ19: of:=[.BK19]&T(ORG.OPENOFFICE.STYLE(IF([.BI19]=1;"seg1";IF([.BI19]=0;"seg0";"segX")))) -> c | BK19: c
B20: of:=[.B19]+1 -> 13 | C20: of:=MOD(ROUNDDOWN([.$B20]/[.C$6]);2) -> 1 | D20: of:=MOD(ROUNDDOWN([.$B20]/[.D$6]);2) -> 1 | E20: of:=MOD(ROUNDDOWN([.$B20]/[.E$6]);2) -> 0 | F20: of:=MOD(ROUNDDOWN([.$B20]/[.F$6]);2) -> 1 | G20: X | H20: X | I20: X | J20: X | K20: X | L20: X | M20: X
B21: of:=[.B20]+1 -> 14 | C21: of:=MOD(ROUNDDOWN([.$B21]/[.C$6]);2) -> 1 | D21: of:=MOD(ROUNDDOWN([.$B21]/[.D$6]);2) -> 1 | E21: of:=MOD(ROUNDDOWN([.$B21]/[.E$6]);2) -> 1 | F21: of:=MOD(ROUNDDOWN([.$B21]/[.F$6]);2) -> 0 | G21: X | H21: X | I21: X | J21: X | K21: X | L21: X | M21: X | Q21: of:=HLOOKUP([.T21];[.$G$5:.$M$22];[.P14];0) -> X | R21: of:=[.T21]&T(ORG.OPENOFFICE.STYLE(IF([.Q21]=1;"seg1";IF([.Q21]=0;"seg0";"segX")))) -> d | T21: d | W21: of:=HLOOKUP([.Z21];[.$G$5:.$M$22];[.V14];0) -> X | X21: of:=[.Z21]&T(ORG.OPENOFFICE.STYLE(IF([.W21]=1;"seg1";IF([.W21]=0;"seg0";"segX")))) -> d | Z21: d | AC21: of:=HLOOKUP([.AF21];[.$G$5:.$M$22];[.AB14];0) -> X | AD21: of:=[.AF21]&T(ORG.OPENOFFICE.STYLE(IF([.AC21]=1;"seg1";IF([.AC21]=0;"seg0";"segX")))) -> d | AF21: d | AI21: of:=HLOOKUP([.AL21];[.$G$5:.$M$22];[.AH14];0) -> X | AJ21: of:=[.AL21]&T(ORG.OPENOFFICE.STYLE(IF([.AI21]=1;"seg1";IF([.AI21]=0;"seg0";"segX")))) -> d | AL21: d | AO21: of:=HLOOKUP([.AR21];[.$G$5:.$M$22];[.AN14];0) -> X | AP21: of:=[.AR21]&T(ORG.OPENOFFICE.STYLE(IF([.AO21]=1;"seg1";IF([.AO21]=0;"seg0";"segX")))) -> d | AR21: d | AU21: of:=HLOOKUP([.AX21];[.$G$5:.$M$22];[.AT14];0) -> X | AV21: of:=[.AX21]&T(ORG.OPENOFFICE.STYLE(IF([.AU21]=1;"seg1";IF([.AU21]=0;"seg0";"segX")))) -> d | AX21: d | BA21: of:=HLOOKUP([.BD21];[.$G$5:.$M$22];[.AZ14];0) -> X | BB21: of:=[.BD21]&T(ORG.OPENOFFICE.STYLE(IF([.BA21]=1;"seg1";IF([.BA21]=0;"seg0";"segX")))) -> d | BD21: d | BG21: of:=HLOOKUP([.BJ21];[.$G$5:.$M$22];[.BF14];0) -> X | BH21: of:=[.BJ21]&T(ORG.OPENOFFICE.STYLE(IF([.BG21]=1;"seg1";IF([.BG21]=0;"seg0";"segX")))) -> d | BJ21: d
B22: of:=[.B21]+1 -> 15 | C22: of:=MOD(ROUNDDOWN([.$B22]/[.C$6]);2) -> 1 | D22: of:=MOD(ROUNDDOWN([.$B22]/[.D$6]);2) -> 1 | E22: of:=MOD(ROUNDDOWN([.$B22]/[.E$6]);2) -> 1 | F22: of:=MOD(ROUNDDOWN([.$B22]/[.F$6]);2) -> 1 | G22: X | H22: X | I22: X | J22: X | K22: X | L22: X | M22: X
P24: Karnaugh-maps
P25: a | Q25: of:=MATCH([.P25];[.$G$5:.$M$5])+5 -> 6 | R25: BA | W25: b | X25: of:=MATCH([.W25];[.$G$5:.$M$5])+5 -> 7 | Y25: BA | AD25: c | AE25: of:=MATCH([.AD25];[.$G$5:.$M$5])+5 -> 8 | AF25: BA | AK25: d | AL25: of:=MATCH([.AK25];[.$G$5:.$M$5])+5 -> 9 | AM25: BA | AR25: e | AS25: of:=MATCH([.AR25];[.$G$5:.$M$5])+5 -> 10 | AT25: BA | AY25: f | AZ25: of:=MATCH([.AY25];[.$G$5:.$M$5])+5 -> 11 | BA25: BA | BF25: g | BG25: of:=MATCH([.BF25];[.$G$5:.$M$5])+5 -> 12 | BH25: BA
R26: 00 | S26: 01 | T26: 11 | U26: 10 | Y26: 00 | Z26: 01 | AA26: 11 | AB26: 10 | AF26: 00 | AG26: 01 | AH26: 11 | AI26: 10 | AM26: 00 | AN26: 01 | AO26: 11 | AP26: 10 | AT26: 00 | AU26: 01 | AV26: 11 | AW26: 10 | BA26: 00 | BB26: 01 | BC26: 11 | BD26: 10 | BH26: 00 | BI26: 01 | BJ26: 11 | BK26: 10
P27: DC | R27: of:=HLOOKUP(MID([.R25];1;1);[.$C$5:.$F$6];2;0)*MID([.R26];1;1) + HLOOKUP(MID([.R25];2;1);[.$C$5:.$F$6];2;0)*MID([.R26];2;1) -> 0 | S27: of:=HLOOKUP(MID([.R25];1;1);[.$C$5:.$F$6];2;0)*MID([.S26];1;1) + HLOOKUP(MID([.R25];2;1);[.$C$5:.$F$6];2;0)*MID([.S26];2;1) -> 1 | T27: of:=HLOOKUP(MID([.R25];1;1);[.$C$5:.$F$6];2;0)*MID([.T26];1;1) + HLOOKUP(MID([.R25];2;1);[.$C$5:.$F$6];2;0)*MID([.T26];2;1) -> 3 | U27: of:=HLOOKUP(MID([.R25];1;1);[.$C$5:.$F$6];2;0)*MID([.U26];1;1) + HLOOKUP(MID([.R25];2;1);[.$C$5:.$F$6];2;0)*MID([.U26];2;1) -> 2 | W27: DC | Y27: of:=HLOOKUP(MID([.Y25];1;1);[.$C$5:.$F$6];2;0)*MID([.Y26];1;1) + HLOOKUP(MID([.Y25];2;1);[.$C$5:.$F$6];2;0)*MID([.Y26];2;1) -> 0 | Z27: of:=HLOOKUP(MID([.Y25];1;1);[.$C$5:.$F$6];2;0)*MID([.Z26];1;1) + HLOOKUP(MID([.Y25];2;1);[.$C$5:.$F$6];2;0)*MID([.Z26];2;1) -> 1 | AA27: of:=HLOOKUP(MID([.Y25];1;1);[.$C$5:.$F$6];2;0)*MID([.AA26];1;1) + HLOOKUP(MID([.Y25];2;1);[.$C$5:.$F$6];2;0)*MID([.AA26];2;1) -> 3 | AB27: of:=HLOOKUP(MID([.Y25];1;1);[.$C$5:.$F$6];2;0)*MID([.AB26];1;1) + HLOOKUP(MID([.Y25];2;1);[.$C$5:.$F$6];2;0)*MID([.AB26];2;1) -> 2 | AD27: DC | AF27: of:=HLOOKUP(MID([.AF25];1;1);[.$C$5:.$F$6];2;0)*MID([.AF26];1;1) + HLOOKUP(MID([.AF25];2;1);[.$C$5:.$F$6];2;0)*MID([.AF26];2;1) -> 0 | AG27: of:=HLOOKUP(MID([.AF25];1;1);[.$C$5:.$F$6];2;0)*MID([.AG26];1;1) + HLOOKUP(MID([.AF25];2;1);[.$C$5:.$F$6];2;0)*MID([.AG26];2;1) -> 1 | AH27: of:=HLOOKUP(MID([.AF25];1;1);[.$C$5:.$F$6];2;0)*MID([.AH26];1;1) + HLOOKUP(MID([.AF25];2;1);[.$C$5:.$F$6];2;0)*MID([.AH26];2;1) -> 3 | AI27: of:=HLOOKUP(MID([.AF25];1;1);[.$C$5:.$F$6];2;0)*MID([.AI26];1;1) + HLOOKUP(MID([.AF25];2;1);[.$C$5:.$F$6];2;0)*MID([.AI26];2;1) -> 2 | AK27: DC | AM27: of:=HLOOKUP(MID([.AM25];1;1);[.$C$5:.$F$6];2;0)*MID([.AM26];1;1) + HLOOKUP(MID([.AM25];2;1);[.$C$5:.$F$6];2;0)*MID([.AM26];2;1) -> 0 | AN27: of:=HLOOKUP(MID([.AM25];1;1);[.$C$5:.$F$6];2;0)*MID([.AN26];1;1) + HLOOKUP(MID([.AM25];2;1);[.$C$5:.$F$6];2;0)*MID([.AN26];2;1) -> 1 | AO27: of:=HLOOKUP(MID([.AM25];1;1);[.$C$5:.$F$6];2;0)*MID([.AO26];1;1) + HLOOKUP(MID([.AM25];2;1);[.$C$5:.$F$6];2;0)*MID([.AO26];2;1) -> 3 | AP27: of:=HLOOKUP(MID([.AM25];1;1);[.$C$5:.$F$6];2;0)*MID([.AP26];1;1) + HLOOKUP(MID([.AM25];2;1);[.$C$5:.$F$6];2;0)*MID([.AP26];2;1) -> 2 | AR27: DC | AT27: of:=HLOOKUP(MID([.AT25];1;1);[.$C$5:.$F$6];2;0)*MID([.AT26];1;1) + HLOOKUP(MID([.AT25];2;1);[.$C$5:.$F$6];2;0)*MID([.AT26];2;1) -> 0 | AU27: of:=HLOOKUP(MID([.AT25];1;1);[.$C$5:.$F$6];2;0)*MID([.AU26];1;1) + HLOOKUP(MID([.AT25];2;1);[.$C$5:.$F$6];2;0)*MID([.AU26];2;1) -> 1 | AV27: of:=HLOOKUP(MID([.AT25];1;1);[.$C$5:.$F$6];2;0)*MID([.AV26];1;1) + HLOOKUP(MID([.AT25];2;1);[.$C$5:.$F$6];2;0)*MID([.AV26];2;1) -> 3 | AW27: of:=HLOOKUP(MID([.AT25];1;1);[.$C$5:.$F$6];2;0)*MID([.AW26];1;1) + HLOOKUP(MID([.AT25];2;1);[.$C$5:.$F$6];2;0)*MID([.AW26];2;1) -> 2 | AY27: DC | BA27: of:=HLOOKUP(MID([.BA25];1;1);[.$C$5:.$F$6];2;0)*MID([.BA26];1;1) + HLOOKUP(MID([.BA25];2;1);[.$C$5:.$F$6];2;0)*MID([.BA26];2;1) -> 0 | BB27: of:=HLOOKUP(MID([.BA25];1;1);[.$C$5:.$F$6];2;0)*MID([.BB26];1;1) + HLOOKUP(MID([.BA25];2;1);[.$C$5:.$F$6];2;0)*MID([.BB26];2;1) -> 1 | BC27: of:=HLOOKUP(MID([.BA25];1;1);[.$C$5:.$F$6];2;0)*MID([.BC26];1;1) + HLOOKUP(MID([.BA25];2;1);[.$C$5:.$F$6];2;0)*MID([.BC26];2;1) -> 3 | BD27: of:=HLOOKUP(MID([.BA25];1;1);[.$C$5:.$F$6];2;0)*MID([.BD26];1;1) + HLOOKUP(MID([.BA25];2;1);[.$C$5:.$F$6];2;0)*MID([.BD26];2;1) -> 2 | BF27: DC | BH27: of:=HLOOKUP(MID([.BH25];1;1);[.$C$5:.$F$6];2;0)*MID([.BH26];1;1) + HLOOKUP(MID([.BH25];2;1);[.$C$5:.$F$6];2;0)*MID([.BH26];2;1) -> 0 | BI27: of:=HLOOKUP(MID([.BH25];1;1);[.$C$5:.$F$6];2;0)*MID([.BI26];1;1) + HLOOKUP(MID([.BH25];2;1);[.$C$5:.$F$6];2;0)*MID([.BI26];2;1) -> 1 | BJ27: of:=HLOOKUP(MID([.BH25];1;1);[.$C$5:.$F$6];2;0)*MID([.BJ26];1;1) + HLOOKUP(MID([.BH25];2;1);[.$C$5:.$F$6];2;0)*MID([.BJ26];2;1) -> 3 | BK27: of:=HLOOKUP(MID([.BH25];1;1);[.$C$5:.$F$6];2;0)*MID([.BK26];1;1) + HLOOKUP(MID([.BH25];2;1);[.$C$5:.$F$6];2;0)*MID([.BK26];2;1) -> 2
P28: 00 | Q28: of:=HLOOKUP(MID([.P27];1;1);[.$C$5:.$F$6];2;0)*MID([.P28];1;1) + HLOOKUP(MID([.P27];2;1);[.$C$5:.$F$6];2;0)*MID([.P28];2;1) -> 0 | R28: of:=VLOOKUP([.Q28]+[.R27];[.$B$7:.$M$22];[.Q25]) -> 1 | S28: of:=VLOOKUP([.Q28]+[.S27];[.$B$7:.$M$22];[.Q25]) -> 0 | T28: of:=VLOOKUP([.Q28]+[.T27];[.$B$7:.$M$22];[.Q25]) -> 1 | U28: of:=VLOOKUP([.Q28]+[.U27];[.$B$7:.$M$22];[.Q25]) -> 1 | W28: 00 | X28: of:=HLOOKUP(MID([.W27];1;1);[.$C$5:.$F$6];2;0)*MID([.W28];1;1) + HLOOKUP(MID([.W27];2;1);[.$C$5:.$F$6];2;0)*MID([.W28];2;1) -> 0 | Y28: of:=VLOOKUP([.X28]+[.Y27];[.$B$7:.$M$22];[.X25]) -> 1 | Z28: of:=VLOOKUP([.X28]+[.Z27];[.$B$7:.$M$22];[.X25]) -> 1 | AA28: of:=VLOOKUP([.X28]+[.AA27];[.$B$7:.$M$22];[.X25]) -> 1 | AB28: of:=VLOOKUP([.X28]+[.AB27];[.$B$7:.$M$22];[.X25]) -> 1 | AD28: 00 | AE28: of:=HLOOKUP(MID([.AD27];1;1);[.$C$5:.$F$6];2;0)*MID([.AD28];1;1) + HLOOKUP(MID([.AD27];2;1);[.$C$5:.$F$6];2;0)*MID([.AD28];2;1) -> 0 | AF28: of:=VLOOKUP([.AE28]+[.AF27];[.$B$7:.$M$22];[.AE25]) -> 1 | AG28: of:=VLOOKUP([.AE28]+[.AG27];[.$B$7:.$M$22];[.AE25]) -> 1 | AH28: of:=VLOOKUP([.AE28]+[.AH27];[.$B$7:.$M$22];[.AE25]) -> 1 | AI28: of:=VLOOKUP([.AE28]+[.AI27];[.$B$7:.$M$22];[.AE25]) -> 0 | AK28: 00 | AL28: of:=HLOOKUP(MID([.AK27];1;1);[.$C$5:.$F$6];2;0)*MID([.AK28];1;1) + HLOOKUP(MID([.AK27];2;1);[.$C$5:.$F$6];2;0)*MID([.AK28];2;1) -> 0 | AM28: of:=VLOOKUP([.AL28]+[.AM27];[.$B$7:.$M$22];[.AL25]) -> 1 | AN28: of:=VLOOKUP([.AL28]+[.AN27];[.$B$7:.$M$22];[.AL25]) -> 0 | AO28: of:=VLOOKUP([.AL28]+[.AO27];[.$B$7:.$M$22];[.AL25]) -> 1 | AP28: of:=VLOOKUP([.AL28]+[.AP27];[.$B$7:.$M$22];[.AL25]) -> 1 | AR28: 00 | AS28: of:=HLOOKUP(MID([.AR27];1;1);[.$C$5:.$F$6];2;0)*MID([.AR28];1;1) + HLOOKUP(MID([.AR27];2;1);[.$C$5:.$F$6];2;0)*MID([.AR28];2;1) -> 0 | AT28: of:=VLOOKUP([.AS28]+[.AT27];[.$B$7:.$M$22];[.AS25]) -> 1 | AU28: of:=VLOOKUP([.AS28]+[.AU27];[.$B$7:.$M$22];[.AS25]) -> 0 | AV28: of:=VLOOKUP([.AS28]+[.AV27];[.$B$7:.$M$22];[.AS25]) -> 0 | AW28: of:=VLOOKUP([.AS28]+[.AW27];[.$B$7:.$M$22];[.AS25]) -> 1 | AY28: 00 | AZ28: of:=HLOOKUP(MID([.AY27];1;1);[.$C$5:.$F$6];2;0)*MID([.AY28];1;1) + HLOOKUP(MID([.AY27];2;1);[.$C$5:.$F$6];2;0)*MID([.AY28];2;1) -> 0 | BA28: of:=VLOOKUP([.AZ28]+[.BA27];[.$B$7:.$M$22];[.AZ25]) -> 1 | BB28: of:=VLOOKUP([.AZ28]+[.BB27];[.$B$7:.$M$22];[.AZ25]) -> 0 | BC28: of:=VLOOKUP([.AZ28]+[.BC27];[.$B$7:.$M$22];[.AZ25]) -> 0 | BD28: of:=VLOOKUP([.AZ28]+[.BD27];[.$B$7:.$M$22];[.AZ25]) -> 0 | BF28: 00 | BG28: of:=HLOOKUP(MID([.BF27];1;1);[.$C$5:.$F$6];2;0)*MID([.BF28];1;1) + HLOOKUP(MID([.BF27];2;1);[.$C$5:.$F$6];2;0)*MID([.BF28];2;1) -> 0 | BH28: of:=VLOOKUP([.BG28]+[.BH27];[.$B$7:.$M$22];[.BG25]) -> 0 | BI28: of:=VLOOKUP([.BG28]+[.BI27];[.$B$7:.$M$22];[.BG25]) -> 0 | BJ28: of:=VLOOKUP([.BG28]+[.BJ27];[.$B$7:.$M$22];[.BG25]) -> 1 | BK28: of:=VLOOKUP([.BG28]+[.BK27];[.$B$7:.$M$22];[.BG25]) -> 1
P29: 01 | Q29: of:=HLOOKUP(MID([.P27];1;1);[.$C$5:.$F$6];2;0)*MID([.P29];1;1) + HLOOKUP(MID([.P27];2;1);[.$C$5:.$F$6];2;0)*MID([.P29];2;1) -> 4 | R29: of:=VLOOKUP([.Q29]+[.R27];[.$B$7:.$M$22];[.Q25]) -> 0 | S29: of:=VLOOKUP([.Q29]+[.S27];[.$B$7:.$M$22];[.Q25]) -> 1 | T29: of:=VLOOKUP([.Q29]+[.T27];[.$B$7:.$M$22];[.Q25]) -> X | U29: of:=VLOOKUP([.Q29]+[.U27];[.$B$7:.$M$22];[.Q25]) -> X | W29: 01 | X29: of:=HLOOKUP(MID([.W27];1;1);[.$C$5:.$F$6];2;0)*MID([.W29];1;1) + HLOOKUP(MID([.W27];2;1);[.$C$5:.$F$6];2;0)*MID([.W29];2;1) -> 4 | Y29: of:=VLOOKUP([.X29]+[.Y27];[.$B$7:.$M$22];[.X25]) -> 1 | Z29: of:=VLOOKUP([.X29]+[.Z27];[.$B$7:.$M$22];[.X25]) -> 0 | AA29: of:=VLOOKUP([.X29]+[.AA27];[.$B$7:.$M$22];[.X25]) -> X | AB29: of:=VLOOKUP([.X29]+[.AB27];[.$B$7:.$M$22];[.X25]) -> X | AD29: 01 | AE29: of:=HLOOKUP(MID([.AD27];1;1);[.$C$5:.$F$6];2;0)*MID([.AD29];1;1) + HLOOKUP(MID([.AD27];2;1);[.$C$5:.$F$6];2;0)*MID([.AD29];2;1) -> 4 | AF29: of:=VLOOKUP([.AE29]+[.AF27];[.$B$7:.$M$22];[.AE25]) -> 1 | AG29: of:=VLOOKUP([.AE29]+[.AG27];[.$B$7:.$M$22];[.AE25]) -> 1 | AH29: of:=VLOOKUP([.AE29]+[.AH27];[.$B$7:.$M$22];[.AE25]) -> X | AI29: of:=VLOOKUP([.AE29]+[.AI27];[.$B$7:.$M$22];[.AE25]) -> X | AK29: 01 | AL29: of:=HLOOKUP(MID([.AK27];1;1);[.$C$5:.$F$6];2;0)*MID([.AK29];1;1) + HLOOKUP(MID([.AK27];2;1);[.$C$5:.$F$6];2;0)*MID([.AK29];2;1) -> 4 | AM29: of:=VLOOKUP([.AL29]+[.AM27];[.$B$7:.$M$22];[.AL25]) -> 0 | AN29: of:=VLOOKUP([.AL29]+[.AN27];[.$B$7:.$M$22];[.AL25]) -> 1 | AO29: of:=VLOOKUP([.AL29]+[.AO27];[.$B$7:.$M$22];[.AL25]) -> X | AP29: of:=VLOOKUP([.AL29]+[.AP27];[.$B$7:.$M$22];[.AL25]) -> X | AR29: 01 | AS29: of:=HLOOKUP(MID([.AR27];1;1);[.$C$5:.$F$6];2;0)*MID([.AR29];1;1) + HLOOKUP(MID([.AR27];2;1);[.$C$5:.$F$6];2;0)*MID([.AR29];2;1) -> 4 | AT29: of:=VLOOKUP([.AS29]+[.AT27];[.$B$7:.$M$22];[.AS25]) -> 0 | AU29: of:=VLOOKUP([.AS29]+[.AU27];[.$B$7:.$M$22];[.AS25]) -> 0 | AV29: of:=VLOOKUP([.AS29]+[.AV27];[.$B$7:.$M$22];[.AS25]) -> X | AW29: of:=VLOOKUP([.AS29]+[.AW27];[.$B$7:.$M$22];[.AS25]) -> X | AY29: 01 | AZ29: of:=HLOOKUP(MID([.AY27];1;1);[.$C$5:.$F$6];2;0)*MID([.AY29];1;1) + HLOOKUP(MID([.AY27];2;1);[.$C$5:.$F$6];2;0)*MID([.AY29];2;1) -> 4 | BA29: of:=VLOOKUP([.AZ29]+[.BA27];[.$B$7:.$M$22];[.AZ25]) -> 1 | BB29: of:=VLOOKUP([.AZ29]+[.BB27];[.$B$7:.$M$22];[.AZ25]) -> 1 | BC29: of:=VLOOKUP([.AZ29]+[.BC27];[.$B$7:.$M$22];[.AZ25]) -> X | BD29: of:=VLOOKUP([.AZ29]+[.BD27];[.$B$7:.$M$22];[.AZ25]) -> X | BF29: 01 | BG29: of:=HLOOKUP(MID([.BF27];1;1);[.$C$5:.$F$6];2;0)*MID([.BF29];1;1) + HLOOKUP(MID([.BF27];2;1);[.$C$5:.$F$6];2;0)*MID([.BF29];2;1) -> 4 | BH29: of:=VLOOKUP([.BG29]+[.BH27];[.$B$7:.$M$22];[.BG25]) -> 1 | BI29: of:=VLOOKUP([.BG29]+[.BI27];[.$B$7:.$M$22];[.BG25]) -> 1 | BJ29: of:=VLOOKUP([.BG29]+[.BJ27];[.$B$7:.$M$22];[.BG25]) -> X | BK29: of:=VLOOKUP([.BG29]+[.BK27];[.$B$7:.$M$22];[.BG25]) -> X
P30: 11 | Q30: of:=HLOOKUP(MID([.P27];1;1);[.$C$5:.$F$6];2;0)*MID([.P30];1;1) + HLOOKUP(MID([.P27];2;1);[.$C$5:.$F$6];2;0)*MID([.P30];2;1) -> 12 | R30: of:=VLOOKUP([.Q30]+[.R27];[.$B$7:.$M$22];[.Q25]) -> X | S30: of:=VLOOKUP([.Q30]+[.S27];[.$B$7:.$M$22];[.Q25]) -> X | T30: of:=VLOOKUP([.Q30]+[.T27];[.$B$7:.$M$22];[.Q25]) -> X | U30: of:=VLOOKUP([.Q30]+[.U27];[.$B$7:.$M$22];[.Q25]) -> X | W30: 11 | X30: of:=HLOOKUP(MID([.W27];1;1);[.$C$5:.$F$6];2;0)*MID([.W30];1;1) + HLOOKUP(MID([.W27];2;1);[.$C$5:.$F$6];2;0)*MID([.W30];2;1) -> 12 | Y30: of:=VLOOKUP([.X30]+[.Y27];[.$B$7:.$M$22];[.X25]) -> X | Z30: of:=VLOOKUP([.X30]+[.Z27];[.$B$7:.$M$22];[.X25]) -> X | AA30: of:=VLOOKUP([.X30]+[.AA27];[.$B$7:.$M$22];[.X25]) -> X | AB30: of:=VLOOKUP([.X30]+[.AB27];[.$B$7:.$M$22];[.X25]) -> X | AD30: 11 | AE30: of:=HLOOKUP(MID([.AD27];1;1);[.$C$5:.$F$6];2;0)*MID([.AD30];1;1) + HLOOKUP(MID([.AD27];2;1);[.$C$5:.$F$6];2;0)*MID([.AD30];2;1) -> 12 | AF30: of:=VLOOKUP([.AE30]+[.AF27];[.$B$7:.$M$22];[.AE25]) -> X | AG30: of:=VLOOKUP([.AE30]+[.AG27];[.$B$7:.$M$22];[.AE25]) -> X | AH30: of:=VLOOKUP([.AE30]+[.AH27];[.$B$7:.$M$22];[.AE25]) -> X | AI30: of:=VLOOKUP([.AE30]+[.AI27];[.$B$7:.$M$22];[.AE25]) -> X | AK30: 11 | AL30: of:=HLOOKUP(MID([.AK27];1;1);[.$C$5:.$F$6];2;0)*MID([.AK30];1;1) + HLOOKUP(MID([.AK27];2;1);[.$C$5:.$F$6];2;0)*MID([.AK30];2;1) -> 12 | AM30: of:=VLOOKUP([.AL30]+[.AM27];[.$B$7:.$M$22];[.AL25]) -> X | AN30: of:=VLOOKUP([.AL30]+[.AN27];[.$B$7:.$M$22];[.AL25]) -> X | AO30: of:=VLOOKUP([.AL30]+[.AO27];[.$B$7:.$M$22];[.AL25]) -> X | AP30: of:=VLOOKUP([.AL30]+[.AP27];[.$B$7:.$M$22];[.AL25]) -> X | AR30: 11 | AS30: of:=HLOOKUP(MID([.AR27];1;1);[.$C$5:.$F$6];2;0)*MID([.AR30];1;1) + HLOOKUP(MID([.AR27];2;1);[.$C$5:.$F$6];2;0)*MID([.AR30];2;1) -> 12 | AT30: of:=VLOOKUP([.AS30]+[.AT27];[.$B$7:.$M$22];[.AS25]) -> X | AU30: of:=VLOOKUP([.AS30]+[.AU27];[.$B$7:.$M$22];[.AS25]) -> X | AV30: of:=VLOOKUP([.AS30]+[.AV27];[.$B$7:.$M$22];[.AS25]) -> X | AW30: of:=VLOOKUP([.AS30]+[.AW27];[.$B$7:.$M$22];[.AS25]) -> X | AY30: 11 | AZ30: of:=HLOOKUP(MID([.AY27];1;1);[.$C$5:.$F$6];2;0)*MID([.AY30];1;1) + HLOOKUP(MID([.AY27];2;1);[.$C$5:.$F$6];2;0)*MID([.AY30];2;1) -> 12 | BA30: of:=VLOOKUP([.AZ30]+[.BA27];[.$B$7:.$M$22];[.AZ25]) -> X | BB30: of:=VLOOKUP([.AZ30]+[.BB27];[.$B$7:.$M$22];[.AZ25]) -> X | BC30: of:=VLOOKUP([.AZ30]+[.BC27];[.$B$7:.$M$22];[.AZ25]) -> X | BD30: of:=VLOOKUP([.AZ30]+[.BD27];[.$B$7:.$M$22];[.AZ25]) -> X | BF30: 11 | BG30: of:=HLOOKUP(MID([.BF27];1;1);[.$C$5:.$F$6];2;0)*MID([.BF30];1;1) + HLOOKUP(MID([.BF27];2;1);[.$C$5:.$F$6];2;0)*MID([.BF30];2;1) -> 12 | BH30: of:=VLOOKUP([.BG30]+[.BH27];[.$B$7:.$M$22];[.BG25]) -> X | BI30: of:=VLOOKUP([.BG30]+[.BI27];[.$B$7:.$M$22];[.BG25]) -> X | BJ30: of:=VLOOKUP([.BG30]+[.BJ27];[.$B$7:.$M$22];[.BG25]) -> X | BK30: of:=VLOOKUP([.BG30]+[.BK27];[.$B$7:.$M$22];[.BG25]) -> X
P31: 10 | Q31: of:=HLOOKUP(MID([.P27];1;1);[.$C$5:.$F$6];2;0)*MID([.P31];1;1) + HLOOKUP(MID([.P27];2;1);[.$C$5:.$F$6];2;0)*MID([.P31];2;1) -> 8 | R31: of:=VLOOKUP([.Q31]+[.R27];[.$B$7:.$M$22];[.Q25]) -> X | S31: of:=VLOOKUP([.Q31]+[.S27];[.$B$7:.$M$22];[.Q25]) -> X | T31: of:=VLOOKUP([.Q31]+[.T27];[.$B$7:.$M$22];[.Q25]) -> X | U31: of:=VLOOKUP([.Q31]+[.U27];[.$B$7:.$M$22];[.Q25]) -> X | W31: 10 | X31: of:=HLOOKUP(MID([.W27];1;1);[.$C$5:.$F$6];2;0)*MID([.W31];1;1) + HLOOKUP(MID([.W27];2;1);[.$C$5:.$F$6];2;0)*MID([.W31];2;1) -> 8 | Y31: of:=VLOOKUP([.X31]+[.Y27];[.$B$7:.$M$22];[.X25]) -> X | Z31: of:=VLOOKUP([.X31]+[.Z27];[.$B$7:.$M$22];[.X25]) -> X | AA31: of:=VLOOKUP([.X31]+[.AA27];[.$B$7:.$M$22];[.X25]) -> X | AB31: of:=VLOOKUP([.X31]+[.AB27];[.$B$7:.$M$22];[.X25]) -> X | AD31: 10 | AE31: of:=HLOOKUP(MID([.AD27];1;1);[.$C$5:.$F$6];2;0)*MID([.AD31];1;1) + HLOOKUP(MID([.AD27];2;1);[.$C$5:.$F$6];2;0)*MID([.AD31];2;1) -> 8 | AF31: of:=VLOOKUP([.AE31]+[.AF27];[.$B$7:.$M$22];[.AE25]) -> X | AG31: of:=VLOOKUP([.AE31]+[.AG27];[.$B$7:.$M$22];[.AE25]) -> X | AH31: of:=VLOOKUP([.AE31]+[.AH27];[.$B$7:.$M$22];[.AE25]) -> X | AI31: of:=VLOOKUP([.AE31]+[.AI27];[.$B$7:.$M$22];[.AE25]) -> X | AK31: 10 | AL31: of:=HLOOKUP(MID([.AK27];1;1);[.$C$5:.$F$6];2;0)*MID([.AK31];1;1) + HLOOKUP(MID([.AK27];2;1);[.$C$5:.$F$6];2;0)*MID([.AK31];2;1) -> 8 | AM31: of:=VLOOKUP([.AL31]+[.AM27];[.$B$7:.$M$22];[.AL25]) -> X | AN31: of:=VLOOKUP([.AL31]+[.AN27];[.$B$7:.$M$22];[.AL25]) -> X | AO31: of:=VLOOKUP([.AL31]+[.AO27];[.$B$7:.$M$22];[.AL25]) -> X | AP31: of:=VLOOKUP([.AL31]+[.AP27];[.$B$7:.$M$22];[.AL25]) -> X | AR31: 10 | AS31: of:=HLOOKUP(MID([.AR27];1;1);[.$C$5:.$F$6];2;0)*MID([.AR31];1;1) + HLOOKUP(MID([.AR27];2;1);[.$C$5:.$F$6];2;0)*MID([.AR31];2;1) -> 8 | AT31: of:=VLOOKUP([.AS31]+[.AT27];[.$B$7:.$M$22];[.AS25]) -> X | AU31: of:=VLOOKUP([.AS31]+[.AU27];[.$B$7:.$M$22];[.AS25]) -> X | AV31: of:=VLOOKUP([.AS31]+[.AV27];[.$B$7:.$M$22];[.AS25]) -> X | AW31: of:=VLOOKUP([.AS31]+[.AW27];[.$B$7:.$M$22];[.AS25]) -> X | AY31: 10 | AZ31: of:=HLOOKUP(MID([.AY27];1;1);[.$C$5:.$F$6];2;0)*MID([.AY31];1;1) + HLOOKUP(MID([.AY27];2;1);[.$C$5:.$F$6];2;0)*MID([.AY31];2;1) -> 8 | BA31: of:=VLOOKUP([.AZ31]+[.BA27];[.$B$7:.$M$22];[.AZ25]) -> X | BB31: of:=VLOOKUP([.AZ31]+[.BB27];[.$B$7:.$M$22];[.AZ25]) -> X | BC31: of:=VLOOKUP([.AZ31]+[.BC27];[.$B$7:.$M$22];[.AZ25]) -> X | BD31: of:=VLOOKUP([.AZ31]+[.BD27];[.$B$7:.$M$22];[.AZ25]) -> X | BF31: 10 | BG31: of:=HLOOKUP(MID([.BF27];1;1);[.$C$5:.$F$6];2;0)*MID([.BF31];1;1) + HLOOKUP(MID([.BF27];2;1);[.$C$5:.$F$6];2;0)*MID([.BF31];2;1) -> 8 | BH31: of:=VLOOKUP([.BG31]+[.BH27];[.$B$7:.$M$22];[.BG25]) -> X | BI31: of:=VLOOKUP([.BG31]+[.BI27];[.$B$7:.$M$22];[.BG25]) -> X | BJ31: of:=VLOOKUP([.BG31]+[.BJ27];[.$B$7:.$M$22];[.BG25]) -> X | BK31: of:=VLOOKUP([.BG31]+[.BK27];[.$B$7:.$M$22];[.BG25]) -> X
N32: 1 | O32: F
N33: 2 | O33: G | P33: G = µ C B -A | AK33: G = µ C B -A | AY33: G = µ C B -A
N34: 3 | O34: H | P34: H = µ -C A | AK34: H = µ -C A | AR34: H = µ -C A
N35: 4 | O35: I
N36: 5 | O36: J | W36: J = µ -C -A
N37: 6 | O37: K
N38: 7 | O38: L
N39: 8 | O39: M
N40: 9 | O40: N | AD40: N = µ -B A
N41: 10 | O41: O
N42: 11 | O42: P
N43: 12 | O43: Q | AR43: Q = A
N44: 13 | O44: R | AY44: R = B
N45: 14 | O45: S | BF45: S = µ C B
N46: 15 | O46: T
I47: Inv. Inputs | P47: a = µ G H | W47: b = -J | AD47: c = -N | AK47: d = a = µ G H | AR47: e = µ H A = µ C A | AY47: f = µ G B | BF47: g = -S | BL47: total
E48: transistors: | I48: 3 | P48: 7 | W48: 3 | AD48: 3 | AK48: 0 | AR48: 2 | AY48: 2 | BF48: 3 | BL48: of:=SUM([.I48:.BK48]) -> 23 | BN48: transistors
E49: gates: | I49: 3 | P49: 3 | W49: 2 | AD49: 2 | AK49: 0 | AR49: 1 | AY49: 1 | BF49: 2 | BL49: of:=SUM([.I49:.BK49]) -> 14 | BN49: gates

Sheet: digits 0-3
B1: 2 bit to 7-segment, digits 0-3
B2: Truth table | P2: 7-segment display as defined by truth table
P3: 0 | V3: of:=[.P3]+1 -> 1 | AB3: of:=[.V3]+1 -> 2 | AH3: of:=[.AB3]+1 -> 3 | AN3: of:=[.AH3]+1 -> 4 | AT3: of:=[.AN3]+1 -> 5 | AZ3: of:=[.AT3]+1 -> 6 | BF3: of:=[.AZ3]+1 -> 7
B4: Inputs | G4: Outputs | P4: of:=MATCH([.P3];[.$B$7:.$B$22];0)+2 -> 3 | V4: of:=MATCH([.V3];[.$B$7:.$B$22];0)+2 -> 4 | AB4: of:=MATCH([.AB3];[.$B$7:.$B$22];0)+2 -> 5 | AH4: of:=MATCH([.AH3];[.$B$7:.$B$22];0)+2 -> 6 | AN4: of:=MATCH([.AN3];[.$B$7:.$B$22];0)+2 -> 7 | AT4: of:=MATCH([.AT3];[.$B$7:.$B$22];0)+2 -> 8 | AZ4: of:=MATCH([.AZ3];[.$B$7:.$B$22];0)+2 -> 9 | BF4: of:=MATCH([.BF3];[.$B$7:.$B$22];0)+2 -> 10
B5: # | C5: D | D5: C | E5: B | F5: A | G5: a | H5: b | I5: c | J5: d | K5: e | L5: f | M5: g | Q5: of:=HLOOKUP([.T5];[.$G$5:.$M$22];[.P4];0) -> 1 | R5: of:=[.T5]&T(ORG.OPENOFFICE.STYLE(IF([.Q5]=1;"seg1";IF([.Q5]=0;"seg0";"segX")))) -> a | T5: a | W5: of:=HLOOKUP([.Z5];[.$G$5:.$M$22];[.V4];0) -> 0 | X5: of:=[.Z5]&T(ORG.OPENOFFICE.STYLE(IF([.W5]=1;"seg1";IF([.W5]=0;"seg0";"segX")))) -> a | Z5: a | AC5: of:=HLOOKUP([.AF5];[.$G$5:.$M$22];[.AB4];0) -> 1 | AD5: of:=[.AF5]&T(ORG.OPENOFFICE.STYLE(IF([.AC5]=1;"seg1";IF([.AC5]=0;"seg0";"segX")))) -> a | AF5: a | AI5: of:=HLOOKUP([.AL5];[.$G$5:.$M$22];[.AH4];0) -> 1 | AJ5: of:=[.AL5]&T(ORG.OPENOFFICE.STYLE(IF([.AI5]=1;"seg1";IF([.AI5]=0;"seg0";"segX")))) -> a | AL5: a | AO5: of:=HLOOKUP([.AR5];[.$G$5:.$M$22];[.AN4];0) -> X | AP5: of:=[.AR5]&T(ORG.OPENOFFICE.STYLE(IF([.AO5]=1;"seg1";IF([.AO5]=0;"seg0";"segX")))) -> a | AR5: a | AU5: of:=HLOOKUP([.AX5];[.$G$5:.$M$22];[.AT4];0) -> X | AV5: of:=[.AX5]&T(ORG.OPENOFFICE.STYLE(IF([.AU5]=1;"seg1";IF([.AU5]=0;"seg0";"segX")))) -> a | AX5: a | BA5: of:=HLOOKUP([.BD5];[.$G$5:.$M$22];[.AZ4];0) -> X | BB5: of:=[.BD5]&T(ORG.OPENOFFICE.STYLE(IF([.BA5]=1;"seg1";IF([.BA5]=0;"seg0";"segX")))) -> a | BD5: a | BG5: of:=HLOOKUP([.BJ5];[.$G$5:.$M$22];[.BF4];0) -> X | BH5: of:=[.BJ5]&T(ORG.OPENOFFICE.STYLE(IF([.BG5]=1;"seg1";IF([.BG5]=0;"seg0";"segX")))) -> a | BJ5: a
C6: 8 | D6: 4 | E6: 2 | F6: 1 | P6: of:=HLOOKUP([.R6];[.$G$5:.$M$22];[.P4];0) -> 1 | Q6: of:=[.R6]&T(ORG.OPENOFFICE.STYLE(IF([.P6]=1;"seg1";IF([.P6]=0;"seg0";"segX")))) -> f | R6: f | S6: of:=HLOOKUP([.U6];[.$G$5:.$M$22];[.P4];0) -> 1 | T6: of:=[.U6]&T(ORG.OPENOFFICE.STYLE(IF([.S6]=1;"seg1";IF([.S6]=0;"seg0";"segX")))) -> b | U6: b | V6: of:=HLOOKUP([.X6];[.$G$5:.$M$22];[.V4];0) -> 0 | W6: of:=[.X6]&T(ORG.OPENOFFICE.STYLE(IF([.V6]=1;"seg1";IF([.V6]=0;"seg0";"segX")))) -> f | X6: f | Y6: of:=HLOOKUP([.AA6];[.$G$5:.$M$22];[.V4];0) -> 1 | Z6: of:=[.AA6]&T(ORG.OPENOFFICE.STYLE(IF([.Y6]=1;"seg1";IF([.Y6]=0;"seg0";"segX")))) -> b | AA6: b | AB6: of:=HLOOKUP([.AD6];[.$G$5:.$M$22];[.AB4];0) -> 0 | AC6: of:=[.AD6]&T(ORG.OPENOFFICE.STYLE(IF([.AB6]=1;"seg1";IF([.AB6]=0;"seg0";"segX")))) -> f | AD6: f | AE6: of:=HLOOKUP([.AG6];[.$G$5:.$M$22];[.AB4];0) -> 1 | AF6: of:=[.AG6]&T(ORG.OPENOFFICE.STYLE(IF([.AE6]=1;"seg1";IF([.AE6]=0;"seg0";"segX")))) -> b | AG6: b | AH6: of:=HLOOKUP([.AJ6];[.$G$5:.$M$22];[.AH4];0) -> 0 | AI6: of:=[.AJ6]&T(ORG.OPENOFFICE.STYLE(IF([.AH6]=1;"seg1";IF([.AH6]=0;"seg0";"segX")))) -> f | AJ6: f | AK6: of:=HLOOKUP([.AM6];[.$G$5:.$M$22];[.AH4];0) -> 1 | AL6: of:=[.AM6]&T(ORG.OPENOFFICE.STYLE(IF([.AK6]=1;"seg1";IF([.AK6]=0;"seg0";"segX")))) -> b | AM6: b | AN6: of:=HLOOKUP([.AP6];[.$G$5:.$M$22];[.AN4];0) -> X | AO6: of:=[.AP6]&T(ORG.OPENOFFICE.STYLE(IF([.AN6]=1;"seg1";IF([.AN6]=0;"seg0";"segX")))) -> f | AP6: f | AQ6: of:=HLOOKUP([.AS6];[.$G$5:.$M$22];[.AN4];0) -> X | AR6: of:=[.AS6]&T(ORG.OPENOFFICE.STYLE(IF([.AQ6]=1;"seg1";IF([.AQ6]=0;"seg0";"segX")))) -> b | AS6: b | AT6: of:=HLOOKUP([.AV6];[.$G$5:.$M$22];[.AT4];0) -> X | AU6: of:=[.AV6]&T(ORG.OPENOFFICE.STYLE(IF([.AT6]=1;"seg1";IF([.AT6]=0;"seg0";"segX")))) -> f | AV6: f | AW6: of:=HLOOKUP([.AY6];[.$G$5:.$M$22];[.AT4];0) -> X | AX6: of:=[.AY6]&T(ORG.OPENOFFICE.STYLE(IF([.AW6]=1;"seg1";IF([.AW6]=0;"seg0";"segX")))) -> b | AY6: b | AZ6: of:=HLOOKUP([.BB6];[.$G$5:.$M$22];[.AZ4];0) -> X | BA6: of:=[.BB6]&T(ORG.OPENOFFICE.STYLE(IF([.AZ6]=1;"seg1";IF([.AZ6]=0;"seg0";"segX")))) -> f | BB6: f | BC6: of:=HLOOKUP([.BE6];[.$G$5:.$M$22];[.AZ4];0) -> X | BD6: of:=[.BE6]&T(ORG.OPENOFFICE.STYLE(IF([.BC6]=1;"seg1";IF([.BC6]=0;"seg0";"segX")))) -> b | BE6: b | BF6: of:=HLOOKUP([.BH6];[.$G$5:.$M$22];[.BF4];0) -> X | BG6: of:=[.BH6]&T(ORG.OPENOFFICE.STYLE(IF([.BF6]=1;"seg1";IF([.BF6]=0;"seg0";"segX")))) -> f | BH6: f | BI6: of:=HLOOKUP([.BK6];[.$G$5:.$M$22];[.BF4];0) -> X | BJ6: of:=[.BK6]&T(ORG.OPENOFFICE.STYLE(IF([.BI6]=1;"seg1";IF([.BI6]=0;"seg0";"segX")))) -> b | BK6: b
B7: 0 | C7: of:=MOD(ROUNDDOWN([.$B7]/[.C$6]);2) -> 0 | D7: of:=MOD(ROUNDDOWN([.$B7]/[.D$6]);2) -> 0 | E7: of:=MOD(ROUNDDOWN([.$B7]/[.E$6]);2) -> 0 | F7: of:=MOD(ROUNDDOWN([.$B7]/[.F$6]);2) -> 0 | G7: 1 | H7: 1 | I7: 1 | J7: 1 | K7: 1 | L7: 1 | M7: 0
B8: of:=[.B7]+1 -> 1 | C8: of:=MOD(ROUNDDOWN([.$B8]/[.C$6]);2) -> 0 | D8: of:=MOD(ROUNDDOWN([.$B8]/[.D$6]);2) -> 0 | E8: of:=MOD(ROUNDDOWN([.$B8]/[.E$6]);2) -> 0 | F8: of:=MOD(ROUNDDOWN([.$B8]/[.F$6]);2) -> 1 | G8: 0 | H8: 1 | I8: 1 | J8: 0 | K8: 0 | L8: 0 | M8: 0 | Q8: of:=HLOOKUP([.T8];[.$G$5:.$M$22];[.P4];0) -> 0 | R8: of:=[.T8]&T(ORG.OPENOFFICE.STYLE(IF([.Q8]=1;"seg1";IF([.Q8]=0;"seg0";"segX")))) -> g | T8: g | W8: of:=HLOOKUP([.Z8];[.$G$5:.$M$22];[.V4];0) -> 0 | X8: of:=[.Z8]&T(ORG.OPENOFFICE.STYLE(IF([.W8]=1;"seg1";IF([.W8]=0;"seg0";"segX")))) -> g | Z8: g | AC8: of:=HLOOKUP([.AF8];[.$G$5:.$M$22];[.AB4];0) -> 1 | AD8: of:=[.AF8]&T(ORG.OPENOFFICE.STYLE(IF([.AC8]=1;"seg1";IF([.AC8]=0;"seg0";"segX")))) -> g | AF8: g | AI8: of:=HLOOKUP([.AL8];[.$G$5:.$M$22];[.AH4];0) -> 1 | AJ8: of:=[.AL8]&T(ORG.OPENOFFICE.STYLE(IF([.AI8]=1;"seg1";IF([.AI8]=0;"seg0";"segX")))) -> g | AL8: g | AO8: of:=HLOOKUP([.AR8];[.$G$5:.$M$22];[.AN4];0) -> X | AP8: of:=[.AR8]&T(ORG.OPENOFFICE.STYLE(IF([.AO8]=1;"seg1";IF([.AO8]=0;"seg0";"segX")))) -> g | AR8: g | AU8: of:=HLOOKUP([.AX8];[.$G$5:.$M$22];[.AT4];0) -> X | AV8: of:=[.AX8]&T(ORG.OPENOFFICE.STYLE(IF([.AU8]=1;"seg1";IF([.AU8]=0;"seg0";"segX")))) -> g | AX8: g | BA8: of:=HLOOKUP([.BD8];[.$G$5:.$M$22];[.AZ4];0) -> X | BB8: of:=[.BD8]&T(ORG.OPENOFFICE.STYLE(IF([.BA8]=1;"seg1";IF([.BA8]=0;"seg0";"segX")))) -> g | BD8: g | BG8: of:=HLOOKUP([.BJ8];[.$G$5:.$M$22];[.BF4];0) -> X | BH8: of:=[.BJ8]&T(ORG.OPENOFFICE.STYLE(IF([.BG8]=1;"seg1";IF([.BG8]=0;"seg0";"segX")))) -> g | BJ8: g
B9: of:=[.B8]+1 -> 2 | C9: of:=MOD(ROUNDDOWN([.$B9]/[.C$6]);2) -> 0 | D9: of:=MOD(ROUNDDOWN([.$B9]/[.D$6]);2) -> 0 | E9: of:=MOD(ROUNDDOWN([.$B9]/[.E$6]);2) -> 1 | F9: of:=MOD(ROUNDDOWN([.$B9]/[.F$6]);2) -> 0 | G9: 1 | H9: 1 | I9: 0 | J9: 1 | K9: 1 | L9: 0 | M9: 1 | P9: of:=HLOOKUP([.R9];[.$G$5:.$M$22];[.P4];0) -> 1 | Q9: of:=[.R9]&T(ORG.OPENOFFICE.STYLE(IF([.P9]=1;"seg1";IF([.P9]=0;"seg0";"segX")))) -> e | R9: e | S9: of:=HLOOKUP([.U9];[.$G$5:.$M$22];[.P4];0) -> 1 | T9: of:=[.U9]&T(ORG.OPENOFFICE.STYLE(IF([.S9]=1;"seg1";IF([.S9]=0;"seg0";"segX")))) -> c | U9: c | V9: of:=HLOOKUP([.X9];[.$G$5:.$M$22];[.V4];0) -> 0 | W9: of:=[.X9]&T(ORG.OPENOFFICE.STYLE(IF([.V9]=1;"seg1";IF([.V9]=0;"seg0";"segX")))) -> e | X9: e | Y9: of:=HLOOKUP([.AA9];[.$G$5:.$M$22];[.V4];0) -> 1 | Z9: of:=[.AA9]&T(ORG.OPENOFFICE.STYLE(IF([.Y9]=1;"seg1";IF([.Y9]=0;"seg0";"segX")))) -> c | AA9: c | AB9: of:=HLOOKUP([.AD9];[.$G$5:.$M$22];[.AB4];0) -> 1 | AC9: of:=[.AD9]&T(ORG.OPENOFFICE.STYLE(IF([.AB9]=1;"seg1";IF([.AB9]=0;"seg0";"segX")))) -> e | AD9: e | AE9: of:=HLOOKUP([.AG9];[.$G$5:.$M$22];[.AB4];0) -> 0 | AF9: of:=[.AG9]&T(ORG.OPENOFFICE.STYLE(IF([.AE9]=1;"seg1";IF([.AE9]=0;"seg0";"segX")))) -> c | AG9: c | AH9: of:=HLOOKUP([.AJ9];[.$G$5:.$M$22];[.AH4];0) -> 0 | AI9: of:=[.AJ9]&T(ORG.OPENOFFICE.STYLE(IF([.AH9]=1;"seg1";IF([.AH9]=0;"seg0";"segX")))) -> e | AJ9: e | AK9: of:=HLOOKUP([.AM9];[.$G$5:.$M$22];[.AH4];0) -> 1 | AL9: of:=[.AM9]&T(ORG.OPENOFFICE.STYLE(IF([.AK9]=1;"seg1";IF([.AK9]=0;"seg0";"segX")))) -> c | AM9: c | AN9: of:=HLOOKUP([.AP9];[.$G$5:.$M$22];[.AN4];0) -> X | AO9: of:=[.AP9]&T(ORG.OPENOFFICE.STYLE(IF([.AN9]=1;"seg1";IF([.AN9]=0;"seg0";"segX")))) -> e | AP9: e | AQ9: of:=HLOOKUP([.AS9];[.$G$5:.$M$22];[.AN4];0) -> X | AR9: of:=[.AS9]&T(ORG.OPENOFFICE.STYLE(IF([.AQ9]=1;"seg1";IF([.AQ9]=0;"seg0";"segX")))) -> c | AS9: c | AT9: of:=HLOOKUP([.AV9];[.$G$5:.$M$22];[.AT4];0) -> X | AU9: of:=[.AV9]&T(ORG.OPENOFFICE.STYLE(IF([.AT9]=1;"seg1";IF([.AT9]=0;"seg0";"segX")))) -> e | AV9: e | AW9: of:=HLOOKUP([.AY9];[.$G$5:.$M$22];[.AT4];0) -> X | AX9: of:=[.AY9]&T(ORG.OPENOFFICE.STYLE(IF([.AW9]=1;"seg1";IF([.AW9]=0;"seg0";"segX")))) -> c | AY9: c | AZ9: of:=HLOOKUP([.BB9];[.$G$5:.$M$22];[.AZ4];0) -> X | BA9: of:=[.BB9]&T(ORG.OPENOFFICE.STYLE(IF([.AZ9]=1;"seg1";IF([.AZ9]=0;"seg0";"segX")))) -> e | BB9: e | BC9: of:=HLOOKUP([.BE9];[.$G$5:.$M$22];[.AZ4];0) -> X | BD9: of:=[.BE9]&T(ORG.OPENOFFICE.STYLE(IF([.BC9]=1;"seg1";IF([.BC9]=0;"seg0";"segX")))) -> c | BE9: c | BF9: of:=HLOOKUP([.BH9];[.$G$5:.$M$22];[.BF4];0) -> X | BG9: of:=[.BH9]&T(ORG.OPENOFFICE.STYLE(IF([.BF9]=1;"seg1";IF([.BF9]=0;"seg0";"segX")))) -> e | BH9: e | BI9: of:=HLOOKUP([.BK9];[.$G$5:.$M$22];[.BF4];0) -> X | BJ9: of:=[.BK9]&T(ORG.OPENOFFICE.STYLE(IF([.BI9]=1;"seg1";IF([.BI9]=0;"seg0";"segX")))) -> c | BK9: c
B10: of:=[.B9]+1 -> 3 | C10: of:=MOD(ROUNDDOWN([.$B10]/[.C$6]);2) -> 0 | D10: of:=MOD(ROUNDDOWN([.$B10]/[.D$6]);2) -> 0 | E10: of:=MOD(ROUNDDOWN([.$B10]/[.E$6]);2) -> 1 | F10: of:=MOD(ROUNDDOWN([.$B10]/[.F$6]);2) -> 1 | G10: 1 | H10: 1 | I10: 1 | J10: 1 | K10: 0 | L10: 0 | M10: 1
B11: of:=[.B10]+1 -> 4 | C11: of:=MOD(ROUNDDOWN([.$B11]/[.C$6]);2) -> 0 | D11: of:=MOD(ROUNDDOWN([.$B11]/[.D$6]);2) -> 1 | E11: of:=MOD(ROUNDDOWN([.$B11]/[.E$6]);2) -> 0 | F11: of:=MOD(ROUNDDOWN([.$B11]/[.F$6]);2) -> 0 | G11: X | H11: X | I11: X | J11: X | K11: X | L11: X | M11: X | Q11: of:=HLOOKUP([.T11];[.$G$5:.$M$22];[.P4];0) -> 1 | R11: of:=[.T11]&T(ORG.OPENOFFICE.STYLE(IF([.Q11]=1;"seg1";IF([.Q11]=0;"seg0";"segX")))) -> d | T11: d | W11: of:=HLOOKUP([.Z11];[.$G$5:.$M$22];[.V4];0) -> 0 | X11: of:=[.Z11]&T(ORG.OPENOFFICE.STYLE(IF([.W11]=1;"seg1";IF([.W11]=0;"seg0";"segX")))) -> d | Z11: d | AC11: of:=HLOOKUP([.AF11];[.$G$5:.$M$22];[.AB4];0) -> 1 | AD11: of:=[.AF11]&T(ORG.OPENOFFICE.STYLE(IF([.AC11]=1;"seg1";IF([.AC11]=0;"seg0";"segX")))) -> d | AF11: d | AI11: of:=HLOOKUP([.AL11];[.$G$5:.$M$22];[.AH4];0) -> 1 | AJ11: of:=[.AL11]&T(ORG.OPENOFFICE.STYLE(IF([.AI11]=1;"seg1";IF([.AI11]=0;"seg0";"segX")))) -> d | AL11: d | AO11: of:=HLOOKUP([.AR11];[.$G$5:.$M$22];[.AN4];0) -> X | AP11: of:=[.AR11]&T(ORG.OPENOFFICE.STYLE(IF([.AO11]=1;"seg1";IF([.AO11]=0;"seg0";"segX")))) -> d | AR11: d | AU11: of:=HLOOKUP([.AX11];[.$G$5:.$M$22];[.AT4];0) -> X | AV11: of:=[.AX11]&T(ORG.OPENOFFICE.STYLE(IF([.AU11]=1;"seg1";IF([.AU11]=0;"seg0";"segX")))) -> d | AX11: d | BA11: of:=HLOOKUP([.BD11];[.$G$5:.$M$22];[.AZ4];0) -> X | BB11: of:=[.BD11]&T(ORG.OPENOFFICE.STYLE(IF([.BA11]=1;"seg1";IF([.BA11]=0;"seg0";"segX")))) -> d | BD11: d | BG11: of:=HLOOKUP([.BJ11];[.$G$5:.$M$22];[.BF4];0) -> X | BH11: of:=[.BJ11]&T(ORG.OPENOFFICE.STYLE(IF([.BG11]=1;"seg1";IF([.BG11]=0;"seg0";"segX")))) -> d | BJ11: d
B12: of:=[.B11]+1 -> 5 | C12: of:=MOD(ROUNDDOWN([.$B12]/[.C$6]);2) -> 0 | D12: of:=MOD(ROUNDDOWN([.$B12]/[.D$6]);2) -> 1 | E12: of:=MOD(ROUNDDOWN([.$B12]/[.E$6]);2) -> 0 | F12: of:=MOD(ROUNDDOWN([.$B12]/[.F$6]);2) -> 1 | G12: X | H12: X | I12: X | J12: X | K12: X | L12: X | M12: X
B13: of:=[.B12]+1 -> 6 | C13: of:=MOD(ROUNDDOWN([.$B13]/[.C$6]);2) -> 0 | D13: of:=MOD(ROUNDDOWN([.$B13]/[.D$6]);2) -> 1 | E13: of:=MOD(ROUNDDOWN([.$B13]/[.E$6]);2) -> 1 | F13: of:=MOD(ROUNDDOWN([.$B13]/[.F$6]);2) -> 0 | G13: X | H13: X | I13: X | J13: X | K13: X | L13: X | M13: X | P13: of:=[.BF3]+1 -> 8 | V13: of:=[.P13]+1 -> 9 | AB13: of:=[.V13]+1 -> 10 | AH13: of:=[.AB13]+1 -> 11 | AN13: of:=[.AH13]+1 -> 12 | AT13: of:=[.AN13]+1 -> 13 | AZ13: of:=[.AT13]+1 -> 14 | BF13: of:=[.AZ13]+1 -> 15
B14: of:=[.B13]+1 -> 7 | C14: of:=MOD(ROUNDDOWN([.$B14]/[.C$6]);2) -> 0 | D14: of:=MOD(ROUNDDOWN([.$B14]/[.D$6]);2) -> 1 | E14: of:=MOD(ROUNDDOWN([.$B14]/[.E$6]);2) -> 1 | F14: of:=MOD(ROUNDDOWN([.$B14]/[.F$6]);2) -> 1 | G14: X | H14: X | I14: X | J14: X | K14: X | L14: X | M14: X | P14: of:=MATCH([.P13];[.$B$7:.$B$22];0)+2 -> 11 | V14: of:=MATCH([.V13];[.$B$7:.$B$22];0)+2 -> 12 | AB14: of:=MATCH([.AB13];[.$B$7:.$B$22];0)+2 -> 13 | AH14: of:=MATCH([.AH13];[.$B$7:.$B$22];0)+2 -> 14 | AN14: of:=MATCH([.AN13];[.$B$7:.$B$22];0)+2 -> 15 | AT14: of:=MATCH([.AT13];[.$B$7:.$B$22];0)+2 -> 16 | AZ14: of:=MATCH([.AZ13];[.$B$7:.$B$22];0)+2 -> 17 | BF14: of:=MATCH([.BF13];[.$B$7:.$B$22];0)+2 -> 18
B15: of:=[.B14]+1 -> 8 | C15: of:=MOD(ROUNDDOWN([.$B15]/[.C$6]);2) -> 1 | D15: of:=MOD(ROUNDDOWN([.$B15]/[.D$6]);2) -> 0 | E15: of:=MOD(ROUNDDOWN([.$B15]/[.E$6]);2) -> 0 | F15: of:=MOD(ROUNDDOWN([.$B15]/[.F$6]);2) -> 0 | G15: X | H15: X | I15: X | J15: X | K15: X | L15: X | M15: X | Q15: of:=HLOOKUP([.T15];[.$G$5:.$M$22];[.P14];0) -> X | R15: of:=[.T15]&T(ORG.OPENOFFICE.STYLE(IF([.Q15]=1;"seg1";IF([.Q15]=0;"seg0";"segX")))) -> a | T15: a | W15: of:=HLOOKUP([.Z15];[.$G$5:.$M$22];[.V14];0) -> X | X15: of:=[.Z15]&T(ORG.OPENOFFICE.STYLE(IF([.W15]=1;"seg1";IF([.W15]=0;"seg0";"segX")))) -> a | Z15: a | AC15: of:=HLOOKUP([.AF15];[.$G$5:.$M$22];[.AB14];0) -> X | AD15: of:=[.AF15]&T(ORG.OPENOFFICE.STYLE(IF([.AC15]=1;"seg1";IF([.AC15]=0;"seg0";"segX")))) -> a | AF15: a | AI15: of:=HLOOKUP([.AL15];[.$G$5:.$M$22];[.AH14];0) -> X | AJ15: of:=[.AL15]&T(ORG.OPENOFFICE.STYLE(IF([.AI15]=1;"seg1";IF([.AI15]=0;"seg0";"segX")))) -> a | AL15: a | AO15: of:=HLOOKUP([.AR15];[.$G$5:.$M$22];[.AN14];0) -> X | AP15: of:=[.AR15]&T(ORG.OPENOFFICE.STYLE(IF([.AO15]=1;"seg1";IF([.AO15]=0;"seg0";"segX")))) -> a | AR15: a | AU15: of:=HLOOKUP([.AX15];[.$G$5:.$M$22];[.AT14];0) -> X | AV15: of:=[.AX15]&T(ORG.OPENOFFICE.STYLE(IF([.AU15]=1;"seg1";IF([.AU15]=0;"seg0";"segX")))) -> a | AX15: a | BA15: of:=HLOOKUP([.BD15];[.$G$5:.$M$22];[.AZ14];0) -> X | BB15: of:=[.BD15]&T(ORG.OPENOFFICE.STYLE(IF([.BA15]=1;"seg1";IF([.BA15]=0;"seg0";"segX")))) -> a | BD15: a | BG15: of:=HLOOKUP([.BJ15];[.$G$5:.$M$22];[.BF14];0) -> X | BH15: of:=[.BJ15]&T(ORG.OPENOFFICE.STYLE(IF([.BG15]=1;"seg1";IF([.BG15]=0;"seg0";"segX")))) -> a | BJ15: a
B16: of:=[.B15]+1 -> 9 | C16: of:=MOD(ROUNDDOWN([.$B16]/[.C$6]);2) -> 1 | D16: of:=MOD(ROUNDDOWN([.$B16]/[.D$6]);2) -> 0 | E16: of:=MOD(ROUNDDOWN([.$B16]/[.E$6]);2) -> 0 | F16: of:=MOD(ROUNDDOWN([.$B16]/[.F$6]);2) -> 1 | G16: X | H16: X | I16: X | J16: X | K16: X | L16: X | M16: X | P16: of:=HLOOKUP([.R16];[.$G$5:.$M$22];[.P14];0) -> X | Q16: of:=[.R16]&T(ORG.OPENOFFICE.STYLE(IF([.P16]=1;"seg1";IF([.P16]=0;"seg0";"segX")))) -> f | R16: f | S16: of:=HLOOKUP([.U16];[.$G$5:.$M$22];[.P14];0) -> X | T16: of:=[.U16]&T(ORG.OPENOFFICE.STYLE(IF([.S16]=1;"seg1";IF([.S16]=0;"seg0";"segX")))) -> b | U16: b | V16: of:=HLOOKUP([.X16];[.$G$5:.$M$22];[.V14];0) -> X | W16: of:=[.X16]&T(ORG.OPENOFFICE.STYLE(IF([.V16]=1;"seg1";IF([.V16]=0;"seg0";"segX")))) -> f | X16: f | Y16: of:=HLOOKUP([.AA16];[.$G$5:.$M$22];[.V14];0) -> X | Z16: of:=[.AA16]&T(ORG.OPENOFFICE.STYLE(IF([.Y16]=1;"seg1";IF([.Y16]=0;"seg0";"segX")))) -> b | AA16: b | AB16: of:=HLOOKUP([.AD16];[.$G$5:.$M$22];[.AB14];0) -> X | AC16: of:=[.AD16]&T(ORG.OPENOFFICE.STYLE(IF([.AB16]=1;"seg1";IF([.AB16]=0;"seg0";"segX")))) -> f | AD16: f | AE16: of:=HLOOKUP([.AG16];[.$G$5:.$M$22];[.AB14];0) -> X | AF16: of:=[.AG16]&T(ORG.OPENOFFICE.STYLE(IF([.AE16]=1;"seg1";IF([.AE16]=0;"seg0";"segX")))) -> b | AG16: b | AH16: of:=HLOOKUP([.AJ16];[.$G$5:.$M$22];[.AH14];0) -> X | AI16: of:=[.AJ16]&T(ORG.OPENOFFICE.STYLE(IF([.AH16]=1;"seg1";IF([.AH16]=0;"seg0";"segX")))) -> f | AJ16: f | AK16: of:=HLOOKUP([.AM16];[.$G$5:.$M$22];[.AH14];0) -> X | AL16: of:=[.AM16]&T(ORG.OPENOFFICE.STYLE(IF([.AK16]=1;"seg1";IF([.AK16]=0;"seg0";"segX")))) -> b | AM16: b | AN16: of:=HLOOKUP([.AP16];[.$G$5:.$M$22];[.AN14];0) -> X | AO16: of:=[.AP16]&T(ORG.OPENOFFICE.STYLE(IF([.AN16]=1;"seg1";IF([.AN16]=0;"seg0";"segX")))) -> f | AP16: f | AQ16: of:=HLOOKUP([.AS16];[.$G$5:.$M$22];[.AN14];0) -> X | AR16: of:=[.AS16]&T(ORG.OPENOFFICE.STYLE(IF([.AQ16]=1;"seg1";IF([.AQ16]=0;"seg0";"segX")))) -> b | AS16: b | AT16: of:=HLOOKUP([.AV16];[.$G$5:.$M$22];[.AT14];0) -> X | AU16: of:=[.AV16]&T(ORG.OPENOFFICE.STYLE(IF([.AT16]=1;"seg1";IF([.AT16]=0;"seg0";"segX")))) -> f | AV16: f | AW16: of:=HLOOKUP([.AY16];[.$G$5:.$M$22];[.AT14];0) -> X | AX16: of:=[.AY16]&T(ORG.OPENOFFICE.STYLE(IF([.AW16]=1;"seg1";IF([.AW16]=0;"seg0";"segX")))) -> b | AY16: b | AZ16: of:=HLOOKUP([.BB16];[.$G$5:.$M$22];[.AZ14];0) -> X | BA16: of:=[.BB16]&T(ORG.OPENOFFICE.STYLE(IF([.AZ16]=1;"seg1";IF([.AZ16]=0;"seg0";"segX")))) -> f | BB16: f | BC16: of:=HLOOKUP([.BE16];[.$G$5:.$M$22];[.AZ14];0) -> X | BD16: of:=[.BE16]&T(ORG.OPENOFFICE.STYLE(IF([.BC16]=1;"seg1";IF([.BC16]=0;"seg0";"segX")))) -> b | BE16: b | BF16: of:=HLOOKUP([.BH16];[.$G$5:.$M$22];[.BF14];0) -> X | BG16: of:=[.BH16]&T(ORG.OPENOFFICE.STYLE(IF([.BF16]=1;"seg1";IF([.BF16]=0;"seg0";"segX")))) -> f | BH16: f | BI16: of:=HLOOKUP([.BK16];[.$G$5:.$M$22];[.BF14];0) -> X | BJ16: of:=[.BK16]&T(ORG.OPENOFFICE.STYLE(IF([.BI16]=1;"seg1";IF([.BI16]=0;"seg0";"segX")))) -> b | BK16: b
B17: of:=[.B16]+1 -> 10 | C17: of:=MOD(ROUNDDOWN([.$B17]/[.C$6]);2) -> 1 | D17: of:=MOD(ROUNDDOWN([.$B17]/[.D$6]);2) -> 0 | E17: of:=MOD(ROUNDDOWN([.$B17]/[.E$6]);2) -> 1 | F17: of:=MOD(ROUNDDOWN([.$B17]/[.F$6]);2) -> 0 | G17: X | H17: X | I17: X | J17: X | K17: X | L17: X | M17: X
B18: of:=[.B17]+1 -> 11 | C18: of:=MOD(ROUNDDOWN([.$B18]/[.C$6]);2) -> 1 | D18: of:=MOD(ROUNDDOWN([.$B18]/[.D$6]);2) -> 0 | E18: of:=MOD(ROUNDDOWN([.$B18]/[.E$6]);2) -> 1 | F18: of:=MOD(ROUNDDOWN([.$B18]/[.F$6]);2) -> 1 | G18: X | H18: X | I18: X | J18: X | K18: X | L18: X | M18: X | Q18: of:=HLOOKUP([.T18];[.$G$5:.$M$22];[.P14];0) -> X | R18: of:=[.T18]&T(ORG.OPENOFFICE.STYLE(IF([.Q18]=1;"seg1";IF([.Q18]=0;"seg0";"segX")))) -> g | T18: g | W18: of:=HLOOKUP([.Z18];[.$G$5:.$M$22];[.V14];0) -> X | X18: of:=[.Z18]&T(ORG.OPENOFFICE.STYLE(IF([.W18]=1;"seg1";IF([.W18]=0;"seg0";"segX")))) -> g | Z18: g | AC18: of:=HLOOKUP([.AF18];[.$G$5:.$M$22];[.AB14];0) -> X | AD18: of:=[.AF18]&T(ORG.OPENOFFICE.STYLE(IF([.AC18]=1;"seg1";IF([.AC18]=0;"seg0";"segX")))) -> g | AF18: g | AI18: of:=HLOOKUP([.AL18];[.$G$5:.$M$22];[.AH14];0) -> X | AJ18: of:=[.AL18]&T(ORG.OPENOFFICE.STYLE(IF([.AI18]=1;"seg1";IF([.AI18]=0;"seg0";"segX")))) -> g | AL18: g | AO18: of:=HLOOKUP([.AR18];[.$G$5:.$M$22];[.AN14];0) -> X | AP18: of:=[.AR18]&T(ORG.OPENOFFICE.STYLE(IF([.AO18]=1;"seg1";IF([.AO18]=0;"seg0";"segX")))) -> g | AR18: g | AU18: of:=HLOOKUP([.AX18];[.$G$5:.$M$22];[.AT14];0) -> X | AV18: of:=[.AX18]&T(ORG.OPENOFFICE.STYLE(IF([.AU18]=1;"seg1";IF([.AU18]=0;"seg0";"segX")))) -> g | AX18: g | BA18: of:=HLOOKUP([.BD18];[.$G$5:.$M$22];[.AZ14];0) -> X | BB18: of:=[.BD18]&T(ORG.OPENOFFICE.STYLE(IF([.BA18]=1;"seg1";IF([.BA18]=0;"seg0";"segX")))) -> g | BD18: g | BG18: of:=HLOOKUP([.BJ18];[.$G$5:.$M$22];[.BF14];0) -> X | BH18: of:=[.BJ18]&T(ORG.OPENOFFICE.STYLE(IF([.BG18]=1;"seg1";IF([.BG18]=0;"seg0";"segX")))) -> g | BJ18: g
B19: of:=[.B18]+1 -> 12 | C19: of:=MOD(ROUNDDOWN([.$B19]/[.C$6]);2) -> 1 | D19: of:=MOD(ROUNDDOWN([.$B19]/[.D$6]);2) -> 1 | E19: of:=MOD(ROUNDDOWN([.$B19]/[.E$6]);2) -> 0 | F19: of:=MOD(ROUNDDOWN([.$B19]/[.F$6]);2) -> 0 | G19: X | H19: X | I19: X | J19: X | K19: X | L19: X | M19: X | P19: of:=HLOOKUP([.R19];[.$G$5:.$M$22];[.P14];0) -> X | Q19: of:=[.R19]&T(ORG.OPENOFFICE.STYLE(IF([.P19]=1;"seg1";IF([.P19]=0;"seg0";"segX")))) -> e | R19: e | S19: of:=HLOOKUP([.U19];[.$G$5:.$M$22];[.P14];0) -> X | T19: of:=[.U19]&T(ORG.OPENOFFICE.STYLE(IF([.S19]=1;"seg1";IF([.S19]=0;"seg0";"segX")))) -> c | U19: c | V19: of:=HLOOKUP([.X19];[.$G$5:.$M$22];[.V14];0) -> X | W19: of:=[.X19]&T(ORG.OPENOFFICE.STYLE(IF([.V19]=1;"seg1";IF([.V19]=0;"seg0";"segX")))) -> e | X19: e | Y19: of:=HLOOKUP([.AA19];[.$G$5:.$M$22];[.V14];0) -> X | Z19: of:=[.AA19]&T(ORG.OPENOFFICE.STYLE(IF([.Y19]=1;"seg1";IF([.Y19]=0;"seg0";"segX")))) -> c | AA19: c | AB19: of:=HLOOKUP([.AD19];[.$G$5:.$M$22];[.AB14];0) -> X | AC19: of:=[.AD19]&T(ORG.OPENOFFICE.STYLE(IF([.AB19]=1;"seg1";IF([.AB19]=0;"seg0";"segX")))) -> e | AD19: e | AE19: of:=HLOOKUP([.AG19];[.$G$5:.$M$22];[.AB14];0) -> X | AF19: of:=[.AG19]&T(ORG.OPENOFFICE.STYLE(IF([.AE19]=1;"seg1";IF([.AE19]=0;"seg0";"segX")))) -> c | AG19: c | AH19: of:=HLOOKUP([.AJ19];[.$G$5:.$M$22];[.AH14];0) -> X | AI19: of:=[.AJ19]&T(ORG.OPENOFFICE.STYLE(IF([.AH19]=1;"seg1";IF([.AH19]=0;"seg0";"segX")))) -> e | AJ19: e | AK19: of:=HLOOKUP([.AM19];[.$G$5:.$M$22];[.AH14];0) -> X | AL19: of:=[.AM19]&T(ORG.OPENOFFICE.STYLE(IF([.AK19]=1;"seg1";IF([.AK19]=0;"seg0";"segX")))) -> c | AM19: c | AN19: of:=HLOOKUP([.AP19];[.$G$5:.$M$22];[.AN14];0) -> X | AO19: of:=[.AP19]&T(ORG.OPENOFFICE.STYLE(IF([.AN19]=1;"seg1";IF([.AN19]=0;"seg0";"segX")))) -> e | AP19: e | AQ19: of:=HLOOKUP([.AS19];[.$G$5:.$M$22];[.AN14];0) -> X | AR19: of:=[.AS19]&T(ORG.OPENOFFICE.STYLE(IF([.AQ19]=1;"seg1";IF([.AQ19]=0;"seg0";"segX")))) -> c | AS19: c | AT19: of:=HLOOKUP([.AV19];[.$G$5:.$M$22];[.AT14];0) -> X | AU19: of:=[.AV19]&T(ORG.OPENOFFICE.STYLE(IF([.AT19]=1;"seg1";IF([.AT19]=0;"seg0";"segX")))) -> e | AV19: e | AW19: of:=HLOOKUP([.AY19];[.$G$5:.$M$22];[.AT14];0) -> X | AX19: of:=[.AY19]&T(ORG.OPENOFFICE.STYLE(IF([.AW19]=1;"seg1";IF([.AW19]=0;"seg0";"segX")))) -> c | AY19: c | AZ19: of:=HLOOKUP([.BB19];[.$G$5:.$M$22];[.AZ14];0) -> X | BA19: of:=[.BB19]&T(ORG.OPENOFFICE.STYLE(IF([.AZ19]=1;"seg1";IF([.AZ19]=0;"seg0";"segX")))) -> e | BB19: e | BC19: of:=HLOOKUP([.BE19];[.$G$5:.$M$22];[.AZ14];0) -> X | BD19: of:=[.BE19]&T(ORG.OPENOFFICE.STYLE(IF([.BC19]=1;"seg1";IF([.BC19]=0;"seg0";"segX")))) -> c | BE19: c | BF19: of:=HLOOKUP([.BH19];[.$G$5:.$M$22];[.BF14];0) -> X | BG19: of:=[.BH19]&T(ORG.OPENOFFICE.STYLE(IF([.BF19]=1;"seg1";IF([.BF19]=0;"seg0";"segX")))) -> e | BH19: e | BI19: of:=HLOOKUP([.BK19];[.$G$5:.$M$22];[.BF14];0) -> X | BJ19: of:=[.BK19]&T(ORG.OPENOFFICE.STYLE(IF([.BI19]=1;"seg1";IF([.BI19]=0;"seg0";"segX")))) -> c | BK19: c
B20: of:=[.B19]+1 -> 13 | C20: of:=MOD(ROUNDDOWN([.$B20]/[.C$6]);2) -> 1 | D20: of:=MOD(ROUNDDOWN([.$B20]/[.D$6]);2) -> 1 | E20: of:=MOD(ROUNDDOWN([.$B20]/[.E$6]);2) -> 0 | F20: of:=MOD(ROUNDDOWN([.$B20]/[.F$6]);2) -> 1 | G20: X | H20: X | I20: X | J20: X | K20: X | L20: X | M20: X
B21: of:=[.B20]+1 -> 14 | C21: of:=MOD(ROUNDDOWN([.$B21]/[.C$6]);2) -> 1 | D21: of:=MOD(ROUNDDOWN([.$B21]/[.D$6]);2) -> 1 | E21: of:=MOD(ROUNDDOWN([.$B21]/[.E$6]);2) -> 1 | F21: of:=MOD(ROUNDDOWN([.$B21]/[.F$6]);2) -> 0 | G21: X | H21: X | I21: X | J21: X | K21: X | L21: X | M21: X | Q21: of:=HLOOKUP([.T21];[.$G$5:.$M$22];[.P14];0) -> X | R21: of:=[.T21]&T(ORG.OPENOFFICE.STYLE(IF([.Q21]=1;"seg1";IF([.Q21]=0;"seg0";"segX")))) -> d | T21: d | W21: of:=HLOOKUP([.Z21];[.$G$5:.$M$22];[.V14];0) -> X | X21: of:=[.Z21]&T(ORG.OPENOFFICE.STYLE(IF([.W21]=1;"seg1";IF([.W21]=0;"seg0";"segX")))) -> d | Z21: d | AC21: of:=HLOOKUP([.AF21];[.$G$5:.$M$22];[.AB14];0) -> X | AD21: of:=[.AF21]&T(ORG.OPENOFFICE.STYLE(IF([.AC21]=1;"seg1";IF([.AC21]=0;"seg0";"segX")))) -> d | AF21: d | AI21: of:=HLOOKUP([.AL21];[.$G$5:.$M$22];[.AH14];0) -> X | AJ21: of:=[.AL21]&T(ORG.OPENOFFICE.STYLE(IF([.AI21]=1;"seg1";IF([.AI21]=0;"seg0";"segX")))) -> d | AL21: d | AO21: of:=HLOOKUP([.AR21];[.$G$5:.$M$22];[.AN14];0) -> X | AP21: of:=[.AR21]&T(ORG.OPENOFFICE.STYLE(IF([.AO21]=1;"seg1";IF([.AO21]=0;"seg0";"segX")))) -> d | AR21: d | AU21: of:=HLOOKUP([.AX21];[.$G$5:.$M$22];[.AT14];0) -> X | AV21: of:=[.AX21]&T(ORG.OPENOFFICE.STYLE(IF([.AU21]=1;"seg1";IF([.AU21]=0;"seg0";"segX")))) -> d | AX21: d | BA21: of:=HLOOKUP([.BD21];[.$G$5:.$M$22];[.AZ14];0) -> X | BB21: of:=[.BD21]&T(ORG.OPENOFFICE.STYLE(IF([.BA21]=1;"seg1";IF([.BA21]=0;"seg0";"segX")))) -> d | BD21: d | BG21: of:=HLOOKUP([.BJ21];[.$G$5:.$M$22];[.BF14];0) -> X | BH21: of:=[.BJ21]&T(ORG.OPENOFFICE.STYLE(IF([.BG21]=1;"seg1";IF([.BG21]=0;"seg0";"segX")))) -> d | BJ21: d
B22: of:=[.B21]+1 -> 15 | C22: of:=MOD(ROUNDDOWN([.$B22]/[.C$6]);2) -> 1 | D22: of:=MOD(ROUNDDOWN([.$B22]/[.D$6]);2) -> 1 | E22: of:=MOD(ROUNDDOWN([.$B22]/[.E$6]);2) -> 1 | F22: of:=MOD(ROUNDDOWN([.$B22]/[.F$6]);2) -> 1 | G22: X | H22: X | I22: X | J22: X | K22: X | L22: X | M22: X
P24: Karnaugh-maps
P25: a | Q25: of:=MATCH([.P25];[.$G$5:.$M$5])+5 -> 6 | R25: BA | W25: b | X25: of:=MATCH([.W25];[.$G$5:.$M$5])+5 -> 7 | Y25: BA | AD25: c | AE25: of:=MATCH([.AD25];[.$G$5:.$M$5])+5 -> 8 | AF25: BA | AK25: d | AL25: of:=MATCH([.AK25];[.$G$5:.$M$5])+5 -> 9 | AM25: BA | AR25: e | AS25: of:=MATCH([.AR25];[.$G$5:.$M$5])+5 -> 10 | AT25: BA | AY25: f | AZ25: of:=MATCH([.AY25];[.$G$5:.$M$5])+5 -> 11 | BA25: BA | BF25: g | BG25: of:=MATCH([.BF25];[.$G$5:.$M$5])+5 -> 12 | BH25: BA
R26: 00 | S26: 01 | T26: 11 | U26: 10 | Y26: 00 | Z26: 01 | AA26: 11 | AB26: 10 | AF26: 00 | AG26: 01 | AH26: 11 | AI26: 10 | AM26: 00 | AN26: 01 | AO26: 11 | AP26: 10 | AT26: 00 | AU26: 01 | AV26: 11 | AW26: 10 | BA26: 00 | BB26: 01 | BC26: 11 | BD26: 10 | BH26: 00 | BI26: 01 | BJ26: 11 | BK26: 10
P27: DC | R27: of:=HLOOKUP(MID([.R25];1;1);[.$C$5:.$F$6];2;0)*MID([.R26];1;1) + HLOOKUP(MID([.R25];2;1);[.$C$5:.$F$6];2;0)*MID([.R26];2;1) -> 0 | S27: of:=HLOOKUP(MID([.R25];1;1);[.$C$5:.$F$6];2;0)*MID([.S26];1;1) + HLOOKUP(MID([.R25];2;1);[.$C$5:.$F$6];2;0)*MID([.S26];2;1) -> 1 | T27: of:=HLOOKUP(MID([.R25];1;1);[.$C$5:.$F$6];2;0)*MID([.T26];1;1) + HLOOKUP(MID([.R25];2;1);[.$C$5:.$F$6];2;0)*MID([.T26];2;1) -> 3 | U27: of:=HLOOKUP(MID([.R25];1;1);[.$C$5:.$F$6];2;0)*MID([.U26];1;1) + HLOOKUP(MID([.R25];2;1);[.$C$5:.$F$6];2;0)*MID([.U26];2;1) -> 2 | W27: DC | Y27: of:=HLOOKUP(MID([.Y25];1;1);[.$C$5:.$F$6];2;0)*MID([.Y26];1;1) + HLOOKUP(MID([.Y25];2;1);[.$C$5:.$F$6];2;0)*MID([.Y26];2;1) -> 0 | Z27: of:=HLOOKUP(MID([.Y25];1;1);[.$C$5:.$F$6];2;0)*MID([.Z26];1;1) + HLOOKUP(MID([.Y25];2;1);[.$C$5:.$F$6];2;0)*MID([.Z26];2;1) -> 1 | AA27: of:=HLOOKUP(MID([.Y25];1;1);[.$C$5:.$F$6];2;0)*MID([.AA26];1;1) + HLOOKUP(MID([.Y25];2;1);[.$C$5:.$F$6];2;0)*MID([.AA26];2;1) -> 3 | AB27: of:=HLOOKUP(MID([.Y25];1;1);[.$C$5:.$F$6];2;0)*MID([.AB26];1;1) + HLOOKUP(MID([.Y25];2;1);[.$C$5:.$F$6];2;0)*MID([.AB26];2;1) -> 2 | AD27: DC | AF27: of:=HLOOKUP(MID([.AF25];1;1);[.$C$5:.$F$6];2;0)*MID([.AF26];1;1) + HLOOKUP(MID([.AF25];2;1);[.$C$5:.$F$6];2;0)*MID([.AF26];2;1) -> 0 | AG27: of:=HLOOKUP(MID([.AF25];1;1);[.$C$5:.$F$6];2;0)*MID([.AG26];1;1) + HLOOKUP(MID([.AF25];2;1);[.$C$5:.$F$6];2;0)*MID([.AG26];2;1) -> 1 | AH27: of:=HLOOKUP(MID([.AF25];1;1);[.$C$5:.$F$6];2;0)*MID([.AH26];1;1) + HLOOKUP(MID([.AF25];2;1);[.$C$5:.$F$6];2;0)*MID([.AH26];2;1) -> 3 | AI27: of:=HLOOKUP(MID([.AF25];1;1);[.$C$5:.$F$6];2;0)*MID([.AI26];1;1) + HLOOKUP(MID([.AF25];2;1);[.$C$5:.$F$6];2;0)*MID([.AI26];2;1) -> 2 | AK27: DC | AM27: of:=HLOOKUP(MID([.AM25];1;1);[.$C$5:.$F$6];2;0)*MID([.AM26];1;1) + HLOOKUP(MID([.AM25];2;1);[.$C$5:.$F$6];2;0)*MID([.AM26];2;1) -> 0 | AN27: of:=HLOOKUP(MID([.AM25];1;1);[.$C$5:.$F$6];2;0)*MID([.AN26];1;1) + HLOOKUP(MID([.AM25];2;1);[.$C$5:.$F$6];2;0)*MID([.AN26];2;1) -> 1 | AO27: of:=HLOOKUP(MID([.AM25];1;1);[.$C$5:.$F$6];2;0)*MID([.AO26];1;1) + HLOOKUP(MID([.AM25];2;1);[.$C$5:.$F$6];2;0)*MID([.AO26];2;1) -> 3 | AP27: of:=HLOOKUP(MID([.AM25];1;1);[.$C$5:.$F$6];2;0)*MID([.AP26];1;1) + HLOOKUP(MID([.AM25];2;1);[.$C$5:.$F$6];2;0)*MID([.AP26];2;1) -> 2 | AR27: DC | AT27: of:=HLOOKUP(MID([.AT25];1;1);[.$C$5:.$F$6];2;0)*MID([.AT26];1;1) + HLOOKUP(MID([.AT25];2;1);[.$C$5:.$F$6];2;0)*MID([.AT26];2;1) -> 0 | AU27: of:=HLOOKUP(MID([.AT25];1;1);[.$C$5:.$F$6];2;0)*MID([.AU26];1;1) + HLOOKUP(MID([.AT25];2;1);[.$C$5:.$F$6];2;0)*MID([.AU26];2;1) -> 1 | AV27: of:=HLOOKUP(MID([.AT25];1;1);[.$C$5:.$F$6];2;0)*MID([.AV26];1;1) + HLOOKUP(MID([.AT25];2;1);[.$C$5:.$F$6];2;0)*MID([.AV26];2;1) -> 3 | AW27: of:=HLOOKUP(MID([.AT25];1;1);[.$C$5:.$F$6];2;0)*MID([.AW26];1;1) + HLOOKUP(MID([.AT25];2;1);[.$C$5:.$F$6];2;0)*MID([.AW26];2;1) -> 2 | AY27: DC | BA27: of:=HLOOKUP(MID([.BA25];1;1);[.$C$5:.$F$6];2;0)*MID([.BA26];1;1) + HLOOKUP(MID([.BA25];2;1);[.$C$5:.$F$6];2;0)*MID([.BA26];2;1) -> 0 | BB27: of:=HLOOKUP(MID([.BA25];1;1);[.$C$5:.$F$6];2;0)*MID([.BB26];1;1) + HLOOKUP(MID([.BA25];2;1);[.$C$5:.$F$6];2;0)*MID([.BB26];2;1) -> 1 | BC27: of:=HLOOKUP(MID([.BA25];1;1);[.$C$5:.$F$6];2;0)*MID([.BC26];1;1) + HLOOKUP(MID([.BA25];2;1);[.$C$5:.$F$6];2;0)*MID([.BC26];2;1) -> 3 | BD27: of:=HLOOKUP(MID([.BA25];1;1);[.$C$5:.$F$6];2;0)*MID([.BD26];1;1) + HLOOKUP(MID([.BA25];2;1);[.$C$5:.$F$6];2;0)*MID([.BD26];2;1) -> 2 | BF27: DC | BH27: of:=HLOOKUP(MID([.BH25];1;1);[.$C$5:.$F$6];2;0)*MID([.BH26];1;1) + HLOOKUP(MID([.BH25];2;1);[.$C$5:.$F$6];2;0)*MID([.BH26];2;1) -> 0 | BI27: of:=HLOOKUP(MID([.BH25];1;1);[.$C$5:.$F$6];2;0)*MID([.BI26];1;1) + HLOOKUP(MID([.BH25];2;1);[.$C$5:.$F$6];2;0)*MID([.BI26];2;1) -> 1 | BJ27: of:=HLOOKUP(MID([.BH25];1;1);[.$C$5:.$F$6];2;0)*MID([.BJ26];1;1) + HLOOKUP(MID([.BH25];2;1);[.$C$5:.$F$6];2;0)*MID([.BJ26];2;1) -> 3 | BK27: of:=HLOOKUP(MID([.BH25];1;1);[.$C$5:.$F$6];2;0)*MID([.BK26];1;1) + HLOOKUP(MID([.BH25];2;1);[.$C$5:.$F$6];2;0)*MID([.BK26];2;1) -> 2
P28: 00 | Q28: of:=HLOOKUP(MID([.P27];1;1);[.$C$5:.$F$6];2;0)*MID([.P28];1;1) + HLOOKUP(MID([.P27];2;1);[.$C$5:.$F$6];2;0)*MID([.P28];2;1) -> 0 | R28: of:=VLOOKUP([.Q28]+[.R27];[.$B$7:.$M$22];[.Q25]) -> 1 | S28: of:=VLOOKUP([.Q28]+[.S27];[.$B$7:.$M$22];[.Q25]) -> 0 | T28: of:=VLOOKUP([.Q28]+[.T27];[.$B$7:.$M$22];[.Q25]) -> 1 | U28: of:=VLOOKUP([.Q28]+[.U27];[.$B$7:.$M$22];[.Q25]) -> 1 | W28: 00 | X28: of:=HLOOKUP(MID([.W27];1;1);[.$C$5:.$F$6];2;0)*MID([.W28];1;1) + HLOOKUP(MID([.W27];2;1);[.$C$5:.$F$6];2;0)*MID([.W28];2;1) -> 0 | Y28: of:=VLOOKUP([.X28]+[.Y27];[.$B$7:.$M$22];[.X25]) -> 1 | Z28: of:=VLOOKUP([.X28]+[.Z27];[.$B$7:.$M$22];[.X25]) -> 1 | AA28: of:=VLOOKUP([.X28]+[.AA27];[.$B$7:.$M$22];[.X25]) -> 1 | AB28: of:=VLOOKUP([.X28]+[.AB27];[.$B$7:.$M$22];[.X25]) -> 1 | AD28: 00 | AE28: of:=HLOOKUP(MID([.AD27];1;1);[.$C$5:.$F$6];2;0)*MID([.AD28];1;1) + HLOOKUP(MID([.AD27];2;1);[.$C$5:.$F$6];2;0)*MID([.AD28];2;1) -> 0 | AF28: of:=VLOOKUP([.AE28]+[.AF27];[.$B$7:.$M$22];[.AE25]) -> 1 | AG28: of:=VLOOKUP([.AE28]+[.AG27];[.$B$7:.$M$22];[.AE25]) -> 1 | AH28: of:=VLOOKUP([.AE28]+[.AH27];[.$B$7:.$M$22];[.AE25]) -> 1 | AI28: of:=VLOOKUP([.AE28]+[.AI27];[.$B$7:.$M$22];[.AE25]) -> 0 | AK28: 00 | AL28: of:=HLOOKUP(MID([.AK27];1;1);[.$C$5:.$F$6];2;0)*MID([.AK28];1;1) + HLOOKUP(MID([.AK27];2;1);[.$C$5:.$F$6];2;0)*MID([.AK28];2;1) -> 0 | AM28: of:=VLOOKUP([.AL28]+[.AM27];[.$B$7:.$M$22];[.AL25]) -> 1 | AN28: of:=VLOOKUP([.AL28]+[.AN27];[.$B$7:.$M$22];[.AL25]) -> 0 | AO28: of:=VLOOKUP([.AL28]+[.AO27];[.$B$7:.$M$22];[.AL25]) -> 1 | AP28: of:=VLOOKUP([.AL28]+[.AP27];[.$B$7:.$M$22];[.AL25]) -> 1 | AR28: 00 | AS28: of:=HLOOKUP(MID([.AR27];1;1);[.$C$5:.$F$6];2;0)*MID([.AR28];1;1) + HLOOKUP(MID([.AR27];2;1);[.$C$5:.$F$6];2;0)*MID([.AR28];2;1) -> 0 | AT28: of:=VLOOKUP([.AS28]+[.AT27];[.$B$7:.$M$22];[.AS25]) -> 1 | AU28: of:=VLOOKUP([.AS28]+[.AU27];[.$B$7:.$M$22];[.AS25]) -> 0 | AV28: of:=VLOOKUP([.AS28]+[.AV27];[.$B$7:.$M$22];[.AS25]) -> 0 | AW28: of:=VLOOKUP([.AS28]+[.AW27];[.$B$7:.$M$22];[.AS25]) -> 1 | AY28: 00 | AZ28: of:=HLOOKUP(MID([.AY27];1;1);[.$C$5:.$F$6];2;0)*MID([.AY28];1;1) + HLOOKUP(MID([.AY27];2;1);[.$C$5:.$F$6];2;0)*MID([.AY28];2;1) -> 0 | BA28: of:=VLOOKUP([.AZ28]+[.BA27];[.$B$7:.$M$22];[.AZ25]) -> 1 | BB28: of:=VLOOKUP([.AZ28]+[.BB27];[.$B$7:.$M$22];[.AZ25]) -> 0 | BC28: of:=VLOOKUP([.AZ28]+[.BC27];[.$B$7:.$M$22];[.AZ25]) -> 0 | BD28: of:=VLOOKUP([.AZ28]+[.BD27];[.$B$7:.$M$22];[.AZ25]) -> 0 | BF28: 00 | BG28: of:=HLOOKUP(MID([.BF27];1;1);[.$C$5:.$F$6];2;0)*MID([.BF28];1;1) + HLOOKUP(MID([.BF27];2;1);[.$C$5:.$F$6];2;0)*MID([.BF28];2;1) -> 0 | BH28: of:=VLOOKUP([.BG28]+[.BH27];[.$B$7:.$M$22];[.BG25]) -> 0 | BI28: of:=VLOOKUP([.BG28]+[.BI27];[.$B$7:.$M$22];[.BG25]) -> 0 | BJ28: of:=VLOOKUP([.BG28]+[.BJ27];[.$B$7:.$M$22];[.BG25]) -> 1 | BK28: of:=VLOOKUP([.BG28]+[.BK27];[.$B$7:.$M$22];[.BG25]) -> 1
P29: 01 | Q29: of:=HLOOKUP(MID([.P27];1;1);[.$C$5:.$F$6];2;0)*MID([.P29];1;1) + HLOOKUP(MID([.P27];2;1);[.$C$5:.$F$6];2;0)*MID([.P29];2;1) -> 4 | R29: of:=VLOOKUP([.Q29]+[.R27];[.$B$7:.$M$22];[.Q25]) -> X | S29: of:=VLOOKUP([.Q29]+[.S27];[.$B$7:.$M$22];[.Q25]) -> X | T29: of:=VLOOKUP([.Q29]+[.T27];[.$B$7:.$M$22];[.Q25]) -> X | U29: of:=VLOOKUP([.Q29]+[.U27];[.$B$7:.$M$22];[.Q25]) -> X | W29: 01 | X29: of:=HLOOKUP(MID([.W27];1;1);[.$C$5:.$F$6];2;0)*MID([.W29];1;1) + HLOOKUP(MID([.W27];2;1);[.$C$5:.$F$6];2;0)*MID([.W29];2;1) -> 4 | Y29: of:=VLOOKUP([.X29]+[.Y27];[.$B$7:.$M$22];[.X25]) -> X | Z29: of:=VLOOKUP([.X29]+[.Z27];[.$B$7:.$M$22];[.X25]) -> X | AA29: of:=VLOOKUP([.X29]+[.AA27];[.$B$7:.$M$22];[.X25]) -> X | AB29: of:=VLOOKUP([.X29]+[.AB27];[.$B$7:.$M$22];[.X25]) -> X | AD29: 01 | AE29: of:=HLOOKUP(MID([.AD27];1;1);[.$C$5:.$F$6];2;0)*MID([.AD29];1;1) + HLOOKUP(MID([.AD27];2;1);[.$C$5:.$F$6];2;0)*MID([.AD29];2;1) -> 4 | AF29: of:=VLOOKUP([.AE29]+[.AF27];[.$B$7:.$M$22];[.AE25]) -> X | AG29: of:=VLOOKUP([.AE29]+[.AG27];[.$B$7:.$M$22];[.AE25]) -> X | AH29: of:=VLOOKUP([.AE29]+[.AH27];[.$B$7:.$M$22];[.AE25]) -> X | AI29: of:=VLOOKUP([.AE29]+[.AI27];[.$B$7:.$M$22];[.AE25]) -> X | AK29: 01 | AL29: of:=HLOOKUP(MID([.AK27];1;1);[.$C$5:.$F$6];2;0)*MID([.AK29];1;1) + HLOOKUP(MID([.AK27];2;1);[.$C$5:.$F$6];2;0)*MID([.AK29];2;1) -> 4 | AM29: of:=VLOOKUP([.AL29]+[.AM27];[.$B$7:.$M$22];[.AL25]) -> X | AN29: of:=VLOOKUP([.AL29]+[.AN27];[.$B$7:.$M$22];[.AL25]) -> X | AO29: of:=VLOOKUP([.AL29]+[.AO27];[.$B$7:.$M$22];[.AL25]) -> X | AP29: of:=VLOOKUP([.AL29]+[.AP27];[.$B$7:.$M$22];[.AL25]) -> X | AR29: 01 | AS29: of:=HLOOKUP(MID([.AR27];1;1);[.$C$5:.$F$6];2;0)*MID([.AR29];1;1) + HLOOKUP(MID([.AR27];2;1);[.$C$5:.$F$6];2;0)*MID([.AR29];2;1) -> 4 | AT29: of:=VLOOKUP([.AS29]+[.AT27];[.$B$7:.$M$22];[.AS25]) -> X | AU29: of:=VLOOKUP([.AS29]+[.AU27];[.$B$7:.$M$22];[.AS25]) -> X | AV29: of:=VLOOKUP([.AS29]+[.AV27];[.$B$7:.$M$22];[.AS25]) -> X | AW29: of:=VLOOKUP([.AS29]+[.AW27];[.$B$7:.$M$22];[.AS25]) -> X | AY29: 01 | AZ29: of:=HLOOKUP(MID([.AY27];1;1);[.$C$5:.$F$6];2;0)*MID([.AY29];1;1) + HLOOKUP(MID([.AY27];2;1);[.$C$5:.$F$6];2;0)*MID([.AY29];2;1) -> 4 | BA29: of:=VLOOKUP([.AZ29]+[.BA27];[.$B$7:.$M$22];[.AZ25]) -> X | BB29: of:=VLOOKUP([.AZ29]+[.BB27];[.$B$7:.$M$22];[.AZ25]) -> X | BC29: of:=VLOOKUP([.AZ29]+[.BC27];[.$B$7:.$M$22];[.AZ25]) -> X | BD29: of:=VLOOKUP([.AZ29]+[.BD27];[.$B$7:.$M$22];[.AZ25]) -> X | BF29: 01 | BG29: of:=HLOOKUP(MID([.BF27];1;1);[.$C$5:.$F$6];2;0)*MID([.BF29];1;1) + HLOOKUP(MID([.BF27];2;1);[.$C$5:.$F$6];2;0)*MID([.BF29];2;1) -> 4 | BH29: of:=VLOOKUP([.BG29]+[.BH27];[.$B$7:.$M$22];[.BG25]) -> X | BI29: of:=VLOOKUP([.BG29]+[.BI27];[.$B$7:.$M$22];[.BG25]) -> X | BJ29: of:=VLOOKUP([.BG29]+[.BJ27];[.$B$7:.$M$22];[.BG25]) -> X | BK29: of:=VLOOKUP([.BG29]+[.BK27];[.$B$7:.$M$22];[.BG25]) -> X
P30: 11 | Q30: of:=HLOOKUP(MID([.P27];1;1);[.$C$5:.$F$6];2;0)*MID([.P30];1;1) + HLOOKUP(MID([.P27];2;1);[.$C$5:.$F$6];2;0)*MID([.P30];2;1) -> 12 | R30: of:=VLOOKUP([.Q30]+[.R27];[.$B$7:.$M$22];[.Q25]) -> X | S30: of:=VLOOKUP([.Q30]+[.S27];[.$B$7:.$M$22];[.Q25]) -> X | T30: of:=VLOOKUP([.Q30]+[.T27];[.$B$7:.$M$22];[.Q25]) -> X | U30: of:=VLOOKUP([.Q30]+[.U27];[.$B$7:.$M$22];[.Q25]) -> X | W30: 11 | X30: of:=HLOOKUP(MID([.W27];1;1);[.$C$5:.$F$6];2;0)*MID([.W30];1;1) + HLOOKUP(MID([.W27];2;1);[.$C$5:.$F$6];2;0)*MID([.W30];2;1) -> 12 | Y30: of:=VLOOKUP([.X30]+[.Y27];[.$B$7:.$M$22];[.X25]) -> X | Z30: of:=VLOOKUP([.X30]+[.Z27];[.$B$7:.$M$22];[.X25]) -> X | AA30: of:=VLOOKUP([.X30]+[.AA27];[.$B$7:.$M$22];[.X25]) -> X | AB30: of:=VLOOKUP([.X30]+[.AB27];[.$B$7:.$M$22];[.X25]) -> X | AD30: 11 | AE30: of:=HLOOKUP(MID([.AD27];1;1);[.$C$5:.$F$6];2;0)*MID([.AD30];1;1) + HLOOKUP(MID([.AD27];2;1);[.$C$5:.$F$6];2;0)*MID([.AD30];2;1) -> 12 | AF30: of:=VLOOKUP([.AE30]+[.AF27];[.$B$7:.$M$22];[.AE25]) -> X | AG30: of:=VLOOKUP([.AE30]+[.AG27];[.$B$7:.$M$22];[.AE25]) -> X | AH30: of:=VLOOKUP([.AE30]+[.AH27];[.$B$7:.$M$22];[.AE25]) -> X | AI30: of:=VLOOKUP([.AE30]+[.AI27];[.$B$7:.$M$22];[.AE25]) -> X | AK30: 11 | AL30: of:=HLOOKUP(MID([.AK27];1;1);[.$C$5:.$F$6];2;0)*MID([.AK30];1;1) + HLOOKUP(MID([.AK27];2;1);[.$C$5:.$F$6];2;0)*MID([.AK30];2;1) -> 12 | AM30: of:=VLOOKUP([.AL30]+[.AM27];[.$B$7:.$M$22];[.AL25]) -> X | AN30: of:=VLOOKUP([.AL30]+[.AN27];[.$B$7:.$M$22];[.AL25]) -> X | AO30: of:=VLOOKUP([.AL30]+[.AO27];[.$B$7:.$M$22];[.AL25]) -> X | AP30: of:=VLOOKUP([.AL30]+[.AP27];[.$B$7:.$M$22];[.AL25]) -> X | AR30: 11 | AS30: of:=HLOOKUP(MID([.AR27];1;1);[.$C$5:.$F$6];2;0)*MID([.AR30];1;1) + HLOOKUP(MID([.AR27];2;1);[.$C$5:.$F$6];2;0)*MID([.AR30];2;1) -> 12 | AT30: of:=VLOOKUP([.AS30]+[.AT27];[.$B$7:.$M$22];[.AS25]) -> X | AU30: of:=VLOOKUP([.AS30]+[.AU27];[.$B$7:.$M$22];[.AS25]) -> X | AV30: of:=VLOOKUP([.AS30]+[.AV27];[.$B$7:.$M$22];[.AS25]) -> X | AW30: of:=VLOOKUP([.AS30]+[.AW27];[.$B$7:.$M$22];[.AS25]) -> X | AY30: 11 | AZ30: of:=HLOOKUP(MID([.AY27];1;1);[.$C$5:.$F$6];2;0)*MID([.AY30];1;1) + HLOOKUP(MID([.AY27];2;1);[.$C$5:.$F$6];2;0)*MID([.AY30];2;1) -> 12 | BA30: of:=VLOOKUP([.AZ30]+[.BA27];[.$B$7:.$M$22];[.AZ25]) -> X | BB30: of:=VLOOKUP([.AZ30]+[.BB27];[.$B$7:.$M$22];[.AZ25]) -> X | BC30: of:=VLOOKUP([.AZ30]+[.BC27];[.$B$7:.$M$22];[.AZ25]) -> X | BD30: of:=VLOOKUP([.AZ30]+[.BD27];[.$B$7:.$M$22];[.AZ25]) -> X | BF30: 11 | BG30: of:=HLOOKUP(MID([.BF27];1;1);[.$C$5:.$F$6];2;0)*MID([.BF30];1;1) + HLOOKUP(MID([.BF27];2;1);[.$C$5:.$F$6];2;0)*MID([.BF30];2;1) -> 12 | BH30: of:=VLOOKUP([.BG30]+[.BH27];[.$B$7:.$M$22];[.BG25]) -> X | BI30: of:=VLOOKUP([.BG30]+[.BI27];[.$B$7:.$M$22];[.BG25]) -> X | BJ30: of:=VLOOKUP([.BG30]+[.BJ27];[.$B$7:.$M$22];[.BG25]) -> X | BK30: of:=VLOOKUP([.BG30]+[.BK27];[.$B$7:.$M$22];[.BG25]) -> X
P31: 10 | Q31: of:=HLOOKUP(MID([.P27];1;1);[.$C$5:.$F$6];2;0)*MID([.P31];1;1) + HLOOKUP(MID([.P27];2;1);[.$C$5:.$F$6];2;0)*MID([.P31];2;1) -> 8 | R31: of:=VLOOKUP([.Q31]+[.R27];[.$B$7:.$M$22];[.Q25]) -> X | S31: of:=VLOOKUP([.Q31]+[.S27];[.$B$7:.$M$22];[.Q25]) -> X | T31: of:=VLOOKUP([.Q31]+[.T27];[.$B$7:.$M$22];[.Q25]) -> X | U31: of:=VLOOKUP([.Q31]+[.U27];[.$B$7:.$M$22];[.Q25]) -> X | W31: 10 | X31: of:=HLOOKUP(MID([.W27];1;1);[.$C$5:.$F$6];2;0)*MID([.W31];1;1) + HLOOKUP(MID([.W27];2;1);[.$C$5:.$F$6];2;0)*MID([.W31];2;1) -> 8 | Y31: of:=VLOOKUP([.X31]+[.Y27];[.$B$7:.$M$22];[.X25]) -> X | Z31: of:=VLOOKUP([.X31]+[.Z27];[.$B$7:.$M$22];[.X25]) -> X | AA31: of:=VLOOKUP([.X31]+[.AA27];[.$B$7:.$M$22];[.X25]) -> X | AB31: of:=VLOOKUP([.X31]+[.AB27];[.$B$7:.$M$22];[.X25]) -> X | AD31: 10 | AE31: of:=HLOOKUP(MID([.AD27];1;1);[.$C$5:.$F$6];2;0)*MID([.AD31];1;1) + HLOOKUP(MID([.AD27];2;1);[.$C$5:.$F$6];2;0)*MID([.AD31];2;1) -> 8 | AF31: of:=VLOOKUP([.AE31]+[.AF27];[.$B$7:.$M$22];[.AE25]) -> X | AG31: of:=VLOOKUP([.AE31]+[.AG27];[.$B$7:.$M$22];[.AE25]) -> X | AH31: of:=VLOOKUP([.AE31]+[.AH27];[.$B$7:.$M$22];[.AE25]) -> X | AI31: of:=VLOOKUP([.AE31]+[.AI27];[.$B$7:.$M$22];[.AE25]) -> X | AK31: 10 | AL31: of:=HLOOKUP(MID([.AK27];1;1);[.$C$5:.$F$6];2;0)*MID([.AK31];1;1) + HLOOKUP(MID([.AK27];2;1);[.$C$5:.$F$6];2;0)*MID([.AK31];2;1) -> 8 | AM31: of:=VLOOKUP([.AL31]+[.AM27];[.$B$7:.$M$22];[.AL25]) -> X | AN31: of:=VLOOKUP([.AL31]+[.AN27];[.$B$7:.$M$22];[.AL25]) -> X | AO31: of:=VLOOKUP([.AL31]+[.AO27];[.$B$7:.$M$22];[.AL25]) -> X | AP31: of:=VLOOKUP([.AL31]+[.AP27];[.$B$7:.$M$22];[.AL25]) -> X | AR31: 10 | AS31: of:=HLOOKUP(MID([.AR27];1;1);[.$C$5:.$F$6];2;0)*MID([.AR31];1;1) + HLOOKUP(MID([.AR27];2;1);[.$C$5:.$F$6];2;0)*MID([.AR31];2;1) -> 8 | AT31: of:=VLOOKUP([.AS31]+[.AT27];[.$B$7:.$M$22];[.AS25]) -> X | AU31: of:=VLOOKUP([.AS31]+[.AU27];[.$B$7:.$M$22];[.AS25]) -> X | AV31: of:=VLOOKUP([.AS31]+[.AV27];[.$B$7:.$M$22];[.AS25]) -> X | AW31: of:=VLOOKUP([.AS31]+[.AW27];[.$B$7:.$M$22];[.AS25]) -> X | AY31: 10 | AZ31: of:=HLOOKUP(MID([.AY27];1;1);[.$C$5:.$F$6];2;0)*MID([.AY31];1;1) + HLOOKUP(MID([.AY27];2;1);[.$C$5:.$F$6];2;0)*MID([.AY31];2;1) -> 8 | BA31: of:=VLOOKUP([.AZ31]+[.BA27];[.$B$7:.$M$22];[.AZ25]) -> X | BB31: of:=VLOOKUP([.AZ31]+[.BB27];[.$B$7:.$M$22];[.AZ25]) -> X | BC31: of:=VLOOKUP([.AZ31]+[.BC27];[.$B$7:.$M$22];[.AZ25]) -> X | BD31: of:=VLOOKUP([.AZ31]+[.BD27];[.$B$7:.$M$22];[.AZ25]) -> X | BF31: 10 | BG31: of:=HLOOKUP(MID([.BF27];1;1);[.$C$5:.$F$6];2;0)*MID([.BF31];1;1) + HLOOKUP(MID([.BF27];2;1);[.$C$5:.$F$6];2;0)*MID([.BF31];2;1) -> 8 | BH31: of:=VLOOKUP([.BG31]+[.BH27];[.$B$7:.$M$22];[.BG25]) -> X | BI31: of:=VLOOKUP([.BG31]+[.BI27];[.$B$7:.$M$22];[.BG25]) -> X | BJ31: of:=VLOOKUP([.BG31]+[.BJ27];[.$B$7:.$M$22];[.BG25]) -> X | BK31: of:=VLOOKUP([.BG31]+[.BK27];[.$B$7:.$M$22];[.BG25]) -> X
N32: 1 | O32: F
N33: 2 | O33: G | P33: G = µ B -A | AK33: G = µ B -A
N34: 3 | O34: H
N35: 4 | O35: I
N36: 5 | O36: J
N37: 6 | O37: K
N38: 7 | O38: L
N39: 8 | O39: M
N40: 9 | O40: N | AD40: N = µ -B A
N41: 10 | O41: O
N42: 11 | O42: P
N43: 12 | O43: Q
N44: 13 | O44: R | AY44: -R = µ B A
N45: 14 | O45: S
N46: 15 | O46: T
I47: Inv. Inputs | P47: a = -G | W47: b = 1 | AD47: c = -N | AK47: d = a = -G | AR47: e =-A | AY47: f = -R = µ B A | BF47: g = B | BL47: total
E48: transistors: | I48: 2 | P48: 3 | W48: 0 | AD48: 3 | AK48: 0 | AR48: 0 | AY48: 2 | BF48: 0 | BL48: of:=SUM([.I48:.BK48]) -> 10 | BN48: transistors
E49: gates: | I49: 2 | P49: 2 | W49: 0 | AD49: 2 | AK49: 0 | AR49: 0 | AY49: 1 | BF49: 0 | BL49: of:=SUM([.I49:.BK49]) -> 7 | BN49: gates

Sheet: digits 0-2
B1: 2 bit to 7-segment, digits 0-2
B2: Truth table | P2: 7-segment display as defined by truth table
P3: 0 | V3: of:=[.P3]+1 -> 1 | AB3: of:=[.V3]+1 -> 2 | AH3: of:=[.AB3]+1 -> 3 | AN3: of:=[.AH3]+1 -> 4 | AT3: of:=[.AN3]+1 -> 5 | AZ3: of:=[.AT3]+1 -> 6 | BF3: of:=[.AZ3]+1 -> 7
B4: Inputs | G4: Outputs | P4: of:=MATCH([.P3];[.$B$7:.$B$22];0)+2 -> 3 | V4: of:=MATCH([.V3];[.$B$7:.$B$22];0)+2 -> 4 | AB4: of:=MATCH([.AB3];[.$B$7:.$B$22];0)+2 -> 5 | AH4: of:=MATCH([.AH3];[.$B$7:.$B$22];0)+2 -> 6 | AN4: of:=MATCH([.AN3];[.$B$7:.$B$22];0)+2 -> 7 | AT4: of:=MATCH([.AT3];[.$B$7:.$B$22];0)+2 -> 8 | AZ4: of:=MATCH([.AZ3];[.$B$7:.$B$22];0)+2 -> 9 | BF4: of:=MATCH([.BF3];[.$B$7:.$B$22];0)+2 -> 10
B5: # | C5: D | D5: C | E5: B | F5: A | G5: a | H5: b | I5: c | J5: d | K5: e | L5: f | M5: g | Q5: of:=HLOOKUP([.T5];[.$G$5:.$M$22];[.P4];0) -> 1 | R5: of:=[.T5]&T(ORG.OPENOFFICE.STYLE(IF([.Q5]=1;"seg1";IF([.Q5]=0;"seg0";"segX")))) -> a | T5: a | W5: of:=HLOOKUP([.Z5];[.$G$5:.$M$22];[.V4];0) -> 0 | X5: of:=[.Z5]&T(ORG.OPENOFFICE.STYLE(IF([.W5]=1;"seg1";IF([.W5]=0;"seg0";"segX")))) -> a | Z5: a | AC5: of:=HLOOKUP([.AF5];[.$G$5:.$M$22];[.AB4];0) -> 1 | AD5: of:=[.AF5]&T(ORG.OPENOFFICE.STYLE(IF([.AC5]=1;"seg1";IF([.AC5]=0;"seg0";"segX")))) -> a | AF5: a | AI5: of:=HLOOKUP([.AL5];[.$G$5:.$M$22];[.AH4];0) -> X | AJ5: of:=[.AL5]&T(ORG.OPENOFFICE.STYLE(IF([.AI5]=1;"seg1";IF([.AI5]=0;"seg0";"segX")))) -> a | AL5: a | AO5: of:=HLOOKUP([.AR5];[.$G$5:.$M$22];[.AN4];0) -> X | AP5: of:=[.AR5]&T(ORG.OPENOFFICE.STYLE(IF([.AO5]=1;"seg1";IF([.AO5]=0;"seg0";"segX")))) -> a | AR5: a | AU5: of:=HLOOKUP([.AX5];[.$G$5:.$M$22];[.AT4];0) -> X | AV5: of:=[.AX5]&T(ORG.OPENOFFICE.STYLE(IF([.AU5]=1;"seg1";IF([.AU5]=0;"seg0";"segX")))) -> a | AX5: a | BA5: of:=HLOOKUP([.BD5];[.$G$5:.$M$22];[.AZ4];0) -> X | BB5: of:=[.BD5]&T(ORG.OPENOFFICE.STYLE(IF([.BA5]=1;"seg1";IF([.BA5]=0;"seg0";"segX")))) -> a | BD5: a | BG5: of:=HLOOKUP([.BJ5];[.$G$5:.$M$22];[.BF4];0) -> X | BH5: of:=[.BJ5]&T(ORG.OPENOFFICE.STYLE(IF([.BG5]=1;"seg1";IF([.BG5]=0;"seg0";"segX")))) -> a | BJ5: a
C6: 8 | D6: 4 | E6: 2 | F6: 1 | P6: of:=HLOOKUP([.R6];[.$G$5:.$M$22];[.P4];0) -> 1 | Q6: of:=[.R6]&T(ORG.OPENOFFICE.STYLE(IF([.P6]=1;"seg1";IF([.P6]=0;"seg0";"segX")))) -> f | R6: f | S6: of:=HLOOKUP([.U6];[.$G$5:.$M$22];[.P4];0) -> 1 | T6: of:=[.U6]&T(ORG.OPENOFFICE.STYLE(IF([.S6]=1;"seg1";IF([.S6]=0;"seg0";"segX")))) -> b | U6: b | V6: of:=HLOOKUP([.X6];[.$G$5:.$M$22];[.V4];0) -> 0 | W6: of:=[.X6]&T(ORG.OPENOFFICE.STYLE(IF([.V6]=1;"seg1";IF([.V6]=0;"seg0";"segX")))) -> f | X6: f | Y6: of:=HLOOKUP([.AA6];[.$G$5:.$M$22];[.V4];0) -> 1 | Z6: of:=[.AA6]&T(ORG.OPENOFFICE.STYLE(IF([.Y6]=1;"seg1";IF([.Y6]=0;"seg0";"segX")))) -> b | AA6: b | AB6: of:=HLOOKUP([.AD6];[.$G$5:.$M$22];[.AB4];0) -> 0 | AC6: of:=[.AD6]&T(ORG.OPENOFFICE.STYLE(IF([.AB6]=1;"seg1";IF([.AB6]=0;"seg0";"segX")))) -> f | AD6: f | AE6: of:=HLOOKUP([.AG6];[.$G$5:.$M$22];[.AB4];0) -> 1 | AF6: of:=[.AG6]&T(ORG.OPENOFFICE.STYLE(IF([.AE6]=1;"seg1";IF([.AE6]=0;"seg0";"segX")))) -> b | AG6: b | AH6: of:=HLOOKUP([.AJ6];[.$G$5:.$M$22];[.AH4];0) -> X | AI6: of:=[.AJ6]&T(ORG.OPENOFFICE.STYLE(IF([.AH6]=1;"seg1";IF([.AH6]=0;"seg0";"segX")))) -> f | AJ6: f | AK6: of:=HLOOKUP([.AM6];[.$G$5:.$M$22];[.AH4];0) -> X | AL6: of:=[.AM6]&T(ORG.OPENOFFICE.STYLE(IF([.AK6]=1;"seg1";IF([.AK6]=0;"seg0";"segX")))) -> b | AM6: b | AN6: of:=HLOOKUP([.AP6];[.$G$5:.$M$22];[.AN4];0) -> X | AO6: of:=[.AP6]&T(ORG.OPENOFFICE.STYLE(IF([.AN6]=1;"seg1";IF([.AN6]=0;"seg0";"segX")))) -> f | AP6: f | AQ6: of:=HLOOKUP([.AS6];[.$G$5:.$M$22];[.AN4];0) -> X | AR6: of:=[.AS6]&T(ORG.OPENOFFICE.STYLE(IF([.AQ6]=1;"seg1";IF([.AQ6]=0;"seg0";"segX")))) -> b | AS6: b | AT6: of:=HLOOKUP([.AV6];[.$G$5:.$M$22];[.AT4];0) -> X | AU6: of:=[.AV6]&T(ORG.OPENOFFICE.STYLE(IF([.AT6]=1;"seg1";IF([.AT6]=0;"seg0";"segX")))) -> f | AV6: f | AW6: of:=HLOOKUP([.AY6];[.$G$5:.$M$22];[.AT4];0) -> X | AX6: of:=[.AY6]&T(ORG.OPENOFFICE.STYLE(IF([.AW6]=1;"seg1";IF([.AW6]=0;"seg0";"segX")))) -> b | AY6: b | AZ6: of:=HLOOKUP([.BB6];[.$G$5:.$M$22];[.AZ4];0) -> X | BA6: of:=[.BB6]&T(ORG.OPENOFFICE.STYLE(IF([.AZ6]=1;"seg1";IF([.AZ6]=0;"seg0";"segX")))) -> f | BB6: f | BC6: of:=HLOOKUP([.BE6];[.$G$5:.$M$22];[.AZ4];0) -> X | BD6: of:=[.BE6]&T(ORG.OPENOFFICE.STYLE(IF([.BC6]=1;"seg1";IF([.BC6]=0;"seg0";"segX")))) -> b | BE6: b | BF6: of:=HLOOKUP([.BH6];[.$G$5:.$M$22];[.BF4];0) -> X | BG6: of:=[.BH6]&T(ORG.OPENOFFICE.STYLE(IF([.BF6]=1;"seg1";IF([.BF6]=0;"seg0";"segX")))) -> f | BH6: f | BI6: of:=HLOOKUP([.BK6];[.$G$5:.$M$22];[.BF4];0) -> X | BJ6: of:=[.BK6]&T(ORG.OPENOFFICE.STYLE(IF([.BI6]=1;"seg1";IF([.BI6]=0;"seg0";"segX")))) -> b | BK6: b
B7: 0 | C7: of:=MOD(ROUNDDOWN([.$B7]/[.C$6]);2) -> 0 | D7: of:=MOD(ROUNDDOWN([.$B7]/[.D$6]);2) -> 0 | E7: of:=MOD(ROUNDDOWN([.$B7]/[.E$6]);2) -> 0 | F7: of:=MOD(ROUNDDOWN([.$B7]/[.F$6]);2) -> 0 | G7: 1 | H7: 1 | I7: 1 | J7: 1 | K7: 1 | L7: 1 | M7: 0
B8: of:=[.B7]+1 -> 1 | C8: of:=MOD(ROUNDDOWN([.$B8]/[.C$6]);2) -> 0 | D8: of:=MOD(ROUNDDOWN([.$B8]/[.D$6]);2) -> 0 | E8: of:=MOD(ROUNDDOWN([.$B8]/[.E$6]);2) -> 0 | F8: of:=MOD(ROUNDDOWN([.$B8]/[.F$6]);2) -> 1 | G8: 0 | H8: 1 | I8: 1 | J8: 0 | K8: 0 | L8: 0 | M8: 0 | Q8: of:=HLOOKUP([.T8];[.$G$5:.$M$22];[.P4];0) -> 0 | R8: of:=[.T8]&T(ORG.OPENOFFICE.STYLE(IF([.Q8]=1;"seg1";IF([.Q8]=0;"seg0";"segX")))) -> g | T8: g | W8: of:=HLOOKUP([.Z8];[.$G$5:.$M$22];[.V4];0) -> 0 | X8: of:=[.Z8]&T(ORG.OPENOFFICE.STYLE(IF([.W8]=1;"seg1";IF([.W8]=0;"seg0";"segX")))) -> g | Z8: g | AC8: of:=HLOOKUP([.AF8];[.$G$5:.$M$22];[.AB4];0) -> 1 | AD8: of:=[.AF8]&T(ORG.OPENOFFICE.STYLE(IF([.AC8]=1;"seg1";IF([.AC8]=0;"seg0";"segX")))) -> g | AF8: g | AI8: of:=HLOOKUP([.AL8];[.$G$5:.$M$22];[.AH4];0) -> X | AJ8: of:=[.AL8]&T(ORG.OPENOFFICE.STYLE(IF([.AI8]=1;"seg1";IF([.AI8]=0;"seg0";"segX")))) -> g | AL8: g | AO8: of:=HLOOKUP([.AR8];[.$G$5:.$M$22];[.AN4];0) -> X | AP8: of:=[.AR8]&T(ORG.OPENOFFICE.STYLE(IF([.AO8]=1;"seg1";IF([.AO8]=0;"seg0";"segX")))) -> g | AR8: g | AU8: of:=HLOOKUP([.AX8];[.$G$5:.$M$22];[.AT4];0) -> X | AV8: of:=[.AX8]&T(ORG.OPENOFFICE.STYLE(IF([.AU8]=1;"seg1";IF([.AU8]=0;"seg0";"segX")))) -> g | AX8: g | BA8: of:=HLOOKUP([.BD8];[.$G$5:.$M$22];[.AZ4];0) -> X | BB8: of:=[.BD8]&T(ORG.OPENOFFICE.STYLE(IF([.BA8]=1;"seg1";IF([.BA8]=0;"seg0";"segX")))) -> g | BD8: g | BG8: of:=HLOOKUP([.BJ8];[.$G$5:.$M$22];[.BF4];0) -> X | BH8: of:=[.BJ8]&T(ORG.OPENOFFICE.STYLE(IF([.BG8]=1;"seg1";IF([.BG8]=0;"seg0";"segX")))) -> g | BJ8: g
B9: of:=[.B8]+1 -> 2 | C9: of:=MOD(ROUNDDOWN([.$B9]/[.C$6]);2) -> 0 | D9: of:=MOD(ROUNDDOWN([.$B9]/[.D$6]);2) -> 0 | E9: of:=MOD(ROUNDDOWN([.$B9]/[.E$6]);2) -> 1 | F9: of:=MOD(ROUNDDOWN([.$B9]/[.F$6]);2) -> 0 | G9: 1 | H9: 1 | I9: 0 | J9: 1 | K9: 1 | L9: 0 | M9: 1 | P9: of:=HLOOKUP([.R9];[.$G$5:.$M$22];[.P4];0) -> 1 | Q9: of:=[.R9]&T(ORG.OPENOFFICE.STYLE(IF([.P9]=1;"seg1";IF([.P9]=0;"seg0";"segX")))) -> e | R9: e | S9: of:=HLOOKUP([.U9];[.$G$5:.$M$22];[.P4];0) -> 1 | T9: of:=[.U9]&T(ORG.OPENOFFICE.STYLE(IF([.S9]=1;"seg1";IF([.S9]=0;"seg0";"segX")))) -> c | U9: c | V9: of:=HLOOKUP([.X9];[.$G$5:.$M$22];[.V4];0) -> 0 | W9: of:=[.X9]&T(ORG.OPENOFFICE.STYLE(IF([.V9]=1;"seg1";IF([.V9]=0;"seg0";"segX")))) -> e | X9: e | Y9: of:=HLOOKUP([.AA9];[.$G$5:.$M$22];[.V4];0) -> 1 | Z9: of:=[.AA9]&T(ORG.OPENOFFICE.STYLE(IF([.Y9]=1;"seg1";IF([.Y9]=0;"seg0";"segX")))) -> c | AA9: c | AB9: of:=HLOOKUP([.AD9];[.$G$5:.$M$22];[.AB4];0) -> 1 | AC9: of:=[.AD9]&T(ORG.OPENOFFICE.STYLE(IF([.AB9]=1;"seg1";IF([.AB9]=0;"seg0";"segX")))) -> e | AD9: e | AE9: of:=HLOOKUP([.AG9];[.$G$5:.$M$22];[.AB4];0) -> 0 | AF9: of:=[.AG9]&T(ORG.OPENOFFICE.STYLE(IF([.AE9]=1;"seg1";IF([.AE9]=0;"seg0";"segX")))) -> c | AG9: c | AH9: of:=HLOOKUP([.AJ9];[.$G$5:.$M$22];[.AH4];0) -> X | AI9: of:=[.AJ9]&T(ORG.OPENOFFICE.STYLE(IF([.AH9]=1;"seg1";IF([.AH9]=0;"seg0";"segX")))) -> e | AJ9: e | AK9: of:=HLOOKUP([.AM9];[.$G$5:.$M$22];[.AH4];0) -> X | AL9: of:=[.AM9]&T(ORG.OPENOFFICE.STYLE(IF([.AK9]=1;"seg1";IF([.AK9]=0;"seg0";"segX")))) -> c | AM9: c | AN9: of:=HLOOKUP([.AP9];[.$G$5:.$M$22];[.AN4];0) -> X | AO9: of:=[.AP9]&T(ORG.OPENOFFICE.STYLE(IF([.AN9]=1;"seg1";IF([.AN9]=0;"seg0";"segX")))) -> e | AP9: e | AQ9: of:=HLOOKUP([.AS9];[.$G$5:.$M$22];[.AN4];0) -> X | AR9: of:=[.AS9]&T(ORG.OPENOFFICE.STYLE(IF([.AQ9]=1;"seg1";IF([.AQ9]=0;"seg0";"segX")))) -> c | AS9: c | AT9: of:=HLOOKUP([.AV9];[.$G$5:.$M$22];[.AT4];0) -> X | AU9: of:=[.AV9]&T(ORG.OPENOFFICE.STYLE(IF([.AT9]=1;"seg1";IF([.AT9]=0;"seg0";"segX")))) -> e | AV9: e | AW9: of:=HLOOKUP([.AY9];[.$G$5:.$M$22];[.AT4];0) -> X | AX9: of:=[.AY9]&T(ORG.OPENOFFICE.STYLE(IF([.AW9]=1;"seg1";IF([.AW9]=0;"seg0";"segX")))) -> c | AY9: c | AZ9: of:=HLOOKUP([.BB9];[.$G$5:.$M$22];[.AZ4];0) -> X | BA9: of:=[.BB9]&T(ORG.OPENOFFICE.STYLE(IF([.AZ9]=1;"seg1";IF([.AZ9]=0;"seg0";"segX")))) -> e | BB9: e | BC9: of:=HLOOKUP([.BE9];[.$G$5:.$M$22];[.AZ4];0) -> X | BD9: of:=[.BE9]&T(ORG.OPENOFFICE.STYLE(IF([.BC9]=1;"seg1";IF([.BC9]=0;"seg0";"segX")))) -> c | BE9: c | BF9: of:=HLOOKUP([.BH9];[.$G$5:.$M$22];[.BF4];0) -> X | BG9: of:=[.BH9]&T(ORG.OPENOFFICE.STYLE(IF([.BF9]=1;"seg1";IF([.BF9]=0;"seg0";"segX")))) -> e | BH9: e | BI9: of:=HLOOKUP([.BK9];[.$G$5:.$M$22];[.BF4];0) -> X | BJ9: of:=[.BK9]&T(ORG.OPENOFFICE.STYLE(IF([.BI9]=1;"seg1";IF([.BI9]=0;"seg0";"segX")))) -> c | BK9: c
B10: of:=[.B9]+1 -> 3 | C10: of:=MOD(ROUNDDOWN([.$B10]/[.C$6]);2) -> 0 | D10: of:=MOD(ROUNDDOWN([.$B10]/[.D$6]);2) -> 0 | E10: of:=MOD(ROUNDDOWN([.$B10]/[.E$6]);2) -> 1 | F10: of:=MOD(ROUNDDOWN([.$B10]/[.F$6]);2) -> 1 | G10: X | H10: X | I10: X | J10: X | K10: X | L10: X | M10: X
B11: of:=[.B10]+1 -> 4 | C11: of:=MOD(ROUNDDOWN([.$B11]/[.C$6]);2) -> 0 | D11: of:=MOD(ROUNDDOWN([.$B11]/[.D$6]);2) -> 1 | E11: of:=MOD(ROUNDDOWN([.$B11]/[.E$6]);2) -> 0 | F11: of:=MOD(ROUNDDOWN([.$B11]/[.F$6]);2) -> 0 | G11: X | H11: X | I11: X | J11: X | K11: X | L11: X | M11: X | Q11: of:=HLOOKUP([.T11];[.$G$5:.$M$22];[.P4];0) -> 1 | R11: of:=[.T11]&T(ORG.OPENOFFICE.STYLE(IF([.Q11]=1;"seg1";IF([.Q11]=0;"seg0";"segX")))) -> d | T11: d | W11: of:=HLOOKUP([.Z11];[.$G$5:.$M$22];[.V4];0) -> 0 | X11: of:=[.Z11]&T(ORG.OPENOFFICE.STYLE(IF([.W11]=1;"seg1";IF([.W11]=0;"seg0";"segX")))) -> d | Z11: d | AC11: of:=HLOOKUP([.AF11];[.$G$5:.$M$22];[.AB4];0) -> 1 | AD11: of:=[.AF11]&T(ORG.OPENOFFICE.STYLE(IF([.AC11]=1;"seg1";IF([.AC11]=0;"seg0";"segX")))) -> d | AF11: d | AI11: of:=HLOOKUP([.AL11];[.$G$5:.$M$22];[.AH4];0) -> X | AJ11: of:=[.AL11]&T(ORG.OPENOFFICE.STYLE(IF([.AI11]=1;"seg1";IF([.AI11]=0;"seg0";"segX")))) -> d | AL11: d | AO11: of:=HLOOKUP([.AR11];[.$G$5:.$M$22];[.AN4];0) -> X | AP11: of:=[.AR11]&T(ORG.OPENOFFICE.STYLE(IF([.AO11]=1;"seg1";IF([.AO11]=0;"seg0";"segX")))) -> d | AR11: d | AU11: of:=HLOOKUP([.AX11];[.$G$5:.$M$22];[.AT4];0) -> X | AV11: of:=[.AX11]&T(ORG.OPENOFFICE.STYLE(IF([.AU11]=1;"seg1";IF([.AU11]=0;"seg0";"segX")))) -> d | AX11: d | BA11: of:=HLOOKUP([.BD11];[.$G$5:.$M$22];[.AZ4];0) -> X | BB11: of:=[.BD11]&T(ORG.OPENOFFICE.STYLE(IF([.BA11]=1;"seg1";IF([.BA11]=0;"seg0";"segX")))) -> d | BD11: d | BG11: of:=HLOOKUP([.BJ11];[.$G$5:.$M$22];[.BF4];0) -> X | BH11: of:=[.BJ11]&T(ORG.OPENOFFICE.STYLE(IF([.BG11]=1;"seg1";IF([.BG11]=0;"seg0";"segX")))) -> d | BJ11: d
B12: of:=[.B11]+1 -> 5 | C12: of:=MOD(ROUNDDOWN([.$B12]/[.C$6]);2) -> 0 | D12: of:=MOD(ROUNDDOWN([.$B12]/[.D$6]);2) -> 1 | E12: of:=MOD(ROUNDDOWN([.$B12]/[.E$6]);2) -> 0 | F12: of:=MOD(ROUNDDOWN([.$B12]/[.F$6]);2) -> 1 | G12: X | H12: X | I12: X | J12: X | K12: X | L12: X | M12: X
B13: of:=[.B12]+1 -> 6 | C13: of:=MOD(ROUNDDOWN([.$B13]/[.C$6]);2) -> 0 | D13: of:=MOD(ROUNDDOWN([.$B13]/[.D$6]);2) -> 1 | E13: of:=MOD(ROUNDDOWN([.$B13]/[.E$6]);2) -> 1 | F13: of:=MOD(ROUNDDOWN([.$B13]/[.F$6]);2) -> 0 | G13: X | H13: X | I13: X | J13: X | K13: X | L13: X | M13: X | P13: of:=[.BF3]+1 -> 8 | V13: of:=[.P13]+1 -> 9 | AB13: of:=[.V13]+1 -> 10 | AH13: of:=[.AB13]+1 -> 11 | AN13: of:=[.AH13]+1 -> 12 | AT13: of:=[.AN13]+1 -> 13 | AZ13: of:=[.AT13]+1 -> 14 | BF13: of:=[.AZ13]+1 -> 15
B14: of:=[.B13]+1 -> 7 | C14: of:=MOD(ROUNDDOWN([.$B14]/[.C$6]);2) -> 0 | D14: of:=MOD(ROUNDDOWN([.$B14]/[.D$6]);2) -> 1 | E14: of:=MOD(ROUNDDOWN([.$B14]/[.E$6]);2) -> 1 | F14: of:=MOD(ROUNDDOWN([.$B14]/[.F$6]);2) -> 1 | G14: X | H14: X | I14: X | J14: X | K14: X | L14: X | M14: X | P14: of:=MATCH([.P13];[.$B$7:.$B$22];0)+2 -> 11 | V14: of:=MATCH([.V13];[.$B$7:.$B$22];0)+2 -> 12 | AB14: of:=MATCH([.AB13];[.$B$7:.$B$22];0)+2 -> 13 | AH14: of:=MATCH([.AH13];[.$B$7:.$B$22];0)+2 -> 14 | AN14: of:=MATCH([.AN13];[.$B$7:.$B$22];0)+2 -> 15 | AT14: of:=MATCH([.AT13];[.$B$7:.$B$22];0)+2 -> 16 | AZ14: of:=MATCH([.AZ13];[.$B$7:.$B$22];0)+2 -> 17 | BF14: of:=MATCH([.BF13];[.$B$7:.$B$22];0)+2 -> 18
B15: of:=[.B14]+1 -> 8 | C15: of:=MOD(ROUNDDOWN([.$B15]/[.C$6]);2) -> 1 | D15: of:=MOD(ROUNDDOWN([.$B15]/[.D$6]);2) -> 0 | E15: of:=MOD(ROUNDDOWN([.$B15]/[.E$6]);2) -> 0 | F15: of:=MOD(ROUNDDOWN([.$B15]/[.F$6]);2) -> 0 | G15: X | H15: X | I15: X | J15: X | K15: X | L15: X | M15: X | Q15: of:=HLOOKUP([.T15];[.$G$5:.$M$22];[.P14];0) -> X | R15: of:=[.T15]&T(ORG.OPENOFFICE.STYLE(IF([.Q15]=1;"seg1";IF([.Q15]=0;"seg0";"segX")))) -> a | T15: a | W15: of:=HLOOKUP([.Z15];[.$G$5:.$M$22];[.V14];0) -> X | X15: of:=[.Z15]&T(ORG.OPENOFFICE.STYLE(IF([.W15]=1;"seg1";IF([.W15]=0;"seg0";"segX")))) -> a | Z15: a | AC15: of:=HLOOKUP([.AF15];[.$G$5:.$M$22];[.AB14];0) -> X | AD15: of:=[.AF15]&T(ORG.OPENOFFICE.STYLE(IF([.AC15]=1;"seg1";IF([.AC15]=0;"seg0";"segX")))) -> a | AF15: a | AI15: of:=HLOOKUP([.AL15];[.$G$5:.$M$22];[.AH14];0) -> X | AJ15: of:=[.AL15]&T(ORG.OPENOFFICE.STYLE(IF([.AI15]=1;"seg1";IF([.AI15]=0;"seg0";"segX")))) -> a | AL15: a | AO15: of:=HLOOKUP([.AR15];[.$G$5:.$M$22];[.AN14];0) -> X | AP15: of:=[.AR15]&T(ORG.OPENOFFICE.STYLE(IF([.AO15]=1;"seg1";IF([.AO15]=0;"seg0";"segX")))) -> a | AR15: a | AU15: of:=HLOOKUP([.AX15];[.$G$5:.$M$22];[.AT14];0) -> X | AV15: of:=[.AX15]&T(ORG.OPENOFFICE.STYLE(IF([.AU15]=1;"seg1";IF([.AU15]=0;"seg0";"segX")))) -> a | AX15: a | BA15: of:=HLOOKUP([.BD15];[.$G$5:.$M$22];[.AZ14];0) -> X | BB15: of:=[.BD15]&T(ORG.OPENOFFICE.STYLE(IF([.BA15]=1;"seg1";IF([.BA15]=0;"seg0";"segX")))) -> a | BD15: a | BG15: of:=HLOOKUP([.BJ15];[.$G$5:.$M$22];[.BF14];0) -> X | BH15: of:=[.BJ15]&T(ORG.OPENOFFICE.STYLE(IF([.BG15]=1;"seg1";IF([.BG15]=0;"seg0";"segX")))) -> a | BJ15: a
B16: of:=[.B15]+1 -> 9 | C16: of:=MOD(ROUNDDOWN([.$B16]/[.C$6]);2) -> 1 | D16: of:=MOD(ROUNDDOWN([.$B16]/[.D$6]);2) -> 0 | E16: of:=MOD(ROUNDDOWN([.$B16]/[.E$6]);2) -> 0 | F16: of:=MOD(ROUNDDOWN([.$B16]/[.F$6]);2) -> 1 | G16: X | H16: X | I16: X | J16: X | K16: X | L16: X | M16: X | P16: of:=HLOOKUP([.R16];[.$G$5:.$M$22];[.P14];0) -> X | Q16: of:=[.R16]&T(ORG.OPENOFFICE.STYLE(IF([.P16]=1;"seg1";IF([.P16]=0;"seg0";"segX")))) -> f | R16: f | S16: of:=HLOOKUP([.U16];[.$G$5:.$M$22];[.P14];0) -> X | T16: of:=[.U16]&T(ORG.OPENOFFICE.STYLE(IF([.S16]=1;"seg1";IF([.S16]=0;"seg0";"segX")))) -> b | U16: b | V16: of:=HLOOKUP([.X16];[.$G$5:.$M$22];[.V14];0) -> X | W16: of:=[.X16]&T(ORG.OPENOFFICE.STYLE(IF([.V16]=1;"seg1";IF([.V16]=0;"seg0";"segX")))) -> f | X16: f | Y16: of:=HLOOKUP([.AA16];[.$G$5:.$M$22];[.V14];0) -> X | Z16: of:=[.AA16]&T(ORG.OPENOFFICE.STYLE(IF([.Y16]=1;"seg1";IF([.Y16]=0;"seg0";"segX")))) -> b | AA16: b | AB16: of:=HLOOKUP([.AD16];[.$G$5:.$M$22];[.AB14];0) -> X | AC16: of:=[.AD16]&T(ORG.OPENOFFICE.STYLE(IF([.AB16]=1;"seg1";IF([.AB16]=0;"seg0";"segX")))) -> f | AD16: f | AE16: of:=HLOOKUP([.AG16];[.$G$5:.$M$22];[.AB14];0) -> X | AF16: of:=[.AG16]&T(ORG.OPENOFFICE.STYLE(IF([.AE16]=1;"seg1";IF([.AE16]=0;"seg0";"segX")))) -> b | AG16: b | AH16: of:=HLOOKUP([.AJ16];[.$G$5:.$M$22];[.AH14];0) -> X | AI16: of:=[.AJ16]&T(ORG.OPENOFFICE.STYLE(IF([.AH16]=1;"seg1";IF([.AH16]=0;"seg0";"segX")))) -> f | AJ16: f | AK16: of:=HLOOKUP([.AM16];[.$G$5:.$M$22];[.AH14];0) -> X | AL16: of:=[.AM16]&T(ORG.OPENOFFICE.STYLE(IF([.AK16]=1;"seg1";IF([.AK16]=0;"seg0";"segX")))) -> b | AM16: b | AN16: of:=HLOOKUP([.AP16];[.$G$5:.$M$22];[.AN14];0) -> X | AO16: of:=[.AP16]&T(ORG.OPENOFFICE.STYLE(IF([.AN16]=1;"seg1";IF([.AN16]=0;"seg0";"segX")))) -> f | AP16: f | AQ16: of:=HLOOKUP([.AS16];[.$G$5:.$M$22];[.AN14];0) -> X | AR16: of:=[.AS16]&T(ORG.OPENOFFICE.STYLE(IF([.AQ16]=1;"seg1";IF([.AQ16]=0;"seg0";"segX")))) -> b | AS16: b | AT16: of:=HLOOKUP([.AV16];[.$G$5:.$M$22];[.AT14];0) -> X | AU16: of:=[.AV16]&T(ORG.OPENOFFICE.STYLE(IF([.AT16]=1;"seg1";IF([.AT16]=0;"seg0";"segX")))) -> f | AV16: f | AW16: of:=HLOOKUP([.AY16];[.$G$5:.$M$22];[.AT14];0) -> X | AX16: of:=[.AY16]&T(ORG.OPENOFFICE.STYLE(IF([.AW16]=1;"seg1";IF([.AW16]=0;"seg0";"segX")))) -> b | AY16: b | AZ16: of:=HLOOKUP([.BB16];[.$G$5:.$M$22];[.AZ14];0) -> X | BA16: of:=[.BB16]&T(ORG.OPENOFFICE.STYLE(IF([.AZ16]=1;"seg1";IF([.AZ16]=0;"seg0";"segX")))) -> f | BB16: f | BC16: of:=HLOOKUP([.BE16];[.$G$5:.$M$22];[.AZ14];0) -> X | BD16: of:=[.BE16]&T(ORG.OPENOFFICE.STYLE(IF([.BC16]=1;"seg1";IF([.BC16]=0;"seg0";"segX")))) -> b | BE16: b | BF16: of:=HLOOKUP([.BH16];[.$G$5:.$M$22];[.BF14];0) -> X | BG16: of:=[.BH16]&T(ORG.OPENOFFICE.STYLE(IF([.BF16]=1;"seg1";IF([.BF16]=0;"seg0";"segX")))) -> f | BH16: f | BI16: of:=HLOOKUP([.BK16];[.$G$5:.$M$22];[.BF14];0) -> X | BJ16: of:=[.BK16]&T(ORG.OPENOFFICE.STYLE(IF([.BI16]=1;"seg1";IF([.BI16]=0;"seg0";"segX")))) -> b | BK16: b
B17: of:=[.B16]+1 -> 10 | C17: of:=MOD(ROUNDDOWN([.$B17]/[.C$6]);2) -> 1 | D17: of:=MOD(ROUNDDOWN([.$B17]/[.D$6]);2) -> 0 | E17: of:=MOD(ROUNDDOWN([.$B17]/[.E$6]);2) -> 1 | F17: of:=MOD(ROUNDDOWN([.$B17]/[.F$6]);2) -> 0 | G17: X | H17: X | I17: X | J17: X | K17: X | L17: X | M17: X
B18: of:=[.B17]+1 -> 11 | C18: of:=MOD(ROUNDDOWN([.$B18]/[.C$6]);2) -> 1 | D18: of:=MOD(ROUNDDOWN([.$B18]/[.D$6]);2) -> 0 | E18: of:=MOD(ROUNDDOWN([.$B18]/[.E$6]);2) -> 1 | F18: of:=MOD(ROUNDDOWN([.$B18]/[.F$6]);2) -> 1 | G18: X | H18: X | I18: X | J18: X | K18: X | L18: X | M18: X | Q18: of:=HLOOKUP([.T18];[.$G$5:.$M$22];[.P14];0) -> X | R18: of:=[.T18]&T(ORG.OPENOFFICE.STYLE(IF([.Q18]=1;"seg1";IF([.Q18]=0;"seg0";"segX")))) -> g | T18: g | W18: of:=HLOOKUP([.Z18];[.$G$5:.$M$22];[.V14];0) -> X | X18: of:=[.Z18]&T(ORG.OPENOFFICE.STYLE(IF([.W18]=1;"seg1";IF([.W18]=0;"seg0";"segX")))) -> g | Z18: g | AC18: of:=HLOOKUP([.AF18];[.$G$5:.$M$22];[.AB14];0) -> X | AD18: of:=[.AF18]&T(ORG.OPENOFFICE.STYLE(IF([.AC18]=1;"seg1";IF([.AC18]=0;"seg0";"segX")))) -> g | AF18: g | AI18: of:=HLOOKUP([.AL18];[.$G$5:.$M$22];[.AH14];0) -> X | AJ18: of:=[.AL18]&T(ORG.OPENOFFICE.STYLE(IF([.AI18]=1;"seg1";IF([.AI18]=0;"seg0";"segX")))) -> g | AL18: g | AO18: of:=HLOOKUP([.AR18];[.$G$5:.$M$22];[.AN14];0) -> X | AP18: of:=[.AR18]&T(ORG.OPENOFFICE.STYLE(IF([.AO18]=1;"seg1";IF([.AO18]=0;"seg0";"segX")))) -> g | AR18: g | AU18: of:=HLOOKUP([.AX18];[.$G$5:.$M$22];[.AT14];0) -> X | AV18: of:=[.AX18]&T(ORG.OPENOFFICE.STYLE(IF([.AU18]=1;"seg1";IF([.AU18]=0;"seg0";"segX")))) -> g | AX18: g | BA18: of:=HLOOKUP([.BD18];[.$G$5:.$M$22];[.AZ14];0) -> X | BB18: of:=[.BD18]&T(ORG.OPENOFFICE.STYLE(IF([.BA18]=1;"seg1";IF([.BA18]=0;"seg0";"segX")))) -> g | BD18: g | BG18: of:=HLOOKUP([.BJ18];[.$G$5:.$M$22];[.BF14];0) -> X | BH18: of:=[.BJ18]&T(ORG.OPENOFFICE.STYLE(IF([.BG18]=1;"seg1";IF([.BG18]=0;"seg0";"segX")))) -> g | BJ18: g
B19: of:=[.B18]+1 -> 12 | C19: of:=MOD(ROUNDDOWN([.$B19]/[.C$6]);2) -> 1 | D19: of:=MOD(ROUNDDOWN([.$B19]/[.D$6]);2) -> 1 | E19: of:=MOD(ROUNDDOWN([.$B19]/[.E$6]);2) -> 0 | F19: of:=MOD(ROUNDDOWN([.$B19]/[.F$6]);2) -> 0 | G19: X | H19: X | I19: X | J19: X | K19: X | L19: X | M19: X | P19: of:=HLOOKUP([.R19];[.$G$5:.$M$22];[.P14];0) -> X | Q19: of:=[.R19]&T(ORG.OPENOFFICE.STYLE(IF([.P19]=1;"seg1";IF([.P19]=0;"seg0";"segX")))) -> e | R19: e | S19: of:=HLOOKUP([.U19];[.$G$5:.$M$22];[.P14];0) -> X | T19: of:=[.U19]&T(ORG.OPENOFFICE.STYLE(IF([.S19]=1;"seg1";IF([.S19]=0;"seg0";"segX")))) -> c | U19: c | V19: of:=HLOOKUP([.X19];[.$G$5:.$M$22];[.V14];0) -> X | W19: of:=[.X19]&T(ORG.OPENOFFICE.STYLE(IF([.V19]=1;"seg1";IF([.V19]=0;"seg0";"segX")))) -> e | X19: e | Y19: of:=HLOOKUP([.AA19];[.$G$5:.$M$22];[.V14];0) -> X | Z19: of:=[.AA19]&T(ORG.OPENOFFICE.STYLE(IF([.Y19]=1;"seg1";IF([.Y19]=0;"seg0";"segX")))) -> c | AA19: c | AB19: of:=HLOOKUP([.AD19];[.$G$5:.$M$22];[.AB14];0) -> X | AC19: of:=[.AD19]&T(ORG.OPENOFFICE.STYLE(IF([.AB19]=1;"seg1";IF([.AB19]=0;"seg0";"segX")))) -> e | AD19: e | AE19: of:=HLOOKUP([.AG19];[.$G$5:.$M$22];[.AB14];0) -> X | AF19: of:=[.AG19]&T(ORG.OPENOFFICE.STYLE(IF([.AE19]=1;"seg1";IF([.AE19]=0;"seg0";"segX")))) -> c | AG19: c | AH19: of:=HLOOKUP([.AJ19];[.$G$5:.$M$22];[.AH14];0) -> X | AI19: of:=[.AJ19]&T(ORG.OPENOFFICE.STYLE(IF([.AH19]=1;"seg1";IF([.AH19]=0;"seg0";"segX")))) -> e | AJ19: e | AK19: of:=HLOOKUP([.AM19];[.$G$5:.$M$22];[.AH14];0) -> X | AL19: of:=[.AM19]&T(ORG.OPENOFFICE.STYLE(IF([.AK19]=1;"seg1";IF([.AK19]=0;"seg0";"segX")))) -> c | AM19: c | AN19: of:=HLOOKUP([.AP19];[.$G$5:.$M$22];[.AN14];0) -> X | AO19: of:=[.AP19]&T(ORG.OPENOFFICE.STYLE(IF([.AN19]=1;"seg1";IF([.AN19]=0;"seg0";"segX")))) -> e | AP19: e | AQ19: of:=HLOOKUP([.AS19];[.$G$5:.$M$22];[.AN14];0) -> X | AR19: of:=[.AS19]&T(ORG.OPENOFFICE.STYLE(IF([.AQ19]=1;"seg1";IF([.AQ19]=0;"seg0";"segX")))) -> c | AS19: c | AT19: of:=HLOOKUP([.AV19];[.$G$5:.$M$22];[.AT14];0) -> X | AU19: of:=[.AV19]&T(ORG.OPENOFFICE.STYLE(IF([.AT19]=1;"seg1";IF([.AT19]=0;"seg0";"segX")))) -> e | AV19: e | AW19: of:=HLOOKUP([.AY19];[.$G$5:.$M$22];[.AT14];0) -> X | AX19: of:=[.AY19]&T(ORG.OPENOFFICE.STYLE(IF([.AW19]=1;"seg1";IF([.AW19]=0;"seg0";"segX")))) -> c | AY19: c | AZ19: of:=HLOOKUP([.BB19];[.$G$5:.$M$22];[.AZ14];0) -> X | BA19: of:=[.BB19]&T(ORG.OPENOFFICE.STYLE(IF([.AZ19]=1;"seg1";IF([.AZ19]=0;"seg0";"segX")))) -> e | BB19: e | BC19: of:=HLOOKUP([.BE19];[.$G$5:.$M$22];[.AZ14];0) -> X | BD19: of:=[.BE19]&T(ORG.OPENOFFICE.STYLE(IF([.BC19]=1;"seg1";IF([.BC19]=0;"seg0";"segX")))) -> c | BE19: c | BF19: of:=HLOOKUP([.BH19];[.$G$5:.$M$22];[.BF14];0) -> X | BG19: of:=[.BH19]&T(ORG.OPENOFFICE.STYLE(IF([.BF19]=1;"seg1";IF([.BF19]=0;"seg0";"segX")))) -> e | BH19: e | BI19: of:=HLOOKUP([.BK19];[.$G$5:.$M$22];[.BF14];0) -> X | BJ19: of:=[.BK19]&T(ORG.OPENOFFICE.STYLE(IF([.BI19]=1;"seg1";IF([.BI19]=0;"seg0";"segX")))) -> c | BK19: c
B20: of:=[.B19]+1 -> 13 | C20: of:=MOD(ROUNDDOWN([.$B20]/[.C$6]);2) -> 1 | D20: of:=MOD(ROUNDDOWN([.$B20]/[.D$6]);2) -> 1 | E20: of:=MOD(ROUNDDOWN([.$B20]/[.E$6]);2) -> 0 | F20: of:=MOD(ROUNDDOWN([.$B20]/[.F$6]);2) -> 1 | G20: X | H20: X | I20: X | J20: X | K20: X | L20: X | M20: X
B21: of:=[.B20]+1 -> 14 | C21: of:=MOD(ROUNDDOWN([.$B21]/[.C$6]);2) -> 1 | D21: of:=MOD(ROUNDDOWN([.$B21]/[.D$6]);2) -> 1 | E21: of:=MOD(ROUNDDOWN([.$B21]/[.E$6]);2) -> 1 | F21: of:=MOD(ROUNDDOWN([.$B21]/[.F$6]);2) -> 0 | G21: X | H21: X | I21: X | J21: X | K21: X | L21: X | M21: X | Q21: of:=HLOOKUP([.T21];[.$G$5:.$M$22];[.P14];0) -> X | R21: of:=[.T21]&T(ORG.OPENOFFICE.STYLE(IF([.Q21]=1;"seg1";IF([.Q21]=0;"seg0";"segX")))) -> d | T21: d | W21: of:=HLOOKUP([.Z21];[.$G$5:.$M$22];[.V14];0) -> X | X21: of:=[.Z21]&T(ORG.OPENOFFICE.STYLE(IF([.W21]=1;"seg1";IF([.W21]=0;"seg0";"segX")))) -> d | Z21: d | AC21: of:=HLOOKUP([.AF21];[.$G$5:.$M$22];[.AB14];0) -> X | AD21: of:=[.AF21]&T(ORG.OPENOFFICE.STYLE(IF([.AC21]=1;"seg1";IF([.AC21]=0;"seg0";"segX")))) -> d | AF21: d | AI21: of:=HLOOKUP([.AL21];[.$G$5:.$M$22];[.AH14];0) -> X | AJ21: of:=[.AL21]&T(ORG.OPENOFFICE.STYLE(IF([.AI21]=1;"seg1";IF([.AI21]=0;"seg0";"segX")))) -> d | AL21: d | AO21: of:=HLOOKUP([.AR21];[.$G$5:.$M$22];[.AN14];0) -> X | AP21: of:=[.AR21]&T(ORG.OPENOFFICE.STYLE(IF([.AO21]=1;"seg1";IF([.AO21]=0;"seg0";"segX")))) -> d | AR21: d | AU21: of:=HLOOKUP([.AX21];[.$G$5:.$M$22];[.AT14];0) -> X | AV21: of:=[.AX21]&T(ORG.OPENOFFICE.STYLE(IF([.AU21]=1;"seg1";IF([.AU21]=0;"seg0";"segX")))) -> d | AX21: d | BA21: of:=HLOOKUP([.BD21];[.$G$5:.$M$22];[.AZ14];0) -> X | BB21: of:=[.BD21]&T(ORG.OPENOFFICE.STYLE(IF([.BA21]=1;"seg1";IF([.BA21]=0;"seg0";"segX")))) -> d | BD21: d | BG21: of:=HLOOKUP([.BJ21];[.$G$5:.$M$22];[.BF14];0) -> X | BH21: of:=[.BJ21]&T(ORG.OPENOFFICE.STYLE(IF([.BG21]=1;"seg1";IF([.BG21]=0;"seg0";"segX")))) -> d | BJ21: d
B22: of:=[.B21]+1 -> 15 | C22: of:=MOD(ROUNDDOWN([.$B22]/[.C$6]);2) -> 1 | D22: of:=MOD(ROUNDDOWN([.$B22]/[.D$6]);2) -> 1 | E22: of:=MOD(ROUNDDOWN([.$B22]/[.E$6]);2) -> 1 | F22: of:=MOD(ROUNDDOWN([.$B22]/[.F$6]);2) -> 1 | G22: X | H22: X | I22: X | J22: X | K22: X | L22: X | M22: X
P24: Karnaugh-maps
P25: a | Q25: of:=MATCH([.P25];[.$G$5:.$M$5])+5 -> 6 | R25: BA | W25: b | X25: of:=MATCH([.W25];[.$G$5:.$M$5])+5 -> 7 | Y25: BA | AD25: c | AE25: of:=MATCH([.AD25];[.$G$5:.$M$5])+5 -> 8 | AF25: BA | AK25: d | AL25: of:=MATCH([.AK25];[.$G$5:.$M$5])+5 -> 9 | AM25: BA | AR25: e | AS25: of:=MATCH([.AR25];[.$G$5:.$M$5])+5 -> 10 | AT25: BA | AY25: f | AZ25: of:=MATCH([.AY25];[.$G$5:.$M$5])+5 -> 11 | BA25: BA | BF25: g | BG25: of:=MATCH([.BF25];[.$G$5:.$M$5])+5 -> 12 | BH25: BA
R26: 00 | S26: 01 | T26: 11 | U26: 10 | Y26: 00 | Z26: 01 | AA26: 11 | AB26: 10 | AF26: 00 | AG26: 01 | AH26: 11 | AI26: 10 | AM26: 00 | AN26: 01 | AO26: 11 | AP26: 10 | AT26: 00 | AU26: 01 | AV26: 11 | AW26: 10 | BA26: 00 | BB26: 01 | BC26: 11 | BD26: 10 | BH26: 00 | BI26: 01 | BJ26: 11 | BK26: 10
P27: DC | R27: of:=HLOOKUP(MID([.R25];1;1);[.$C$5:.$F$6];2;0)*MID([.R26];1;1) + HLOOKUP(MID([.R25];2;1);[.$C$5:.$F$6];2;0)*MID([.R26];2;1) -> 0 | S27: of:=HLOOKUP(MID([.R25];1;1);[.$C$5:.$F$6];2;0)*MID([.S26];1;1) + HLOOKUP(MID([.R25];2;1);[.$C$5:.$F$6];2;0)*MID([.S26];2;1) -> 1 | T27: of:=HLOOKUP(MID([.R25];1;1);[.$C$5:.$F$6];2;0)*MID([.T26];1;1) + HLOOKUP(MID([.R25];2;1);[.$C$5:.$F$6];2;0)*MID([.T26];2;1) -> 3 | U27: of:=HLOOKUP(MID([.R25];1;1);[.$C$5:.$F$6];2;0)*MID([.U26];1;1) + HLOOKUP(MID([.R25];2;1);[.$C$5:.$F$6];2;0)*MID([.U26];2;1) -> 2 | W27: DC | Y27: of:=HLOOKUP(MID([.Y25];1;1);[.$C$5:.$F$6];2;0)*MID([.Y26];1;1) + HLOOKUP(MID([.Y25];2;1);[.$C$5:.$F$6];2;0)*MID([.Y26];2;1) -> 0 | Z27: of:=HLOOKUP(MID([.Y25];1;1);[.$C$5:.$F$6];2;0)*MID([.Z26];1;1) + HLOOKUP(MID([.Y25];2;1);[.$C$5:.$F$6];2;0)*MID([.Z26];2;1) -> 1 | AA27: of:=HLOOKUP(MID([.Y25];1;1);[.$C$5:.$F$6];2;0)*MID([.AA26];1;1) + HLOOKUP(MID([.Y25];2;1);[.$C$5:.$F$6];2;0)*MID([.AA26];2;1) -> 3 | AB27: of:=HLOOKUP(MID([.Y25];1;1);[.$C$5:.$F$6];2;0)*MID([.AB26];1;1) + HLOOKUP(MID([.Y25];2;1);[.$C$5:.$F$6];2;0)*MID([.AB26];2;1) -> 2 | AD27: DC | AF27: of:=HLOOKUP(MID([.AF25];1;1);[.$C$5:.$F$6];2;0)*MID([.AF26];1;1) + HLOOKUP(MID([.AF25];2;1);[.$C$5:.$F$6];2;0)*MID([.AF26];2;1) -> 0 | AG27: of:=HLOOKUP(MID([.AF25];1;1);[.$C$5:.$F$6];2;0)*MID([.AG26];1;1) + HLOOKUP(MID([.AF25];2;1);[.$C$5:.$F$6];2;0)*MID([.AG26];2;1) -> 1 | AH27: of:=HLOOKUP(MID([.AF25];1;1);[.$C$5:.$F$6];2;0)*MID([.AH26];1;1) + HLOOKUP(MID([.AF25];2;1);[.$C$5:.$F$6];2;0)*MID([.AH26];2;1) -> 3 | AI27: of:=HLOOKUP(MID([.AF25];1;1);[.$C$5:.$F$6];2;0)*MID([.AI26];1;1) + HLOOKUP(MID([.AF25];2;1);[.$C$5:.$F$6];2;0)*MID([.AI26];2;1) -> 2 | AK27: DC | AM27: of:=HLOOKUP(MID([.AM25];1;1);[.$C$5:.$F$6];2;0)*MID([.AM26];1;1) + HLOOKUP(MID([.AM25];2;1);[.$C$5:.$F$6];2;0)*MID([.AM26];2;1) -> 0 | AN27: of:=HLOOKUP(MID([.AM25];1;1);[.$C$5:.$F$6];2;0)*MID([.AN26];1;1) + HLOOKUP(MID([.AM25];2;1);[.$C$5:.$F$6];2;0)*MID([.AN26];2;1) -> 1 | AO27: of:=HLOOKUP(MID([.AM25];1;1);[.$C$5:.$F$6];2;0)*MID([.AO26];1;1) + HLOOKUP(MID([.AM25];2;1);[.$C$5:.$F$6];2;0)*MID([.AO26];2;1) -> 3 | AP27: of:=HLOOKUP(MID([.AM25];1;1);[.$C$5:.$F$6];2;0)*MID([.AP26];1;1) + HLOOKUP(MID([.AM25];2;1);[.$C$5:.$F$6];2;0)*MID([.AP26];2;1) -> 2 | AR27: DC | AT27: of:=HLOOKUP(MID([.AT25];1;1);[.$C$5:.$F$6];2;0)*MID([.AT26];1;1) + HLOOKUP(MID([.AT25];2;1);[.$C$5:.$F$6];2;0)*MID([.AT26];2;1) -> 0 | AU27: of:=HLOOKUP(MID([.AT25];1;1);[.$C$5:.$F$6];2;0)*MID([.AU26];1;1) + HLOOKUP(MID([.AT25];2;1);[.$C$5:.$F$6];2;0)*MID([.AU26];2;1) -> 1 | AV27: of:=HLOOKUP(MID([.AT25];1;1);[.$C$5:.$F$6];2;0)*MID([.AV26];1;1) + HLOOKUP(MID([.AT25];2;1);[.$C$5:.$F$6];2;0)*MID([.AV26];2;1) -> 3 | AW27: of:=HLOOKUP(MID([.AT25];1;1);[.$C$5:.$F$6];2;0)*MID([.AW26];1;1) + HLOOKUP(MID([.AT25];2;1);[.$C$5:.$F$6];2;0)*MID([.AW26];2;1) -> 2 | AY27: DC | BA27: of:=HLOOKUP(MID([.BA25];1;1);[.$C$5:.$F$6];2;0)*MID([.BA26];1;1) + HLOOKUP(MID([.BA25];2;1);[.$C$5:.$F$6];2;0)*MID([.BA26];2;1) -> 0 | BB27: of:=HLOOKUP(MID([.BA25];1;1);[.$C$5:.$F$6];2;0)*MID([.BB26];1;1) + HLOOKUP(MID([.BA25];2;1);[.$C$5:.$F$6];2;0)*MID([.BB26];2;1) -> 1 | BC27: of:=HLOOKUP(MID([.BA25];1;1);[.$C$5:.$F$6];2;0)*MID([.BC26];1;1) + HLOOKUP(MID([.BA25];2;1);[.$C$5:.$F$6];2;0)*MID([.BC26];2;1) -> 3 | BD27: of:=HLOOKUP(MID([.BA25];1;1);[.$C$5:.$F$6];2;0)*MID([.BD26];1;1) + HLOOKUP(MID([.BA25];2;1);[.$C$5:.$F$6];2;0)*MID([.BD26];2;1) -> 2 | BF27: DC | BH27: of:=HLOOKUP(MID([.BH25];1;1);[.$C$5:.$F$6];2;0)*MID([.BH26];1;1) + HLOOKUP(MID([.BH25];2;1);[.$C$5:.$F$6];2;0)*MID([.BH26];2;1) -> 0 | BI27: of:=HLOOKUP(MID([.BH25];1;1);[.$C$5:.$F$6];2;0)*MID([.BI26];1;1) + HLOOKUP(MID([.BH25];2;1);[.$C$5:.$F$6];2;0)*MID([.BI26];2;1) -> 1 | BJ27: of:=HLOOKUP(MID([.BH25];1;1);[.$C$5:.$F$6];2;0)*MID([.BJ26];1;1) + HLOOKUP(MID([.BH25];2;1);[.$C$5:.$F$6];2;0)*MID([.BJ26];2;1) -> 3 | BK27: of:=HLOOKUP(MID([.BH25];1;1);[.$C$5:.$F$6];2;0)*MID([.BK26];1;1) + HLOOKUP(MID([.BH25];2;1);[.$C$5:.$F$6];2;0)*MID([.BK26];2;1) -> 2
P28: 00 | Q28: of:=HLOOKUP(MID([.P27];1;1);[.$C$5:.$F$6];2;0)*MID([.P28];1;1) + HLOOKUP(MID([.P27];2;1);[.$C$5:.$F$6];2;0)*MID([.P28];2;1) -> 0 | R28: of:=VLOOKUP([.Q28]+[.R27];[.$B$7:.$M$22];[.Q25]) -> 1 | S28: of:=VLOOKUP([.Q28]+[.S27];[.$B$7:.$M$22];[.Q25]) -> 0 | T28: of:=VLOOKUP([.Q28]+[.T27];[.$B$7:.$M$22];[.Q25]) -> X | U28: of:=VLOOKUP([.Q28]+[.U27];[.$B$7:.$M$22];[.Q25]) -> 1 | W28: 00 | X28: of:=HLOOKUP(MID([.W27];1;1);[.$C$5:.$F$6];2;0)*MID([.W28];1;1) + HLOOKUP(MID([.W27];2;1);[.$C$5:.$F$6];2;0)*MID([.W28];2;1) -> 0 | Y28: of:=VLOOKUP([.X28]+[.Y27];[.$B$7:.$M$22];[.X25]) -> 1 | Z28: of:=VLOOKUP([.X28]+[.Z27];[.$B$7:.$M$22];[.X25]) -> 1 | AA28: of:=VLOOKUP([.X28]+[.AA27];[.$B$7:.$M$22];[.X25]) -> X | AB28: of:=VLOOKUP([.X28]+[.AB27];[.$B$7:.$M$22];[.X25]) -> 1 | AD28: 00 | AE28: of:=HLOOKUP(MID([.AD27];1;1);[.$C$5:.$F$6];2;0)*MID([.AD28];1;1) + HLOOKUP(MID([.AD27];2;1);[.$C$5:.$F$6];2;0)*MID([.AD28];2;1) -> 0 | AF28: of:=VLOOKUP([.AE28]+[.AF27];[.$B$7:.$M$22];[.AE25]) -> 1 | AG28: of:=VLOOKUP([.AE28]+[.AG27];[.$B$7:.$M$22];[.AE25]) -> 1 | AH28: of:=VLOOKUP([.AE28]+[.AH27];[.$B$7:.$M$22];[.AE25]) -> X | AI28: of:=VLOOKUP([.AE28]+[.AI27];[.$B$7:.$M$22];[.AE25]) -> 0 | AK28: 00 | AL28: of:=HLOOKUP(MID([.AK27];1;1);[.$C$5:.$F$6];2;0)*MID([.AK28];1;1) + HLOOKUP(MID([.AK27];2;1);[.$C$5:.$F$6];2;0)*MID([.AK28];2;1) -> 0 | AM28: of:=VLOOKUP([.AL28]+[.AM27];[.$B$7:.$M$22];[.AL25]) -> 1 | AN28: of:=VLOOKUP([.AL28]+[.AN27];[.$B$7:.$M$22];[.AL25]) -> 0 | AO28: of:=VLOOKUP([.AL28]+[.AO27];[.$B$7:.$M$22];[.AL25]) -> X | AP28: of:=VLOOKUP([.AL28]+[.AP27];[.$B$7:.$M$22];[.AL25]) -> 1 | AR28: 00 | AS28: of:=HLOOKUP(MID([.AR27];1;1);[.$C$5:.$F$6];2;0)*MID([.AR28];1;1) + HLOOKUP(MID([.AR27];2;1);[.$C$5:.$F$6];2;0)*MID([.AR28];2;1) -> 0 | AT28: of:=VLOOKUP([.AS28]+[.AT27];[.$B$7:.$M$22];[.AS25]) -> 1 | AU28: of:=VLOOKUP([.AS28]+[.AU27];[.$B$7:.$M$22];[.AS25]) -> 0 | AV28: of:=VLOOKUP([.AS28]+[.AV27];[.$B$7:.$M$22];[.AS25]) -> X | AW28: of:=VLOOKUP([.AS28]+[.AW27];[.$B$7:.$M$22];[.AS25]) -> 1 | AY28: 00 | AZ28: of:=HLOOKUP(MID([.AY27];1;1);[.$C$5:.$F$6];2;0)*MID([.AY28];1;1) + HLOOKUP(MID([.AY27];2;1);[.$C$5:.$F$6];2;0)*MID([.AY28];2;1) -> 0 | BA28: of:=VLOOKUP([.AZ28]+[.BA27];[.$B$7:.$M$22];[.AZ25]) -> 1 | BB28: of:=VLOOKUP([.AZ28]+[.BB27];[.$B$7:.$M$22];[.AZ25]) -> 0 | BC28: of:=VLOOKUP([.AZ28]+[.BC27];[.$B$7:.$M$22];[.AZ25]) -> X | BD28: of:=VLOOKUP([.AZ28]+[.BD27];[.$B$7:.$M$22];[.AZ25]) -> 0 | BF28: 00 | BG28: of:=HLOOKUP(MID([.BF27];1;1);[.$C$5:.$F$6];2;0)*MID([.BF28];1;1) + HLOOKUP(MID([.BF27];2;1);[.$C$5:.$F$6];2;0)*MID([.BF28];2;1) -> 0 | BH28: of:=VLOOKUP([.BG28]+[.BH27];[.$B$7:.$M$22];[.BG25]) -> 0 | BI28: of:=VLOOKUP([.BG28]+[.BI27];[.$B$7:.$M$22];[.BG25]) -> 0 | BJ28: of:=VLOOKUP([.BG28]+[.BJ27];[.$B$7:.$M$22];[.BG25]) -> X | BK28: of:=VLOOKUP([.BG28]+[.BK27];[.$B$7:.$M$22];[.BG25]) -> 1
P29: 01 | Q29: of:=HLOOKUP(MID([.P27];1;1);[.$C$5:.$F$6];2;0)*MID([.P29];1;1) + HLOOKUP(MID([.P27];2;1);[.$C$5:.$F$6];2;0)*MID([.P29];2;1) -> 4 | R29: of:=VLOOKUP([.Q29]+[.R27];[.$B$7:.$M$22];[.Q25]) -> X | S29: of:=VLOOKUP([.Q29]+[.S27];[.$B$7:.$M$22];[.Q25]) -> X | T29: of:=VLOOKUP([.Q29]+[.T27];[.$B$7:.$M$22];[.Q25]) -> X | U29: of:=VLOOKUP([.Q29]+[.U27];[.$B$7:.$M$22];[.Q25]) -> X | W29: 01 | X29: of:=HLOOKUP(MID([.W27];1;1);[.$C$5:.$F$6];2;0)*MID([.W29];1;1) + HLOOKUP(MID([.W27];2;1);[.$C$5:.$F$6];2;0)*MID([.W29];2;1) -> 4 | Y29: of:=VLOOKUP([.X29]+[.Y27];[.$B$7:.$M$22];[.X25]) -> X | Z29: of:=VLOOKUP([.X29]+[.Z27];[.$B$7:.$M$22];[.X25]) -> X | AA29: of:=VLOOKUP([.X29]+[.AA27];[.$B$7:.$M$22];[.X25]) -> X | AB29: of:=VLOOKUP([.X29]+[.AB27];[.$B$7:.$M$22];[.X25]) -> X | AD29: 01 | AE29: of:=HLOOKUP(MID([.AD27];1;1);[.$C$5:.$F$6];2;0)*MID([.AD29];1;1) + HLOOKUP(MID([.AD27];2;1);[.$C$5:.$F$6];2;0)*MID([.AD29];2;1) -> 4 | AF29: of:=VLOOKUP([.AE29]+[.AF27];[.$B$7:.$M$22];[.AE25]) -> X | AG29: of:=VLOOKUP([.AE29]+[.AG27];[.$B$7:.$M$22];[.AE25]) -> X | AH29: of:=VLOOKUP([.AE29]+[.AH27];[.$B$7:.$M$22];[.AE25]) -> X | AI29: of:=VLOOKUP([.AE29]+[.AI27];[.$B$7:.$M$22];[.AE25]) -> X | AK29: 01 | AL29: of:=HLOOKUP(MID([.AK27];1;1);[.$C$5:.$F$6];2;0)*MID([.AK29];1;1) + HLOOKUP(MID([.AK27];2;1);[.$C$5:.$F$6];2;0)*MID([.AK29];2;1) -> 4 | AM29: of:=VLOOKUP([.AL29]+[.AM27];[.$B$7:.$M$22];[.AL25]) -> X | AN29: of:=VLOOKUP([.AL29]+[.AN27];[.$B$7:.$M$22];[.AL25]) -> X | AO29: of:=VLOOKUP([.AL29]+[.AO27];[.$B$7:.$M$22];[.AL25]) -> X | AP29: of:=VLOOKUP([.AL29]+[.AP27];[.$B$7:.$M$22];[.AL25]) -> X | AR29: 01 | AS29: of:=HLOOKUP(MID([.AR27];1;1);[.$C$5:.$F$6];2;0)*MID([.AR29];1;1) + HLOOKUP(MID([.AR27];2;1);[.$C$5:.$F$6];2;0)*MID([.AR29];2;1) -> 4 | AT29: of:=VLOOKUP([.AS29]+[.AT27];[.$B$7:.$M$22];[.AS25]) -> X | AU29: of:=VLOOKUP([.AS29]+[.AU27];[.$B$7:.$M$22];[.AS25]) -> X | AV29: of:=VLOOKUP([.AS29]+[.AV27];[.$B$7:.$M$22];[.AS25]) -> X | AW29: of:=VLOOKUP([.AS29]+[.AW27];[.$B$7:.$M$22];[.AS25]) -> X | AY29: 01 | AZ29: of:=HLOOKUP(MID([.AY27];1;1);[.$C$5:.$F$6];2;0)*MID([.AY29];1;1) + HLOOKUP(MID([.AY27];2;1);[.$C$5:.$F$6];2;0)*MID([.AY29];2;1) -> 4 | BA29: of:=VLOOKUP([.AZ29]+[.BA27];[.$B$7:.$M$22];[.AZ25]) -> X | BB29: of:=VLOOKUP([.AZ29]+[.BB27];[.$B$7:.$M$22];[.AZ25]) -> X | BC29: of:=VLOOKUP([.AZ29]+[.BC27];[.$B$7:.$M$22];[.AZ25]) -> X | BD29: of:=VLOOKUP([.AZ29]+[.BD27];[.$B$7:.$M$22];[.AZ25]) -> X | BF29: 01 | BG29: of:=HLOOKUP(MID([.BF27];1;1);[.$C$5:.$F$6];2;0)*MID([.BF29];1;1) + HLOOKUP(MID([.BF27];2;1);[.$C$5:.$F$6];2;0)*MID([.BF29];2;1) -> 4 | BH29: of:=VLOOKUP([.BG29]+[.BH27];[.$B$7:.$M$22];[.BG25]) -> X | BI29: of:=VLOOKUP([.BG29]+[.BI27];[.$B$7:.$M$22];[.BG25]) -> X | BJ29: of:=VLOOKUP([.BG29]+[.BJ27];[.$B$7:.$M$22];[.BG25]) -> X | BK29: of:=VLOOKUP([.BG29]+[.BK27];[.$B$7:.$M$22];[.BG25]) -> X
P30: 11 | Q30: of:=HLOOKUP(MID([.P27];1;1);[.$C$5:.$F$6];2;0)*MID([.P30];1;1) + HLOOKUP(MID([.P27];2;1);[.$C$5:.$F$6];2;0)*MID([.P30];2;1) -> 12 | R30: of:=VLOOKUP([.Q30]+[.R27];[.$B$7:.$M$22];[.Q25]) -> X | S30: of:=VLOOKUP([.Q30]+[.S27];[.$B$7:.$M$22];[.Q25]) -> X | T30: of:=VLOOKUP([.Q30]+[.T27];[.$B$7:.$M$22];[.Q25]) -> X | U30: of:=VLOOKUP([.Q30]+[.U27];[.$B$7:.$M$22];[.Q25]) -> X | W30: 11 | X30: of:=HLOOKUP(MID([.W27];1;1);[.$C$5:.$F$6];2;0)*MID([.W30];1;1) + HLOOKUP(MID([.W27];2;1);[.$C$5:.$F$6];2;0)*MID([.W30];2;1) -> 12 | Y30: of:=VLOOKUP([.X30]+[.Y27];[.$B$7:.$M$22];[.X25]) -> X | Z30: of:=VLOOKUP([.X30]+[.Z27];[.$B$7:.$M$22];[.X25]) -> X | AA30: of:=VLOOKUP([.X30]+[.AA27];[.$B$7:.$M$22];[.X25]) -> X | AB30: of:=VLOOKUP([.X30]+[.AB27];[.$B$7:.$M$22];[.X25]) -> X | AD30: 11 | AE30: of:=HLOOKUP(MID([.AD27];1;1);[.$C$5:.$F$6];2;0)*MID([.AD30];1;1) + HLOOKUP(MID([.AD27];2;1);[.$C$5:.$F$6];2;0)*MID([.AD30];2;1) -> 12 | AF30: of:=VLOOKUP([.AE30]+[.AF27];[.$B$7:.$M$22];[.AE25]) -> X | AG30: of:=VLOOKUP([.AE30]+[.AG27];[.$B$7:.$M$22];[.AE25]) -> X | AH30: of:=VLOOKUP([.AE30]+[.AH27];[.$B$7:.$M$22];[.AE25]) -> X | AI30: of:=VLOOKUP([.AE30]+[.AI27];[.$B$7:.$M$22];[.AE25]) -> X | AK30: 11 | AL30: of:=HLOOKUP(MID([.AK27];1;1);[.$C$5:.$F$6];2;0)*MID([.AK30];1;1) + HLOOKUP(MID([.AK27];2;1);[.$C$5:.$F$6];2;0)*MID([.AK30];2;1) -> 12 | AM30: of:=VLOOKUP([.AL30]+[.AM27];[.$B$7:.$M$22];[.AL25]) -> X | AN30: of:=VLOOKUP([.AL30]+[.AN27];[.$B$7:.$M$22];[.AL25]) -> X | AO30: of:=VLOOKUP([.AL30]+[.AO27];[.$B$7:.$M$22];[.AL25]) -> X | AP30: of:=VLOOKUP([.AL30]+[.AP27];[.$B$7:.$M$22];[.AL25]) -> X | AR30: 11 | AS30: of:=HLOOKUP(MID([.AR27];1;1);[.$C$5:.$F$6];2;0)*MID([.AR30];1;1) + HLOOKUP(MID([.AR27];2;1);[.$C$5:.$F$6];2;0)*MID([.AR30];2;1) -> 12 | AT30: of:=VLOOKUP([.AS30]+[.AT27];[.$B$7:.$M$22];[.AS25]) -> X | AU30: of:=VLOOKUP([.AS30]+[.AU27];[.$B$7:.$M$22];[.AS25]) -> X | AV30: of:=VLOOKUP([.AS30]+[.AV27];[.$B$7:.$M$22];[.AS25]) -> X | AW30: of:=VLOOKUP([.AS30]+[.AW27];[.$B$7:.$M$22];[.AS25]) -> X | AY30: 11 | AZ30: of:=HLOOKUP(MID([.AY27];1;1);[.$C$5:.$F$6];2;0)*MID([.AY30];1;1) + HLOOKUP(MID([.AY27];2;1);[.$C$5:.$F$6];2;0)*MID([.AY30];2;1) -> 12 | BA30: of:=VLOOKUP([.AZ30]+[.BA27];[.$B$7:.$M$22];[.AZ25]) -> X | BB30: of:=VLOOKUP([.AZ30]+[.BB27];[.$B$7:.$M$22];[.AZ25]) -> X | BC30: of:=VLOOKUP([.AZ30]+[.BC27];[.$B$7:.$M$22];[.AZ25]) -> X | BD30: of:=VLOOKUP([.AZ30]+[.BD27];[.$B$7:.$M$22];[.AZ25]) -> X | BF30: 11 | BG30: of:=HLOOKUP(MID([.BF27];1;1);[.$C$5:.$F$6];2;0)*MID([.BF30];1;1) + HLOOKUP(MID([.BF27];2;1);[.$C$5:.$F$6];2;0)*MID([.BF30];2;1) -> 12 | BH30: of:=VLOOKUP([.BG30]+[.BH27];[.$B$7:.$M$22];[.BG25]) -> X | BI30: of:=VLOOKUP([.BG30]+[.BI27];[.$B$7:.$M$22];[.BG25]) -> X | BJ30: of:=VLOOKUP([.BG30]+[.BJ27];[.$B$7:.$M$22];[.BG25]) -> X | BK30: of:=VLOOKUP([.BG30]+[.BK27];[.$B$7:.$M$22];[.BG25]) -> X
P31: 10 | Q31: of:=HLOOKUP(MID([.P27];1;1);[.$C$5:.$F$6];2;0)*MID([.P31];1;1) + HLOOKUP(MID([.P27];2;1);[.$C$5:.$F$6];2;0)*MID([.P31];2;1) -> 8 | R31: of:=VLOOKUP([.Q31]+[.R27];[.$B$7:.$M$22];[.Q25]) -> X | S31: of:=VLOOKUP([.Q31]+[.S27];[.$B$7:.$M$22];[.Q25]) -> X | T31: of:=VLOOKUP([.Q31]+[.T27];[.$B$7:.$M$22];[.Q25]) -> X | U31: of:=VLOOKUP([.Q31]+[.U27];[.$B$7:.$M$22];[.Q25]) -> X | W31: 10 | X31: of:=HLOOKUP(MID([.W27];1;1);[.$C$5:.$F$6];2;0)*MID([.W31];1;1) + HLOOKUP(MID([.W27];2;1);[.$C$5:.$F$6];2;0)*MID([.W31];2;1) -> 8 | Y31: of:=VLOOKUP([.X31]+[.Y27];[.$B$7:.$M$22];[.X25]) -> X | Z31: of:=VLOOKUP([.X31]+[.Z27];[.$B$7:.$M$22];[.X25]) -> X | AA31: of:=VLOOKUP([.X31]+[.AA27];[.$B$7:.$M$22];[.X25]) -> X | AB31: of:=VLOOKUP([.X31]+[.AB27];[.$B$7:.$M$22];[.X25]) -> X | AD31: 10 | AE31: of:=HLOOKUP(MID([.AD27];1;1);[.$C$5:.$F$6];2;0)*MID([.AD31];1;1) + HLOOKUP(MID([.AD27];2;1);[.$C$5:.$F$6];2;0)*MID([.AD31];2;1) -> 8 | AF31: of:=VLOOKUP([.AE31]+[.AF27];[.$B$7:.$M$22];[.AE25]) -> X | AG31: of:=VLOOKUP([.AE31]+[.AG27];[.$B$7:.$M$22];[.AE25]) -> X | AH31: of:=VLOOKUP([.AE31]+[.AH27];[.$B$7:.$M$22];[.AE25]) -> X | AI31: of:=VLOOKUP([.AE31]+[.AI27];[.$B$7:.$M$22];[.AE25]) -> X | AK31: 10 | AL31: of:=HLOOKUP(MID([.AK27];1;1);[.$C$5:.$F$6];2;0)*MID([.AK31];1;1) + HLOOKUP(MID([.AK27];2;1);[.$C$5:.$F$6];2;0)*MID([.AK31];2;1) -> 8 | AM31: of:=VLOOKUP([.AL31]+[.AM27];[.$B$7:.$M$22];[.AL25]) -> X | AN31: of:=VLOOKUP([.AL31]+[.AN27];[.$B$7:.$M$22];[.AL25]) -> X | AO31: of:=VLOOKUP([.AL31]+[.AO27];[.$B$7:.$M$22];[.AL25]) -> X | AP31: of:=VLOOKUP([.AL31]+[.AP27];[.$B$7:.$M$22];[.AL25]) -> X | AR31: 10 | AS31: of:=HLOOKUP(MID([.AR27];1;1);[.$C$5:.$F$6];2;0)*MID([.AR31];1;1) + HLOOKUP(MID([.AR27];2;1);[.$C$5:.$F$6];2;0)*MID([.AR31];2;1) -> 8 | AT31: of:=VLOOKUP([.AS31]+[.AT27];[.$B$7:.$M$22];[.AS25]) -> X | AU31: of:=VLOOKUP([.AS31]+[.AU27];[.$B$7:.$M$22];[.AS25]) -> X | AV31: of:=VLOOKUP([.AS31]+[.AV27];[.$B$7:.$M$22];[.AS25]) -> X | AW31: of:=VLOOKUP([.AS31]+[.AW27];[.$B$7:.$M$22];[.AS25]) -> X | AY31: 10 | AZ31: of:=HLOOKUP(MID([.AY27];1;1);[.$C$5:.$F$6];2;0)*MID([.AY31];1;1) + HLOOKUP(MID([.AY27];2;1);[.$C$5:.$F$6];2;0)*MID([.AY31];2;1) -> 8 | BA31: of:=VLOOKUP([.AZ31]+[.BA27];[.$B$7:.$M$22];[.AZ25]) -> X | BB31: of:=VLOOKUP([.AZ31]+[.BB27];[.$B$7:.$M$22];[.AZ25]) -> X | BC31: of:=VLOOKUP([.AZ31]+[.BC27];[.$B$7:.$M$22];[.AZ25]) -> X | BD31: of:=VLOOKUP([.AZ31]+[.BD27];[.$B$7:.$M$22];[.AZ25]) -> X | BF31: 10 | BG31: of:=HLOOKUP(MID([.BF27];1;1);[.$C$5:.$F$6];2;0)*MID([.BF31];1;1) + HLOOKUP(MID([.BF27];2;1);[.$C$5:.$F$6];2;0)*MID([.BF31];2;1) -> 8 | BH31: of:=VLOOKUP([.BG31]+[.BH27];[.$B$7:.$M$22];[.BG25]) -> X | BI31: of:=VLOOKUP([.BG31]+[.BI27];[.$B$7:.$M$22];[.BG25]) -> X | BJ31: of:=VLOOKUP([.BG31]+[.BJ27];[.$B$7:.$M$22];[.BG25]) -> X | BK31: of:=VLOOKUP([.BG31]+[.BK27];[.$B$7:.$M$22];[.BG25]) -> X
N32: 1 | O32: F
N33: 2 | O33: G
N34: 3 | O34: H
N35: 4 | O35: I
N36: 5 | O36: J
N37: 6 | O37: K
N38: 7 | O38: L
N39: 8 | O39: M
N40: 9 | O40: N
N41: 10 | O41: O
N42: 11 | O42: P
N43: 12 | O43: Q
N44: 13 | O44: R | AY44: -R = µ B A
N45: 14 | O45: S
N46: 15 | O46: T
I47: Inv. Inputs | P47: a = -A | W47: b = 1 | AD47: c = -B | AK47: d = a = -A | AR47: e = a = -A | AY47: f = -R = µ B A | BF47: g = B | BL47: total
E48: transistors: | I48: 2 | P48: 0 | W48: 0 | AD48: 0 | AK48: 0 | AR48: 0 | AY48: 2 | BF48: 0 | BL48: of:=SUM([.I48:.BK48]) -> 4 | BN48: transistors
E49: gates: | I49: 2 | P49: 0 | W49: 0 | AD49: 0 | AK49: 0 | AR49: 0 | AY49: 1 | BF49: 0 | BL49: of:=SUM([.I49:.BK49]) -> 3 | BN49: gates

Sheet: digits 1-2 (0 off)
B1: 2 bit to 7-segment, digits 1-2 (0 off)
B2: Truth table | P2: 7-segment display as defined by truth table
P3: 0 | V3: of:=[.P3]+1 -> 1 | AB3: of:=[.V3]+1 -> 2 | AH3: of:=[.AB3]+1 -> 3 | AN3: of:=[.AH3]+1 -> 4 | AT3: of:=[.AN3]+1 -> 5 | AZ3: of:=[.AT3]+1 -> 6 | BF3: of:=[.AZ3]+1 -> 7
B4: Inputs | G4: Outputs | P4: of:=MATCH([.P3];[.$B$7:.$B$22];0)+2 -> 3 | V4: of:=MATCH([.V3];[.$B$7:.$B$22];0)+2 -> 4 | AB4: of:=MATCH([.AB3];[.$B$7:.$B$22];0)+2 -> 5 | AH4: of:=MATCH([.AH3];[.$B$7:.$B$22];0)+2 -> 6 | AN4: of:=MATCH([.AN3];[.$B$7:.$B$22];0)+2 -> 7 | AT4: of:=MATCH([.AT3];[.$B$7:.$B$22];0)+2 -> 8 | AZ4: of:=MATCH([.AZ3];[.$B$7:.$B$22];0)+2 -> 9 | BF4: of:=MATCH([.BF3];[.$B$7:.$B$22];0)+2 -> 10
B5: # | C5: D | D5: C | E5: B | F5: A | G5: a | H5: b | I5: c | J5: d | K5: e | L5: f | M5: g | Q5: of:=HLOOKUP([.T5];[.$G$5:.$M$22];[.P4];0) -> 0 | R5: of:=[.T5]&T(ORG.OPENOFFICE.STYLE(IF([.Q5]=1;"seg1";IF([.Q5]=0;"seg0";"segX")))) -> a | T5: a | W5: of:=HLOOKUP([.Z5];[.$G$5:.$M$22];[.V4];0) -> 0 | X5: of:=[.Z5]&T(ORG.OPENOFFICE.STYLE(IF([.W5]=1;"seg1";IF([.W5]=0;"seg0";"segX")))) -> a | Z5: a | AC5: of:=HLOOKUP([.AF5];[.$G$5:.$M$22];[.AB4];0) -> 1 | AD5: of:=[.AF5]&T(ORG.OPENOFFICE.STYLE(IF([.AC5]=1;"seg1";IF([.AC5]=0;"seg0";"segX")))) -> a | AF5: a | AI5: of:=HLOOKUP([.AL5];[.$G$5:.$M$22];[.AH4];0) -> X | AJ5: of:=[.AL5]&T(ORG.OPENOFFICE.STYLE(IF([.AI5]=1;"seg1";IF([.AI5]=0;"seg0";"segX")))) -> a | AL5: a | AO5: of:=HLOOKUP([.AR5];[.$G$5:.$M$22];[.AN4];0) -> X | AP5: of:=[.AR5]&T(ORG.OPENOFFICE.STYLE(IF([.AO5]=1;"seg1";IF([.AO5]=0;"seg0";"segX")))) -> a | AR5: a | AU5: of:=HLOOKUP([.AX5];[.$G$5:.$M$22];[.AT4];0) -> X | AV5: of:=[.AX5]&T(ORG.OPENOFFICE.STYLE(IF([.AU5]=1;"seg1";IF([.AU5]=0;"seg0";"segX")))) -> a | AX5: a | BA5: of:=HLOOKUP([.BD5];[.$G$5:.$M$22];[.AZ4];0) -> X | BB5: of:=[.BD5]&T(ORG.OPENOFFICE.STYLE(IF([.BA5]=1;"seg1";IF([.BA5]=0;"seg0";"segX")))) -> a | BD5: a | BG5: of:=HLOOKUP([.BJ5];[.$G$5:.$M$22];[.BF4];0) -> X | BH5: of:=[.BJ5]&T(ORG.OPENOFFICE.STYLE(IF([.BG5]=1;"seg1";IF([.BG5]=0;"seg0";"segX")))) -> a | BJ5: a
C6: 8 | D6: 4 | E6: 2 | F6: 1 | P6: of:=HLOOKUP([.R6];[.$G$5:.$M$22];[.P4];0) -> 0 | Q6: of:=[.R6]&T(ORG.OPENOFFICE.STYLE(IF([.P6]=1;"seg1";IF([.P6]=0;"seg0";"segX")))) -> f | R6: f | S6: of:=HLOOKUP([.U6];[.$G$5:.$M$22];[.P4];0) -> 0 | T6: of:=[.U6]&T(ORG.OPENOFFICE.STYLE(IF([.S6]=1;"seg1";IF([.S6]=0;"seg0";"segX")))) -> b | U6: b | V6: of:=HLOOKUP([.X6];[.$G$5:.$M$22];[.V4];0) -> 0 | W6: of:=[.X6]&T(ORG.OPENOFFICE.STYLE(IF([.V6]=1;"seg1";IF([.V6]=0;"seg0";"segX")))) -> f | X6: f | Y6: of:=HLOOKUP([.AA6];[.$G$5:.$M$22];[.V4];0) -> 1 | Z6: of:=[.AA6]&T(ORG.OPENOFFICE.STYLE(IF([.Y6]=1;"seg1";IF([.Y6]=0;"seg0";"segX")))) -> b | AA6: b | AB6: of:=HLOOKUP([.AD6];[.$G$5:.$M$22];[.AB4];0) -> 0 | AC6: of:=[.AD6]&T(ORG.OPENOFFICE.STYLE(IF([.AB6]=1;"seg1";IF([.AB6]=0;"seg0";"segX")))) -> f | AD6: f | AE6: of:=HLOOKUP([.AG6];[.$G$5:.$M$22];[.AB4];0) -> 1 | AF6: of:=[.AG6]&T(ORG.OPENOFFICE.STYLE(IF([.AE6]=1;"seg1";IF([.AE6]=0;"seg0";"segX")))) -> b | AG6: b | AH6: of:=HLOOKUP([.AJ6];[.$G$5:.$M$22];[.AH4];0) -> X | AI6: of:=[.AJ6]&T(ORG.OPENOFFICE.STYLE(IF([.AH6]=1;"seg1";IF([.AH6]=0;"seg0";"segX")))) -> f | AJ6: f | AK6: of:=HLOOKUP([.AM6];[.$G$5:.$M$22];[.AH4];0) -> X | AL6: of:=[.AM6]&T(ORG.OPENOFFICE.STYLE(IF([.AK6]=1;"seg1";IF([.AK6]=0;"seg0";"segX")))) -> b | AM6: b | AN6: of:=HLOOKUP([.AP6];[.$G$5:.$M$22];[.AN4];0) -> X | AO6: of:=[.AP6]&T(ORG.OPENOFFICE.STYLE(IF([.AN6]=1;"seg1";IF([.AN6]=0;"seg0";"segX")))) -> f | AP6: f | AQ6: of:=HLOOKUP([.AS6];[.$G$5:.$M$22];[.AN4];0) -> X | AR6: of:=[.AS6]&T(ORG.OPENOFFICE.STYLE(IF([.AQ6]=1;"seg1";IF([.AQ6]=0;"seg0";"segX")))) -> b | AS6: b | AT6: of:=HLOOKUP([.AV6];[.$G$5:.$M$22];[.AT4];0) -> X | AU6: of:=[.AV6]&T(ORG.OPENOFFICE.STYLE(IF([.AT6]=1;"seg1";IF([.AT6]=0;"seg0";"segX")))) -> f | AV6: f | AW6: of:=HLOOKUP([.AY6];[.$G$5:.$M$22];[.AT4];0) -> X | AX6: of:=[.AY6]&T(ORG.OPENOFFICE.STYLE(IF([.AW6]=1;"seg1";IF([.AW6]=0;"seg0";"segX")))) -> b | AY6: b | AZ6: of:=HLOOKUP([.BB6];[.$G$5:.$M$22];[.AZ4];0) -> X | BA6: of:=[.BB6]&T(ORG.OPENOFFICE.STYLE(IF([.AZ6]=1;"seg1";IF([.AZ6]=0;"seg0";"segX")))) -> f | BB6: f | BC6: of:=HLOOKUP([.BE6];[.$G$5:.$M$22];[.AZ4];0) -> X | BD6: of:=[.BE6]&T(ORG.OPENOFFICE.STYLE(IF([.BC6]=1;"seg1";IF([.BC6]=0;"seg0";"segX")))) -> b | BE6: b | BF6: of:=HLOOKUP([.BH6];[.$G$5:.$M$22];[.BF4];0) -> X | BG6: of:=[.BH6]&T(ORG.OPENOFFICE.STYLE(IF([.BF6]=1;"seg1";IF([.BF6]=0;"seg0";"segX")))) -> f | BH6: f | BI6: of:=HLOOKUP([.BK6];[.$G$5:.$M$22];[.BF4];0) -> X | BJ6: of:=[.BK6]&T(ORG.OPENOFFICE.STYLE(IF([.BI6]=1;"seg1";IF([.BI6]=0;"seg0";"segX")))) -> b | BK6: b
B7: 0 | C7: of:=MOD(ROUNDDOWN([.$B7]/[.C$6]);2) -> 0 | D7: of:=MOD(ROUNDDOWN([.$B7]/[.D$6]);2) -> 0 | E7: of:=MOD(ROUNDDOWN([.$B7]/[.E$6]);2) -> 0 | F7: of:=MOD(ROUNDDOWN([.$B7]/[.F$6]);2) -> 0 | G7: 0 | H7: 0 | I7: 0 | J7: 0 | K7: 0 | L7: 0 | M7: 0
B8: of:=[.B7]+1 -> 1 | C8: of:=MOD(ROUNDDOWN([.$B8]/[.C$6]);2) -> 0 | D8: of:=MOD(ROUNDDOWN([.$B8]/[.D$6]);2) -> 0 | E8: of:=MOD(ROUNDDOWN([.$B8]/[.E$6]);2) -> 0 | F8: of:=MOD(ROUNDDOWN([.$B8]/[.F$6]);2) -> 1 | G8: 0 | H8: 1 | I8: 1 | J8: 0 | K8: 0 | L8: 0 | M8: 0 | Q8: of:=HLOOKUP([.T8];[.$G$5:.$M$22];[.P4];0) -> 0 | R8: of:=[.T8]&T(ORG.OPENOFFICE.STYLE(IF([.Q8]=1;"seg1";IF([.Q8]=0;"seg0";"segX")))) -> g | T8: g | W8: of:=HLOOKUP([.Z8];[.$G$5:.$M$22];[.V4];0) -> 0 | X8: of:=[.Z8]&T(ORG.OPENOFFICE.STYLE(IF([.W8]=1;"seg1";IF([.W8]=0;"seg0";"segX")))) -> g | Z8: g | AC8: of:=HLOOKUP([.AF8];[.$G$5:.$M$22];[.AB4];0) -> 1 | AD8: of:=[.AF8]&T(ORG.OPENOFFICE.STYLE(IF([.AC8]=1;"seg1";IF([.AC8]=0;"seg0";"segX")))) -> g | AF8: g | AI8: of:=HLOOKUP([.AL8];[.$G$5:.$M$22];[.AH4];0) -> X | AJ8: of:=[.AL8]&T(ORG.OPENOFFICE.STYLE(IF([.AI8]=1;"seg1";IF([.AI8]=0;"seg0";"segX")))) -> g | AL8: g | AO8: of:=HLOOKUP([.AR8];[.$G$5:.$M$22];[.AN4];0) -> X | AP8: of:=[.AR8]&T(ORG.OPENOFFICE.STYLE(IF([.AO8]=1;"seg1";IF([.AO8]=0;"seg0";"segX")))) -> g | AR8: g | AU8: of:=HLOOKUP([.AX8];[.$G$5:.$M$22];[.AT4];0) -> X | AV8: of:=[.AX8]&T(ORG.OPENOFFICE.STYLE(IF([.AU8]=1;"seg1";IF([.AU8]=0;"seg0";"segX")))) -> g | AX8: g | BA8: of:=HLOOKUP([.BD8];[.$G$5:.$M$22];[.AZ4];0) -> X | BB8: of:=[.BD8]&T(ORG.OPENOFFICE.STYLE(IF([.BA8]=1;"seg1";IF([.BA8]=0;"seg0";"segX")))) -> g | BD8: g | BG8: of:=HLOOKUP([.BJ8];[.$G$5:.$M$22];[.BF4];0) -> X | BH8: of:=[.BJ8]&T(ORG.OPENOFFICE.STYLE(IF([.BG8]=1;"seg1";IF([.BG8]=0;"seg0";"segX")))) -> g | BJ8: g
B9: of:=[.B8]+1 -> 2 | C9: of:=MOD(ROUNDDOWN([.$B9]/[.C$6]);2) -> 0 | D9: of:=MOD(ROUNDDOWN([.$B9]/[.D$6]);2) -> 0 | E9: of:=MOD(ROUNDDOWN([.$B9]/[.E$6]);2) -> 1 | F9: of:=MOD(ROUNDDOWN([.$B9]/[.F$6]);2) -> 0 | G9: 1 | H9: 1 | I9: 0 | J9: 1 | K9: 1 | L9: 0 | M9: 1 | P9: of:=HLOOKUP([.R9];[.$G$5:.$M$22];[.P4];0) -> 0 | Q9: of:=[.R9]&T(ORG.OPENOFFICE.STYLE(IF([.P9]=1;"seg1";IF([.P9]=0;"seg0";"segX")))) -> e | R9: e | S9: of:=HLOOKUP([.U9];[.$G$5:.$M$22];[.P4];0) -> 0 | T9: of:=[.U9]&T(ORG.OPENOFFICE.STYLE(IF([.S9]=1;"seg1";IF([.S9]=0;"seg0";"segX")))) -> c | U9: c | V9: of:=HLOOKUP([.X9];[.$G$5:.$M$22];[.V4];0) -> 0 | W9: of:=[.X9]&T(ORG.OPENOFFICE.STYLE(IF([.V9]=1;"seg1";IF([.V9]=0;"seg0";"segX")))) -> e | X9: e | Y9: of:=HLOOKUP([.AA9];[.$G$5:.$M$22];[.V4];0) -> 1 | Z9: of:=[.AA9]&T(ORG.OPENOFFICE.STYLE(IF([.Y9]=1;"seg1";IF([.Y9]=0;"seg0";"segX")))) -> c | AA9: c | AB9: of:=HLOOKUP([.AD9];[.$G$5:.$M$22];[.AB4];0) -> 1 | AC9: of:=[.AD9]&T(ORG.OPENOFFICE.STYLE(IF([.AB9]=1;"seg1";IF([.AB9]=0;"seg0";"segX")))) -> e | AD9: e | AE9: of:=HLOOKUP([.AG9];[.$G$5:.$M$22];[.AB4];0) -> 0 | AF9: of:=[.AG9]&T(ORG.OPENOFFICE.STYLE(IF([.AE9]=1;"seg1";IF([.AE9]=0;"seg0";"segX")))) -> c | AG9: c | AH9: of:=HLOOKUP([.AJ9];[.$G$5:.$M$22];[.AH4];0) -> X | AI9: of:=[.AJ9]&T(ORG.OPENOFFICE.STYLE(IF([.AH9]=1;"seg1";IF([.AH9]=0;"seg0";"segX")))) -> e | AJ9: e | AK9: of:=HLOOKUP([.AM9];[.$G$5:.$M$22];[.AH4];0) -> X | AL9: of:=[.AM9]&T(ORG.OPENOFFICE.STYLE(IF([.AK9]=1;"seg1";IF([.AK9]=0;"seg0";"segX")))) -> c | AM9: c | AN9: of:=HLOOKUP([.AP9];[.$G$5:.$M$22];[.AN4];0) -> X | AO9: of:=[.AP9]&T(ORG.OPENOFFICE.STYLE(IF([.AN9]=1;"seg1";IF([.AN9]=0;"seg0";"segX")))) -> e | AP9: e | AQ9: of:=HLOOKUP([.AS9];[.$G$5:.$M$22];[.AN4];0) -> X | AR9: of:=[.AS9]&T(ORG.OPENOFFICE.STYLE(IF([.AQ9]=1;"seg1";IF([.AQ9]=0;"seg0";"segX")))) -> c | AS9: c | AT9: of:=HLOOKUP([.AV9];[.$G$5:.$M$22];[.AT4];0) -> X | AU9: of:=[.AV9]&T(ORG.OPENOFFICE.STYLE(IF([.AT9]=1;"seg1";IF([.AT9]=0;"seg0";"segX")))) -> e | AV9: e | AW9: of:=HLOOKUP([.AY9];[.$G$5:.$M$22];[.AT4];0) -> X | AX9: of:=[.AY9]&T(ORG.OPENOFFICE.STYLE(IF([.AW9]=1;"seg1";IF([.AW9]=0;"seg0";"segX")))) -> c | AY9: c | AZ9: of:=HLOOKUP([.BB9];[.$G$5:.$M$22];[.AZ4];0) -> X | BA9: of:=[.BB9]&T(ORG.OPENOFFICE.STYLE(IF([.AZ9]=1;"seg1";IF([.AZ9]=0;"seg0";"segX")))) -> e | BB9: e | BC9: of:=HLOOKUP([.BE9];[.$G$5:.$M$22];[.AZ4];0) -> X | BD9: of:=[.BE9]&T(ORG.OPENOFFICE.STYLE(IF([.BC9]=1;"seg1";IF([.BC9]=0;"seg0";"segX")))) -> c | BE9: c | BF9: of:=HLOOKUP([.BH9];[.$G$5:.$M$22];[.BF4];0) -> X | BG9: of:=[.BH9]&T(ORG.OPENOFFICE.STYLE(IF([.BF9]=1;"seg1";IF([.BF9]=0;"seg0";"segX")))) -> e | BH9: e | BI9: of:=HLOOKUP([.BK9];[.$G$5:.$M$22];[.BF4];0) -> X | BJ9: of:=[.BK9]&T(ORG.OPENOFFICE.STYLE(IF([.BI9]=1;"seg1";IF([.BI9]=0;"seg0";"segX")))) -> c | BK9: c
B10: of:=[.B9]+1 -> 3 | C10: of:=MOD(ROUNDDOWN([.$B10]/[.C$6]);2) -> 0 | D10: of:=MOD(ROUNDDOWN([.$B10]/[.D$6]);2) -> 0 | E10: of:=MOD(ROUNDDOWN([.$B10]/[.E$6]);2) -> 1 | F10: of:=MOD(ROUNDDOWN([.$B10]/[.F$6]);2) -> 1 | G10: X | H10: X | I10: X | J10: X | K10: X | L10: X | M10: X
B11: of:=[.B10]+1 -> 4 | C11: of:=MOD(ROUNDDOWN([.$B11]/[.C$6]);2) -> 0 | D11: of:=MOD(ROUNDDOWN([.$B11]/[.D$6]);2) -> 1 | E11: of:=MOD(ROUNDDOWN([.$B11]/[.E$6]);2) -> 0 | F11: of:=MOD(ROUNDDOWN([.$B11]/[.F$6]);2) -> 0 | G11: X | H11: X | I11: X | J11: X | K11: X | L11: X | M11: X | Q11: of:=HLOOKUP([.T11];[.$G$5:.$M$22];[.P4];0) -> 0 | R11: of:=[.T11]&T(ORG.OPENOFFICE.STYLE(IF([.Q11]=1;"seg1";IF([.Q11]=0;"seg0";"segX")))) -> d | T11: d | W11: of:=HLOOKUP([.Z11];[.$G$5:.$M$22];[.V4];0) -> 0 | X11: of:=[.Z11]&T(ORG.OPENOFFICE.STYLE(IF([.W11]=1;"seg1";IF([.W11]=0;"seg0";"segX")))) -> d | Z11: d | AC11: of:=HLOOKUP([.AF11];[.$G$5:.$M$22];[.AB4];0) -> 1 | AD11: of:=[.AF11]&T(ORG.OPENOFFICE.STYLE(IF([.AC11]=1;"seg1";IF([.AC11]=0;"seg0";"segX")))) -> d | AF11: d | AI11: of:=HLOOKUP([.AL11];[.$G$5:.$M$22];[.AH4];0) -> X | AJ11: of:=[.AL11]&T(ORG.OPENOFFICE.STYLE(IF([.AI11]=1;"seg1";IF([.AI11]=0;"seg0";"segX")))) -> d | AL11: d | AO11: of:=HLOOKUP([.AR11];[.$G$5:.$M$22];[.AN4];0) -> X | AP11: of:=[.AR11]&T(ORG.OPENOFFICE.STYLE(IF([.AO11]=1;"seg1";IF([.AO11]=0;"seg0";"segX")))) -> d | AR11: d | AU11: of:=HLOOKUP([.AX11];[.$G$5:.$M$22];[.AT4];0) -> X | AV11: of:=[.AX11]&T(ORG.OPENOFFICE.STYLE(IF([.AU11]=1;"seg1";IF([.AU11]=0;"seg0";"segX")))) -> d | AX11: d | BA11: of:=HLOOKUP([.BD11];[.$G$5:.$M$22];[.AZ4];0) -> X | BB11: of:=[.BD11]&T(ORG.OPENOFFICE.STYLE(IF([.BA11]=1;"seg1";IF([.BA11]=0;"seg0";"segX")))) -> d | BD11: d | BG11: of:=HLOOKUP([.BJ11];[.$G$5:.$M$22];[.BF4];0) -> X | BH11: of:=[.BJ11]&T(ORG.OPENOFFICE.STYLE(IF([.BG11]=1;"seg1";IF([.BG11]=0;"seg0";"segX")))) -> d | BJ11: d
B12: of:=[.B11]+1 -> 5 | C12: of:=MOD(ROUNDDOWN([.$B12]/[.C$6]);2) -> 0 | D12: of:=MOD(ROUNDDOWN([.$B12]/[.D$6]);2) -> 1 | E12: of:=MOD(ROUNDDOWN([.$B12]/[.E$6]);2) -> 0 | F12: of:=MOD(ROUNDDOWN([.$B12]/[.F$6]);2) -> 1 | G12: X | H12: X | I12: X | J12: X | K12: X | L12: X | M12: X
B13: of:=[.B12]+1 -> 6 | C13: of:=MOD(ROUNDDOWN([.$B13]/[.C$6]);2) -> 0 | D13: of:=MOD(ROUNDDOWN([.$B13]/[.D$6]);2) -> 1 | E13: of:=MOD(ROUNDDOWN([.$B13]/[.E$6]);2) -> 1 | F13: of:=MOD(ROUNDDOWN([.$B13]/[.F$6]);2) -> 0 | G13: X | H13: X | I13: X | J13: X | K13: X | L13: X | M13: X | P13: of:=[.BF3]+1 -> 8 | V13: of:=[.P13]+1 -> 9 | AB13: of:=[.V13]+1 -> 10 | AH13: of:=[.AB13]+1 -> 11 | AN13: of:=[.AH13]+1 -> 12 | AT13: of:=[.AN13]+1 -> 13 | AZ13: of:=[.AT13]+1 -> 14 | BF13: of:=[.AZ13]+1 -> 15
B14: of:=[.B13]+1 -> 7 | C14: of:=MOD(ROUNDDOWN([.$B14]/[.C$6]);2) -> 0 | D14: of:=MOD(ROUNDDOWN([.$B14]/[.D$6]);2) -> 1 | E14: of:=MOD(ROUNDDOWN([.$B14]/[.E$6]);2) -> 1 | F14: of:=MOD(ROUNDDOWN([.$B14]/[.F$6]);2) -> 1 | G14: X | H14: X | I14: X | J14: X | K14: X | L14: X | M14: X | P14: of:=MATCH([.P13];[.$B$7:.$B$22];0)+2 -> 11 | V14: of:=MATCH([.V13];[.$B$7:.$B$22];0)+2 -> 12 | AB14: of:=MATCH([.AB13];[.$B$7:.$B$22];0)+2 -> 13 | AH14: of:=MATCH([.AH13];[.$B$7:.$B$22];0)+2 -> 14 | AN14: of:=MATCH([.AN13];[.$B$7:.$B$22];0)+2 -> 15 | AT14: of:=MATCH([.AT13];[.$B$7:.$B$22];0)+2 -> 16 | AZ14: of:=MATCH([.AZ13];[.$B$7:.$B$22];0)+2 -> 17 | BF14: of:=MATCH([.BF13];[.$B$7:.$B$22];0)+2 -> 18
B15: of:=[.B14]+1 -> 8 | C15: of:=MOD(ROUNDDOWN([.$B15]/[.C$6]);2) -> 1 | D15: of:=MOD(ROUNDDOWN([.$B15]/[.D$6]);2) -> 0 | E15: of:=MOD(ROUNDDOWN([.$B15]/[.E$6]);2) -> 0 | F15: of:=MOD(ROUNDDOWN([.$B15]/[.F$6]);2) -> 0 | G15: X | H15: X | I15: X | J15: X | K15: X | L15: X | M15: X | Q15: of:=HLOOKUP([.T15];[.$G$5:.$M$22];[.P14];0) -> X | R15: of:=[.T15]&T(ORG.OPENOFFICE.STYLE(IF([.Q15]=1;"seg1";IF([.Q15]=0;"seg0";"segX")))) -> a | T15: a | W15: of:=HLOOKUP([.Z15];[.$G$5:.$M$22];[.V14];0) -> X | X15: of:=[.Z15]&T(ORG.OPENOFFICE.STYLE(IF([.W15]=1;"seg1";IF([.W15]=0;"seg0";"segX")))) -> a | Z15: a | AC15: of:=HLOOKUP([.AF15];[.$G$5:.$M$22];[.AB14];0) -> X | AD15: of:=[.AF15]&T(ORG.OPENOFFICE.STYLE(IF([.AC15]=1;"seg1";IF([.AC15]=0;"seg0";"segX")))) -> a | AF15: a | AI15: of:=HLOOKUP([.AL15];[.$G$5:.$M$22];[.AH14];0) -> X | AJ15: of:=[.AL15]&T(ORG.OPENOFFICE.STYLE(IF([.AI15]=1;"seg1";IF([.AI15]=0;"seg0";"segX")))) -> a | AL15: a | AO15: of:=HLOOKUP([.AR15];[.$G$5:.$M$22];[.AN14];0) -> X | AP15: of:=[.AR15]&T(ORG.OPENOFFICE.STYLE(IF([.AO15]=1;"seg1";IF([.AO15]=0;"seg0";"segX")))) -> a | AR15: a | AU15: of:=HLOOKUP([.AX15];[.$G$5:.$M$22];[.AT14];0) -> X | AV15: of:=[.AX15]&T(ORG.OPENOFFICE.STYLE(IF([.AU15]=1;"seg1";IF([.AU15]=0;"seg0";"segX")))) -> a | AX15: a | BA15: of:=HLOOKUP([.BD15];[.$G$5:.$M$22];[.AZ14];0) -> X | BB15: of:=[.BD15]&T(ORG.OPENOFFICE.STYLE(IF([.BA15]=1;"seg1";IF([.BA15]=0;"seg0";"segX")))) -> a | BD15: a | BG15: of:=HLOOKUP([.BJ15];[.$G$5:.$M$22];[.BF14];0) -> X | BH15: of:=[.BJ15]&T(ORG.OPENOFFICE.STYLE(IF([.BG15]=1;"seg1";IF([.BG15]=0;"seg0";"segX")))) -> a | BJ15: a
B16: of:=[.B15]+1 -> 9 | C16: of:=MOD(ROUNDDOWN([.$B16]/[.C$6]);2) -> 1 | D16: of:=MOD(ROUNDDOWN([.$B16]/[.D$6]);2) -> 0 | E16: of:=MOD(ROUNDDOWN([.$B16]/[.E$6]);2) -> 0 | F16: of:=MOD(ROUNDDOWN([.$B16]/[.F$6]);2) -> 1 | G16: X | H16: X | I16: X | J16: X | K16: X | L16: X | M16: X | P16: of:=HLOOKUP([.R16];[.$G$5:.$M$22];[.P14];0) -> X | Q16: of:=[.R16]&T(ORG.OPENOFFICE.STYLE(IF([.P16]=1;"seg1";IF([.P16]=0;"seg0";"segX")))) -> f | R16: f | S16: of:=HLOOKUP([.U16];[.$G$5:.$M$22];[.P14];0) -> X | T16: of:=[.U16]&T(ORG.OPENOFFICE.STYLE(IF([.S16]=1;"seg1";IF([.S16]=0;"seg0";"segX")))) -> b | U16: b | V16: of:=HLOOKUP([.X16];[.$G$5:.$M$22];[.V14];0) -> X | W16: of:=[.X16]&T(ORG.OPENOFFICE.STYLE(IF([.V16]=1;"seg1";IF([.V16]=0;"seg0";"segX")))) -> f | X16: f | Y16: of:=HLOOKUP([.AA16];[.$G$5:.$M$22];[.V14];0) -> X | Z16: of:=[.AA16]&T(ORG.OPENOFFICE.STYLE(IF([.Y16]=1;"seg1";IF([.Y16]=0;"seg0";"segX")))) -> b | AA16: b | AB16: of:=HLOOKUP([.AD16];[.$G$5:.$M$22];[.AB14];0) -> X | AC16: of:=[.AD16]&T(ORG.OPENOFFICE.STYLE(IF([.AB16]=1;"seg1";IF([.AB16]=0;"seg0";"segX")))) -> f | AD16: f | AE16: of:=HLOOKUP([.AG16];[.$G$5:.$M$22];[.AB14];0) -> X | AF16: of:=[.AG16]&T(ORG.OPENOFFICE.STYLE(IF([.AE16]=1;"seg1";IF([.AE16]=0;"seg0";"segX")))) -> b | AG16: b | AH16: of:=HLOOKUP([.AJ16];[.$G$5:.$M$22];[.AH14];0) -> X | AI16: of:=[.AJ16]&T(ORG.OPENOFFICE.STYLE(IF([.AH16]=1;"seg1";IF([.AH16]=0;"seg0";"segX")))) -> f | AJ16: f | AK16: of:=HLOOKUP([.AM16];[.$G$5:.$M$22];[.AH14];0) -> X | AL16: of:=[.AM16]&T(ORG.OPENOFFICE.STYLE(IF([.AK16]=1;"seg1";IF([.AK16]=0;"seg0";"segX")))) -> b | AM16: b | AN16: of:=HLOOKUP([.AP16];[.$G$5:.$M$22];[.AN14];0) -> X | AO16: of:=[.AP16]&T(ORG.OPENOFFICE.STYLE(IF([.AN16]=1;"seg1";IF([.AN16]=0;"seg0";"segX")))) -> f | AP16: f | AQ16: of:=HLOOKUP([.AS16];[.$G$5:.$M$22];[.AN14];0) -> X | AR16: of:=[.AS16]&T(ORG.OPENOFFICE.STYLE(IF([.AQ16]=1;"seg1";IF([.AQ16]=0;"seg0";"segX")))) -> b | AS16: b | AT16: of:=HLOOKUP([.AV16];[.$G$5:.$M$22];[.AT14];0) -> X | AU16: of:=[.AV16]&T(ORG.OPENOFFICE.STYLE(IF([.AT16]=1;"seg1";IF([.AT16]=0;"seg0";"segX")))) -> f | AV16: f | AW16: of:=HLOOKUP([.AY16];[.$G$5:.$M$22];[.AT14];0) -> X | AX16: of:=[.AY16]&T(ORG.OPENOFFICE.STYLE(IF([.AW16]=1;"seg1";IF([.AW16]=0;"seg0";"segX")))) -> b | AY16: b | AZ16: of:=HLOOKUP([.BB16];[.$G$5:.$M$22];[.AZ14];0) -> X | BA16: of:=[.BB16]&T(ORG.OPENOFFICE.STYLE(IF([.AZ16]=1;"seg1";IF([.AZ16]=0;"seg0";"segX")))) -> f | BB16: f | BC16: of:=HLOOKUP([.BE16];[.$G$5:.$M$22];[.AZ14];0) -> X | BD16: of:=[.BE16]&T(ORG.OPENOFFICE.STYLE(IF([.BC16]=1;"seg1";IF([.BC16]=0;"seg0";"segX")))) -> b | BE16: b | BF16: of:=HLOOKUP([.BH16];[.$G$5:.$M$22];[.BF14];0) -> X | BG16: of:=[.BH16]&T(ORG.OPENOFFICE.STYLE(IF([.BF16]=1;"seg1";IF([.BF16]=0;"seg0";"segX")))) -> f | BH16: f | BI16: of:=HLOOKUP([.BK16];[.$G$5:.$M$22];[.BF14];0) -> X | BJ16: of:=[.BK16]&T(ORG.OPENOFFICE.STYLE(IF([.BI16]=1;"seg1";IF([.BI16]=0;"seg0";"segX")))) -> b | BK16: b
B17: of:=[.B16]+1 -> 10 | C17: of:=MOD(ROUNDDOWN([.$B17]/[.C$6]);2) -> 1 | D17: of:=MOD(ROUNDDOWN([.$B17]/[.D$6]);2) -> 0 | E17: of:=MOD(ROUNDDOWN([.$B17]/[.E$6]);2) -> 1 | F17: of:=MOD(ROUNDDOWN([.$B17]/[.F$6]);2) -> 0 | G17: X | H17: X | I17: X | J17: X | K17: X | L17: X | M17: X
B18: of:=[.B17]+1 -> 11 | C18: of:=MOD(ROUNDDOWN([.$B18]/[.C$6]);2) -> 1 | D18: of:=MOD(ROUNDDOWN([.$B18]/[.D$6]);2) -> 0 | E18: of:=MOD(ROUNDDOWN([.$B18]/[.E$6]);2) -> 1 | F18: of:=MOD(ROUNDDOWN([.$B18]/[.F$6]);2) -> 1 | G18: X | H18: X | I18: X | J18: X | K18: X | L18: X | M18: X | Q18: of:=HLOOKUP([.T18];[.$G$5:.$M$22];[.P14];0) -> X | R18: of:=[.T18]&T(ORG.OPENOFFICE.STYLE(IF([.Q18]=1;"seg1";IF([.Q18]=0;"seg0";"segX")))) -> g | T18: g | W18: of:=HLOOKUP([.Z18];[.$G$5:.$M$22];[.V14];0) -> X | X18: of:=[.Z18]&T(ORG.OPENOFFICE.STYLE(IF([.W18]=1;"seg1";IF([.W18]=0;"seg0";"segX")))) -> g | Z18: g | AC18: of:=HLOOKUP([.AF18];[.$G$5:.$M$22];[.AB14];0) -> X | AD18: of:=[.AF18]&T(ORG.OPENOFFICE.STYLE(IF([.AC18]=1;"seg1";IF([.AC18]=0;"seg0";"segX")))) -> g | AF18: g | AI18: of:=HLOOKUP([.AL18];[.$G$5:.$M$22];[.AH14];0) -> X | AJ18: of:=[.AL18]&T(ORG.OPENOFFICE.STYLE(IF([.AI18]=1;"seg1";IF([.AI18]=0;"seg0";"segX")))) -> g | AL18: g | AO18: of:=HLOOKUP([.AR18];[.$G$5:.$M$22];[.AN14];0) -> X | AP18: of:=[.AR18]&T(ORG.OPENOFFICE.STYLE(IF([.AO18]=1;"seg1";IF([.AO18]=0;"seg0";"segX")))) -> g | AR18: g | AU18: of:=HLOOKUP([.AX18];[.$G$5:.$M$22];[.AT14];0) -> X | AV18: of:=[.AX18]&T(ORG.OPENOFFICE.STYLE(IF([.AU18]=1;"seg1";IF([.AU18]=0;"seg0";"segX")))) -> g | AX18: g | BA18: of:=HLOOKUP([.BD18];[.$G$5:.$M$22];[.AZ14];0) -> X | BB18: of:=[.BD18]&T(ORG.OPENOFFICE.STYLE(IF([.BA18]=1;"seg1";IF([.BA18]=0;"seg0";"segX")))) -> g | BD18: g | BG18: of:=HLOOKUP([.BJ18];[.$G$5:.$M$22];[.BF14];0) -> X | BH18: of:=[.BJ18]&T(ORG.OPENOFFICE.STYLE(IF([.BG18]=1;"seg1";IF([.BG18]=0;"seg0";"segX")))) -> g | BJ18: g
B19: of:=[.B18]+1 -> 12 | C19: of:=MOD(ROUNDDOWN([.$B19]/[.C$6]);2) -> 1 | D19: of:=MOD(ROUNDDOWN([.$B19]/[.D$6]);2) -> 1 | E19: of:=MOD(ROUNDDOWN([.$B19]/[.E$6]);2) -> 0 | F19: of:=MOD(ROUNDDOWN([.$B19]/[.F$6]);2) -> 0 | G19: X | H19: X | I19: X | J19: X | K19: X | L19: X | M19: X | P19: of:=HLOOKUP([.R19];[.$G$5:.$M$22];[.P14];0) -> X | Q19: of:=[.R19]&T(ORG.OPENOFFICE.STYLE(IF([.P19]=1;"seg1";IF([.P19]=0;"seg0";"segX")))) -> e | R19: e | S19: of:=HLOOKUP([.U19];[.$G$5:.$M$22];[.P14];0) -> X | T19: of:=[.U19]&T(ORG.OPENOFFICE.STYLE(IF([.S19]=1;"seg1";IF([.S19]=0;"seg0";"segX")))) -> c | U19: c | V19: of:=HLOOKUP([.X19];[.$G$5:.$M$22];[.V14];0) -> X | W19: of:=[.X19]&T(ORG.OPENOFFICE.STYLE(IF([.V19]=1;"seg1";IF([.V19]=0;"seg0";"segX")))) -> e | X19: e | Y19: of:=HLOOKUP([.AA19];[.$G$5:.$M$22];[.V14];0) -> X | Z19: of:=[.AA19]&T(ORG.OPENOFFICE.STYLE(IF([.Y19]=1;"seg1";IF([.Y19]=0;"seg0";"segX")))) -> c | AA19: c | AB19: of:=HLOOKUP([.AD19];[.$G$5:.$M$22];[.AB14];0) -> X | AC19: of:=[.AD19]&T(ORG.OPENOFFICE.STYLE(IF([.AB19]=1;"seg1";IF([.AB19]=0;"seg0";"segX")))) -> e | AD19: e | AE19: of:=HLOOKUP([.AG19];[.$G$5:.$M$22];[.AB14];0) -> X | AF19: of:=[.AG19]&T(ORG.OPENOFFICE.STYLE(IF([.AE19]=1;"seg1";IF([.AE19]=0;"seg0";"segX")))) -> c | AG19: c | AH19: of:=HLOOKUP([.AJ19];[.$G$5:.$M$22];[.AH14];0) -> X | AI19: of:=[.AJ19]&T(ORG.OPENOFFICE.STYLE(IF([.AH19]=1;"seg1";IF([.AH19]=0;"seg0";"segX")))) -> e | AJ19: e | AK19: of:=HLOOKUP([.AM19];[.$G$5:.$M$22];[.AH14];0) -> X | AL19: of:=[.AM19]&T(ORG.OPENOFFICE.STYLE(IF([.AK19]=1;"seg1";IF([.AK19]=0;"seg0";"segX")))) -> c | AM19: c | AN19: of:=HLOOKUP([.AP19];[.$G$5:.$M$22];[.AN14];0) -> X | AO19: of:=[.AP19]&T(ORG.OPENOFFICE.STYLE(IF([.AN19]=1;"seg1";IF([.AN19]=0;"seg0";"segX")))) -> e | AP19: e | AQ19: of:=HLOOKUP([.AS19];[.$G$5:.$M$22];[.AN14];0) -> X | AR19: of:=[.AS19]&T(ORG.OPENOFFICE.STYLE(IF([.AQ19]=1;"seg1";IF([.AQ19]=0;"seg0";"segX")))) -> c | AS19: c | AT19: of:=HLOOKUP([.AV19];[.$G$5:.$M$22];[.AT14];0) -> X | AU19: of:=[.AV19]&T(ORG.OPENOFFICE.STYLE(IF([.AT19]=1;"seg1";IF([.AT19]=0;"seg0";"segX")))) -> e | AV19: e | AW19: of:=HLOOKUP([.AY19];[.$G$5:.$M$22];[.AT14];0) -> X | AX19: of:=[.AY19]&T(ORG.OPENOFFICE.STYLE(IF([.AW19]=1;"seg1";IF([.AW19]=0;"seg0";"segX")))) -> c | AY19: c | AZ19: of:=HLOOKUP([.BB19];[.$G$5:.$M$22];[.AZ14];0) -> X | BA19: of:=[.BB19]&T(ORG.OPENOFFICE.STYLE(IF([.AZ19]=1;"seg1";IF([.AZ19]=0;"seg0";"segX")))) -> e | BB19: e | BC19: of:=HLOOKUP([.BE19];[.$G$5:.$M$22];[.AZ14];0) -> X | BD19: of:=[.BE19]&T(ORG.OPENOFFICE.STYLE(IF([.BC19]=1;"seg1";IF([.BC19]=0;"seg0";"segX")))) -> c | BE19: c | BF19: of:=HLOOKUP([.BH19];[.$G$5:.$M$22];[.BF14];0) -> X | BG19: of:=[.BH19]&T(ORG.OPENOFFICE.STYLE(IF([.BF19]=1;"seg1";IF([.BF19]=0;"seg0";"segX")))) -> e | BH19: e | BI19: of:=HLOOKUP([.BK19];[.$G$5:.$M$22];[.BF14];0) -> X | BJ19: of:=[.BK19]&T(ORG.OPENOFFICE.STYLE(IF([.BI19]=1;"seg1";IF([.BI19]=0;"seg0";"segX")))) -> c | BK19: c
B20: of:=[.B19]+1 -> 13 | C20: of:=MOD(ROUNDDOWN([.$B20]/[.C$6]);2) -> 1 | D20: of:=MOD(ROUNDDOWN([.$B20]/[.D$6]);2) -> 1 | E20: of:=MOD(ROUNDDOWN([.$B20]/[.E$6]);2) -> 0 | F20: of:=MOD(ROUNDDOWN([.$B20]/[.F$6]);2) -> 1 | G20: X | H20: X | I20: X | J20: X | K20: X | L20: X | M20: X
B21: of:=[.B20]+1 -> 14 | C21: of:=MOD(ROUNDDOWN([.$B21]/[.C$6]);2) -> 1 | D21: of:=MOD(ROUNDDOWN([.$B21]/[.D$6]);2) -> 1 | E21: of:=MOD(ROUNDDOWN([.$B21]/[.E$6]);2) -> 1 | F21: of:=MOD(ROUNDDOWN([.$B21]/[.F$6]);2) -> 0 | G21: X | H21: X | I21: X | J21: X | K21: X | L21: X | M21: X | Q21: of:=HLOOKUP([.T21];[.$G$5:.$M$22];[.P14];0) -> X | R21: of:=[.T21]&T(ORG.OPENOFFICE.STYLE(IF([.Q21]=1;"seg1";IF([.Q21]=0;"seg0";"segX")))) -> d | T21: d | W21: of:=HLOOKUP([.Z21];[.$G$5:.$M$22];[.V14];0) -> X | X21: of:=[.Z21]&T(ORG.OPENOFFICE.STYLE(IF([.W21]=1;"seg1";IF([.W21]=0;"seg0";"segX")))) -> d | Z21: d | AC21: of:=HLOOKUP([.AF21];[.$G$5:.$M$22];[.AB14];0) -> X | AD21: of:=[.AF21]&T(ORG.OPENOFFICE.STYLE(IF([.AC21]=1;"seg1";IF([.AC21]=0;"seg0";"segX")))) -> d | AF21: d | AI21: of:=HLOOKUP([.AL21];[.$G$5:.$M$22];[.AH14];0) -> X | AJ21: of:=[.AL21]&T(ORG.OPENOFFICE.STYLE(IF([.AI21]=1;"seg1";IF([.AI21]=0;"seg0";"segX")))) -> d | AL21: d | AO21: of:=HLOOKUP([.AR21];[.$G$5:.$M$22];[.AN14];0) -> X | AP21: of:=[.AR21]&T(ORG.OPENOFFICE.STYLE(IF([.AO21]=1;"seg1";IF([.AO21]=0;"seg0";"segX")))) -> d | AR21: d | AU21: of:=HLOOKUP([.AX21];[.$G$5:.$M$22];[.AT14];0) -> X | AV21: of:=[.AX21]&T(ORG.OPENOFFICE.STYLE(IF([.AU21]=1;"seg1";IF([.AU21]=0;"seg0";"segX")))) -> d | AX21: d | BA21: of:=HLOOKUP([.BD21];[.$G$5:.$M$22];[.AZ14];0) -> X | BB21: of:=[.BD21]&T(ORG.OPENOFFICE.STYLE(IF([.BA21]=1;"seg1";IF([.BA21]=0;"seg0";"segX")))) -> d | BD21: d | BG21: of:=HLOOKUP([.BJ21];[.$G$5:.$M$22];[.BF14];0) -> X | BH21: of:=[.BJ21]&T(ORG.OPENOFFICE.STYLE(IF([.BG21]=1;"seg1";IF([.BG21]=0;"seg0";"segX")))) -> d | BJ21: d
B22: of:=[.B21]+1 -> 15 | C22: of:=MOD(ROUNDDOWN([.$B22]/[.C$6]);2) -> 1 | D22: of:=MOD(ROUNDDOWN([.$B22]/[.D$6]);2) -> 1 | E22: of:=MOD(ROUNDDOWN([.$B22]/[.E$6]);2) -> 1 | F22: of:=MOD(ROUNDDOWN([.$B22]/[.F$6]);2) -> 1 | G22: X | H22: X | I22: X | J22: X | K22: X | L22: X | M22: X
P24: Karnaugh-maps
P25: a | Q25: of:=MATCH([.P25];[.$G$5:.$M$5])+5 -> 6 | R25: BA | W25: b | X25: of:=MATCH([.W25];[.$G$5:.$M$5])+5 -> 7 | Y25: BA | AD25: c | AE25: of:=MATCH([.AD25];[.$G$5:.$M$5])+5 -> 8 | AF25: BA | AK25: d | AL25: of:=MATCH([.AK25];[.$G$5:.$M$5])+5 -> 9 | AM25: BA | AR25: e | AS25: of:=MATCH([.AR25];[.$G$5:.$M$5])+5 -> 10 | AT25: BA | AY25: f | AZ25: of:=MATCH([.AY25];[.$G$5:.$M$5])+5 -> 11 | BA25: BA | BF25: g | BG25: of:=MATCH([.BF25];[.$G$5:.$M$5])+5 -> 12 | BH25: BA
R26: 00 | S26: 01 | T26: 11 | U26: 10 | Y26: 00 | Z26: 01 | AA26: 11 | AB26: 10 | AF26: 00 | AG26: 01 | AH26: 11 | AI26: 10 | AM26: 00 | AN26: 01 | AO26: 11 | AP26: 10 | AT26: 00 | AU26: 01 | AV26: 11 | AW26: 10 | BA26: 00 | BB26: 01 | BC26: 11 | BD26: 10 | BH26: 00 | BI26: 01 | BJ26: 11 | BK26: 10
P27: DC | R27: of:=HLOOKUP(MID([.R25];1;1);[.$C$5:.$F$6];2;0)*MID([.R26];1;1) + HLOOKUP(MID([.R25];2;1);[.$C$5:.$F$6];2;0)*MID([.R26];2;1) -> 0 | S27: of:=HLOOKUP(MID([.R25];1;1);[.$C$5:.$F$6];2;0)*MID([.S26];1;1) + HLOOKUP(MID([.R25];2;1);[.$C$5:.$F$6];2;0)*MID([.S26];2;1) -> 1 | T27: of:=HLOOKUP(MID([.R25];1;1);[.$C$5:.$F$6];2;0)*MID([.T26];1;1) + HLOOKUP(MID([.R25];2;1);[.$C$5:.$F$6];2;0)*MID([.T26];2;1) -> 3 | U27: of:=HLOOKUP(MID([.R25];1;1);[.$C$5:.$F$6];2;0)*MID([.U26];1;1) + HLOOKUP(MID([.R25];2;1);[.$C$5:.$F$6];2;0)*MID([.U26];2;1) -> 2 | W27: DC | Y27: of:=HLOOKUP(MID([.Y25];1;1);[.$C$5:.$F$6];2;0)*MID([.Y26];1;1) + HLOOKUP(MID([.Y25];2;1);[.$C$5:.$F$6];2;0)*MID([.Y26];2;1) -> 0 | Z27: of:=HLOOKUP(MID([.Y25];1;1);[.$C$5:.$F$6];2;0)*MID([.Z26];1;1) + HLOOKUP(MID([.Y25];2;1);[.$C$5:.$F$6];2;0)*MID([.Z26];2;1) -> 1 | AA27: of:=HLOOKUP(MID([.Y25];1;1);[.$C$5:.$F$6];2;0)*MID([.AA26];1;1) + HLOOKUP(MID([.Y25];2;1);[.$C$5:.$F$6];2;0)*MID([.AA26];2;1) -> 3 | AB27: of:=HLOOKUP(MID([.Y25];1;1);[.$C$5:.$F$6];2;0)*MID([.AB26];1;1) + HLOOKUP(MID([.Y25];2;1);[.$C$5:.$F$6];2;0)*MID([.AB26];2;1) -> 2 | AD27: DC | AF27: of:=HLOOKUP(MID([.AF25];1;1);[.$C$5:.$F$6];2;0)*MID([.AF26];1;1) + HLOOKUP(MID([.AF25];2;1);[.$C$5:.$F$6];2;0)*MID([.AF26];2;1) -> 0 | AG27: of:=HLOOKUP(MID([.AF25];1;1);[.$C$5:.$F$6];2;0)*MID([.AG26];1;1) + HLOOKUP(MID([.AF25];2;1);[.$C$5:.$F$6];2;0)*MID([.AG26];2;1) -> 1 | AH27: of:=HLOOKUP(MID([.AF25];1;1);[.$C$5:.$F$6];2;0)*MID([.AH26];1;1) + HLOOKUP(MID([.AF25];2;1);[.$C$5:.$F$6];2;0)*MID([.AH26];2;1) -> 3 | AI27: of:=HLOOKUP(MID([.AF25];1;1);[.$C$5:.$F$6];2;0)*MID([.AI26];1;1) + HLOOKUP(MID([.AF25];2;1);[.$C$5:.$F$6];2;0)*MID([.AI26];2;1) -> 2 | AK27: DC | AM27: of:=HLOOKUP(MID([.AM25];1;1);[.$C$5:.$F$6];2;0)*MID([.AM26];1;1) + HLOOKUP(MID([.AM25];2;1);[.$C$5:.$F$6];2;0)*MID([.AM26];2;1) -> 0 | AN27: of:=HLOOKUP(MID([.AM25];1;1);[.$C$5:.$F$6];2;0)*MID([.AN26];1;1) + HLOOKUP(MID([.AM25];2;1);[.$C$5:.$F$6];2;0)*MID([.AN26];2;1) -> 1 | AO27: of:=HLOOKUP(MID([.AM25];1;1);[.$C$5:.$F$6];2;0)*MID([.AO26];1;1) + HLOOKUP(MID([.AM25];2;1);[.$C$5:.$F$6];2;0)*MID([.AO26];2;1) -> 3 | AP27: of:=HLOOKUP(MID([.AM25];1;1);[.$C$5:.$F$6];2;0)*MID([.AP26];1;1) + HLOOKUP(MID([.AM25];2;1);[.$C$5:.$F$6];2;0)*MID([.AP26];2;1) -> 2 | AR27: DC | AT27: of:=HLOOKUP(MID([.AT25];1;1);[.$C$5:.$F$6];2;0)*MID([.AT26];1;1) + HLOOKUP(MID([.AT25];2;1);[.$C$5:.$F$6];2;0)*MID([.AT26];2;1) -> 0 | AU27: of:=HLOOKUP(MID([.AT25];1;1);[.$C$5:.$F$6];2;0)*MID([.AU26];1;1) + HLOOKUP(MID([.AT25];2;1);[.$C$5:.$F$6];2;0)*MID([.AU26];2;1) -> 1 | AV27: of:=HLOOKUP(MID([.AT25];1;1);[.$C$5:.$F$6];2;0)*MID([.AV26];1;1) + HLOOKUP(MID([.AT25];2;1);[.$C$5:.$F$6];2;0)*MID([.AV26];2;1) -> 3 | AW27: of:=HLOOKUP(MID([.AT25];1;1);[.$C$5:.$F$6];2;0)*MID([.AW26];1;1) + HLOOKUP(MID([.AT25];2;1);[.$C$5:.$F$6];2;0)*MID([.AW26];2;1) -> 2 | AY27: DC | BA27: of:=HLOOKUP(MID([.BA25];1;1);[.$C$5:.$F$6];2;0)*MID([.BA26];1;1) + HLOOKUP(MID([.BA25];2;1);[.$C$5:.$F$6];2;0)*MID([.BA26];2;1) -> 0 | BB27: of:=HLOOKUP(MID([.BA25];1;1);[.$C$5:.$F$6];2;0)*MID([.BB26];1;1) + HLOOKUP(MID([.BA25];2;1);[.$C$5:.$F$6];2;0)*MID([.BB26];2;1) -> 1 | BC27: of:=HLOOKUP(MID([.BA25];1;1);[.$C$5:.$F$6];2;0)*MID([.BC26];1;1) + HLOOKUP(MID([.BA25];2;1);[.$C$5:.$F$6];2;0)*MID([.BC26];2;1) -> 3 | BD27: of:=HLOOKUP(MID([.BA25];1;1);[.$C$5:.$F$6];2;0)*MID([.BD26];1;1) + HLOOKUP(MID([.BA25];2;1);[.$C$5:.$F$6];2;0)*MID([.BD26];2;1) -> 2 | BF27: DC | BH27: of:=HLOOKUP(MID([.BH25];1;1);[.$C$5:.$F$6];2;0)*MID([.BH26];1;1) + HLOOKUP(MID([.BH25];2;1);[.$C$5:.$F$6];2;0)*MID([.BH26];2;1) -> 0 | BI27: of:=HLOOKUP(MID([.BH25];1;1);[.$C$5:.$F$6];2;0)*MID([.BI26];1;1) + HLOOKUP(MID([.BH25];2;1);[.$C$5:.$F$6];2;0)*MID([.BI26];2;1) -> 1 | BJ27: of:=HLOOKUP(MID([.BH25];1;1);[.$C$5:.$F$6];2;0)*MID([.BJ26];1;1) + HLOOKUP(MID([.BH25];2;1);[.$C$5:.$F$6];2;0)*MID([.BJ26];2;1) -> 3 | BK27: of:=HLOOKUP(MID([.BH25];1;1);[.$C$5:.$F$6];2;0)*MID([.BK26];1;1) + HLOOKUP(MID([.BH25];2;1);[.$C$5:.$F$6];2;0)*MID([.BK26];2;1) -> 2
P28: 00 | Q28: of:=HLOOKUP(MID([.P27];1;1);[.$C$5:.$F$6];2;0)*MID([.P28];1;1) + HLOOKUP(MID([.P27];2;1);[.$C$5:.$F$6];2;0)*MID([.P28];2;1) -> 0 | R28: of:=VLOOKUP([.Q28]+[.R27];[.$B$7:.$M$22];[.Q25]) -> 0 | S28: of:=VLOOKUP([.Q28]+[.S27];[.$B$7:.$M$22];[.Q25]) -> 0 | T28: of:=VLOOKUP([.Q28]+[.T27];[.$B$7:.$M$22];[.Q25]) -> X | U28: of:=VLOOKUP([.Q28]+[.U27];[.$B$7:.$M$22];[.Q25]) -> 1 | W28: 00 | X28: of:=HLOOKUP(MID([.W27];1;1);[.$C$5:.$F$6];2;0)*MID([.W28];1;1) + HLOOKUP(MID([.W27];2;1);[.$C$5:.$F$6];2;0)*MID([.W28];2;1) -> 0 | Y28: of:=VLOOKUP([.X28]+[.Y27];[.$B$7:.$M$22];[.X25]) -> 0 | Z28: of:=VLOOKUP([.X28]+[.Z27];[.$B$7:.$M$22];[.X25]) -> 1 | AA28: of:=VLOOKUP([.X28]+[.AA27];[.$B$7:.$M$22];[.X25]) -> X | AB28: of:=VLOOKUP([.X28]+[.AB27];[.$B$7:.$M$22];[.X25]) -> 1 | AD28: 00 | AE28: of:=HLOOKUP(MID([.AD27];1;1);[.$C$5:.$F$6];2;0)*MID([.AD28];1;1) + HLOOKUP(MID([.AD27];2;1);[.$C$5:.$F$6];2;0)*MID([.AD28];2;1) -> 0 | AF28: of:=VLOOKUP([.AE28]+[.AF27];[.$B$7:.$M$22];[.AE25]) -> 0 | AG28: of:=VLOOKUP([.AE28]+[.AG27];[.$B$7:.$M$22];[.AE25]) -> 1 | AH28: of:=VLOOKUP([.AE28]+[.AH27];[.$B$7:.$M$22];[.AE25]) -> X | AI28: of:=VLOOKUP([.AE28]+[.AI27];[.$B$7:.$M$22];[.AE25]) -> 0 | AK28: 00 | AL28: of:=HLOOKUP(MID([.AK27];1;1);[.$C$5:.$F$6];2;0)*MID([.AK28];1;1) + HLOOKUP(MID([.AK27];2;1);[.$C$5:.$F$6];2;0)*MID([.AK28];2;1) -> 0 | AM28: of:=VLOOKUP([.AL28]+[.AM27];[.$B$7:.$M$22];[.AL25]) -> 0 | AN28: of:=VLOOKUP([.AL28]+[.AN27];[.$B$7:.$M$22];[.AL25]) -> 0 | AO28: of:=VLOOKUP([.AL28]+[.AO27];[.$B$7:.$M$22];[.AL25]) -> X | AP28: of:=VLOOKUP([.AL28]+[.AP27];[.$B$7:.$M$22];[.AL25]) -> 1 | AR28: 00 | AS28: of:=HLOOKUP(MID([.AR27];1;1);[.$C$5:.$F$6];2;0)*MID([.AR28];1;1) + HLOOKUP(MID([.AR27];2;1);[.$C$5:.$F$6];2;0)*MID([.AR28];2;1) -> 0 | AT28: of:=VLOOKUP([.AS28]+[.AT27];[.$B$7:.$M$22];[.AS25]) -> 0 | AU28: of:=VLOOKUP([.AS28]+[.AU27];[.$B$7:.$M$22];[.AS25]) -> 0 | AV28: of:=VLOOKUP([.AS28]+[.AV27];[.$B$7:.$M$22];[.AS25]) -> X | AW28: of:=VLOOKUP([.AS28]+[.AW27];[.$B$7:.$M$22];[.AS25]) -> 1 | AY28: 00 | AZ28: of:=HLOOKUP(MID([.AY27];1;1);[.$C$5:.$F$6];2;0)*MID([.AY28];1;1) + HLOOKUP(MID([.AY27];2;1);[.$C$5:.$F$6];2;0)*MID([.AY28];2;1) -> 0 | BA28: of:=VLOOKUP([.AZ28]+[.BA27];[.$B$7:.$M$22];[.AZ25]) -> 0 | BB28: of:=VLOOKUP([.AZ28]+[.BB27];[.$B$7:.$M$22];[.AZ25]) -> 0 | BC28: of:=VLOOKUP([.AZ28]+[.BC27];[.$B$7:.$M$22];[.AZ25]) -> X | BD28: of:=VLOOKUP([.AZ28]+[.BD27];[.$B$7:.$M$22];[.AZ25]) -> 0 | BF28: 00 | BG28: of:=HLOOKUP(MID([.BF27];1;1);[.$C$5:.$F$6];2;0)*MID([.BF28];1;1) + HLOOKUP(MID([.BF27];2;1);[.$C$5:.$F$6];2;0)*MID([.BF28];2;1) -> 0 | BH28: of:=VLOOKUP([.BG28]+[.BH27];[.$B$7:.$M$22];[.BG25]) -> 0 | BI28: of:=VLOOKUP([.BG28]+[.BI27];[.$B$7:.$M$22];[.BG25]) -> 0 | BJ28: of:=VLOOKUP([.BG28]+[.BJ27];[.$B$7:.$M$22];[.BG25]) -> X | BK28: of:=VLOOKUP([.BG28]+[.BK27];[.$B$7:.$M$22];[.BG25]) -> 1
P29: 01 | Q29: of:=HLOOKUP(MID([.P27];1;1);[.$C$5:.$F$6];2;0)*MID([.P29];1;1) + HLOOKUP(MID([.P27];2;1);[.$C$5:.$F$6];2;0)*MID([.P29];2;1) -> 4 | R29: of:=VLOOKUP([.Q29]+[.R27];[.$B$7:.$M$22];[.Q25]) -> X | S29: of:=VLOOKUP([.Q29]+[.S27];[.$B$7:.$M$22];[.Q25]) -> X | T29: of:=VLOOKUP([.Q29]+[.T27];[.$B$7:.$M$22];[.Q25]) -> X | U29: of:=VLOOKUP([.Q29]+[.U27];[.$B$7:.$M$22];[.Q25]) -> X | W29: 01 | X29: of:=HLOOKUP(MID([.W27];1;1);[.$C$5:.$F$6];2;0)*MID([.W29];1;1) + HLOOKUP(MID([.W27];2;1);[.$C$5:.$F$6];2;0)*MID([.W29];2;1) -> 4 | Y29: of:=VLOOKUP([.X29]+[.Y27];[.$B$7:.$M$22];[.X25]) -> X | Z29: of:=VLOOKUP([.X29]+[.Z27];[.$B$7:.$M$22];[.X25]) -> X | AA29: of:=VLOOKUP([.X29]+[.AA27];[.$B$7:.$M$22];[.X25]) -> X | AB29: of:=VLOOKUP([.X29]+[.AB27];[.$B$7:.$M$22];[.X25]) -> X | AD29: 01 | AE29: of:=HLOOKUP(MID([.AD27];1;1);[.$C$5:.$F$6];2;0)*MID([.AD29];1;1) + HLOOKUP(MID([.AD27];2;1);[.$C$5:.$F$6];2;0)*MID([.AD29];2;1) -> 4 | AF29: of:=VLOOKUP([.AE29]+[.AF27];[.$B$7:.$M$22];[.AE25]) -> X | AG29: of:=VLOOKUP([.AE29]+[.AG27];[.$B$7:.$M$22];[.AE25]) -> X | AH29: of:=VLOOKUP([.AE29]+[.AH27];[.$B$7:.$M$22];[.AE25]) -> X | AI29: of:=VLOOKUP([.AE29]+[.AI27];[.$B$7:.$M$22];[.AE25]) -> X | AK29: 01 | AL29: of:=HLOOKUP(MID([.AK27];1;1);[.$C$5:.$F$6];2;0)*MID([.AK29];1;1) + HLOOKUP(MID([.AK27];2;1);[.$C$5:.$F$6];2;0)*MID([.AK29];2;1) -> 4 | AM29: of:=VLOOKUP([.AL29]+[.AM27];[.$B$7:.$M$22];[.AL25]) -> X | AN29: of:=VLOOKUP([.AL29]+[.AN27];[.$B$7:.$M$22];[.AL25]) -> X | AO29: of:=VLOOKUP([.AL29]+[.AO27];[.$B$7:.$M$22];[.AL25]) -> X | AP29: of:=VLOOKUP([.AL29]+[.AP27];[.$B$7:.$M$22];[.AL25]) -> X | AR29: 01 | AS29: of:=HLOOKUP(MID([.AR27];1;1);[.$C$5:.$F$6];2;0)*MID([.AR29];1;1) + HLOOKUP(MID([.AR27];2;1);[.$C$5:.$F$6];2;0)*MID([.AR29];2;1) -> 4 | AT29: of:=VLOOKUP([.AS29]+[.AT27];[.$B$7:.$M$22];[.AS25]) -> X | AU29: of:=VLOOKUP([.AS29]+[.AU27];[.$B$7:.$M$22];[.AS25]) -> X | AV29: of:=VLOOKUP([.AS29]+[.AV27];[.$B$7:.$M$22];[.AS25]) -> X | AW29: of:=VLOOKUP([.AS29]+[.AW27];[.$B$7:.$M$22];[.AS25]) -> X | AY29: 01 | AZ29: of:=HLOOKUP(MID([.AY27];1;1);[.$C$5:.$F$6];2;0)*MID([.AY29];1;1) + HLOOKUP(MID([.AY27];2;1);[.$C$5:.$F$6];2;0)*MID([.AY29];2;1) -> 4 | BA29: of:=VLOOKUP([.AZ29]+[.BA27];[.$B$7:.$M$22];[.AZ25]) -> X | BB29: of:=VLOOKUP([.AZ29]+[.BB27];[.$B$7:.$M$22];[.AZ25]) -> X | BC29: of:=VLOOKUP([.AZ29]+[.BC27];[.$B$7:.$M$22];[.AZ25]) -> X | BD29: of:=VLOOKUP([.AZ29]+[.BD27];[.$B$7:.$M$22];[.AZ25]) -> X | BF29: 01 | BG29: of:=HLOOKUP(MID([.BF27];1;1);[.$C$5:.$F$6];2;0)*MID([.BF29];1;1) + HLOOKUP(MID([.BF27];2;1);[.$C$5:.$F$6];2;0)*MID([.BF29];2;1) -> 4 | BH29: of:=VLOOKUP([.BG29]+[.BH27];[.$B$7:.$M$22];[.BG25]) -> X | BI29: of:=VLOOKUP([.BG29]+[.BI27];[.$B$7:.$M$22];[.BG25]) -> X | BJ29: of:=VLOOKUP([.BG29]+[.BJ27];[.$B$7:.$M$22];[.BG25]) -> X | BK29: of:=VLOOKUP([.BG29]+[.BK27];[.$B$7:.$M$22];[.BG25]) -> X
P30: 11 | Q30: of:=HLOOKUP(MID([.P27];1;1);[.$C$5:.$F$6];2;0)*MID([.P30];1;1) + HLOOKUP(MID([.P27];2;1);[.$C$5:.$F$6];2;0)*MID([.P30];2;1) -> 12 | R30: of:=VLOOKUP([.Q30]+[.R27];[.$B$7:.$M$22];[.Q25]) -> X | S30: of:=VLOOKUP([.Q30]+[.S27];[.$B$7:.$M$22];[.Q25]) -> X | T30: of:=VLOOKUP([.Q30]+[.T27];[.$B$7:.$M$22];[.Q25]) -> X | U30: of:=VLOOKUP([.Q30]+[.U27];[.$B$7:.$M$22];[.Q25]) -> X | W30: 11 | X30: of:=HLOOKUP(MID([.W27];1;1);[.$C$5:.$F$6];2;0)*MID([.W30];1;1) + HLOOKUP(MID([.W27];2;1);[.$C$5:.$F$6];2;0)*MID([.W30];2;1) -> 12 | Y30: of:=VLOOKUP([.X30]+[.Y27];[.$B$7:.$M$22];[.X25]) -> X | Z30: of:=VLOOKUP([.X30]+[.Z27];[.$B$7:.$M$22];[.X25]) -> X | AA30: of:=VLOOKUP([.X30]+[.AA27];[.$B$7:.$M$22];[.X25]) -> X | AB30: of:=VLOOKUP([.X30]+[.AB27];[.$B$7:.$M$22];[.X25]) -> X | AD30: 11 | AE30: of:=HLOOKUP(MID([.AD27];1;1);[.$C$5:.$F$6];2;0)*MID([.AD30];1;1) + HLOOKUP(MID([.AD27];2;1);[.$C$5:.$F$6];2;0)*MID([.AD30];2;1) -> 12 | AF30: of:=VLOOKUP([.AE30]+[.AF27];[.$B$7:.$M$22];[.AE25]) -> X | AG30: of:=VLOOKUP([.AE30]+[.AG27];[.$B$7:.$M$22];[.AE25]) -> X | AH30: of:=VLOOKUP([.AE30]+[.AH27];[.$B$7:.$M$22];[.AE25]) -> X | AI30: of:=VLOOKUP([.AE30]+[.AI27];[.$B$7:.$M$22];[.AE25]) -> X | AK30: 11 | AL30: of:=HLOOKUP(MID([.AK27];1;1);[.$C$5:.$F$6];2;0)*MID([.AK30];1;1) + HLOOKUP(MID([.AK27];2;1);[.$C$5:.$F$6];2;0)*MID([.AK30];2;1) -> 12 | AM30: of:=VLOOKUP([.AL30]+[.AM27];[.$B$7:.$M$22];[.AL25]) -> X | AN30: of:=VLOOKUP([.AL30]+[.AN27];[.$B$7:.$M$22];[.AL25]) -> X | AO30: of:=VLOOKUP([.AL30]+[.AO27];[.$B$7:.$M$22];[.AL25]) -> X | AP30: of:=VLOOKUP([.AL30]+[.AP27];[.$B$7:.$M$22];[.AL25]) -> X | AR30: 11 | AS30: of:=HLOOKUP(MID([.AR27];1;1);[.$C$5:.$F$6];2;0)*MID([.AR30];1;1) + HLOOKUP(MID([.AR27];2;1);[.$C$5:.$F$6];2;0)*MID([.AR30];2;1) -> 12 | AT30: of:=VLOOKUP([.AS30]+[.AT27];[.$B$7:.$M$22];[.AS25]) -> X | AU30: of:=VLOOKUP([.AS30]+[.AU27];[.$B$7:.$M$22];[.AS25]) -> X | AV30: of:=VLOOKUP([.AS30]+[.AV27];[.$B$7:.$M$22];[.AS25]) -> X | AW30: of:=VLOOKUP([.AS30]+[.AW27];[.$B$7:.$M$22];[.AS25]) -> X | AY30: 11 | AZ30: of:=HLOOKUP(MID([.AY27];1;1);[.$C$5:.$F$6];2;0)*MID([.AY30];1;1) + HLOOKUP(MID([.AY27];2;1);[.$C$5:.$F$6];2;0)*MID([.AY30];2;1) -> 12 | BA30: of:=VLOOKUP([.AZ30]+[.BA27];[.$B$7:.$M$22];[.AZ25]) -> X | BB30: of:=VLOOKUP([.AZ30]+[.BB27];[.$B$7:.$M$22];[.AZ25]) -> X | BC30: of:=VLOOKUP([.AZ30]+[.BC27];[.$B$7:.$M$22];[.AZ25]) -> X | BD30: of:=VLOOKUP([.AZ30]+[.BD27];[.$B$7:.$M$22];[.AZ25]) -> X | BF30: 11 | BG30: of:=HLOOKUP(MID([.BF27];1;1);[.$C$5:.$F$6];2;0)*MID([.BF30];1;1) + HLOOKUP(MID([.BF27];2;1);[.$C$5:.$F$6];2;0)*MID([.BF30];2;1) -> 12 | BH30: of:=VLOOKUP([.BG30]+[.BH27];[.$B$7:.$M$22];[.BG25]) -> X | BI30: of:=VLOOKUP([.BG30]+[.BI27];[.$B$7:.$M$22];[.BG25]) -> X | BJ30: of:=VLOOKUP([.BG30]+[.BJ27];[.$B$7:.$M$22];[.BG25]) -> X | BK30: of:=VLOOKUP([.BG30]+[.BK27];[.$B$7:.$M$22];[.BG25]) -> X
P31: 10 | Q31: of:=HLOOKUP(MID([.P27];1;1);[.$C$5:.$F$6];2;0)*MID([.P31];1;1) + HLOOKUP(MID([.P27];2;1);[.$C$5:.$F$6];2;0)*MID([.P31];2;1) -> 8 | R31: of:=VLOOKUP([.Q31]+[.R27];[.$B$7:.$M$22];[.Q25]) -> X | S31: of:=VLOOKUP([.Q31]+[.S27];[.$B$7:.$M$22];[.Q25]) -> X | T31: of:=VLOOKUP([.Q31]+[.T27];[.$B$7:.$M$22];[.Q25]) -> X | U31: of:=VLOOKUP([.Q31]+[.U27];[.$B$7:.$M$22];[.Q25]) -> X | W31: 10 | X31: of:=HLOOKUP(MID([.W27];1;1);[.$C$5:.$F$6];2;0)*MID([.W31];1;1) + HLOOKUP(MID([.W27];2;1);[.$C$5:.$F$6];2;0)*MID([.W31];2;1) -> 8 | Y31: of:=VLOOKUP([.X31]+[.Y27];[.$B$7:.$M$22];[.X25]) -> X | Z31: of:=VLOOKUP([.X31]+[.Z27];[.$B$7:.$M$22];[.X25]) -> X | AA31: of:=VLOOKUP([.X31]+[.AA27];[.$B$7:.$M$22];[.X25]) -> X | AB31: of:=VLOOKUP([.X31]+[.AB27];[.$B$7:.$M$22];[.X25]) -> X | AD31: 10 | AE31: of:=HLOOKUP(MID([.AD27];1;1);[.$C$5:.$F$6];2;0)*MID([.AD31];1;1) + HLOOKUP(MID([.AD27];2;1);[.$C$5:.$F$6];2;0)*MID([.AD31];2;1) -> 8 | AF31: of:=VLOOKUP([.AE31]+[.AF27];[.$B$7:.$M$22];[.AE25]) -> X | AG31: of:=VLOOKUP([.AE31]+[.AG27];[.$B$7:.$M$22];[.AE25]) -> X | AH31: of:=VLOOKUP([.AE31]+[.AH27];[.$B$7:.$M$22];[.AE25]) -> X | AI31: of:=VLOOKUP([.AE31]+[.AI27];[.$B$7:.$M$22];[.AE25]) -> X | AK31: 10 | AL31: of:=HLOOKUP(MID([.AK27];1;1);[.$C$5:.$F$6];2;0)*MID([.AK31];1;1) + HLOOKUP(MID([.AK27];2;1);[.$C$5:.$F$6];2;0)*MID([.AK31];2;1) -> 8 | AM31: of:=VLOOKUP([.AL31]+[.AM27];[.$B$7:.$M$22];[.AL25]) -> X | AN31: of:=VLOOKUP([.AL31]+[.AN27];[.$B$7:.$M$22];[.AL25]) -> X | AO31: of:=VLOOKUP([.AL31]+[.AO27];[.$B$7:.$M$22];[.AL25]) -> X | AP31: of:=VLOOKUP([.AL31]+[.AP27];[.$B$7:.$M$22];[.AL25]) -> X | AR31: 10 | AS31: of:=HLOOKUP(MID([.AR27];1;1);[.$C$5:.$F$6];2;0)*MID([.AR31];1;1) + HLOOKUP(MID([.AR27];2;1);[.$C$5:.$F$6];2;0)*MID([.AR31];2;1) -> 8 | AT31: of:=VLOOKUP([.AS31]+[.AT27];[.$B$7:.$M$22];[.AS25]) -> X | AU31: of:=VLOOKUP([.AS31]+[.AU27];[.$B$7:.$M$22];[.AS25]) -> X | AV31: of:=VLOOKUP([.AS31]+[.AV27];[.$B$7:.$M$22];[.AS25]) -> X | AW31: of:=VLOOKUP([.AS31]+[.AW27];[.$B$7:.$M$22];[.AS25]) -> X | AY31: 10 | AZ31: of:=HLOOKUP(MID([.AY27];1;1);[.$C$5:.$F$6];2;0)*MID([.AY31];1;1) + HLOOKUP(MID([.AY27];2;1);[.$C$5:.$F$6];2;0)*MID([.AY31];2;1) -> 8 | BA31: of:=VLOOKUP([.AZ31]+[.BA27];[.$B$7:.$M$22];[.AZ25]) -> X | BB31: of:=VLOOKUP([.AZ31]+[.BB27];[.$B$7:.$M$22];[.AZ25]) -> X | BC31: of:=VLOOKUP([.AZ31]+[.BC27];[.$B$7:.$M$22];[.AZ25]) -> X | BD31: of:=VLOOKUP([.AZ31]+[.BD27];[.$B$7:.$M$22];[.AZ25]) -> X | BF31: 10 | BG31: of:=HLOOKUP(MID([.BF27];1;1);[.$C$5:.$F$6];2;0)*MID([.BF31];1;1) + HLOOKUP(MID([.BF27];2;1);[.$C$5:.$F$6];2;0)*MID([.BF31];2;1) -> 8 | BH31: of:=VLOOKUP([.BG31]+[.BH27];[.$B$7:.$M$22];[.BG25]) -> X | BI31: of:=VLOOKUP([.BG31]+[.BI27];[.$B$7:.$M$22];[.BG25]) -> X | BJ31: of:=VLOOKUP([.BG31]+[.BJ27];[.$B$7:.$M$22];[.BG25]) -> X | BK31: of:=VLOOKUP([.BG31]+[.BK27];[.$B$7:.$M$22];[.BG25]) -> X
N32: 1 | O32: F
N33: 2 | O33: G | W33: H = µ B A
N34: 3 | O34: H
N35: 4 | O35: I
N36: 5 | O36: J
N37: 6 | O37: K
N38: 7 | O38: L
N39: 8 | O39: M
N40: 9 | O40: N
N41: 10 | O41: O
N42: 11 | O42: P
N43: 12 | O43: Q
N44: 13 | O44: R
N45: 14 | O45: S
N46: 15 | O46: T
I47: Inv. Inputs (none used) | P47: a = B | W47: b = -H | AD47: c = A | AK47: d = a = B | AR47: e = a = B | AY47: f = 0 | BF47: g = a = B | BL47: total
E48: transistors: | I48: 0 | P48: 0 | W48: 3 | AD48: 0 | AK48: 0 | AR48: 0 | AY48: 0 | BF48: 0 | BL48: of:=SUM([.I48:.BK48]) -> 3 | BN48: transistors
E49: gates: | I49: 0 | P49: 0 | W49: 2 | AD49: 0 | AK49: 0 | AR49: 0 | AY49: 0 | BF49: 0 | BL49: of:=SUM([.I49:.BK49]) -> 2 | BN49: gates

Sheet: tests
A1: skip? | B1: expression | G1: expected | H1: actual | I1: result
C2: arg0 | D2: arg1 | E2: arg2 | F2: # args
A4: 1 | B4: of:=MID(FORMULA([.H4]);2;LEN(FORMULA([.H4]))-1) -> TOSTRING(C4) | G4: ???????? | H4: of:=TOSTRING([.C4]) -> 0 | I4: of:=IF([.A4];-1;IF([.G4]<>[.H4];0;1)) -> -1
I5: of:=IF([.A5];-1;IF([.G5]<>[.H5];0;1)) -> 1
B6: of:=MID(FORMULA([.H6]);2;LEN(FORMULA([.H6]))-1) -> NOR(0) | C6: 0 | F6: of:=IF(ISBLANK([.C6]);0;IF(ISBLANK([.D6]);1;IF(ISBLANK([.E2]);2;3))) -> 1 | G6: 1 | H6: of:=NOR(0) -> 1 | I6: of:=IF([.A6];-1;IF([.G6]<>[.H6];0;1)) -> 1
B7: of:=MID(FORMULA([.H7]);2;LEN(FORMULA([.H7]))-1) -> NOR(1) | F7: of:=IF(ISBLANK([.C7]);0;IF(ISBLANK([.D7]);1;IF(ISBLANK([.E6]);2;3))) -> 0 | G7: 0 | H7: of:=NOR(1) -> 0 | I7: of:=IF([.A7];-1;IF([.G7]<>[.H7];0;1)) -> 1
F8: of:=IF(ISBLANK([.C8]);0;IF(ISBLANK([.D8]);1;IF(ISBLANK([.E7]);2;3))) -> 0 | I8: of:=IF([.A8];-1;IF([.G8]<>[.H8];0;1)) -> 1
B9: of:=MID(FORMULA([.H9]);2;LEN(FORMULA([.H9]))-1) -> NOR(0;0) | F9: of:=IF(ISBLANK([.C9]);0;IF(ISBLANK([.D9]);1;IF(ISBLANK([.E8]);2;3))) -> 0 | G9: 1 | H9: of:=NOR(0;0) -> 1 | I9: of:=IF([.A9];-1;IF([.G9]<>[.H9];0;1)) -> 1
B10: of:=MID(FORMULA([.H10]);2;LEN(FORMULA([.H10]))-1) -> NOR(0;1) | F10: of:=IF(ISBLANK([.C10]);0;IF(ISBLANK([.D10]);1;IF(ISBLANK([.E9]);2;3))) -> 0 | G10: 0 | H10: of:=NOR(0;1) -> 0 | I10: of:=IF([.A10];-1;IF([.G10]<>[.H10];0;1)) -> 1
B11: of:=MID(FORMULA([.H11]);2;LEN(FORMULA([.H11]))-1) -> NOR(1;0) | F11: of:=IF(ISBLANK([.C11]);0;IF(ISBLANK([.D11]);1;IF(ISBLANK([.E10]);2;3))) -> 0 | G11: 0 | H11: of:=NOR(1;0) -> 0 | I11: of:=IF([.A11];-1;IF([.G11]<>[.H11];0;1)) -> 1
B12: of:=MID(FORMULA([.H12]);2;LEN(FORMULA([.H12]))-1) -> NOR(1;1) | F12: of:=IF(ISBLANK([.C12]);0;IF(ISBLANK([.D12]);1;IF(ISBLANK([.E11]);2;3))) -> 0 | G12: 0 | H12: of:=NOR(1;1) -> 0 | I12: of:=IF([.A12];-1;IF([.G12]<>[.H12];0;1)) -> 1
F13: of:=IF(ISBLANK([.C13]);0;IF(ISBLANK([.D13]);1;IF(ISBLANK([.E12]);2;3))) -> 0 | I13: of:=IF([.A13];-1;IF([.G13]<>[.H13];0;1)) -> 1
B14: of:=MID(FORMULA([.H14]);2;LEN(FORMULA([.H14]))-1) -> NOR(0;0;0) | F14: of:=IF(ISBLANK([.C14]);0;IF(ISBLANK([.D14]);1;IF(ISBLANK([.E13]);2;3))) -> 0 | G14: 1 | H14: of:=NOR(0;0;0) -> 1 | I14: of:=IF([.A14];-1;IF([.G14]<>[.H14];0;1)) -> 1
B15: of:=MID(FORMULA([.H15]);2;LEN(FORMULA([.H15]))-1) -> NOR(0;0;1) | F15: of:=IF(ISBLANK([.C15]);0;IF(ISBLANK([.D15]);1;IF(ISBLANK([.E14]);2;3))) -> 0 | G15: 0 | H15: of:=NOR(0;0;1) -> 0 | I15: of:=IF([.A15];-1;IF([.G15]<>[.H15];0;1)) -> 1
B16: of:=MID(FORMULA([.H16]);2;LEN(FORMULA([.H16]))-1) -> NOR(0;1;0) | F16: of:=IF(ISBLANK([.C16]);0;IF(ISBLANK([.D16]);1;IF(ISBLANK([.E15]);2;3))) -> 0 | G16: 0 | H16: of:=NOR(0;1;0) -> 0 | I16: of:=IF([.A16];-1;IF([.G16]<>[.H16];0;1)) -> 1
B17: of:=MID(FORMULA([.H17]);2;LEN(FORMULA([.H17]))-1) -> NOR(0;1;1) | F17: of:=IF(ISBLANK([.C17]);0;IF(ISBLANK([.D17]);1;IF(ISBLANK([.E16]);2;3))) -> 0 | G17: 0 | H17: of:=NOR(0;1;1) -> 0 | I17: of:=IF([.A17];-1;IF([.G17]<>[.H17];0;1)) -> 1
B18: of:=MID(FORMULA([.H18]);2;LEN(FORMULA([.H18]))-1) -> NOR(1;0;0) | F18: of:=IF(ISBLANK([.C18]);0;IF(ISBLANK([.D18]);1;IF(ISBLANK([.E17]);2;3))) -> 0 | G18: 0 | H18: of:=NOR(1;0;0) -> 0 | I18: of:=IF([.A18];-1;IF([.G18]<>[.H18];0;1)) -> 1
B19: of:=MID(FORMULA([.H19]);2;LEN(FORMULA([.H19]))-1) -> NOR(1;0;1) | F19: of:=IF(ISBLANK([.C19]);0;IF(ISBLANK([.D19]);1;IF(ISBLANK([.E18]);2;3))) -> 0 | G19: 0 | H19: of:=NOR(1;0;1) -> 0 | I19: of:=IF([.A19];-1;IF([.G19]<>[.H19];0;1)) -> 1
B20: of:=MID(FORMULA([.H20]);2;LEN(FORMULA([.H20]))-1) -> NOR(1;1;0) | F20: of:=IF(ISBLANK([.C20]);0;IF(ISBLANK([.D20]);1;IF(ISBLANK([.E19]);2;3))) -> 0 | G20: 0 | H20: of:=NOR(1;1;0) -> 0 | I20: of:=IF([.A20];-1;IF([.G20]<>[.H20];0;1)) -> 1
B21: of:=MID(FORMULA([.H21]);2;LEN(FORMULA([.H21]))-1) -> NOR(1;1;1) | F21: of:=IF(ISBLANK([.C21]);0;IF(ISBLANK([.D21]);1;IF(ISBLANK([.E20]);2;3))) -> 0 | G21: 0 | H21: of:=NOR(1;1;1) -> 0 | I21: of:=IF([.A21];-1;IF([.G21]<>[.H21];0;1)) -> 1
F22: of:=IF(ISBLANK([.C22]);0;IF(ISBLANK([.D22]);1;IF(ISBLANK([.E21]);2;3))) -> 0 | I22: of:=IF([.A22];-1;IF([.G22]<>[.H22];0;1)) -> 1
B23: of:=MID(FORMULA([.H23]);2;LEN(FORMULA([.H23]))-1) -> GETDIM(C23:C23) | C23: a | D23: b | E23: c | F23: of:=IF(ISBLANK([.C23]);0;IF(ISBLANK([.D23]);1;IF(ISBLANK([.E23]);2;3))) -> 3 | G23: 2 | H23: of:=GETDIM([.C23:.C23]) -> 2 | I23: of:=IF([.A23];-1;IF([.G23]<>[.H23];0;1)) -> 1
B24: of:=MID(FORMULA([.H24]);2;LEN(FORMULA([.H24]))-1) -> GETDIM(C24:E24) | C24: a | D24: b | E24: c | F24: of:=IF(ISBLANK([.C24]);0;IF(ISBLANK([.D24]);1;IF(ISBLANK([.E23]);2;3))) -> 3 | G24: 2 | H24: of:=GETDIM([.C24:.E24]) -> 2 | I24: of:=IF([.A24];-1;IF([.G24]<>[.H24];0;1)) -> 1
B25: of:=MID(FORMULA([.H25]);2;LEN(FORMULA([.H25]))-1) -> GETDIM(C25:C26) | C25: a | D25: b | E25: c | F25: of:=IF(ISBLANK([.C25]);0;IF(ISBLANK([.D25]);1;IF(ISBLANK([.E24]);2;3))) -> 3 | G25: 2 | H25: of:=GETDIM([.C25:.C26]) -> 2 | I25: of:=IF([.A25];-1;IF([.G25]<>[.H25];0;1)) -> 1
B26: of:=MID(FORMULA([.H26]);2;LEN(FORMULA([.H26]))-1) -> GETDIM(C26:E27) | C26: a | D26: b | E26: c | F26: of:=IF(ISBLANK([.C26]);0;IF(ISBLANK([.D26]);1;IF(ISBLANK([.E25]);2;3))) -> 3 | G26: 2 | H26: of:=GETDIM([.C26:.E27]) -> 2 | I26: of:=IF([.A26];-1;IF([.G26]<>[.H26];0;1)) -> 1
C27: a | D27: b | E27: c
F28: of:=IF(ISBLANK([.C28]);0;IF(ISBLANK([.D28]);1;IF(ISBLANK(e#ref!);2;3))) -> Err:508
A46: >>>> | B46: of:=TEST_PARSER("primitives") -> test_Parser(primitives): 1,5 2412 | C46: of:=TESTSTAT("name"; [.B46]) -> test_Parser(primitives): | D46: of:=TESTSTAT("time"; [.B46]) -> 1.5 | E46: of:=TESTSTAT("count"; [.B46]) -> 2412 | F46: of:=[.E46]/[.D46] -> 1608
B47: of:=TEST_PARSER("multiplicity") -> test_Parser(multiplicity): 1,6 1546 | C47: of:=TESTSTAT("name"; [.B47]) -> test_Parser(multiplicity): | D47: of:=TESTSTAT("time"; [.B47]) -> 1.6 | E47: of:=TESTSTAT("count"; [.B47]) -> 1546 | F47: of:=[.E47]/[.D47] -> 966.25
B48: of:=TEST_PARSER("basic") -> test_Parser(basic): 6,2 9107 | C48: of:=TESTSTAT("name"; [.B48]) -> test_Parser(basic): | D48: of:=TESTSTAT("time"; [.B48]) -> 6.2 | E48: of:=TESTSTAT("count"; [.B48]) -> 9107 | F48: of:=[.E48]/[.D48] -> 1468.87096774194
B49: of:=TEST_PARSER("special") -> test_Parser(special): 0,8 479 | C49: of:=TESTSTAT("name"; [.B49]) -> test_Parser(special): | D49: of:=TESTSTAT("time"; [.B49]) -> 0.8 | E49: of:=TESTSTAT("count"; [.B49]) -> 479 | F49: of:=[.E49]/[.D49] -> 598.75
B50: of:=TEST_PARSER("numbers") -> test_Parser(numbers): 2,9 3046 | C50: of:=TESTSTAT("name"; [.B50]) -> test_Parser(numbers): | D50: of:=TESTSTAT("time"; [.B50]) -> 2.9 | E50: of:=TESTSTAT("count"; [.B50]) -> 3046 | F50: of:=[.E50]/[.D50] -> 1050.34482758621
B51: of:=TEST_PARSER("types") -> test_Parser(types): 5,9 11149 | C51: of:=TESTSTAT("name"; [.B51]) -> test_Parser(types): | D51: of:=TESTSTAT("time"; [.B51]) -> 5.9 | E51: of:=TESTSTAT("count"; [.B51]) -> 11149 | F51: of:=[.E51]/[.D51] -> 1889.66101694915
D52: of:=SUM([.D46:.D51]) -> 18.9 | E52: of:=SUM([.E46:.E51]) -> 27739 | F52: of:=[.E52]/[.D52] -> 1467.67195767196
B54: of:=TEST_PARSER("all") -> test_Parser(all): 17,2 27734 | C54: of:=TESTSTAT("name"; [.B54]) -> test_Parser(all): | D54: of:=TESTSTAT("time"; [.B54]) -> 17.2 | E54: of:=TESTSTAT("count"; [.B54]) -> 27734 | F54: of:=[.E54]/[.D54] -> 1612.44186046512
A58: asdf | B58: of:=TEST_PRSLOGIC_TOSTRING([.A58]) -> ─op2:'*'
    ├─op1:'!'
    │    └─C:False
    └─op2:'+'
         ├─op2:'*'
         │    ├─I:'B'
         │    └─I:'C'
         └─I:'A'
A59: S ::= W* T W* ("+" S)? T ::= W* F W* ("*" T)? F ::= C | I | N | "(" S ")" C ::= [01] I ::= [A-Za-z]+ N ::= "!" W* F W ::= [ \t] | B59: of:=TEST_AST_MKASN([.A59]) -> ─S
 ├─T
 │ └─F
 │   └─I
 │     └─'A'
 ├─'+'
 └─S
   └─T
     ├─F
     │ └─I
     │   └─'B'
     ├─'*'
     └─T
       └─F
         └─I
           └─'C'
A60: ─Grammar └─Rule ├□(*):ws │ └─ws │ └─' ' ├■RuleName │ └─'Foo_7' ├○(*):ws │ └─ws │ └─' ' ├/'::=' └─Alt ├●(*):ws │ └─ws │ └─' ' ├─Con │ └─(+):(. . .) │ ├─(...) │ │ ├─Nonterminal │ │ │ └─'AB' │ │ └─(*):ws │ │ └─ws │ │ └─' ' │ └─(...) │ ├─Nonterminal │ │ └─'C' │ └─(*):ws │ └─ws │ └─' ' └─(*):(. . .) ├─(...) │ ├─'|' │ ├─(*):ws │ └─Con │ └─(+):(. . .) │ ├─(...) │ │ ├─Nonterminal │ │ │ └─'D' │ │ └─(*):ws │ │ └─ws │ │ └─' ' │ └─(...) │ ├─Nonterminal │ │ └─'E' │ └─(*):ws │ └─ws │ └─' ' └─(...) ├─'|' ├─(*):ws │ └─ws │ └─' ' └─Con └─(+):(. . .) └─(...) ├─Nonterminal │ └─'F' └─(*):ws ├─ws │ └─' ' └─ws └─' ' | B60: ○○ ─○+ ─□+ ─■+ ─●+ ─┐+
A61: pLogic_dt | B61: of:=TPARSER_TOSTRING([.A61]) -> S where
S ::= ((do a0 <- (W* >>= return ° (mkDtMult '■(*)W'))
          a1 <- T
          a2 <- (W* >>= return ° (mkDtMult '■(*)W'))
          a3 <- ((((do a4 <- ((str '+') >>= return ° mkDtTerminal)
                     a5 <- (W* >>= return ° (mkDtMult '■(*)W'))
                     a6 <- S
                  return [a4, a5, a6]
                 ) >>= return ° \a0.[a0] ° (mkASN '(. . .)' Empty)))? >>= return ° (mkDtMult '■(?)(. . .)'))
       return [a0, a1, a2, a3]
      ) >>= return ° (mkDtNonterminal 'S'))
T ::= ((do a0 <- (W* >>= return ° (mkDtMult '■(*)W'))
          a1 <- F
          a2 <- (W* >>= return ° (mkDtMult '■(*)W'))
          a3 <- ((((do a4 <- ((str '*') >>= return ° mkDtTerminal)
                     a5 <- (W* >>= return ° (mkDtMult '■(*)W'))
                     a6 <- T
                  return [a4, a5, a6]
                 ) >>= return ° \a0.[a0] ° (mkASN '(. . .)' Empty)))? >>= return ° (mkDtMult '■(?)(. . .)'))
       return [a0, a1, a2, a3]
      ) >>= return ° (mkDtNonterminal 'T'))
F ::= (((C >>= return ° \a0.[a0])) | ((I >>= return ° \a0.[a0])) | ((N >>= return ° \a0.[a0])) | (do a0 <- ((str '(') >>= return ° mkDtTerminal)
          a1 <- S
          a2 <- ((str ')') >>= return ° mkDtTerminal)
       return [a0, a1, a2]
      ) >>= return ° (mkDtNonterminal 'F'))
N ::= ((do a0 <- ((str '!') >>= return ° mkDtTerminal)
          a1 <- (W* >>= return ° (mkDtMult '■(*)W'))
          a2 <- F
       return [a0, a1, a2]
      ) >>= return ° (mkDtNonterminal 'N'))
I ::= (((([A-Z] >>= return ° (mkDtCClass '([A-Z])'))) | (([a-z] >>= return ° (mkDtCClass '([a-z])'))))+ >>= return ° (mkDtNonterminal 'I') ° \a0.[a0] ° (mkDtMult '■(+)(..|..)'))
C ::= ((((str '0') >>= return ° mkDtTerminal)) | (((str '1') >>= return ° mkDtTerminal)) >>= return ° (mkDtNonterminal 'C') ° \a0.[a0])
W ::= ((((str ' ') >>= return ° mkDtTerminal)) | (((str '\t') >>= return ° mkDtTerminal)) >>= return ° (mkDtNonterminal 'W') ° \a0.[a0])
A62: pDecDigit | B62: of:=TPARSER_TOSTRING([.A62]) -> DecDigit where
DecDigit ::= BinDigit
           | (str '2') >>= \_.return 2
           | (str '3') >>= \_.return 3
           | (str '4') >>= \_.return 4
           | (str '5') >>= \_.return 5
           | (str '6') >>= \_.return 6
           | (str '7') >>= \_.return 7
           | (str '8') >>= \_.return 8
           | (str '9') >>= \_.return 9
BinDigit ::= (do a0 <- [0-1]
              return ((add -48) ° asc a0)
             )
A63: pHexLit | B63: of:=TPARSER_TOSTRING([.A63]) -> HexLit where
HexLit ::= (do  _ <- (str '0x')
               a0 <- HexNum
            return a0
           )
HexNum ::= (do a0 <- HexDigit+
            return ((foldl1 add ° (mul 16)) a0)
           )
HexDigit ::= (item >>= (ite (inRange 48 57) pReturn ° (add -48) (ite (inRange 65 70) pReturn ° (add -55) (ite (inRange 97 102) pReturn ° (add -87) (fstArg fail)))) ° asc)
A64: pTypeExpr | B64: of:=TPARSER_TOSTRING([.A64]) -> TypeExpr where
TypeExpr ::= (do  _ <- ws*
                 a0 <- NonArrow
                  _ <- ws*
                 a1 <- ((str '->') >>= \_.TypeExpr)?
              return (maybeMakeArrowType a0 a1)
             )
NonArrow ::= BaseType
           | TypeVar
           | ListType
           | ParensTyEx
           | (do a0 <- (do a1 <- [A-Z]
                           a2 <- [a-z]+
                        return ((foldl concat) a1 a2)
                       )
                 a3 <- (ws+ >>= \_.NonArrow)*
              return (mkTypeCtor a0 a3)
             )
ParensTyEx ::= (do  _ <- (str '(')
                   a0 <- TyUnitSuffix
                       | TySingleSuffix
                       | TyTupleSuffix
                return a0
               )
TyTupleSuffix ::= (do a0 <- TypeExpr
                      a1 <- (do  _ <- (str ',')
                                a2 <- TypeExpr
                             return a2
                            )+
                       _ <- (str ')')
                   return (mkTupleType a0 a1)
                  )
TySingleSuffix ::= (do a0 <- TypeExpr
                        _ <- (str ')')
                    return a0
                   )
TyUnitSuffix ::= (str ')') >>= \_.return '(Unit [])'
ListType ::= (do  _ <- (str '[')
                 a0 <- (do a1 <- TypeExpr
                           a2 <- (return [])
                        return (cons a1 a2)
                       )
                  _ <- (str ']')
              return ((mkTypeCtor 'List') a0)
             )
TypeVar ::= ([a-z] >>= return ° mkTypeVar)
BaseType ::= (str 'Any')
           | (str 'Bool')
           | (str 'Char')
           | (str 'Str')
           | (str 'Int')
           | (str 'Long')
ws ::= [ \t]

Sheet: PrsGrammar
B2: S ::= Grammar ws ::= [ \t] lb ::= "\r" "\n"? | "\n" "\r"? Ident ::= [_A-Za-z][\-0-9_A-Za-z]* escQ ::= "\\" [rnt\\"] escC ::= "\\" [rnt\[\-\]\\"] multOp ::= [?+*] Grammar ::= ws* Rule ws* (lb+ ws* Rule)* Rule ::= ws* RuleName ws* "::=" Alt RuleName ::= Ident Alt ::= Con (lb? ws* "|" Con)* Con ::= (ws* Factor ws*)+ Factor ::= Atom multOp? Atom ::= "(" Alt ")" | Nonterminal | Terminal | CClass Nonterminal ::= Ident Terminal ::= ["] (escQ | [-"\r\n\t\\])+ ["] CClass ::= "." | ("[" (NCList | PCList) "]") NCList ::= "-" PCList PCList ::= (CCItem ("-" CCItem)?)+ CCItem ::= escC | [-\r\n\t\[\-\]\\] ASN lbl () [ASN () val []] -> ASN lbl v [] ASN "Alt" () [x] -> x ASN "Con" () [x] -> x ASN "Atom" () [x] -> x | C2: of:=DERIVATIONTREE_PRSGRAMMAR([.B28]; SUM([.D2:.D27])) -> ─Grammar
 ├─Rule
 │ ├─RuleName
 │ │ └─Ident
 │ │   └─'_S'
 │ └─Alt
 │   └─Con
 │     └─Atom
 │       └─Nonterminal
 │         └─Ident
 │           └─'_Grammar'
 ├─Rule
 │ ├─RuleName
 │ │ └─Ident
 │ │   └─'_ws'
 │ └─Alt
 │   └─Con
 │     └─Atom
 │       └─CClass
 │         └─PCList
 │           ├─CCItem
 │           │ └─([-\r\n\t\[\-\]\\]):' '
 │           └─CCItem
 │             └─escC
 │               └─(◄─):'\t'
 ├─Rule
 │ ├─RuleName
 │ │ └─Ident
 │ │   └─'_lb'
 │ └─Alt
 │   ├─Con
 │   │ └─Atom
 │   │   └─Terminal
 │   │     └─'\r\n'
 │   ├─Con
 │   │ └─Atom
 │   │   └─Terminal
 │   │     └─'\r'
 │   ├─Con
 │   │ └─Atom
 │   │   └─Terminal
 │   │     └─'\n\r'
 │   └─Con
 │     └─Atom
 │       └─Terminal
 │         └─'\n'
 ├─Rule
 │ ├─RuleName
 │ │ └─Ident
 │ │   └─'_multOp'
 │ └─Alt
 │   └─Con
 │     └─Atom
 │       └─CClass
 │         └─PCList
 │           ├─CCItem
 │           │ └─([-\r\n\t\[\-\]\\]):'?'
 │           ├─CCItem
 │           │ └─([-\r\n\t\[\-\]\\]):'+'
 │           └─CCItem
 │             └─([-\r\n\t\[\-\]\\]):'*'
 ├─Rule
 │ ├─RuleName
 │ │ └─Ident
 │ │   └─'_Ident'
 │ └─Alt
 │   └─Con
 │     ├─Atom
 │     │ └─CClass
 │     │   └─PCList
 │     │     ├─CCItem
 │     │     │ └─([-\r\n\t\[\-\]\\]):'_'
 │     │     ├─CCRange
 │     │     │ ├─CCItem
 │     │     │ │ └─([-\r\n\t\[\-\]\\]):'A'
 │     │     │ └─CCItem
 │     │     │   └─([-\r\n\t\[\-\]\\]):'Z'
 │     │     └─CCRange
 │     │       ├─CCItem
 │     │       │ └─([-\r\n\t\[\-\]\\]):'a'
 │     │       └─CCItem
 │     │         └─([-\r\n\t\[\-\]\\]):'z'
 │     └─Atom
 │       └─CClass
 │         └─PCList
 │           ├─CCItem
 │           │ └─escC
 │           │   └─([\\"\[\-\]]):'-'
 │           ├─CCRange
 │           │ ├─CCItem
 │           │ │ └─([-\r\n\t\[\-\]\\]):'0'
 │           │ └─CCItem
 │           │   └─([-\r\n\t\[\-\]\\]):'9'
 │           ├─CCItem
 │           │ └─([-\r\n\t\[\-\]\\]):'_'
 │           ├─CCRange
 │           │ ├─CCItem
 │           │ │ └─([-\r\n\t\[\-\]\\]):'A'
 │           │ └─CCItem
 │           │   └─([-\r\n\t\[\-\]\\]):'Z'
 │           └─CCRange
 │             ├─CCItem
 │             │ └─([-\r\n\t\[\-\]\\]):'a'
 │             └─CCItem
 │               └─([-\r\n\t\[\-\]\\]):'z'
 ├─Rule
 │ ├─RuleName
 │ │ └─Ident
 │ │   └─'_escQ'
 │ └─Alt
 │   └─Con
 │     ├─Atom
 │     │ └─Terminal
 │     │   └─'\\'
 │     └─Atom
 │       └─CClass
 │         └─PCList
 │           ├─CCItem
 │           │ └─([-\r\n\t\[\-\]\\]):'r'
 │           ├─CCItem
 │           │ └─([-\r\n\t\[\-\]\\]):'n'
 │           ├─CCItem
 │           │ └─([-\r\n\t\[\-\]\\]):'t'
 │           ├─CCItem
 │           │ └─escC
 │           │   └─([\\"\[\-\]]):'\\'
 │           └─CCItem
 │             └─([-\r\n\t\[\-\]\\]):'\"'
 ├─Rule
 │ ├─RuleName
 │ │ └─Ident
 │ │   └─'_escC'
 │ └─Alt
 │   └─Con
 │     ├─Atom
 │     │ └─Terminal
 │     │   └─'\\'
 │     └─Atom
 │       └─CClass
 │         └─PCList
 │           ├─CCItem
 │           │ └─([-\r\n\t\[\-\]\\]):'r'
 │           ├─CCItem
 │           │ └─([-\r\n\t\[\-\]\\]):'n'
 │           ├─CCItem
 │           │ └─([-\r\n\t\[\-\]\\]):'t'
 │           ├─CCItem
 │           │ └─escC
 │           │   └─([\\"\[\-\]]):'['
 │           ├─CCItem
 │           │ └─escC
 │           │   └─([\\"\[\-\]]):'-'
 │           ├─CCItem
 │           │ └─escC
 │           │   └─([\\"\[\-\]]):']'
 │           └─CCItem
 │             └─escC
 │               └─([\\"\[\-\]]):'\\'
 ├─Rule
 │ ├─RuleName
 │ │ └─Ident
 │ │   └─'_Grammar'
 │ └─Alt
 │   └─Con
 │     ├─Atom
 │     │ └─Nonterminal
 │     │   └─Ident
 │     │     └─'_Rule'
 │     └─Atom
 │       └─Alt
 │         └─Con
 │           ├─Atom
 │           │ └─Nonterminal
 │           │   └─Ident
 │           │     └─'_lb'
 │           └─Atom
 │             └─Nonterminal
 │               └─Ident
 │                 └─'_Rule'
 ├─Rule
 │ ├─RuleName
 │ │ └─Ident
 │ │   └─'_Rule'
 │ └─Alt
 │   └─Con
 │     ├─Atom
 │     │ └─Nonterminal
 │     │   └─Ident
 │     │     └─'_RuleName'
 │     ├─Atom
 │     │ └─Terminal
 │     │   └─'::='
 │     └─Atom
 │       └─Nonterminal
 │         └─Ident
 │           └─'_Alt'
 ├─Rule
 │ ├─RuleName
 │ │ └─Ident
 │ │   └─'_Con'
 │ └─Alt
 │   └─Con
 │     └─Atom
 │       └─Alt
 │         └─Con
 │           ├─Atom
 │           │ └─Nonterminal
 │           │   └─Ident
 │           │     └─'_ws'
 │           ├─Atom
 │           │ └─Nonterminal
 │           │   └─Ident
 │           │     └─'_Atom'
 │           └─Atom
 │             └─Nonterminal
 │               └─Ident
 │                 └─'_ws'
 ├─Rule
 │ ├─RuleName
 │ │ └─Ident
 │ │   └─'_Atom'
 │ └─Alt
 │   ├─Con
 │   │ ├─Atom
 │   │ │ └─Terminal
 │   │ │   └─'('
 │   │ ├─Atom
 │   │ │ └─Nonterminal
 │   │ │   └─Ident
 │   │ │     └─'_Alt'
 │   │ └─Atom
 │   │   └─Terminal
 │   │     └─')'
 │   ├─Con
 │   │ └─Atom
 │   │   └─Nonterminal
 │   │     └─Ident
 │   │       └─'_Nonterminal'
 │   ├─Con
 │   │ └─Atom
 │   │   └─Nonterminal
 │   │     └─Ident
 │   │       └─'_Terminal'
 │   └─Con
 │     └─Atom
 │       └─Nonterminal
 │         └─Ident
 │           └─'_CClass'
 ├─Rule
 │ ├─RuleName
 │ │ └─Ident
 │ │   └─'_Nonterminal'
 │ └─Alt
 │   └─Con
 │     └─Atom
 │       └─Nonterminal
 │         └─Ident
 │           └─'_Ident'
 ├─Rule
 │ ├─RuleName
 │ │ └─Ident
 │ │   └─'_Terminal'
 │ └─Alt
 │   └─Con
 │     ├─Atom
 │     │ └─Terminal
 │     │   └─'\"'
 │     ├─Atom
 │     │ └─Alt
 │     │   └─Con
 │     │     └─Atom
 │     │       └─Nonterminal
 │     │         └─Ident
 │     │           └─'escQ'
 │     └─Atom
 │       └─Terminal
 │         └─'\"'
 ├─Rule
 │ ├─RuleName
 │ │ └─Ident
 │ │   └─'_CClass'
 │ └─Alt
 │   ├─Con
 │   │ └─Atom
 │   │   └─Terminal
 │   │     └─'.'
 │   └─Con
 │     └─Atom
 │       └─Alt
 │         └─Con
 │           ├─Atom
 │           │ └─Terminal
 │           │   └─'['
 │           ├─Atom
 │           │ └─Alt
 │           │   ├─Con
 │           │   │ └─Atom
 │           │   │   └─Nonterminal
 │           │   │     └─Ident
 │           │   │       └─'_NCList'
 │           │   └─Con
 │           │     └─Atom
 │           │       └─Nonterminal
 │           │         └─Ident
 │           │           └─'_PCList'
 │           └─Atom
 │             └─Terminal
 │               └─']'
 ├─Rule
 │ ├─RuleName
 │ │ └─Ident
 │ │   └─'_NCList'
 │ └─Alt
 │   └─Con
 │     ├─Atom
 │     │ └─Terminal
 │     │   └─'-'
 │     └─Atom
 │       └─Nonterminal
 │         └─Ident
 │           └─'PCList'
 ├─Rule
 │ ├─RuleName
 │ │ └─Ident
 │ │   └─'_PCList'
 │ └─Alt
 │   └─Con
 │     └─Atom
 │       └─Alt
 │         ├─Con
 │         │ └─Atom
 │         │   └─Nonterminal
 │         │     └─Ident
 │         │       └─'_CCRange'
 │         └─Con
 │           └─Atom
 │             └─Nonterminal
 │               └─Ident
 │                 └─'_CCItem'
 ├─Rule
 │ ├─RuleName
 │ │ └─Ident
 │ │   └─'_CCItem'
 │ └─Alt
 │   ├─Con
 │   │ └─Atom
 │   │   └─Nonterminal
 │   │     └─Ident
 │   │       └─'escC'
 │   └─Con
 │     └─Atom
 │       └─CClass
 │         └─NCList
 │           └─PCList
 │             ├─CCItem
 │             │ └─escC
 │             │   └─(◄─):'\r'
 │             ├─CCItem
 │             │ └─escC
 │             │   └─(◄─):'\n'
 │             ├─CCItem
 │             │ └─escC
 │             │   └─(◄─):'\t'
 │             ├─CCItem
 │             │ └─escC
 │             │   └─([\\"\[\-\]]):'['
 │             ├─CCItem
 │             │ └─escC
 │             │   └─([\\"\[\-\]]):'-'
 │             ├─CCItem
 │             │ └─escC
 │             │   └─([\\"\[\-\]]):']'
 │             └─CCItem
 │               └─escC
 │                 └─([\\"\[\-\]]):'\\'
 └─Rule
   ├─RuleName
   │ └─Ident
   │   └─'_CCRange'
   └─Alt
     └─Con
       ├─Atom
       │ └─Nonterminal
       │   └─Ident
       │     └─'_CCItem'
       ├─Atom
       │ └─Terminal
       │   └─'-'
       └─Atom
         └─Nonterminal
           └─Ident
             └─'_CCItem' | D2: of:=[.E2]*[.F2] -> 1 | E2: 1 | F2: of:=DTOPT_HIDESKIPPED() -> 1
D3: of:=[.E3]*[.F3] -> 2 | E3: 1 | F3: of:=DTOPT_DOFOLDLCONCAT() -> 2
D4: of:=[.E4]*[.F4] -> 4 | E4: 1 | F4: of:=DTOPT_IMPLICITMULT() -> 4
D5: of:=[.E5]*[.F5] -> 0 | E5: 0 | F5: of:=DTOPT_PROMOTESINGLETERMINAL() -> 8
D6: of:=[.E6]*[.F6] -> 0 | E6: 0 | F6: of:=16 -> 16
B28: _S ::= _Grammar _ws ::= [ \t] _lb ::= "\r\n" | "\r" | "\n\r" | "\n" _multOp ::= [?+*] _Ident ::= [_A-Za-z][\-0-9_A-Za-z] _escQ ::= "\\" [rnt\\"] _escC ::= "\\" [rnt\[\-\]\\] _Grammar ::= _Rule (_lb _Rule) _Rule ::= _RuleName "::=" _Alt _Con ::= (_ws _Atom _ws) _Atom ::= "(" _Alt ")" | _Nonterminal | _Terminal | _CClass _Nonterminal ::= _Ident _Terminal ::= "\"" (escQ ) "\"" _CClass ::= "." | ("[" (_NCList | _PCList) "]") _NCList ::= "-" PCList _PCList ::= (_CCRange | _CCItem) _CCItem ::= escC | [-\r\n\t\[\-\]\\] _CCRange ::= _CCItem "-" _CCItem

Sheet: PrsPattern
B2: S ::= Cases ws ::= [ \t] lb ::= "\r" "\n"? | "\n" "\r"? natLiteral ::= [0-9]+ loIdent ::= [a-z][\-0-9_A-Za-z]* upIdent ::= [A-Z][\-0-9_A-Za-z]* escC ::= "\\" [rnt\[\-\]\\"] Cases ::= Case ws* (lb+ Case)* Case ::= Pattern ws* "::=" Expr Pattern ::= ws* (Any | Var | Const | Data) Any ::= "_" Var ::= loIdent Const ::= CEmpty | CBool | CStr | CFloat | CInt CEmpty ::= "()" CBool ::= "True" | "False" CStr ::= ["] (escQ | [-"\r\n\t\\])+ ["] CFloat ::= CInt "." natLiteral CInt ::= ("-" ws*)? natLiteral Data ::= PatList | PatASN PatASN ::= "ASN" Pattern Pattern PatList PatList ::= Any | Var | ListLiteral | ListCons ListLiteral ::= ListNil | ListOther ListNil ::= "[]" | "Nil" ListCons ::= "(" Pattern ":" PatList ")" | "Cons" Pattern PatList ListOther ::= "[" Pattern (ws* "," Pattern)* "]" ASN lbl () [ASN () val []] -> ASN lbl v [] ASN "Alt" () [x] -> x ASN "Con" () [x] -> x ASN "Atom" () [x] -> x | C2: of:=DERIVATIONTREE_PRSGRAMMAR([.B28]; SUM([.D2:.D27])) -> ─Grammar
 ├─Rule
 │ ├─RuleName
 │ │ └─Ident
 │ │   └─'_S'
 │ └─Alt
 │   └─Con
 │     └─Atom
 │       └─Nonterminal
 │         └─Ident
 │           └─'_Grammar'
 ├─Rule
 │ ├─RuleName
 │ │ └─Ident
 │ │   └─'_ws'
 │ └─Alt
 │   └─Con
 │     └─Atom
 │       └─CClass
 │         └─PCList
 │           ├─CCItem
 │           │ └─([-\r\n\t\[\-\]\\]):' '
 │           └─CCItem
 │             └─escC
 │               └─(◄─):'\t'
 ├─Rule
 │ ├─RuleName
 │ │ └─Ident
 │ │   └─'_lb'
 │ └─Alt
 │   ├─Con
 │   │ └─Atom
 │   │   └─Terminal
 │   │     └─'\r\n'
 │   ├─Con
 │   │ └─Atom
 │   │   └─Terminal
 │   │     └─'\r'
 │   ├─Con
 │   │ └─Atom
 │   │   └─Terminal
 │   │     └─'\n\r'
 │   └─Con
 │     └─Atom
 │       └─Terminal
 │         └─'\n'
 ├─Rule
 │ ├─RuleName
 │ │ └─Ident
 │ │   └─'_multOp'
 │ └─Alt
 │   └─Con
 │     └─Atom
 │       └─CClass
 │         └─PCList
 │           ├─CCItem
 │           │ └─([-\r\n\t\[\-\]\\]):'?'
 │           ├─CCItem
 │           │ └─([-\r\n\t\[\-\]\\]):'+'
 │           └─CCItem
 │             └─([-\r\n\t\[\-\]\\]):'*'
 ├─Rule
 │ ├─RuleName
 │ │ └─Ident
 │ │   └─'_Ident'
 │ └─Alt
 │   └─Con
 │     ├─Atom
 │     │ └─CClass
 │     │   └─PCList
 │     │     ├─CCItem
 │     │     │ └─([-\r\n\t\[\-\]\\]):'_'
 │     │     ├─CCRange
 │     │     │ ├─CCItem
 │     │     │ │ └─([-\r\n\t\[\-\]\\]):'A'
 │     │     │ └─CCItem
 │     │     │   └─([-\r\n\t\[\-\]\\]):'Z'
 │     │     └─CCRange
 │     │       ├─CCItem
 │     │       │ └─([-\r\n\t\[\-\]\\]):'a'
 │     │       └─CCItem
 │     │         └─([-\r\n\t\[\-\]\\]):'z'
 │     └─Atom
 │       └─CClass
 │         └─PCList
 │           ├─CCItem
 │           │ └─escC
 │           │   └─([\\"\[\-\]]):'-'
 │           ├─CCRange
 │           │ ├─CCItem
 │           │ │ └─([-\r\n\t\[\-\]\\]):'0'
 │           │ └─CCItem
 │           │   └─([-\r\n\t\[\-\]\\]):'9'
 │           ├─CCItem
 │           │ └─([-\r\n\t\[\-\]\\]):'_'
 │           ├─CCRange
 │           │ ├─CCItem
 │           │ │ └─([-\r\n\t\[\-\]\\]):'A'
 │           │ └─CCItem
 │           │   └─([-\r\n\t\[\-\]\\]):'Z'
 │           └─CCRange
 │             ├─CCItem
 │             │ └─([-\r\n\t\[\-\]\\]):'a'
 │             └─CCItem
 │               └─([-\r\n\t\[\-\]\\]):'z'
 ├─Rule
 │ ├─RuleName
 │ │ └─Ident
 │ │   └─'_escQ'
 │ └─Alt
 │   └─Con
 │     ├─Atom
 │     │ └─Terminal
 │     │   └─'\\'
 │     └─Atom
 │       └─CClass
 │         └─PCList
 │           ├─CCItem
 │           │ └─([-\r\n\t\[\-\]\\]):'r'
 │           ├─CCItem
 │           │ └─([-\r\n\t\[\-\]\\]):'n'
 │           ├─CCItem
 │           │ └─([-\r\n\t\[\-\]\\]):'t'
 │           ├─CCItem
 │           │ └─escC
 │           │   └─([\\"\[\-\]]):'\\'
 │           └─CCItem
 │             └─([-\r\n\t\[\-\]\\]):'\"'
 ├─Rule
 │ ├─RuleName
 │ │ └─Ident
 │ │   └─'_escC'
 │ └─Alt
 │   └─Con
 │     ├─Atom
 │     │ └─Terminal
 │     │   └─'\\'
 │     └─Atom
 │       └─CClass
 │         └─PCList
 │           ├─CCItem
 │           │ └─([-\r\n\t\[\-\]\\]):'r'
 │           ├─CCItem
 │           │ └─([-\r\n\t\[\-\]\\]):'n'
 │           ├─CCItem
 │           │ └─([-\r\n\t\[\-\]\\]):'t'
 │           ├─CCItem
 │           │ └─escC
 │           │   └─([\\"\[\-\]]):'['
 │           ├─CCItem
 │           │ └─escC
 │           │   └─([\\"\[\-\]]):'-'
 │           ├─CCItem
 │           │ └─escC
 │           │   └─([\\"\[\-\]]):']'
 │           └─CCItem
 │             └─escC
 │               └─([\\"\[\-\]]):'\\'
 ├─Rule
 │ ├─RuleName
 │ │ └─Ident
 │ │   └─'_Grammar'
 │ └─Alt
 │   └─Con
 │     ├─Atom
 │     │ └─Nonterminal
 │     │   └─Ident
 │     │     └─'_Rule'
 │     └─Atom
 │       └─Alt
 │         └─Con
 │           ├─Atom
 │           │ └─Nonterminal
 │           │   └─Ident
 │           │     └─'_lb'
 │           └─Atom
 │             └─Nonterminal
 │               └─Ident
 │                 └─'_Rule'
 ├─Rule
 │ ├─RuleName
 │ │ └─Ident
 │ │   └─'_Rule'
 │ └─Alt
 │   └─Con
 │     ├─Atom
 │     │ └─Nonterminal
 │     │   └─Ident
 │     │     └─'_RuleName'
 │     ├─Atom
 │     │ └─Terminal
 │     │   └─'::='
 │     └─Atom
 │       └─Nonterminal
 │         └─Ident
 │           └─'_Alt'
 ├─Rule
 │ ├─RuleName
 │ │ └─Ident
 │ │   └─'_Con'
 │ └─Alt
 │   └─Con
 │     └─Atom
 │       └─Alt
 │         └─Con
 │           ├─Atom
 │           │ └─Nonterminal
 │           │   └─Ident
 │           │     └─'_ws'
 │           ├─Atom
 │           │ └─Nonterminal
 │           │   └─Ident
 │           │     └─'_Atom'
 │           └─Atom
 │             └─Nonterminal
 │               └─Ident
 │                 └─'_ws'
 ├─Rule
 │ ├─RuleName
 │ │ └─Ident
 │ │   └─'_Atom'
 │ └─Alt
 │   ├─Con
 │   │ ├─Atom
 │   │ │ └─Terminal
 │   │ │   └─'('
 │   │ ├─Atom
 │   │ │ └─Nonterminal
 │   │ │   └─Ident
 │   │ │     └─'_Alt'
 │   │ └─Atom
 │   │   └─Terminal
 │   │     └─')'
 │   ├─Con
 │   │ └─Atom
 │   │   └─Nonterminal
 │   │     └─Ident
 │   │       └─'_Nonterminal'
 │   ├─Con
 │   │ └─Atom
 │   │   └─Nonterminal
 │   │     └─Ident
 │   │       └─'_Terminal'
 │   └─Con
 │     └─Atom
 │       └─Nonterminal
 │         └─Ident
 │           └─'_CClass'
 ├─Rule
 │ ├─RuleName
 │ │ └─Ident
 │ │   └─'_Nonterminal'
 │ └─Alt
 │   └─Con
 │     └─Atom
 │       └─Nonterminal
 │         └─Ident
 │           └─'_Ident'
 ├─Rule
 │ ├─RuleName
 │ │ └─Ident
 │ │   └─'_Terminal'
 │ └─Alt
 │   └─Con
 │     ├─Atom
 │     │ └─Terminal
 │     │   └─'\"'
 │     ├─Atom
 │     │ └─Alt
 │     │   └─Con
 │     │     └─Atom
 │     │       └─Nonterminal
 │     │         └─Ident
 │     │           └─'escQ'
 │     └─Atom
 │       └─Terminal
 │         └─'\"'
 ├─Rule
 │ ├─RuleName
 │ │ └─Ident
 │ │   └─'_CClass'
 │ └─Alt
 │   ├─Con
 │   │ └─Atom
 │   │   └─Terminal
 │   │     └─'.'
 │   └─Con
 │     └─Atom
 │       └─Alt
 │         └─Con
 │           ├─Atom
 │           │ └─Terminal
 │           │   └─'['
 │           ├─Atom
 │           │ └─Alt
 │           │   ├─Con
 │           │   │ └─Atom
 │           │   │   └─Nonterminal
 │           │   │     └─Ident
 │           │   │       └─'_NCList'
 │           │   └─Con
 │           │     └─Atom
 │           │       └─Nonterminal
 │           │         └─Ident
 │           │           └─'_PCList'
 │           └─Atom
 │             └─Terminal
 │               └─']'
 ├─Rule
 │ ├─RuleName
 │ │ └─Ident
 │ │   └─'_NCList'
 │ └─Alt
 │   └─Con
 │     ├─Atom
 │     │ └─Terminal
 │     │   └─'-'
 │     └─Atom
 │       └─Nonterminal
 │         └─Ident
 │           └─'PCList'
 ├─Rule
 │ ├─RuleName
 │ │ └─Ident
 │ │   └─'_PCList'
 │ └─Alt
 │   └─Con
 │     └─Atom
 │       └─Alt
 │         ├─Con
 │         │ └─Atom
 │         │   └─Nonterminal
 │         │     └─Ident
 │         │       └─'_CCRange'
 │         └─Con
 │           └─Atom
 │             └─Nonterminal
 │               └─Ident
 │                 └─'_CCItem'
 ├─Rule
 │ ├─RuleName
 │ │ └─Ident
 │ │   └─'_CCItem'
 │ └─Alt
 │   ├─Con
 │   │ └─Atom
 │   │   └─Nonterminal
 │   │     └─Ident
 │   │       └─'escC'
 │   └─Con
 │     └─Atom
 │       └─CClass
 │         └─NCList
 │           └─PCList
 │             ├─CCItem
 │             │ └─escC
 │             │   └─(◄─):'\r'
 │             ├─CCItem
 │             │ └─escC
 │             │   └─(◄─):'\n'
 │             ├─CCItem
 │             │ └─escC
 │             │   └─(◄─):'\t'
 │             ├─CCItem
 │             │ └─escC
 │             │   └─([\\"\[\-\]]):'['
 │             ├─CCItem
 │             │ └─escC
 │             │   └─([\\"\[\-\]]):'-'
 │             ├─CCItem
 │             │ └─escC
 │             │   └─([\\"\[\-\]]):']'
 │             └─CCItem
 │               └─escC
 │                 └─([\\"\[\-\]]):'\\'
 └─Rule
   ├─RuleName
   │ └─Ident
   │   └─'_CCRange'
   └─Alt
     └─Con
       ├─Atom
       │ └─Nonterminal
       │   └─Ident
       │     └─'_CCItem'
       ├─Atom
       │ └─Terminal
       │   └─'-'
       └─Atom
         └─Nonterminal
           └─Ident
             └─'_CCItem' | D2: of:=[.E2]*[.F2] -> 1 | E2: 1 | F2: of:=DTOPT_HIDESKIPPED() -> 1
D3: of:=[.E3]*[.F3] -> 2 | E3: 1 | F3: of:=DTOPT_DOFOLDLCONCAT() -> 2
D4: of:=[.E4]*[.F4] -> 4 | E4: 1 | F4: of:=DTOPT_IMPLICITMULT() -> 4
D5: of:=[.E5]*[.F5] -> 0 | E5: 0 | F5: of:=DTOPT_PROMOTESINGLETERMINAL() -> 8
D6: of:=[.E6]*[.F6] -> 0 | E6: 0 | F6: of:=16 -> 16
B28: ASN lbl () [ASN () val []] -> ASN lbl v [] ASN "Alt" () [x] -> x ASN "Con" () [x] -> x ASN "Atom" () [x] -> x